id,comment,toxic,severe_toxic,obscene,threat,insult,identity_hate
hgrub,I watched WC match of Ireland vs German in person.Irish fans are the best. You all sing all the time lol,0.00651304516941309,1.2983775832253741e-06,0.0005546403117477894,1.7851878510555252e-05,0.0002996032126247883,7.923787052277476e-05
glazby,Ha ha ha ha ha ha ha -love England,0.9249134659767151,0.05793165788054466,0.532206118106842,0.04400984197854996,0.5749587416648865,0.1215149387717247
Davolyncho,"Everybody will be laughing at England when they get knocked out as usual, plus all the fans will get their heads kicked in (as usual). Can't wait 😊",0.01753254048526287,7.931924301374238e-06,0.0011777988402172923,8.365295798284933e-05,0.0010701795108616352,0.0003264830738771707
Skiingfun,TIL Italy and Canada are equal in soccer.,0.011203802190721035,4.570387318381108e-06,0.0007785280467942357,5.125413372297771e-05,0.0006298849475570023,0.00022933630680199713
TheFuego126,"Yeah, that's totally how that works",0.0223223976790905,1.4594217645935714e-05,0.0015071284724399447,0.00013847099035046995,0.0014798040501773357,0.0006128346431069076
Schnackenpfeffer,And also the Solomon Islands,0.059756841510534286,8.489559695590287e-05,0.0037566772662103176,0.0005946706514805555,0.004763992968946695,0.0021667855326086283
karek2134,rip in Pepperoni,0.05493053421378136,9.393945219926536e-05,0.003732782555744052,0.0006504323682747781,0.004776607267558575,0.0022976298350840807
Diorama42,and chease,0.12023509293794632,0.0003602024808060378,0.008937401697039604,0.0021320993546396494,0.013048923574388027,0.006353258155286312
HaraGG,So Rest In Peace in pepperoni? You should've thought out this comment more. It's like saying rip in peace,0.010812939144670963,4.305468337406637e-06,0.0008311126730404794,4.580926906783134e-05,0.0005968023906461895,0.00018686449038796127
aMoistNug,Just sad. So much talent. Just straight incompetence by the coach.,0.14153613150119781,0.00026189602795057,0.009059004485607147,0.001515555428341031,0.012866975739598274,0.005299770273268223
PrincessXxXDiana,"Although a good squad, it's not much compared to other Italy sides of the 2000's",0.009952808730304241,3.117861751888995e-06,0.0005896377260796726,3.6613586416933686e-05,0.0004824561474379152,0.00016899917682167143
arnoldit,"There sure is a lack of quality but the coach is the master of incompetence. Last year at Euro 2016 we eliminated Spain by outplaying them: our players were pretty much the same but our coach was the mighty Conte, not the idiot Ventura.",0.8269443511962891,0.003690493991598487,0.32837238907814026,0.005972381681203842,0.24111858010292053,0.02241671271622181
zzona13,"With insigne actually playing, the attack looks a lot more solid, the defence is still very good and midfield without injuries would be very good.... not the same level as previous squads but not bad by any means",0.002427923260256648,2.80276452713224e-07,0.00017390905122738332,4.333686320023844e-06,8.489997708238661e-05,2.419922748231329e-05
arnoldit,"The fact is that El Sharaawi (one of the players in better condition around Italy) should have played on Saturday, yet the idiot coach decided to leave him out of the match.",0.413553923368454,0.0004266664036549628,0.06774415820837021,0.0022297895047813654,0.04876527190208435,0.005906612612307072
Jfelt45,"You know it's funny, I played PES2018 and did become a legend mode. Made a Japanese character and eventually got drafted for the national team. I had planned to carry the team through tremendous victories over Spain, usa, Argentina, etc and nearly all of the big teams got knocked out in the first few games. Ended up playing not a single big name team save for the Netherlands the entire tournament and was a little disappointed at what I thought was somewhat lack of realism. This year is making me think pes is a better game than I thought",0.00474600400775671,9.398035558660922e-07,0.0005019863601773977,1.0489682608749717e-05,0.00019462729687802494,5.088959005661309e-05
Professional_Bob,"This draw simulator seems to suggest that Japan is actually likely to end up in a group with no big names. I've run it through a whole load of times and it seems as though they get an ""easy"" group more often than not. http://ultra.zone/2018-FIFA-World-Cup-Group-Stage-DrawsOf course it's currently working on the assumption that Australia, Peru and Denmark all qualify. If that doesn't happen then the outcome of the draw will probably be a bit different.",0.004563463851809502,4.1488036117698357e-07,0.0004363844927866012,7.635002475581132e-06,0.00016357790445908904,3.962014670833014e-05
KRIEGLERR,https://i.imgur.com/gaRhDG6.png Just tried,0.18535083532333374,0.00038014649180695415,0.014131166972219944,0.001942090573720634,0.01987016573548317,0.006656058598309755
Aoae,#SVENSKA🇸🇪🇸🇪🇸🇪,0.09350578486919403,0.000316751713398844,0.00731961103156209,0.0017841528169810772,0.01021448615938425,0.005277747754007578
Elvysaur,"If vuvuzelas in 2010 were bad, wait till they break out the surstromming",0.020115211606025696,9.797319762583356e-06,0.001279795658774674,0.00010066483810078353,0.0011509236646816134,0.00044100501690991223
Ikenmike96,I'm expecting some dank shit on r/polandball,0.9405254125595093,0.03786875680088997,0.6362277269363403,0.019980743527412415,0.4592549204826355,0.07971914112567902
Lakefargo,Kobe Bryant is going to be disappointed. Both Italy and USA failed to qualify.,0.04029659926891327,3.441366789047606e-05,0.002483764896169305,0.00028541588108055294,0.0027530300430953503,0.0011637272546067834
atertaqunderdog,"Congrats to the swedes! Italy played well, so did the swedes!",0.03202251344919205,2.6798350518220104e-05,0.0018780160462483764,0.0002164142206311226,0.0020404516253620386,0.0009155256557278335
Maskedrussian,"I mean fair play and everything, but what the fuck were Italy's tactics? The starting 11 was an absolute clusterfuck with inexperienced forwards and a mediocre midfield, allowing Sweden to park the bus for the draw.",0.949097216129303,0.028561385348439217,0.7014496326446533,0.015558445826172829,0.5097426176071167,0.05891694501042366
Babladuar,And no insigne as well.. To be honest ventura is the bruce arena of italian football.,0.0035463972017169,5.051715561421588e-07,0.0002598460705485195,7.666851161047816e-06,0.0001366847864119336,4.2724201193777844e-05
atertaqunderdog,"We've seen Italy play defensive for many years, I don't think the problem is players but I think the tactics is. Should've been more awaiting and not too forced and I think the swedes knew that somehow.",0.018222695216536522,8.462872756354045e-06,0.001400873064994812,9.256260091206059e-05,0.0011208512587472796,0.0003382466675247997
LordHuuckster,Well no.. Italy didnt play well. Thats why they didn't make it.,0.008548019453883171,2.5158253720292123e-06,0.0005741332424804568,2.9853175874450244e-05,0.0004166580911260098,0.00014220360026229173
sirbrookc,Breaking News: The U.S. is at the same skill level as both Italy and the Netherlands,0.03286381810903549,1.792132025002502e-05,0.002177362097427249,0.00015030948270577937,0.001981171080842614,0.0006115454598329961
SharkSymphony,"USA! USA!! USA!!!(_pulled aside by assistant who urgently whispers in his ear_)Oh, um, never mind.",0.23291249573230743,0.000556050450541079,0.018519043922424316,0.002812017919495702,0.027951257303357124,0.008714831434190273
OMyBuddha,Confirming this is the darkest timeline.,0.02161417342722416,1.4388650924956892e-05,0.0012592851417139173,0.00013079574273433536,0.0012847320176661015,0.0005999722634442151
intrepidone66,No fucking way...seriously???There are going to be TONS of broken windows because I've seen Italians throwing their TV's through the closed windows because of soccer.Not qualifying for the Cup *will* cause mayhem there.,0.9136269092559814,0.006704044062644243,0.5788654088973999,0.004966838285326958,0.33786824345588684,0.02399173378944397
MetalHead_Literally,"As a German, this is great news!",0.03868810832500458,3.887972343363799e-05,0.0025542727671563625,0.0003082366893067956,0.0028312397189438343,0.001191283343359828
FiddlerOnARim,"Tactic against germany is to replace their beer cans with water, whole team will suffer from abstinence and be chasing hallucinations.",0.01248723641037941,2.9874527172069065e-06,0.000893094576895237,4.0553099097451195e-05,0.0006149177788756788,0.00017243241018150002
achrafla,"Doesn't work, their best player is muslim 😂",0.04116334393620491,3.254447437939234e-05,0.0026810697745531797,0.00026848079869523644,0.002941919956356287,0.0010712897637858987
MetalHead_Literally,Neuer is muslim?,0.1877579391002655,0.0006149494438432157,0.013643904589116573,0.0031522810459136963,0.02205897867679596,0.008920653723180294
Voltdrive,How does a country fuck up getting into the World Cup when their whole country looks like a leg?,0.9565414190292358,0.04172779619693756,0.7345021367073059,0.017939971759915352,0.545890748500824,0.07351045310497284
zenverak,Lol,0.024683048948645592,2.4436118110315874e-05,0.001618754817172885,0.00020534376380965114,0.001723986235447228,0.000894169497769326
pussypink,"England, we can do it this time",0.016025958582758904,7.609132353536552e-06,0.0010207793675363064,7.927430124254897e-05,0.0009138541063293815,0.0003595043672248721
bragif,Watch out for Iceland,0.04013388603925705,4.281074507161975e-05,0.0026390659622848034,0.0003405470051802695,0.0029406894464045763,0.00130550900939852
pussypink,Lol,0.024683048948645592,2.4436118110315874e-05,0.001618754817172885,0.00020534376380965114,0.001723986235447228,0.000894169497769326
lelife,It just feels ....so...wrong.,0.01316072978079319,5.542038252315251e-06,0.0008679793099872768,5.5931199312908575e-05,0.000710971828084439,0.0002657694567460567
Buttbang69,Mamma Mia!,0.058254629373550415,0.00010756740812212229,0.004079179838299751,0.0007331161759793758,0.0051656258292496204,0.00260129664093256
Treason_Weasel,pappa pia!,0.09350578486919403,0.000316751713398844,0.00731961103156209,0.0017841528169810772,0.01021448615938425,0.005277747754007578
SpiritCrvsher,What you get for leaving Mario at home...,0.06813159584999084,9.445036994293332e-05,0.005190352909266949,0.0005782468360848725,0.006101076956838369,0.0019357261480763555
chase_witt,HELL YES Mario should be in the squad,0.6454190611839294,0.0031225010752677917,0.11372249573469162,0.009711617603898048,0.13329142332077026,0.03228912875056267
MaddingMumbaikar,should have been*,0.03525048866868019,3.7656300264643505e-05,0.0022651657927781343,0.00029515207279473543,0.0025480592157691717,0.0012425943277776241
chase_witt,He's been balling for Nice. Got fucked in the EPL. Only time I️ blame him is in Italy,0.8659271001815796,0.008756311610341072,0.4257226586341858,0.00919131375849247,0.2674633860588074,0.036209870129823685
chase_witt,I️ see what you were saying lmao,0.02732389234006405,1.8196418750449084e-05,0.0018593291752040386,0.00014838346396572888,0.0017638776917010546,0.0006245738477446139
Smok3h,Da Da Da DaDaDa .... Da!,0.8015506267547607,0.018362129107117653,0.2473124861717224,0.03264784812927246,0.3132351040840149,0.08167906105518341
NAN,Watch the Tim and Sid talk show. Sid goes insane for good reason. Gian Piero Ventura is a disgrace!,0.775316059589386,0.004445530008524656,0.1930014193058014,0.009607401676476002,0.2084108144044876,0.034487996250391006
BestWingmanEver,"Just had a look, he's right, Ventura has to go, what a sad day for Italian football",0.17970076203346252,0.00024900544667616487,0.014242535457015038,0.0015084436163306236,0.018772801384329796,0.004349124617874622
ftatman,"Looking at the side Italy fielded, it just wasn't that good. Tough game though. Sweden just packed the box for 90 mins. Had like 20% possession.Italy needed to sort this out earlier rather than put themselves in that position. Their coach seems absolutely useless.",0.019595077261328697,6.5816334426926915e-06,0.0013531252043321729,7.63382704462856e-05,0.0010901151690632105,0.00028377160197123885
notsocrazycatlady101,No Norn Iron either :(,0.010572164319455624,4.7027301661728416e-06,0.0006618103361688554,4.8485122533747926e-05,0.0005671681137755513,0.00025207301951013505
hellosugars,Pasta La Vista baby,0.013009605929255486,5.351433628675295e-06,0.0008312758873216808,5.4720876505598426e-05,0.000709939980879426,0.00027150072855874896
choicemeats,"as my dad just told me, Italian clubs have been buying players for years and no one is being brought up through Serie B to play in the big time clubs. So now when the national team has to play they have no one.Also the coach is shit.",0.8263847827911377,0.0033991120290011168,0.37495025992393494,0.004477841779589653,0.2210846245288849,0.018421372398734093
NutsForProfitCompany,Same problem Turkey has. We lost 2-0 to Romania way on Friday and lost 3-2 at home to Albania today. hopefully it is just a transitional phase because we really need it with Arda & Co. gone from the NT,0.0035598643589764833,7.20980210644484e-07,0.00032647157786414027,9.65742947300896e-06,0.00015132722910493612,4.2853142076637596e-05
KRIEGLERR,"Same problem Netherland has (kinda) they don't produce any good players anymore. A lot of them are being sold from Eredivisie way to soon and ended up flopping or rotting on the bench. The Van Persie / Sneijder / Robben / Van Der Vaart / Hunterlaar / de Jong generation is over and since then they haven't produced nearly enough players who made it into great clubs, I can only think of Blind, Strootman and De Vrij That's pretty sad coming from a nation that produces some of the all time best players and had a big impact in modern football.",0.016470840200781822,5.286551640892867e-06,0.0017500134417787194,4.736748815048486e-05,0.0009822011925280094,0.00021733377070631832
NutsForProfitCompany,Netherlands and Turkey should play a friendly to figure things out,0.015184398740530014,5.796445293526631e-06,0.0009896192932501435,6.40664147795178e-05,0.0009006109903566539,0.00027631406555883586
andywang512,"I watched the game live, and I gotta say Italy feels like they are missing something. Chiellini is dribbling and doing most of the passing, non existant mid field, and attackers who are short but yet only recieve crosses. The half field crosses were really just wasting time. Props to Sweden to making it even without Zalatan.",0.007799963932484388,2.117580606864067e-06,0.0005468503222800791,2.749452141870279e-05,0.0003708419972099364,0.00011928047752007842
StuffSpurs,I dunno why Insigne stayed on the bench and all three CBs stayed on the pitch.,0.03724345564842224,3.409861892578192e-05,0.00237633241340518,0.00028262301930226386,0.0026241664309054613,0.0011339642805978656
notorious98,Maybe they could have used Giovinco.<insert Kermit sipping tea meme>,0.0060213468968868256,9.767230721990927e-07,0.00045330560533329844,1.3160488379071467e-05,0.00025588489370420575,6.91945751896128e-05
Funcooker216,"Coming from a half english half american arizona born ITALIA fan, I'm so disappointed honestly. Gianluigi Buffon is my favorite player to ever play football (GK being my favorite position) and he cried post match because he felt that he failed his country & fans but a man who has exceeded past the amount of levels of legend he has can never fail us, I'm gonna still support Italy cause of how much I like the country and all the players (even though half the team resigned today) I just feel they need a big push in the field of youth development, GK Gianluigi Donarumma isn't enough to bring us places and he's the best player we've developed in years.",0.01298596803098917,5.996765594318276e-06,0.0015484057366847992,5.414599218056537e-05,0.0006602788344025612,0.00024512887466698885
that-there,Why don't you support the US and/or England?,0.03284025192260742,2.869055788323749e-05,0.0021498268470168114,0.0002319923514733091,0.0023060257080942392,0.0009706189739517868
Funcooker216,"I do like the US and England, but I'm much bigger into club football and player following than international football, I've always liked Italy cause I'm a GK when I play and Gigi Buffon is the best keeper to play in my opinion. The class and style of the Italian team is what attracts me, the country also has my favorite foods, the nicest brands when it comes to clothing, the fastest cars and the country reminds me of badass new york mob familys and those are general reasons I like the country Italy but I also love all the players...er former players. Buffon, Balotelli (My favorite player of all time being a city fan) Pirlo, Del Piero, Giorgio Chiellini, Leo Bonucci, I follow players more than teams in every sport and I just love all those players. But to the point of why I don't support US or England is because though they both have decent teams, the success of the teams are very low. I don't know the players on either country nearly half as well as I'm familiar with the Italian players, (being a juve fan too) so I'm drawn to the team with the players I enjoy watching for my clubs rather than home teams.",0.002721605123952031,5.186740850149363e-07,0.00036357552744448185,5.887489351152908e-06,9.28004301385954e-05,3.5148594179190695e-05
TheFuego126,The last World Cup they didn't qualify for was in Sweden,0.011642059311270714,4.126880867261207e-06,0.0007506207330152392,4.6188710257411e-05,0.0006245140684768558,0.0002176624839194119
pistragol,"Brazilians have their MaracanazoWe Italians now have our *Sansirazo* We were not jealous.And now, who shall we support? I will personally support the Half Italians of south America, Go Argentina!Look at their Surnames: Marchesin, Fazio, Mammana, Pezzella, Ansaldi, Perotti, Salvio, Lo Celso, Rigoni, Belluschi, Benedetto, Messi, Di Maria, Pavon.....(all in the squad of current friendlies against Russia and Nigeria, and then there are Icardi, Pastore, Biglia...... )Our genes are not yet defeated! (but our colors are, sigh)",0.005077976733446121,1.0442903430885053e-06,0.00042538042180240154,1.3895582924305927e-05,0.00023046914429869503,5.977016917313449e-05
madeindavid,Supporting Argentina is a wise choice sempai.,0.02370016649365425,1.6981795852188952e-05,0.0014672973193228245,0.00014267298683989793,0.0014912850456312299,0.000610693299677223
otaku_mimmi,Swede here. Asshole ex boyfriend is Italian.I'm so proud my countrymen came together to help me with this massive fuck you.,0.9824146628379822,0.10108940303325653,0.871620774269104,0.02312011457979679,0.7162958383560181,0.0882582813501358
Taviiiiii,"What a fantastic feat from the swedes in the absence of Zlatan. New head coach seems to have a good thing going. Now, swedish media are speculating about a comeback from Zlatan in Russia...",0.028622156009078026,1.9607839931268245e-05,0.0018827790627256036,0.00017851896700449288,0.001893170760013163,0.0006971013499423862
ziiguy92,Zlatan to me seems like a locker room problem. Sweden might be better off without him,0.08504880964756012,0.00010433394345454872,0.005856778007000685,0.0007489787531085312,0.0071964445523917675,0.002655459102243185
StuffSpurs,"I think Zlatan said he wouldn't, and I hope that is the case because I genuinely think they are better off without him.",0.0634574219584465,7.167917647166178e-05,0.004062639083713293,0.0005193036049604416,0.004737286362797022,0.0018796541262418032
Taviiiiii,"Well with some tension building up from media, tickling his balls, who knows what's gonna happen. I'm also not sure about it though, if it happens I think and hope coach Andersson has the integrity to put him on the bench if needed.",0.25841304659843445,0.0002729544648900628,0.02222832851111889,0.0016936232568696141,0.02642562985420227,0.005415725521743298
StuffSpurs,"I think it will be required. Even if he does hit some good form (far from guaranteed), I just think it is better for the team if he does not play.",0.010762974619865417,3.6748019738297444e-06,0.0008991264039650559,4.3061041651526466e-05,0.0005506349843926728,0.0001508446002844721
TzunSu,"His manager said tonight that if he wants to play he will ""hand deliver him to the stadium""",0.08511868864297867,8.213709224946797e-05,0.0052710105665028095,0.0005986625328660011,0.006641974672675133,0.0024975533597171307
funkyandros,"Oh, I know some guys in Italy who are going to be pissed!",0.7291281819343567,0.011357221752405167,0.16491980850696564,0.027047673240303993,0.22310899198055267,0.06385599076747894
symphony_41_mozart,"I'm an American. I was in Italy in 2006 when they won the World Cup. I didn't watch the match but I was outside in my peaceful yard having a smoke and the tiny town and all of Italy exploded. There were fireworks, cheering, those annoying horn things; it was incredible. I'm sad to see that they don't qualify because that is such a big deal there! Sorry Italia :(",0.03316938504576683,1.3440314432955347e-05,0.003081413684412837,0.0001387451047776267,0.0020543651189655066,0.0005236713332124054
ricolausvonmyra,Poor Buffon 😔,0.06805337965488434,0.00012716485070995986,0.004790961276739836,0.0009035638649947941,0.006221701856702566,0.003173388773575425
brolarvortex,"As an American, this makes me feel a whoooollleeee lot better.",0.04111770913004875,4.614943827618845e-05,0.002859910950064659,0.0003606694517657161,0.0032930951565504074,0.0015135103603824973
SlashYouSlashYouSir,"As a long suffering Toronto Maple Leafs Fan, I now add Italy soccer fan to the list of sports fans that I would not want to be. The list includes: Atlanta Falcons, Buffalo Bills, Cleveland Browns, Buffalo Sabres, Arizona Coyotes, Brooklyn Nets, New York Knicks",0.0029696431010961533,4.0065623352347757e-07,0.00023613042139913887,6.180569926073076e-06,0.00011193739919690415,3.18681268254295e-05
6caletta,🇸🇪🇸🇪🇸🇪🇸🇪 Äntligen Sverige!!,0.09350578486919403,0.000316751713398844,0.00731961103156209,0.0017841528169810772,0.01021448615938425,0.005277747754007578
Duckpoke,Watch US MLS pundits rationalize the US missing out because Italy did too.,0.022030070424079895,1.4222593563317787e-05,0.0014663187321275473,0.00013484855298884213,0.0013551003066822886,0.0005747034447267652
standswithpencil,"We need a tournament for ""loser"" teams... Italy, Netherlands, USA, China... We can play in Brazil. There are all of those empty stadiums leftover from the Olympics",0.1713569164276123,0.00012521495227701962,0.013387425802648067,0.0009133639978244901,0.013851371593773365,0.0032872548326849937
NAN,[deleted],0.062306083738803864,0.00012997032899875194,0.004337160848081112,0.0008427735301665962,0.00553680257871747,0.0029814550653100014
Alex01854,"My girlfriend is Brazilian and she becomes a lunatic when CAM plays Cruzeiro. Rabid, intense fan base.",0.022166775539517403,1.1135075510537717e-05,0.0016842392506077886,0.00011209634249098599,0.001530736219137907,0.0004626701702363789
pm_8_me,Tfw no pão de queijo gf,0.02274983562529087,1.7589838535059243e-05,0.0014863463584333658,0.00015467235061805695,0.0014670597156509757,0.0007208503666333854
iNeedanewnickname,"I wouldn't be to happy, Germany just lost its natural predator. A Brazil German final is very likely to happen (only France seems to be able to match their squads).",0.016414700075984,6.026198661857052e-06,0.0011604069732129574,6.988616223679855e-05,0.0008736310410313308,0.00024183568893931806
HaraGG,Man Argentina is still here maybe this time... maybe,0.014390734024345875,8.133097253448796e-06,0.00092796963872388,8.236596477217972e-05,0.0008280069450847805,0.00036856241058558226
iNeedanewnickname,"Honestly doubt it, in theory yes but they rely so much on Messi that any team who would be able to play him out of the game would win.Of course they reached to final last time but they needed penalties against a very poor Holland to get there. If they meet Spain/Germany/Brazil/France I don't see them win. Even a lesser team could win if they negate Messi.",0.0022552418522536755,2.2332250182444113e-07,0.00018415451631881297,3.531388756528031e-06,8.109993359539658e-05,1.8012869986705482e-05
spacedskunk,"Don't forget England. We have the most enthusiastic, well organised explosive team I've seen since...ermm....umm....yea a Brazil vs Germany is likely. Good shout.",0.0019337115809321404,1.799361797338861e-07,0.00016078419866971672,2.932384404630284e-06,6.724205741193146e-05,1.547089959785808e-05
NAN,"""Its me, your boyfriend"" << In Italian speak.",0.005893174558877945,1.373751388200617e-06,0.00044939765939489007,1.7136475435108878e-05,0.00028531302814371884,8.942025306168944e-05
TrustTheFriendship,And the universe finally punishes Italy for Materazzi's sins.,0.04285689815878868,5.074348155176267e-05,0.002794724889099598,0.000396964605897665,0.003322768956422806,0.0016000622417777777
joaodiogotim,"I know most of reddit is American, but stop putting the US in the same bag as Italy and Netherlands.Y'all can't even get the name of the sport right, and you still acting like you should be in the WC.smh",0.2374836951494217,0.0003173039003740996,0.019321395084261894,0.0019805310294032097,0.023554135113954544,0.005950956139713526
StuffSpurs,Yeah there is a big difference. It is embarrassing the US failed because of how easy (with all due respect to CONCACAF) their qualifying group should be. It is a shock about Italy and the Netherlands because they are world heavyweights.,0.310959130525589,0.0006725764251314104,0.024838009849190712,0.003417680272832513,0.03588595241308212,0.00987984612584114
wolfmalfoy,"Erm, Holland wasn't a shock at all. I mean... have you watched them the last three years? They haven't been playing like heavyweights at all.",0.02211414836347103,1.0182749065279495e-05,0.0015445866156369448,0.00010148031287826598,0.001291578751988709,0.000401357829105109
