id,comment,toxic,severe_toxic,obscene,threat,insult,identity_hate
reece0n,By what measure exactly? :S,0.02416100539267063,1.5040518519526813e-05,0.0015993905253708363,0.00013294733071234077,0.0014513549394905567,0.0005903496639803052
NAN,"Life standards, low criminality rate, education, healthcare, etc. Oh wait. We're talking about 'Murica ? I dunno, ya got me there pal",0.009708521887660027,3.391139216546435e-06,0.0006716410280205309,3.947799632442184e-05,0.0005061809788458049,0.00017090080655179918
ciskje,Using English born in EU :),0.012952328659594059,5.592673460341757e-06,0.0008271433762274683,5.772778968093917e-05,0.000709514191839844,0.00027738173957914114
Skylord_ah,typing on a keyboard probably made in china. CHINA NUMBA 1,0.004922171588987112,9.505833418188558e-07,0.00030391968903131783,1.2426039575075265e-05,0.00020394397142808884,6.405921158147976e-05
preserved_fish,England is leaving the EU tho.,0.03592665493488312,2.6994672225555405e-05,0.0022218155208975077,0.00023376620083581656,0.0023837266489863396,0.0009645021636970341
astralcalculus,They will still be part of europe and european culture.,0.009519238956272602,2.0266811588953715e-06,0.0006890137447044253,2.7593152481131256e-05,0.00045296220923773944,0.00013075134484097362
preserved_fish,"[Fog in Channel, Continent Cut Off](https://media.licdn.com/mpr/mpr/AAEAAQAAAAAAAAl9AAAAJDJlZWZlOGU5LTUyZTgtNDJjMC04MzY2LTUyNmUzOGUxYTU0Zg.jpg)",0.31083184480667114,0.0007829522364772856,0.025205383077263832,0.0034877355210483074,0.03740249574184418,0.011454479768872261
ciskje,Remove EU insert Europe,0.0021929102949798107,1.7412308750408556e-07,0.00016163747932296246,3.179631903549307e-06,7.276171527337283e-05,2.1166490114410408e-05
Treason_Weasel,AMERICA FIRST,0.029152382165193558,2.9255377739900723e-05,0.0019493631552904844,0.00023396601318381727,0.0020423380192369223,0.0010302204173058271
TheChairIsNotMySon,Depends on how you look at it. UEFA gets thirteen slots in the WC which means there will always be world class teams not qualifying. CONCACAF has three and a half slots and three teams that can even pretend to belong in the conversation. So one of the three CONCACAF teams missing out is arguably a bigger deal than a better team in UEFA missing out.,0.006697608157992363,1.327841118836659e-06,0.0006194296875037253,1.6203211998799816e-05,0.0003059743030462414,6.946166831767187e-05
StuffSpurs,"Depends what you mean by a bigger deal. Yeah a big CONCACAF team missing out is a bigger shock, but I think more people (outside of the countries themselves) are bothered about the Netherlands and Italy missing out. It's actually a shame for the tournament. I just don't think people care about the US missing out in the same way.",0.018608244135975838,4.974746843799949e-06,0.0015068501234054565,5.456569851958193e-05,0.0010625456925481558,0.00022106579854153097
NAN,[deleted],0.062306083738803864,0.00012997032899875194,0.004337160848081112,0.0008427735301665962,0.00553680257871747,0.0029814550653100014
Professional_Bob,For the US it was. For the rest of us? Mild surprise.,0.025301994755864143,1.6420211977674626e-05,0.0015041657024994493,0.00015068662469275296,0.0014922182308509946,0.0006573146674782038
throwawaythatbrother,It's the first time since 1986. It's a bigger deal than you think.,0.07429002970457077,7.707787153776735e-05,0.004778466187417507,0.0005483145941980183,0.005653967149555683,0.0019964086823165417
Professional_Bob,Doesn't mean many non-Americans really care. The US's record of qualifying hasn't really been down to them being good so much as it was that the rest of CONCACAF is shit. Italy on the other hand are 4 time winners (the latest being in 2006) and the Netherlands reached the final for the third time in 2010.The main thing I care about is the fact that /r/soccer isn't going to get flooded with as many obnoxious casuals as it did in 2014.,0.6975864171981812,0.0012452489463612437,0.20288577675819397,0.002788297599181533,0.1198112815618515,0.009847242385149002
Westlax21,Yeah god forbid Americans try to learn a growing sport in america and the most popular sport in the world,0.15687988698482513,0.00013637778465636075,0.013277697376906872,0.000870389339979738,0.013675249181687832,0.002814721316099167
Professional_Bob,"There's a difference between trying to learn the sport and flooding the match threads with ""USA! USA! USA!"" or throwing a tantrum and spamming crap about how ""soccer is a shit sport anyway"" when they get knocked out.",0.8196830749511719,0.004088687244802713,0.3332567512989044,0.005698356311768293,0.21597595512866974,0.02297593466937542
uninanx,Most of the US was not surprised at all. Soccer is not even remotely popular here.,0.005913192871958017,1.1434990483394358e-06,0.0004313941753935069,1.515975145593984e-05,0.0002510850317776203,7.186814764281735e-05
Professional_Bob,Its popularity is largely irrelevant. Any American who knows a decent amount about international football would know that the US is expected to qualify.Pundits on the TV and fans /r/soccer alike were basically calling for a complete upheaval of the whole US soccer infrastructure. It was a big deal to anyone who follows the sport.,0.0030207138042896986,4.242877480464813e-07,0.0002883806300815195,6.341066637105541e-06,0.00012425829481799155,2.8945369194843806e-05
uninanx,">It was a big deal to anyone who follows the sport.That's such a small minority of Americans though. Go tell the average American that the US didn't make the world cup and they'd be hearing about it for the first time. Hell, I'm a huge sports fan and I'm just learning about it right now. The truth is, practically no one in this country pays attention to soccer.",0.15237239003181458,9.906181367114186e-05,0.014102132059633732,0.0006882809684611857,0.013012237846851349,0.002392129274085164
Sarcastic_Facade,People you hang out with and talk to is not equivalent to everyone in America,0.2105160802602768,0.00035866667167283595,0.015317454934120178,0.0018723559333011508,0.021961579099297523,0.00593888433650136
respekmynameplz,">The truth is, practically no one in this country pays attention to soccer.This is just not true at all. It isn't as big as basketball or football but it is still very big. You might not pay attention, but there are many others who do.",0.00748033681884408,1.7875461253424874e-06,0.0005337839247658849,2.109100933012087e-05,0.00033881256240420043,9.648688865127042e-05
Bakedpotato1212,My city just put $200 million into a new stadium and team offices. There is definitely money being put towards soccer.,0.003839849028736353,5.362251727092371e-07,0.0002623328473418951,8.00022007751977e-06,0.00015029286441858858,3.9961847505765036e-05
StuffSpurs,"For Reddit I guess lol. For the Americans it is, it is a growing sport there. Plus, it is the first time since 1986.",0.00690171355381608,1.7184632952194079e-06,0.00048053881619125605,2.1300846128724515e-05,0.00031962504726834595,0.00010510965512366965
PM_ME_UR_SMILE_GURL,It wasn't. Unless it's women's soccer/football the U.S. isn't even a player.,0.015020630322396755,4.915818863082677e-06,0.0011144456220790744,5.507814057637006e-05,0.000792428501881659,0.0002289203548571095
Das_Boot1,Except for how we dominate the olympics...,0.008471878245472908,2.528489403630374e-06,0.000565794762223959,3.0522249289788306e-05,0.00040890020318329334,0.00014859811926726252
Caboose_Juice,Didn't realise this was the olympics my bad,0.11662512272596359,0.00018495660333428532,0.007265171036124229,0.001133546931669116,0.009853819385170937,0.003553589340299368
Das_Boot1,"I misunderstood the guy's comment. I thought he meant women's soccer and American football, implying that those were the only two sports that the USA was good at internationally.",0.002592998556792736,2.9213623520263354e-07,0.00017613997624721378,4.83140274809557e-06,9.428182238480076e-05,2.391208181506954e-05
TzunSu,"That's because you're allowed to use professional players, the rest of the world isn't. Also, noone cares about soccer at the olympics.",0.01579868048429489,7.627396826137556e-06,0.0011154854437336326,7.799930608598515e-05,0.0009413608931936324,0.0003147333918605
Rideyn,Is there a reason as to why nobody cares about soccer at the Olympics? I've always been curious about that. I assume the World Cup just steals all of the glory?,0.006158073898404837,1.4091712046138127e-06,0.0005054594366811216,1.8063858078676276e-05,0.00028012628899887204,7.415971049340442e-05
TzunSu,"Yes, and because men must be under 23. The level of play is much lower.",0.02674768678843975,1.5903553503449075e-05,0.0016871979460120201,0.0001552219473524019,0.0016759055433794856,0.000580633815843612
Rideyn,"That makes a lot of sense, I didn't realize the age restriction.",0.01260457094758749,5.44845806871308e-06,0.0008321503992192447,6.095151911722496e-05,0.0006911560776643455,0.00027244200464338064
another-hero,Here in Brazil was a big deal last Olympcs because it was the only title that was missing for men football and the final was at Maracanã.,0.018306871876120567,8.428240107605234e-06,0.0013322001323103905,9.580961341271177e-05,0.001123009598813951,0.0003725566784851253
Das_Boot1,"I misunderstood the guy's comment. I thought he meant women's soccer and American football, implying that those were the only two sports that the USA was good at internationally.",0.002592998556792736,2.9213623520263354e-07,0.00017613997624721378,4.83140274809557e-06,9.428182238480076e-05,2.391208181506954e-05
hate_is_beautiful,"I could see it mattering to FIFA. There's pretty much zero chance of Americans paying attention to the World Cup now, and while their viewership number may not be spectacular, their relative worth to advertisers is probably high based on their wealth.On the other hand, while Italy is by no means poor, will their viewership be greatly impacted? Theyre big enough football fans that they will likely watch anyways, right?",0.01833627186715603,5.6254798437294085e-06,0.0014379586791619658,5.694906576536596e-05,0.0010383911430835724,0.0002517279062885791
Winter_already_came,"Italian, won't watch. And most people who care about football I know don't care about World Cup, they watch serie A. World Cup was usually also by people who usually don't care, but only Italy matches",0.03281695023179054,1.9251092453487217e-05,0.002812652848660946,0.0001799231395125389,0.0023432739544659853,0.0005968189216218889
bombo_red,And lost to Trinidad and Tobago no less.,0.08033677190542221,0.0001643049472477287,0.005573787726461887,0.0010616532526910305,0.007379892747849226,0.003893496235832572
StephCurryIsAbitch,Especially seeing that the USA play in that concaaf joke conference and still couldn't qualify,0.006652074865996838,1.0681764024411677e-06,0.00038457190385088325,1.585979771334678e-05,0.00026405349490232766,7.535670738434419e-05
MeC0195,Big deal? What big deal?,0.07435394823551178,0.0001457835896871984,0.005009982269257307,0.0009494309779256582,0.0069326115772128105,0.003309299238026142
StuffSpurs,"Well it was here (Reddit), and it was to a degree in America.I dunno, massive country, sport growing there. And of course it was just embarrassing (hilarious).",0.023078367114067078,1.1158260349475313e-05,0.0018428303301334381,0.0001157915176008828,0.0015147855738177896,0.00039180603926070035
LuisSuarez,this is just simply untrue. the US not qualifying is 10x a greater upset then any of the other teams not qualifying.,0.013181820511817932,4.942066880175844e-06,0.0008137449622154236,5.486394729814492e-05,0.0006764997960999608,0.0002494424406904727
StuffSpurs,"It's a greater upset, but the point is that nobody really cares that much. Italy and the Netherlands missing out is a shame for the tournament because they are two footballing giants. The US missing out is embarrassing but only Americans are really upset, and it won't really affect the tournament.",0.013277810998260975,4.648128197004553e-06,0.0009601671481505036,5.26615149283316e-05,0.0007366397767327726,0.00023582307039760053
GerrardSlippedHahaha,Ah yes the football powerhouse USA,0.034730132669210434,2.012420372921042e-05,0.0022367704659700394,0.0001810325775295496,0.0021591749973595142,0.0007431148551404476
lonestarhandy,"It's not that the USA is a football powerhouse...it's that the CONCACAF is so weak that it's actually mind-boggling that the largest country by far cant find a way to qualify, when countries with 15% of the population do. As far as I'm concerned, USA Soccer needs to be de-certified from FIFA. Blow it up and start all over. It's a crime the way these clubs charge American families thousands of dollars and do nothing to turn the kids into remotely decent players.",0.006586420349776745,1.3866679182683583e-06,0.000577760161831975,1.8776156139210798e-05,0.00030866218730807304,7.927112892502919e-05
Aoae,"Could be worse, as shown by India",0.011828036978840828,4.805531716556288e-06,0.0006969937821850181,5.195736594032496e-05,0.0006189233972691,0.0002459233801346272
snorlz,1.3 billion people. 28 olympic medals. Ever.,0.11672000586986542,0.00018007711332757026,0.0074112387374043465,0.0011539387051016092,0.010186716914176941,0.003763664746657014
lonestarhandy,"""But we're really good at this one sport only played in a handful of British colonies!""",0.0057112472131848335,1.1231337566641741e-06,0.0003829866473097354,1.5284420442185365e-05,0.0002466941368766129,7.320009171962738e-05
StephCurryIsAbitch,Look at the combined population of India Pakistan Australia Sri Lanka bangaladesh South Africa NZ and England and you'll see How a sport only played by former colonies isn't a small scale thing lol,0.005201918072998524,7.36141771540133e-07,0.00047938499483279884,1.10364699139609e-05,0.00022900592011865228,5.2266572311054915e-05
lonestarhandy,"Australia, South Africa, New Zealand, and England are actually good at other sports too though. Hell New Zealanders might be the most athletic people on the planet. I have never met one that wasn't extremely fit.What do you think would happen if India tried to play Rugby? A bunch of 5'4'' 120 pound guys playing a contact sport against giant Aussies. Ooof...that's a brutal thought.",0.042923785746097565,1.6549547581234947e-05,0.0033140568993985653,0.00016242775018326938,0.0027823944110423326,0.0006384029984474182
Swaggerboyz,Do you really expect a third world country whose population has suffered from severe malnutrition for most of its existence to have a tall and athletic population?,0.1085900142788887,0.00013685118756256998,0.008363023400306702,0.0009132291888818145,0.0100098280236125,0.0030653078574687243
JaiBharatMata,"African countries with 5% of the population and a higher rate of malnutrition have more medals per capital. India, Pakistan and Bangladesh are just genuinely the worst places in the world for sport.",0.0028312006033957005,3.867589555284212e-07,0.0002431109023746103,5.900766154809389e-06,0.00010613536142045632,2.8330739951343276e-05
bombo_red,Fact... But will piss off those Reddit SJWs.,0.89129239320755,0.027787912636995316,0.4215984344482422,0.029332881793379784,0.41853272914886475,0.08677003532648087
turret7,"too bad china and many african countries do decently in many sports and prove this ""fact"" not as significant as to make a country of more than 1 billion people completely useless in basically every sport",0.0070707956328988075,1.788183794815268e-06,0.0005237612058408558,2.4799484890536405e-05,0.00034963287180289626,0.0001057865665643476
MaddingMumbaikar,"Hey! I'm Indian and am 6' 3"". Would've definitely played rugby if there was anything happening related to it in school or college.",0.00911206565797329,3.4071920254064025e-06,0.0008462087716907263,3.696628482430242e-05,0.0005046362639404833,0.00015234880265779793
patrick_k,"Japan also plays rugby, and they're not exactly giants, in fact they engineered a win against South Africa in the RWC2015. South Africa are renowned for their monstrous pack and very physical approach, yet Japan's speed and guile won them the game. It was pretty historic.",0.002452265005558729,3.1056779903337883e-07,0.00020992591453250498,4.900237399851903e-06,9.175296872854233e-05,2.37799140450079e-05
NAN,[removed],0.027424072846770287,2.4321454475284554e-05,0.0018184053478762507,0.0002107009495375678,0.0019011300755664706,0.0009046075283549726
vix-,"country of 1.3bil is bound to have some one or two big guys....Iceland, Now thats a country where being a big guy is in the genes",0.08141039311885834,9.063128527486697e-05,0.005015207454562187,0.0006443666061386466,0.006565502379089594,0.0023075896315276623
lonestarhandy,Holy shit Indian redditors are easy to trigger,0.96659255027771,0.07073243707418442,0.77592933177948,0.027947058901190758,0.6370728015899658,0.10004924982786179
MaddingMumbaikar,"Lol, you bet. Check out r/India some day.",0.09600900113582611,0.00011198480206076056,0.006303220987319946,0.0007019371842034161,0.007934934459626675,0.0024675028398633003
NAN,[removed],0.027424072846770287,2.4321454475284554e-05,0.0018184053478762507,0.0002107009495375678,0.0019011300755664706,0.0009046075283549726
NAN,[removed],0.027424072846770287,2.4321454475284554e-05,0.0018184053478762507,0.0002107009495375678,0.0019011300755664706,0.0009046075283549726
NAN,[removed],0.027424072846770287,2.4321454475284554e-05,0.0018184053478762507,0.0002107009495375678,0.0019011300755664706,0.0009046075283549726
NAN,[removed],0.027424072846770287,2.4321454475284554e-05,0.0018184053478762507,0.0002107009495375678,0.0019011300755664706,0.0009046075283549726
NAN,[removed],0.027424072846770287,2.4321454475284554e-05,0.0018184053478762507,0.0002107009495375678,0.0019011300755664706,0.0009046075283549726
NAN,[removed],0.027424072846770287,2.4321454475284554e-05,0.0018184053478762507,0.0002107009495375678,0.0019011300755664706,0.0009046075283549726
NAN,[removed],0.027424072846770287,2.4321454475284554e-05,0.0018184053478762507,0.0002107009495375678,0.0019011300755664706,0.0009046075283549726
NAN,[removed],0.027424072846770287,2.4321454475284554e-05,0.0018184053478762507,0.0002107009495375678,0.0019011300755664706,0.0009046075283549726
NAN,[removed],0.027424072846770287,2.4321454475284554e-05,0.0018184053478762507,0.0002107009495375678,0.0019011300755664706,0.0009046075283549726
NAN,[removed],0.027424072846770287,2.4321454475284554e-05,0.0018184053478762507,0.0002107009495375678,0.0019011300755664706,0.0009046075283549726
NAN,[removed],0.027424072846770287,2.4321454475284554e-05,0.0018184053478762507,0.0002107009495375678,0.0019011300755664706,0.0009046075283549726
NAN,[removed],0.027424072846770287,2.4321454475284554e-05,0.0018184053478762507,0.0002107009495375678,0.0019011300755664706,0.0009046075283549726
NAN,[removed],0.027424072846770287,2.4321454475284554e-05,0.0018184053478762507,0.0002107009495375678,0.0019011300755664706,0.0009046075283549726
Wehavecrashed,Cricket is like the second most popular sport in the world though.And they aren't that good.,0.007574405521154404,1.4929759117876529e-06,0.0005455924547277391,2.011063952522818e-05,0.0003333992208354175,8.538785186829045e-05
shortpaleugly,India aren't that good at cricket?Did you forget an '/s'?,0.018286054953932762,8.201818673114758e-06,0.0012266897829249501,7.92631835793145e-05,0.0010479384800419211,0.0003319355600979179
Wehavecrashed,"1. '/s' is dumb, sarcasm is obvious.2. Yes I was talking shit about Indian Cricket.",0.9473989009857178,0.05045309662818909,0.6991128921508789,0.02455371618270874,0.5383568406105042,0.09111003577709198
bombo_red,When you talk about 'aren't that good' talk about the 'Waste Indies',0.010347525589168072,3.574900119929225e-06,0.0007445743540301919,3.65815831173677e-05,0.0005305634113028646,0.00017125610611401498
rattleandhum,"half of the world population, you mean?",0.3170163333415985,0.0008535379893146455,0.0249618086963892,0.0037811065558344126,0.03906469792127609,0.011443788185715675
NAN,"The sports we care about, we are pretty competitive in. It's like that saying about fish being asked to climb trees. We do well in cricket, hockey, badminton, shooting, chess, kabaddi. We've got our sweet spots and boy, do we hit them hard!",0.004989103879779577,4.129831268073758e-07,0.0004803198971785605,7.620373708050465e-06,0.0001557872019475326,4.063908272655681e-05
NAN,"Yeah, boy, you hit field hockey so hard that your last olympic medal in it is from 1980 in Moscow where half of the world boycotted the games.",0.11530812829732895,0.00012601737398654222,0.008608382195234299,0.0008784352685324848,0.010647572576999664,0.002873579738661647
Joko11,Hockey? You sure?,0.19721166789531708,0.0004885814851149917,0.014496581628918648,0.0023786905221641064,0.02067161351442337,0.007183833513408899
AustinxRyan,Probably means field hockey not ice hockey,0.005875634960830212,1.399995539941301e-06,0.000328892027027905,1.7322290659649298e-05,0.00025112045113928616,9.719156514620408e-05
NAN,[removed],0.027424072846770287,2.4321454475284554e-05,0.0018184053478762507,0.0002107009495375678,0.0019011300755664706,0.0009046075283549726
NAN,[removed],0.027424072846770287,2.4321454475284554e-05,0.0018184053478762507,0.0002107009495375678,0.0019011300755664706,0.0009046075283549726
NAN,[removed],0.027424072846770287,2.4321454475284554e-05,0.0018184053478762507,0.0002107009495375678,0.0019011300755664706,0.0009046075283549726
SunshineLovestorm,"India had a spot in World Cup 1950, but turned it down!",0.03740055859088898,2.9797769457218237e-05,0.0023595013190060854,0.0002495897060725838,0.002619509119540453,0.0010626307921484113
new_number_one,"Maybe instead of the World Cup, espn can just show a series about how much India sucks at sports.",0.2464400678873062,0.00017219039727933705,0.02994162030518055,0.0009910955559462309,0.022224677726626396,0.003336290130391717
lonestarhandy,"Yeah but Indians are like the most unathletic people on the face of the earth. Americans are actually good at sports, generally speaking.America also has a large club soccer system that is basically just a big scam. American families who put their kids on ""high-level"" soccer clubs are paying more than just about anywhere else in the world, and the results are inexcusably bad. The US club system has literally never produced a world class player. It's pathetic. If I were a club soccer coach in the US I honestly don't know how I could sleep at night, being such a hideous thief.edit: Sorry if this comment offended any Indian redditors but, until pooping in the street becomes an Olympic event, I stand by my comment.",0.054038871079683304,3.8567017327295616e-05,0.009157163091003895,0.00029383247601799667,0.0033907610923051834,0.0011051975889131427
HoMaster,"It's not that Indians are unathletic. It's that India doesn't have a system in place to support sports the way the US or other countries do, except Cricket. And that's due to the British influence.",0.003741381922736764,5.536684852813778e-07,0.00027674250304698944,8.356512807949912e-06,0.00014475674834102392,4.265462848707102e-05
lonestarhandy,"So if India had a well-developed system for Rugby, they'd be just as good as countries like Australia and New Zealand? I'm skeptical. I don't think there's a support system that can make the average Indian a foot taller and 80 pounds heavier.",0.007935977540910244,2.003087047341978e-06,0.0006103470805101097,2.5212648324668407e-05,0.0003946623473893851,0.0001026902100420557
HoMaster,China was a nobody in world sports competition until the government decided to pour money and resources into it. The same can be done in India if they had the money and the will.,0.017436478286981583,6.319918611552566e-06,0.0012093299301341176,6.292615580605343e-05,0.0009908745996654034,0.00028085397207178175
lonestarhandy,China is also an authoritarian country that will take a kid from their family to train at a sport because the kid is singled out as having favorable characteristics for it. India won't do that.,0.023735586553812027,1.10658638732275e-05,0.0016331396764144301,0.00011666520003927872,0.001503690262325108,0.0004524502146523446
HoMaster,"So unless it's an authoritatian country throwing a kid into a sport you won't get results? Bottom line is if you invest money and resources into setting up a system to produce world athletes, you will get world athletes. The main problem with India in this regard is money. As you said, they can't afford toilets let alone a school system rich enough to support and nurture world class athletes.",0.029889237135648727,1.6306436009472236e-05,0.0025114300660789013,0.00014615996042266488,0.0021115727722644806,0.0005290672997944057
lonestarhandy,"> Bottom line is if you invest money and resources into setting up a system to produce world athletes, you will get world athletes.Ironic, considering this thread was originally about US soccer, which has spent countless amounts of money and never produced world class athlete.",0.026034144684672356,1.2849330232711509e-05,0.002127300249412656,0.00011861998791573569,0.0017656399868428707,0.0004439421172719449
NAN,[removed],0.027424072846770287,2.4321454475284554e-05,0.0018184053478762507,0.0002107009495375678,0.0019011300755664706,0.0009046075283549726
NAN,[removed],0.027424072846770287,2.4321454475284554e-05,0.0018184053478762507,0.0002107009495375678,0.0019011300755664706,0.0009046075283549726
soonwar,"I hope shitting from mouth becomes a sport, you'll win gold.",0.10212790220975876,8.233172411564738e-05,0.007288256194442511,0.0005611612577922642,0.008323450572788715,0.001928480458445847
lonestarhandy,"No, Australia would definitely run away with that event.",0.0051842923276126385,1.2016897699140827e-06,0.00032063742401078343,1.6122965462272987e-05,0.00022503582295030355,8.229271043092012e-05
teh_venM,What about cricket?,0.016451802104711533,9.83590871328488e-06,0.0011247064685449004,9.3738482974004e-05,0.0009864616440609097,0.0004349065129645169
