id,comment,toxic,severe_toxic,obscene,threat,insult,identity_hate
p1ratemafia,"update your phone, patch was pushed yesterday",0.0026875431649386883,2.87554428268777e-07,0.0001705519389361143,4.4187090679770336e-06,9.663365926826373e-05,2.593468889244832e-05
rebuked_nard,"Damn, me really liked his resolution. Me can finally speak as me please",0.3092585504055023,0.00034037319710478187,0.0346304252743721,0.0017568115144968033,0.033618487417697906,0.0062993657775223255
IsraeliForTrump,"Hey, you've got reason to celebrate mate - Egypt qualified for the first time since 1990! And to my knowledge, the only time before that was in 1934.Still waiting myself for Israel to make at least a dent",0.017346933484077454,5.514128133654594e-06,0.0014039850793778896,6.140341429272667e-05,0.0009862844599410892,0.00023436342598870397
dlm891,Israel qualifying for Qatar 2022 would be interesting,0.009511329233646393,2.9879226985940477e-06,0.0006405736203305423,3.596013266360387e-05,0.00046316839870996773,0.00019151107699144632
IsraeliForTrump,"I think a far more accurate adjective here would be ""infuriating"". Just take a look at what happened a few weeks ago when an Israeli won a gold medal in UAE : https://www.timesofisrael.com/israeli-wins-gold-at-abu-dhabi-judo-tourney-which-refuses-to-play-the-anthem/For anyone who can't click the link for whatever reason, here's a summary - ""An Israeli judoka won a gold medal on Thursday at the Abu Dhabi Grand Slam judo tournament, but had to sing his own private “Hatikvah” because the organizers refused to play the Israeli national anthem. He also had to celebrate his victory under the International Judo Federation's flag, because the emirate banned the display of Israeli symbols.""It's honestly just appalling that sports, which is supposed to represent people's ability to come together and compete one against another in the spirit of the old Greek Olympics when war was put on hold and hostilities put aside, sees such behavior with no repercussions.",0.009351078420877457,3.6408539472176926e-06,0.001181680359877646,3.568499596440233e-05,0.0004370970418676734,0.00016516903997398913
dlm891,"I can tell you that many fans around the world will be rooting for Israel next qualifying cycle, just to see the Qatar World Cup turn into an even bigger shitshow than it already is.",0.0243894774466753,1.2136134500906337e-05,0.0016892062267288566,0.00011470552999526262,0.001485523534938693,0.00045550300274044275
IsraeliForTrump,"Damn, that's awesome to hear, man! But even we don't have any hope for that happening lol. Excluding like 3 nations(I think it was Indonesia, Cuba and Tahiti), Israel is the country with the longest streak of not making it to the qualifying round(Last time was in 1970). Though it sure would be hell of a shitshow, as you said, to see us qualifying for the first time in 50 years just to spite people who don't understand sports represent a bridge between nations and cultures rather than a platform to express your hate. At least last olympic the committee did the right thing when this hate was expressed:https://www.theguardian.com/sport/2016/aug/15/egyptian-judoka-sent-home-israeli-opponent-hand-shake-olympics",0.020079903304576874,8.798398084763903e-06,0.0030027565080672503,7.571910828119144e-05,0.0011457676300778985,0.00028905723593197763
JN27,Are... are you El Shaarawy...?,0.2734096646308899,0.0008472180925309658,0.02211861126124859,0.003630273276939988,0.03543807193636894,0.011064368300139904
johnsonandhisjohnson,And Italians probably.,0.01764615811407566,1.1364085366949439e-05,0.00111769896466285,0.00010474034934304655,0.001094646635465324,0.0004730077343992889
OfficerMendez,Whaddya gonna do huh?,0.10164865106344223,0.00023114342184271663,0.007047819904983044,0.0013002017512917519,0.009772560559213161,0.0043894099071621895
wellitri3d,I legitimately don't know who to pull for now.,0.04358232021331787,5.1792831072816625e-05,0.0028260708786547184,0.00038249095086939633,0.0032723199110478163,0.0015767412260174751
milk5829,Always Iceland if your country is out,0.09882039576768875,0.00014136430399958044,0.006495426408946514,0.0008846585405990481,0.008375845849514008,0.003056045388802886
wellitri3d,"I was thinking Iceland or whatever African nations make it, they always seem to have the most fun.",0.0233563594520092,1.6597074136370793e-05,0.0015300557715818286,0.00016136553313117474,0.0015273818280547857,0.0006322188419289887
NorthAve,"Don't worry, Miami is doing good in NCAA football, which means they have something to cheer about.",0.0038570764008909464,6.047471856618358e-07,0.0002660298196133226,8.688326488481835e-06,0.0001546838611830026,4.384507337817922e-05
NE-0N,I don't even watch soccer and I'm still depressed.,0.012125235050916672,6.0481570471893065e-06,0.0008273957064375281,5.9958962083328515e-05,0.0006900671287439764,0.00027229631086811423
dgimpastato,Can confirm. Source: I'm Italian-American.,0.017442598938941956,5.426248662843136e-06,0.0011447197757661343,5.90367526456248e-05,0.0009503785404376686,0.0002533831284381449
Dontmovetoaustintx,You're telling me. I married one!,0.06900057941675186,0.00010976042540278286,0.004808771423995495,0.0006538339075632393,0.006029094103723764,0.002400825032964349
Kuido,I'm greek American it's looking bleak,0.06292879581451416,6.432972440961748e-05,0.004208467900753021,0.00047162864939309657,0.005003312136977911,0.0019186539575457573
Blow-The-Whistle,"For real man. Like I was bummed about the US because we have a good squad and blew it. But I was like okay, I'll do like everyone else and use my heritage and cheer on Italy. Now I'm like, do I cheer on Germany? Because then I'm just that tool that goes for the favorites",0.06154574453830719,6.584806396858767e-05,0.004452998284250498,0.0005055685760453343,0.0049300300888717175,0.0017499919049441814
RedBullFan137,Don't even get me started man,0.04758631810545921,5.599471114692278e-05,0.0030508125200867653,0.0003968707751482725,0.0035585113801062107,0.0015191893326118588
CTeam19,As an American who is half Dutch don't remind me.,0.15678568184375763,0.0003676953783724457,0.010338456369936466,0.001891006133519113,0.015862740576267242,0.006349352188408375
Vocitate,Me.,0.15363964438438416,0.0005320400814525783,0.011624323204159737,0.002705942140892148,0.01756782829761505,0.00758349010720849
IsMiseOzz,I'm just praying the Irish-Americans don't feel the same way tomorrow,0.01990566775202751,1.2364559552224819e-05,0.0011911749606952071,0.00011263464693911374,0.0011301710037514567,0.0005359071656130254
guyincognito777,"Confirmed. I'll root for Iceland, because fuck it.",0.9723019599914551,0.06261789798736572,0.8105307817459106,0.02056211046874523,0.6247677803039551,0.08105058968067169
belgariad222,Joke's on everyone else I'm Italian American and German 😎,0.05750862881541252,6.855917308712378e-05,0.003834672272205353,0.0004913308657705784,0.004558852408081293,0.0018036848632618785
GoEagles247,Can confirm,0.029988138005137444,3.247118365834467e-05,0.0020247898064553738,0.00025736395036801696,0.002191227162256837,0.0010519130155444145
NAN,They'll just continue being annoying Yankees fans.,0.029412517324090004,1.4763910257897805e-05,0.0018720395164564252,0.0001458043116144836,0.0017886959249153733,0.000634805706795305
Bigbadbear888,"It hurts already, buddy",0.03188658133149147,2.699091419344768e-05,0.0019736841786652803,0.00022107928816694766,0.002111266367137432,0.0009670614963397384
TheGakGuru,I've decided to rewatch the 2006 WC in place of normal match days.,0.0062879170291125774,1.3456450460580527e-06,0.00036149442894384265,1.813417657103855e-05,0.0002618203579913825,9.362850687466562e-05
brianMMMMM,Ayyyeee OOOooohhhhhh. Whhoooaaaa. Aayyyyeee.,0.09350578486919403,0.000316751713398844,0.00731961103156209,0.0017841528169810772,0.01021448615938425,0.005277747754007578
I_am_the_Moon_King,"Nah, like most Americans who watch the World Cup, they'll just latch on to the team most likely to win.",0.011184784583747387,2.4925716388679575e-06,0.0007168472511693835,2.920445149356965e-05,0.0005046153091825545,0.0001501781225670129
Fighterhayabusa,If it weren't for the Astros winning I'd be a broken man.,0.01498300489038229,7.016379640845116e-06,0.0010037801694124937,6.838158151367679e-05,0.0008441978134214878,0.00032442627707496285
john_denisovich,Or not care at all. Which is more likely.,0.015779562294483185,8.514586625096854e-06,0.0011070120381191373,8.602165326010436e-05,0.0009378573158755898,0.0003878342395182699
materfuze,Yea it's gonna be real tough not watching us go out in the first round,0.04817252606153488,4.755458940053359e-05,0.003463023342192173,0.0004039012419525534,0.0038235317915678024,0.0015399972908198833
WeTheCitizenry,"Italian-American checking in. Can confirm, am upset.",0.027550172060728073,1.7372665752191097e-05,0.0017098953248932958,0.000153400978888385,0.0017493896884843707,0.0006090027745813131
its_a_tarp_,Mama Mia!,0.7667875289916992,0.012357586063444614,0.21615350246429443,0.025425566360354424,0.25728896260261536,0.06360812485218048
Cyclonitron,I now pretty much have zero reason to watch the WC next summer.,0.018820520490407944,1.1280500984867103e-05,0.0012309432495385408,0.00010784235200844705,0.0011135006789118052,0.00047650907072238624
NAN,"""aaaaaye I'm walkin ova here!""",0.04865752160549164,6.664867396466434e-05,0.0031860829330980778,0.00047411254490725696,0.0038018710911273956,0.0018075575353577733
PC__LOAD__LETTER,Americans are used to the US losing in the first round. We'll hardly know the difference.,0.01505678053945303,5.151521691004746e-06,0.001079846522770822,5.910254913032986e-05,0.0008329393458552659,0.00025975366588681936
falconbox,Only if they care about soccer.,0.03623853623867035,3.84481500077527e-05,0.0024906194303184748,0.0002971556386910379,0.002723023993894458,0.0011572206858545542
harambe4prezident,As a dutch italian i have the same struggle,0.006694686599075794,1.8695163817028515e-06,0.000437371083535254,2.172611675632652e-05,0.0003064264892600477,0.00011443655239418149
leshake,What shirt are all the Jersey bros gonna wear to games now?,0.022877410054206848,1.3449032849166542e-05,0.0013866599183529615,0.00012615250307135284,0.0013804283225908875,0.0005954186781309545
metompkin,means more time for GTL.,0.01221062894910574,5.061161118646851e-06,0.0007539812941104174,5.5814514780649915e-05,0.0006431812071241438,0.00028607051353901625
PrinceOfWales_,You don't even know...I'm dead inside,0.3258111774921417,0.001052111852914095,0.026684174314141273,0.004277121741324663,0.04220210760831833,0.013201212510466576
thewisepuppet,We have litteraly cancelled all barbecue date for the Summer.,0.012890677899122238,5.711284302378772e-06,0.0008425640407949686,6.212154403328896e-05,0.0007037668256089091,0.00028728405595757067
wowthisguyoverhere,Yup. Soccer couldn't be more dead to me. As you can see I'm very salty by both clubs not qualifying.,0.026723304763436317,1.542658355901949e-05,0.001725593931041658,0.00014109832409303635,0.001668810728006065,0.0005565849714912474
hotstickywaffle,Yeah... This hurts...,0.107857346534729,0.00023587793111801147,0.007379805203527212,0.0013828210067003965,0.010842377319931984,0.004731996916234493
ironmanmk42,"After Italy won the FIFA cup in 2010, Italians in the NJ area went crazy flying Italian flags. These were mostly 3rd gen Americans flying the Italian flag. tbh I don't think it is right to do that but that wasn't what annoyed me. What annoyed me was their cursing and drinking and yelling and shouting on the streets of Hoboken, NJ. Disgusting behavior",0.052726585417985916,1.4573091903002933e-05,0.004383489489555359,0.00012875690299551934,0.0030620277393609285,0.0004836092994082719
Astyanax1,"I suppose they could always cheer for... you know, america",0.0337182953953743,1.9459317627479322e-05,0.002454973990097642,0.0001610353501746431,0.0021916585974395275,0.0005557601107284427
throwawaythatbrother,The USA isn't in. That's the point.,0.009743187576532364,3.933848347514868e-06,0.0006440240540541708,4.276838808436878e-05,0.0005117286345921457,0.00020659258007071912
StuffSpurs,Someone doesn't follow football.,0.008029130287468433,2.4887001472961856e-06,0.0005665057105943561,2.954742740257643e-05,0.00040209616417996585,0.00015852053184062243
shikhar30,https://imgur.com/a/wWwfBThis wiki headline sums it up for ventura too.,0.07961244881153107,7.0087582571432e-05,0.005773971788585186,0.0004939048085361719,0.006426872219890356,0.0018704170361161232
imguralbumbot,"^(Hi, I'm a bot for linking direct images of albums with only 1 image)**https://i.imgur.com/KnNyTuK.jpg**^^[Source](https://github.com/AUTplayed/imguralbumbot) ^^| ^^[Why?](https://github.com/AUTplayed/imguralbumbot/blob/master/README.md) ^^| ^^[Creator](https://np.reddit.com/user/AUTplayed/) ^^| ^^[ignoreme](https://np.reddit.com/message/compose/?to=imguralbumbot&subject=ignoreme&message=ignoreme) ^^| ^^[deletthis](https://np.reddit.com/message/compose/?to=imguralbumbot&subject=delet%20this&message=delet%20this%20dprxlvi)",0.008399765938520432,1.7680556538834935e-06,0.0006441780715249479,2.280151966260746e-05,0.0003937840519938618,0.00011143578012706712
WhyAlwaysMe1991,Ventura......vafanculo !!!,0.09350578486919403,0.000316751713398844,0.00731961103156209,0.0017841528169810772,0.01021448615938425,0.005277747754007578
thepurplebottle1,Sweden qualified for the first time since 2006,0.013368505984544754,5.159422926226398e-06,0.0008396434714086354,6.0287660744506866e-05,0.0007103720563463867,0.0002783765667118132
UncleGriswold,Could only imagine if Canada failed to qualify for the world cup of hockey. There'd be blood and poutine gravy running in the streets.,0.008392265997827053,1.1007048215105897e-06,0.0005539271514862776,1.6013585991458967e-05,0.0003612956206779927,7.18376541044563e-05
Mike9797,As a Canadian I cant even begin to imagine the outrage lol Fuck lol,0.9369704127311707,0.013804774731397629,0.6388540267944336,0.008241779170930386,0.4046593904495239,0.03668097406625748
NoClue22,"Can confirm, outraged at the thought",0.008652660995721817,2.5186413949995767e-06,0.0005518384277820587,3.031735286640469e-05,0.0003996698942501098,0.00016187253640964627
ClubberLain,Some riots should do the trick!,0.027413301169872284,2.333537304366473e-05,0.001652501174248755,0.00020149386546108872,0.001732886885292828,0.0008919825777411461
EricDaKat,"The world championships in hockey aren't actually a big thing, because they take place during may, which is the same time as the playoffs in the NHL meaning many fantastic players aren't given an opportunity to participate due to restrictions from their teams.",0.0033955033868551254,4.3382249259593664e-07,0.0002486223238520324,5.967287961539114e-06,0.00012742569379042834,3.2335716241505e-05
Dultsboi,"Ok so imagine if somehow Canada's best didn't qualify for the Olympics, and we had to send players who only play in Europe Just imagine the outrage then...",0.0014908164739608765,7.199503215815639e-08,0.0001145373098552227,1.397067876496294e-06,3.938196095987223e-05,9.788083843886852e-06
IamMrT,That's what's happening next year for Olympic hockey lol,0.004750499501824379,1.0401158760942053e-06,0.0003122932102996856,1.2946883543918375e-05,0.000203232528292574,7.27687292965129e-05
ItsMeMudkip,That's the joke man cmon,0.053055524826049805,7.565747364424169e-05,0.0033732682932168245,0.0005413504550233483,0.0041507333517074585,0.0020349128171801567
Donuil23,"Surprised no one else mentioned it, lol",0.0035463753156363964,5.925641062276554e-07,0.00024123395269270986,7.766862836433575e-06,0.000137393013574183,4.4479900680016726e-05
zdelusion,"I get the point you're trying to make. We'd probably launch a national inquiry like we did when we didn't win Gold in '06.It's possible, but would take a lot more then just sucking at one qualifier. The way Olympic hockey qualifiers work Canada would have to be absolute ass at tournaments for several years leading up to them. Currently Canada doesn't even bother sending close to its tier A rosters to the World Championship because it doesn't really matter and we're so comfortably qualified for everything. [IIHF standings for the curious](https://en.wikipedia.org/wiki/IIHF_World_Ranking)",0.23349721729755402,0.0002388295833952725,0.04572094976902008,0.0009830596391111612,0.024833764880895615,0.0034438855946063995
WaffleboardedAway,I don't think you get the point he's trying to make. Canadas best players aren't going to the olympics this year and they have to send players who mostly play in Europe. The outrage is... well pretty mild to be honest eh?,0.019443757832050323,5.97255439060973e-06,0.0014090649783611298,5.9724356106016785e-05,0.0010404647327959538,0.0002283409412484616
inbruges99,"Speak for yourself, I'm fucking pissed at those greedy fuckers ruining hockey (Bettman and the like). And I mean the whole insurance and money issue is bullshit, they have the world championships every year and NHLers can compete in that, but they can't break up the league for 2 weeks every 4 years for the olympics? Sorry for the rant aha",0.9378804564476013,0.008134691044688225,0.6472586989402771,0.004618422128260136,0.40098726749420166,0.025831500068306923
Anhydrite,And we still manage to win World Championships with those teams!,0.051895640790462494,5.89358969591558e-05,0.003577250288799405,0.0004229447222314775,0.004087999928742647,0.0016950526041910052
WikiTextBot,**IIHF World Ranking**The IIHF World Ranking is a ranking of the performance of the national ice hockey teams of member countries of the International Ice Hockey Federation (IIHF). It is based on a formula giving points for each team's placings at IIHF-sanctioned tournaments over the previous four years. The ranking is used to determine seedings and qualification requirements for future IIHF tournaments. The current leader in rankings is Canada in men's play and the United States in women's play.***^[ [^PM](https://www.reddit.com/message/compose?to=kittens_from_space) ^| [^Exclude ^me](https://reddit.com/message/compose?to=WikiTextBot&message=Excludeme&subject=Excludeme) ^| [^Exclude ^from ^subreddit](https://np.reddit.com/r/sports/about/banned) ^| [^FAQ ^/ ^Information](https://np.reddit.com/r/WikiTextBot/wiki/index) ^| [^Source](https://github.com/kittenswolf/WikiTextBot) ^| [^Donate](https://www.reddit.com/r/WikiTextBot/wiki/donate) ^]^Downvote ^to ^remove ^| ^v0.28,0.10756532102823257,8.181432349374518e-05,0.02372019924223423,0.0005203908076509833,0.00826070737093687,0.0020992145873606205
Gotthosebushyeyebrow,Yeah I wish that wasn't actually happening.,0.016460994258522987,8.127413821057416e-06,0.0011106218444183469,8.118868572637439e-05,0.000995810842141509,0.0003532383416313678
Jontenn,"Or like imagine the outrage when a Canadian team lost against an American team in the stanely cup final, there'd be riots and stuff...Oh wait.",0.006119392812252045,8.036283247747633e-07,0.0003690340381581336,1.0855663276743144e-05,0.00024215361918322742,4.773387627210468e-05
ElTechnoBanana,"That's a bad comparison, players aren't assigned to NHL teams based on their nationality. Up until 2015, more than half of all NHL players were Canadian, which is pretty insane when you consider that Canada has a tenth of the population of the US.",0.016158156096935272,5.661981958837714e-06,0.001279989373870194,6.787101301597431e-05,0.0009588808170519769,0.00025492277927696705
Jontenn,"he has a canucks flair, the last time the lost against the boston bruins in the stanley cup final there were city wide riots. I'm just pulling his leg here.",0.006410092581063509,1.280278183912742e-06,0.00045600347220897675,1.576235990796704e-05,0.00028771712095476687,6.841171125415713e-05
therealdilbert,"afaict it is mostly a ""we are more important than you"" between IIHF and NHL. In football there clubs are required to release player for the nation teams and the different club tournaments have usually have breaks for the national games",0.004343418870121241,6.023113314768125e-07,0.00033676717430353165,8.233064363594167e-06,0.00017918609955813736,4.181086114840582e-05
TzunSu,"Eh, what? It's a huge thing in both Canada and Sweden. The amount of roars you can hear in any apartment block in Sweden during games are easily comparable.",0.006570539437234402,1.6403511153839645e-06,0.0006398853729479015,1.975461418624036e-05,0.0003233926836401224,8.82828826433979e-05
dimethylarginine,lol fuck lol?,0.9770699739456177,0.11964695900678635,0.8550893068313599,0.03109423629939556,0.7005088925361633,0.10458674281835556
Mike9797,I guess it more of me typing what I am thinking to be honest. Like its unfathomable and makes me laugh in disbelief.,0.030759669840335846,2.904098255385179e-05,0.0020559232216328382,0.0002464409335516393,0.002211253857240081,0.0009629196138121188
seanyok,Well explained :),0.06215003505349159,9.4984432507772e-05,0.004253211431205273,0.0006720744422636926,0.0052634854800999165,0.0023781259078532457
Rube25,Frig off rick,0.8410422205924988,0.0294481348246336,0.33113893866539,0.041533730924129486,0.3842288851737976,0.09745882451534271
Bahndoos,He's being polite by laughing off the mention of 'fuck',0.7720962762832642,0.009908691048622131,0.1978796273469925,0.021301915869116783,0.2364574521780014,0.057798080146312714
SquashMarks,lol Canadians lol,0.007696758024394512,2.5965721306420164e-06,0.000472664280096069,2.9527540391427465e-05,0.00037697103107348084,0.0001628515892662108
iwaspeachykeen,lol fuckin Canads lol,0.9340766668319702,0.04870723932981491,0.6336409449577332,0.027163762599229813,0.4866550862789154,0.09845501184463501
Uy9KC7OP2R2yn6TZVSMP,Haha.. Fuck... Haha,0.9914727210998535,0.34753862023353577,0.9331565499305725,0.05092565342783928,0.8523157238960266,0.17122946679592133
ChunkyDay,Sorry.,0.018853962421417236,1.1527728020155337e-05,0.0012159222969785333,0.00011122897558379918,0.0011540288105607033,0.0005469475290738046
throwawayswede123,julia roberts' career has gone downhill tbh,0.02263319306075573,1.4348897821037099e-05,0.0014386044349521399,0.00013120383664499968,0.001403890666551888,0.0005845362902618945
Herrderqual,As a Canadian I'm trying to figure out how bad the riots would be. That might induce marshall law and a fall of the sitting government.,0.006185385398566723,1.31338811115711e-06,0.0004254380473867059,1.7709038729663007e-05,0.0002684746577870101,8.238261943915859e-05
Mike9797,Sports talk radio and the sports tv stations would probably be talking about it non stop for months. It would be unbearable.,0.0032330576796084642,3.619165056534257e-07,0.0002361452643526718,5.552136371989036e-06,0.00011712064588209614,2.9039098080829717e-05
NAN,"back bacon and toques everywhere, the humanity",0.11475197225809097,0.0001682540896581486,0.007093694061040878,0.0010621869005262852,0.00972813181579113,0.0036423562560230494
bmacdonald12,do you remember when Canada lost to Switzerland in the Olympics? ugh,0.07519752532243729,4.6016459236852825e-05,0.00531726935878396,0.00036238462780602276,0.00553179532289505,0.0012775443028658628
DrewsFire,I like the nervous double lol as a Canadian actually considered a the outcome.,0.0037785551976412535,4.366299322100531e-07,0.0002499912225175649,6.202269105415326e-06,0.00013566933921538293,3.7422571040224284e-05
EricDaKat,"The world championships in hockey aren't actually a big thing, because they take place during may, which is the same time as the playoffs in the NHL meaning many fantastic players aren't given an opportunity to participate due to restrictions from their teams.",0.0033955033868551254,4.3382249259593664e-07,0.0002486223238520324,5.967287961539114e-06,0.00012742569379042834,3.2335716241505e-05
skinte1,It is a big thing. At least when Canada wins... And since NHL players can play as long as their team is out of the playoffs around 75% of the players are available in may.,0.004657247103750706,7.410541229546652e-07,0.0003201749350409955,1.0778819159895647e-05,0.00019092766160611063,5.8095982240047306e-05
TardisTechnologist,"World juniors is a big deal but Canada not qualifying is out of the question. Soccer is far more international than hockey, there's many more teams and a greater spectrum. The big hockey countries dominate the small ones.The NHL's ""World Cup of Hockey"" is just put on as an extra money grab for the NHL, I enjoyed it last year but it's not like teams had to qualify. They essentially just made up the teams put of NHL players however they wanted and said ""go play hockey"".",0.022422034293413162,7.836121767468285e-06,0.002447552280500531,8.504290599375963e-05,0.0013459308538585901,0.00031964670051820576
EricDaKat,"The world championships in hockey aren't actually a big thing, because they take place during may, which is the same time as the playoffs in the NHL meaning many fantastic players aren't given an opportunity to participate due to restrictions from their teams.",0.0033955033868551254,4.3382249259593664e-07,0.0002486223238520324,5.967287961539114e-06,0.00012742569379042834,3.2335716241505e-05
canary_burns,"Coach Ventura has to emigrate soon, I'm pretty sure",0.026959728449583054,2.19909125007689e-05,0.0016798225697129965,0.0001851639390224591,0.0017633462557569146,0.0007890008855611086
MeC0195,It's not all his fault. He wasn't there during the whole qualifiers.,0.03538810461759567,2.1437854229588993e-05,0.0024861323181539774,0.00018547421495895833,0.002334749326109886,0.0007402822957374156
Adrian5156,"They got absolutely battered by Spain, only managed to beat Israel and Albania 1-0 and drew 1-1 at home with Macedonia. The warning signs have been there for a little while for Italy while the fans have been fed up with Ventura for a whole year by this point",0.0031761322170495987,4.088449543360184e-07,0.00025485039805062115,6.461539669544436e-06,0.00012456151307560503,3.130267941742204e-05
MeC0195,"I know, but he grabbed the team in a difficult situation already.",0.007727885618805885,1.7417587514501065e-06,0.0004799063899554312,1.9953589799115434e-05,0.0003458497812971473,0.00010228297469438985
