id,comment,toxic,severe_toxic,obscene,threat,insult,identity_hate
polerize,The strategy of scoring almost no goals didn't work,0.004496644251048565,7.810023703314073e-07,0.00031354499515146017,1.076114313036669e-05,0.0001804111961973831,5.8146033552475274e-05
A_Bit_Of_Nonsense,*almost*?,0.0274666715413332,2.1373345589381643e-05,0.001838569063693285,0.00020073163614142686,0.0018901277799159288,0.0008948223548941314
ChunkyDay,almost.,0.0274666715413332,2.1373345589381643e-05,0.001838569063693285,0.00020073163614142686,0.0018901277799159288,0.0008948223548941314
chopyhop,"People shouldn't be angry with the Italian team. There was a long time where many countries did not have serious football teams, that's simply not the case any more. There are few free wins, and throughout the last few qualifications it became harder for the big teams to qualify across the board.",0.007465772796422243,1.1271350786046241e-06,0.0006313670892268419,1.4145746717986185e-05,0.00033700771746225655,6.719590601278469e-05
yarnoshke,They were never qualified to begin with.,0.05377928540110588,6.589033728232607e-05,0.003576633520424366,0.0005149386706762016,0.0042594680562615395,0.001968580996617675
FerryAce,"The Italy national team in Euro 2016 is awesome. Was under Antonio Conte then. Great defence, unity and exciting attacking team as well. Going to miss them badly in the 2018 World Cup.",0.004165318328887224,5.641849156745593e-07,0.00031381953158415854,8.347424227395095e-06,0.00016654729552101344,3.829895649687387e-05
grine,Seems to have worked better than Italy's plan of scoring no goals at all.,0.006825086195021868,1.1749458508347743e-06,0.000470328755909577,1.595421417732723e-05,0.0002872873446904123,7.143672701204196e-05
FerryAce,"This is sad news. They were always one of those teams I look forward to watching. Was always an interesting team no matter how badly they did in the qualifier, they always does better in the main tournament. Italy will be missed. They have a failed manager. Forza Italia.",0.0030930412467569113,3.2819144735185546e-07,0.00026939643430523574,5.322574907040689e-06,0.00011376296606613323,2.7080506697529927e-05
TBNecksnapper,"Sweden followed the same strategy, worked for them!",0.00860090646892786,2.2224542135518277e-06,0.000529127602931112,2.6350504413130693e-05,0.00039559518336318433,0.0001310779043706134
batboy963,8 - 0 baby. Top that!,0.022143898531794548,1.7207778000738472e-05,0.0014224605401977897,0.0001503302773926407,0.0014170232461765409,0.0006216493202373385
GerryAdams32,Tell that to Ireland,0.0201755128800869,1.439868447050685e-05,0.001301590702496469,0.000139481300720945,0.0012749787420034409,0.0006425418541766703
cardboardunderwear,I thought all of soccer was almost no goals.,0.0398828499019146,2.8306732929195277e-05,0.0028009708039462566,0.000246690382482484,0.002808105433359742,0.0008460314711555839
1992_,I can't believe this is a thing. How soccer is so popular is beyond me.,0.009817101061344147,3.0630351375293685e-06,0.0008382572559639812,3.444722460699268e-05,0.0005236358847469091,0.0001389757526339963
JustFoundItDudePT,Football you mean. How the word soccer is so popular is beyond me.,0.007813522592186928,1.910775836222456e-06,0.0006493109976872802,2.141602999472525e-05,0.00037490655086003244,9.153998689725995e-05
rhaegar_tldragon,Soccer is a British word and was used in England until about 30 years ago.,0.006239532493054867,1.584399001330894e-06,0.0004905243404209614,1.918026464409195e-05,0.0003028174687642604,9.271375165553764e-05
TooLazytoCreateUser,"Some nations, like Ireland Australia and the USA, have different forms of football besides association football. In order to avoid confusion they use the name soccer.",0.002150028245523572,1.4519781643684837e-07,0.00017603587184567004,2.5822644147410756e-06,6.231015140656382e-05,1.8370008547208272e-05
-dsh,That what is a thing? Italy tried to score but they didn't manage to.,0.030570587143301964,2.1798692614538595e-05,0.0020294326823204756,0.00020573358051478863,0.002023551147431135,0.0008375108591280878
NAN,[deleted],0.062306083738803864,0.00012997032899875194,0.004337160848081112,0.0008427735301665962,0.00553680257871747,0.0029814550653100014
WikiTextBot,"**Catenaccio**Catenaccio (Italian pronunciation: [kateˈnattʃo]) or The Chain is a tactical system in football with a strong emphasis on defence. In Italian, catenaccio means ""door-bolt"", which implies a highly organised and effective backline defence focused on nullifying opponents' attacks and preventing goal-scoring opportunities.***^[ [^PM](https://www.reddit.com/message/compose?to=kittens_from_space) ^| [^Exclude ^me](https://reddit.com/message/compose?to=WikiTextBot&message=Excludeme&subject=Excludeme) ^| [^Exclude ^from ^subreddit](https://np.reddit.com/r/sports/about/banned) ^| [^FAQ ^/ ^Information](https://np.reddit.com/r/WikiTextBot/wiki/index) ^| [^Source](https://github.com/kittenswolf/WikiTextBot) ^| [^Donate](https://www.reddit.com/r/WikiTextBot/wiki/donate) ^]^Downvote ^to ^remove ^| ^v0.28",0.11299692839384079,6.566214142367244e-05,0.019257809966802597,0.0004992617759853601,0.008750110864639282,0.0019162766402587295
-dsh,I know what catenaccio is but this wasn't about catenaccio. Op said that Italy wasn't trying to score goals and he asked how that's a thing although Italy actually tried to score.,0.006642037536948919,1.6490421330672689e-06,0.0005022098193876445,2.0312138076405972e-05,0.00031867786310613155,8.971303032012656e-05
polerize,I don't know. Those 0-0 ties So thrilling! The beautiful game!,0.03417203947901726,2.6507574148126878e-05,0.0022930302657186985,0.00022488139802590013,0.0023031937889754772,0.0009286290151067078
Ermellino,"Soccer so simple, everyone can watch it and understand, but I also think it's bad, and almost every action consists of throwing the ball in front of the net and hope your comrade runs faster than the other... And it seems that they kick the ball randomly: there's no difference between a teen that does it as a hobby and a pro, considering precision. Failing a penality kick by missing the net, where the keeper just guesses and jumps randomly is proof of that...",0.009584972634911537,3.1180939004116226e-06,0.0007895989110693336,3.6968016502214596e-05,0.0005049451719969511,0.00013242516433820128
Remli_7,Can't tell if you're being sarcastic or watch too much MLS.,0.0546504445374012,6.218175985850394e-05,0.0033896544482558966,0.0004423059581313282,0.004161520395427942,0.0016900982009246945
new_number_one,I disagree with 100% of what you're saying but your criticism is hilarious.,0.01484586950391531,3.903454398823669e-06,0.0010011207778006792,4.364412961876951e-05,0.0007813891861587763,0.0001702635345282033
peanuts_for_sale,Who would have guessed. Iceland in. Italy and the Netherlands out.,0.041655585169792175,4.076095501659438e-05,0.002705527702346444,0.00031701757689006627,0.002961742924526334,0.0012038368731737137
RumblesUbambaa,And Sweden knocked out both Italy and the Netherlands!,0.045782480388879776,5.384513133321889e-05,0.0030709521379321814,0.00040138463373295963,0.003545776940882206,0.0014743191422894597
NAN,Damn.. Scandinavia coming in strong,0.7023694515228271,0.00592060899361968,0.16749422252178192,0.01528228260576725,0.19011199474334717,0.04489821195602417
Willof,"Iceland isn't part of Scandinavia. Edit: Except when it is. Edit2: Sweden, Denmark and Norway are officially Scandinavia. Sweden and Norway though are the only countries on the Scandinavian Peninsula. Finland, Iceland, Faroe Islands (and even Greenland if you're ambitious enough) can sometimes be constituted into Scandinavia.I LOVE YOU. Edit3: Physical and cultural geography are alternate modes of exploring and explaining our relationship to space, both of which are context-dependent and neither of which holds a monopoly on truth. -Someone smartier than me",0.0041139028035104275,7.415376899189141e-07,0.0003746211004909128,9.372801287099719e-06,0.00017517624655738473,3.8581918488489464e-05
CantFindMyWallet,They're close enough,0.04788302630186081,7.165381975937635e-05,0.003086742712184787,0.0005174043471924961,0.0037723910063505173,0.001944705960340798
Willof,Finland is closer.,0.011807427741587162,5.185937880014535e-06,0.0007530524744652212,5.486415102495812e-05,0.0006342686829157174,0.0002790940925478935
Iloveyou_upvoted,Finland doesn't exist.,0.0575934574007988,7.365873898379505e-05,0.003980318550020456,0.0005504261353053153,0.004717241041362286,0.002000650390982628
erixtyminutes,r/finlandConspiracy/,0.18137215077877045,0.0006861602887511253,0.014028185047209263,0.0035103424452245235,0.022120291367173195,0.00969617534428835
AlanMichel,Omfg you just opened up a whole new world. How many other don't exist?! Where is Finland?! Why don't I see it in old maps?,0.036464888602495193,2.7643722205539234e-05,0.0028869910165667534,0.00023708761727903038,0.002790077356621623,0.0008952236385084689
erixtyminutes,"As fas as I know it's just Finland, but I wouldn't surprised if there were others. The existence of the nation-state is an elaborate lie orchestrated by the Japanese to control finishing channels. You can read more about it in this [scholarly news article](https://www.reddit.com/r/AskReddit/comments/2qjohv/what_did_your_parents_show_you_to_do_that_you/cn6pn30/).",0.026788773015141487,1.017005524772685e-05,0.0022981425281614065,9.387918544234708e-05,0.0016078470507636666,0.00031630872399546206
AlanMichel,I just looked at one of my antique clocks withe the world map. Finland isn't even there,0.00317169982008636,4.1795325955718e-07,0.00021702855883631855,5.768590654042782e-06,0.00011974612425547093,3.238394856452942e-05
NerimaJoe,The city of Bielefeld in North Rhine-Westphalia in Germany also [doesn't really exist](https://rationalwiki.org/wiki/Bielefeld_conspiracy). It's on the map but have you even been there or met anyone from there?,0.002716911258175969,2.709931550270994e-07,0.00019775854889303446,4.2420788304298185e-06,9.290721209254116e-05,2.2875658032717183e-05
MankyBusiness1,"> Mossad owns the area. By using undocumented ley lines, they plan to discover lost tunnels to America and Australiawut",0.008714386261999607,2.0674403913290007e-06,0.0005803151289001107,2.5642695618444122e-05,0.0003971135593019426,0.00011672406253637746
RumWalker,Idaho is a lie,0.1588531732559204,0.00042110757203772664,0.01087598130106926,0.0022720021661370993,0.017144152894616127,0.0067141237668693066
notaunion,Hey I'm from there.,0.030658187344670296,3.230541915399954e-05,0.00202784757129848,0.00023837119806557894,0.002189601305872202,0.0010260785929858685
RumWalker,That's what they want you to think.https://web.archive.org/web/20041012002236/http://www.fantasymaps.com:80/stuff/idaho.html,0.006032693199813366,1.6811961813800735e-06,0.0004884038353338838,1.9336079276399687e-05,0.000303295673802495,8.851452003000304e-05
IsThisMeta,"Sometimes I think it's weird that Idaho in specific has its own breathing, sprawling cities and stories. I just feel like.. what are you doing Idaho do you think you are people? That place should just be a huge cornfield no?",0.45943978428840637,0.000818191678263247,0.05439165234565735,0.004232590086758137,0.06345593184232712,0.012633886188268661
lind_p,Some city in Germany doesn't exist as well. I can't remember the name unfortunately. Not worth remembering names for fictional cities anyway.Edit: had to google it. Bielefeld doesn't exist.,0.00849096942692995,2.2255890144151635e-06,0.0006719063385389745,2.721329110499937e-05,0.00042678273166529834,0.00010924949310719967
SgvSth,/r/mapswithoutfinland,0.18137215077877045,0.0006861602887511253,0.014028185047209263,0.0035103424452245235,0.022120291367173195,0.00969617534428835
Nipezar,as a finn I am shocked that this subreddit exists,0.010380812920629978,3.6130925309407758e-06,0.0006796368397772312,4.084881948074326e-05,0.0005452779587358236,0.00019860245811287314
erixtyminutes,I'm sorry to be the one to tell you this... your life is a lie.,0.38600826263427734,0.000929617031943053,0.029615623876452446,0.004131930880248547,0.047721851617097855,0.012243437580764294
Nipezar,"Thank you friend. However, what am i looking at outside? Narnia? Where am I?",0.006331870332360268,1.0617000043566804e-06,0.0004908786504529417,1.3998917893331964e-05,0.00026736859581433237,6.651546573266387e-05
erixtyminutes,I'm pretty sure that's the ocean and you're a Japanese fisherman.,0.09027216583490372,0.0001246312604052946,0.005854177288711071,0.0008291138801723719,0.007628761697560549,0.0027837217785418034
Nipezar,That would explain my deep love for sushi.. I think i need to talk to someone,0.011103133670985699,3.1530951218883274e-06,0.0007210187613964081,4.06383078370709e-05,0.000546974886674434,0.0001809970272006467
melonkernel,"Finland was the eastern part of Sweden longer than Skåne has belonged to Sweden... then Russia took it and we became an autonomous duchy in the Russian empire. Then a hundred years ago we declared our independence and became this awesome country of our own. We are not scandinavia, but part of ”the Northern countries” together with Iceland, Denmark (and yes Greenland & Faroe Island since they belong to Denmark), Norway and Sweden. Scandinavia + Finland is called Fennoscandia",0.004801802337169647,8.513640636920172e-07,0.0004583924310281873,1.2326072464929894e-05,0.00019519914349075407,5.639829396386631e-05
metalmetal1,#FINLANDDD!!!!!,0.09350578486919403,0.000316751713398844,0.00731961103156209,0.0017841528169810772,0.01021448615938425,0.005277747754007578
JustWhateverUsername,Australia doesn't either according to some flat earthers.,0.007864363491535187,2.0261343252059305e-06,0.0004887966788373888,2.5416351491003297e-05,0.0003668113786261529,0.00012729258742183447
jwthawk,"Well, Today I Learned... Wow.",0.010500669479370117,3.968389592046151e-06,0.0006901681190356612,4.095971962669864e-05,0.0005479825777001679,0.00020795504678972065
remuliini,"If Finland existed it would have qualified to major tournaments by now. Not even once, thereby it doesn't exist.",0.009330248460173607,2.317581220268039e-06,0.000662965583615005,2.9697996069444343e-05,0.0004604518471751362,0.00012881732254754752
T8BZ,As a Finn I can confirm,0.04518911615014076,5.908778257435188e-05,0.0030741507653146982,0.00040372912189923227,0.003580872667953372,0.0015646808315068483
artaxerxes316,"See, I respect that. Most Finns I've met are just too damned smug to admit that they don't exist. Bravo, sir.",0.020973186939954758,1.065051128534833e-05,0.0013756040716543794,0.00010690386989153922,0.0012565323850139976,0.0003940687165595591
morinessan,"No, no, no. I believe that what you mean is that Denmark doesn't exist.",0.06942956894636154,9.135372965829447e-05,0.005278822034597397,0.0005916767986491323,0.006042379420250654,0.002002094406634569
Feynization,"Once again, technically not Scandinavia",0.033544864505529404,3.10062023345381e-05,0.002122692298144102,0.0002603459870442748,0.0023989470209926367,0.0010494741145521402
Willof,Exactly my point.,0.008850370533764362,2.950702764792368e-06,0.0005516709061339498,3.3045893360394984e-05,0.00043207278940826654,0.0001752587704686448
frugalerthingsinlife,But the Faroe Islands [*sometimes*](https://en.wikipedia.org/wiki/Scandinavia) qualify? Veird.,0.03192063421010971,2.603755820018705e-05,0.0020035954657942057,0.0002322313521290198,0.002203630981966853,0.0008863612893037498
Willof,Blame Denmark.,0.01368800364434719,6.633411885559326e-06,0.0008935481891967356,7.051200373098254e-05,0.0007770741940476,0.00035605434095487
Hemmingways,They have a goalkeeper with a top hat. don't blame us!,0.07601235806941986,0.00011594974785111845,0.005163327790796757,0.0007839970639906824,0.006844066083431244,0.0027920708525925875
mechadragon469,"Blame Canada, Blame Canada.",0.004894791636615992,9.670909548731288e-07,0.00031790166394785047,1.31312654048088e-05,0.00020684232003986835,7.894756708992645e-05
ezR6s,You Americans...,0.6419836282730103,0.00784303992986679,0.11416864395141602,0.020229777321219444,0.17096999287605286,0.04691436514258385
Lurk_and_Chill,"Once again, technically not a country",0.08027614653110504,0.00012163024075562134,0.005249794106930494,0.0008410916780121624,0.006960353814065456,0.0028552873991429806
NAN,"They didn't qualify, though.",0.03592134639620781,3.151678538415581e-05,0.0023869583383202553,0.00026840734062716365,0.0025787949562072754,0.0010372442193329334
Elvysaur,"Geographically yes, in every other way, no",0.03904208540916443,3.539518002071418e-05,0.0025603859685361385,0.0002976549440063536,0.0027435484807938337,0.0011701476760208607
Willof,"I'm confused, is Finland different to Sweden in every other way compared to Iceland?",0.008513081818819046,2.1335561086743837e-06,0.0005681684706360102,2.706380473682657e-05,0.0003983514616265893,0.00012944814807269722
Elvysaur,"Iceland is basically an offshoot of Norway/Denmark from 1000 years ago. Finland is a totally different culture, language family, etc. So yes, Iceland is much more ""Scandinavian"" than Finland in every way save geographic distance",0.0033253596629947424,5.405947263170674e-07,0.00029888455173932016,8.059714673436247e-06,0.00012698779755737633,4.1631188651081175e-05
Willof,Well language certainly but I'd take heed to call finnish and swedish culture totally different.,0.002053041011095047,1.9595694311647094e-07,0.00015325448475778103,3.1475672130909516e-06,7.215704681584612e-05,1.8471688235877082e-05
pewpew69weed,"Finland is a Nordic country, along with Denmark and all the other mentioned counties. They do follow the Scandinavian model (social democracy, think Bernie but actually sound economically). But you're right, their most common language has a remote relation to Hungarian, and nothing else. However, most of them do speak Swedish. This one can see that on many levels they are Scandinavian. Cultural aspects such as food howver, have more in common with Russian culture.Source: Norwegian who was on a cultural exchange in esbo/Helsinki.",0.007439663168042898,1.7146899153885897e-06,0.0006747403531335294,2.3511664039688185e-05,0.00038438517367467284,8.373684249818325e-05
Rodec,[Super cool video about it.](https://youtu.be/TsXMe8H6iyc)GCP GREY,0.05457428842782974,4.182066913926974e-05,0.0033044868614524603,0.00033977715065702796,0.0037673369515687227,0.0012376750819385052
Trumpstered,"Wikipedia.orgThe term Scandinavia always includes the three kingdoms of Denmark, Norway, and Sweden. The remote Norwegian islands of Svalbard and Jan Mayen are usually not seen as a part of Scandinavia, nor is Greenland, a constituent country within the Kingdom of Denmark. However, the Faroe Islands, also a Danish constituent country, are sometimes included, as sometimes are Iceland, Finland, and the Finnish autonomous region of the Åland Islands, because of their historical association with the Scandinavian countries and the Scandinavian peoples and languages.",0.0015168505487963557,1.4015475358064577e-07,0.00012805812002625316,2.222216835434665e-06,4.829528188565746e-05,1.3001685147173703e-05
jansencheng,"Use the Nordic Countries, that unambiguously includes everybody you'd associate with it.",0.005559243727475405,1.0251305866404437e-06,0.00034532349673099816,1.3636637959280051e-05,0.0002307611284777522,7.042370270937681e-05
Kalapakki,"Friendly reminder everyone, do not accidentally associate Estonia with Nordic. :)",0.0036450482439249754,4.0178844074034714e-07,0.00022327368787955493,5.824238996865461e-06,0.00013569858856499195,3.3840304240584373e-05
jansencheng,"They are on the Nordic Council, though. 🤔",0.04666423052549362,4.7509172873105854e-05,0.003181323641911149,0.00037766058812849224,0.0035955135244876146,0.0014665917260572314
pref-top,Estonia isn't on the nordic council. They are are an observative member.,0.030279770493507385,2.2142365196486935e-05,0.0019443053752183914,0.0002012951299548149,0.001991467783227563,0.0008889853488653898
lgb_br,"Just say: ""Those countries in and around that peninsula that is shaped like a dick"". (I know, Peninsula comes from Penis, it's basic Latin).",0.8987672328948975,0.01308300718665123,0.45672157406806946,0.01180279441177845,0.3536417484283447,0.05297175049781799
FallOnSlough,"For anyone who wonders whether the above stated etymology is true - it is not. Peninsula comes from the latin words for 'almost' (paene) and 'island' (insula). Same 'pen-' as in penultimate.But that's the boring truth. I like the penis version better, so I'll stick with that explanation in the future.",0.03431346267461777,9.857826626102906e-06,0.003160106483846903,0.00010063451190944761,0.002026332076638937,0.0004566233546938747
lgb_br,"Dang Latin nerds, lemme troll Reddit alone! Hahaha, fair play. It's completely bollocks, but it's a way funnier explanation.",0.09977947920560837,9.983145719161257e-05,0.006889174226671457,0.0007482814253307879,0.008617699146270752,0.00287014152854681
Fapoleon_Boneherpart,TIL,0.03222845494747162,3.757569720619358e-05,0.0021412677597254515,0.00029953778721392155,0.0024019547272473574,0.0012247726554051042
pm_your_boobiess,"Estonia... So close, but still so far, even the Estonian language sounds like Finnish.",0.012515497393906116,5.929151484451722e-06,0.0008277202141471207,6.548386591020972e-05,0.0007038225303404033,0.0002776100591290742
OldGodsAndNew,"Using the Nordic Council doesn't help. It includes Schleswig-Holstein, a state of Germany",0.007912197150290012,1.4450822618528036e-06,0.0005826675333082676,1.845698534452822e-05,0.0003513422852847725,8.575072570238262e-05
MoustacheSanctuary,"> Schleswig-Holstein, a state of GermanyI think you mean German occupied Danish territory.DENMARK TO THE EIDER!!!",0.04105944186449051,4.113716568099335e-05,0.0028167725540697575,0.00033223285572603345,0.003042195225134492,0.0012340153334662318
ameya2693,"They are on the council, but they are not granted the rank of member.",0.005583763122558594,9.997565939556807e-07,0.0003481530584394932,1.3812901670462452e-05,0.00022734836966264993,7.801283936714754e-05
KetchupBlood,As an observer. Not a member.,0.03604536131024361,3.4772125218296424e-05,0.0023779382463544607,0.00027942529413849115,0.0026172837242484093,0.0011815947946161032
MonsterRider80,Eesti can not into Nordic. :(,0.043612245470285416,5.504631917574443e-05,0.0028530224226415157,0.00041445239912718534,0.0033951178193092346,0.001575560076162219
warpainter,No no it's cool. Estonia is always invited to all the parties,0.013516307808458805,6.261235284910072e-06,0.0009037115960381925,7.044828817015514e-05,0.0007562696118839085,0.00030220660846680403
MartinBlank73,"Except you know realistically Scotland Ireland England and the ne Her land and Germany can fit in that too, and the baltics at times.Acting like there is one best word for something like this is typically folly, and definitely folly here.",0.008561632595956326,2.147641907868092e-06,0.0006335147190839052,2.4617342205601744e-05,0.0004131565219722688,0.00010523099626880139
plomerosKTBFFH,"They can? I've NEVER heard anyone referring to Scotland, Ireland, England or Germany as part of the Nordic countries. That is reserved for Sweden, Denmark, Norway, Finland & co.I mean sure you can be super-technical and say ""But they are in the northern part of Europe"", but with that reasoning you could also count Bulgaria or Romania to Southern Europe but nobody does that. The Nordics is a term unequivocally used to refer to the Scandinavian (you know which one's I mean ;) ) countries.",0.001090693287551403,4.280887822005752e-08,9.880069410428405e-05,8.527169939043233e-07,2.344210042792838e-05,7.122576789697632e-06
MartinBlank73,"Well you should read some more history and ethnography then. Certainly those countries are lumped in depending on what lense you are using.>unequivocallyyou used this word, but I don't think you know what it means.",0.019401807337999344,9.817119462240953e-06,0.0016775619005784392,9.948069782694802e-05,0.0013195561477914453,0.00037069356767460704
plomerosKTBFFH,"Please provide me with an example of that ""lense"" then, cause like I said I've never heard of anyone counting Germany or Ireland as part of the Nordics. Even googling ""The Nordics"" or ""Nordic countries"" provides you with maps and descriptions of the area spanning Sweden, Denmark, Finland, Norway and Iceland, nothing else.HOWEVER. If you google ""Northern Europe"", England, Germany, Ireland etc. are included. Could this be what you were referring to? Northern Europe and not Nordic countries?You're probably right about unequivocally, English is my second language so I'm sure I've misunderstood a few words here and there.",0.0020793285220861435,2.7970395422016736e-07,0.00024170729739125818,3.4394438443996478e-06,6.787088204873726e-05,2.102834878314752e-05
MartinBlank73,"Well one of the ones I already mentioned, ethnographically. England Scotland and Ireland saw extensive Nordic settlement, such that much of England was ruled under Danish law for a time. Dublin is a Nordic town. There are many others.",0.003449713345617056,4.970759164280025e-07,0.0003049041552003473,7.001213816693053e-06,0.00014159674174152315,3.502338586258702e-05
plomerosKTBFFH,"So what you're saying is that parts of Ukraine and maybe even Russia can be considered Nordic too, with our viking settlements in Ukraine and the Nestor chronicles description of the foundation of the Kingdom of Rus, eventually followed by the Russian Empire.This is some next-level technicality, really.",0.002919632475823164,3.141316256005666e-07,0.0002520929556339979,4.884332156507298e-06,0.00010868020763155073,2.6662073651095852e-05
MartinBlank73,"Ummm no, it is pointing out that the word means different things in different contexts. I am sorry you don't read more.",0.00467258132994175,7.678820566070499e-07,0.00040106408414430916,1.0346752787881996e-05,0.00019242004782427102,4.735059701488353e-05
