id,comment,toxic,severe_toxic,obscene,threat,insult,identity_hate
nnalic,Your right on that. In the video though you do hear the cop say don't reach for it and Castile say that he wasn't. I just don't like how it took about 40s for a whole clip to be emptied into someone. Both sides could have done better and I wish the cop was a little better at deescalation.,0.0010373653,1.7566942e-13,1.8703331e-05,1.8672479e-08,6.2696367e-06,9.7243085e-09
WorkingClassAmerican,"I don't know why because that didn't happen. If you'd like to talk about it let's use actual facts. He reached for his glovebox that contained his insurance and pistol, no?",1.295713e-09,1.5590288e-19,9.175376e-09,2.1100705e-11,1.2751632e-08,1.4485611e-12
nnalic,My bad. Why would he TELL the police officer he had a gun before getting the gun to shoot the officer. I sayto shoot him because the only reason the officer had to use force is if he thought that's what was going to happen.,0.00012490204,1.4747887e-09,0.00013863969,3.578761e-05,0.00031166206,7.803606e-06
t920698,Yeah I thought the guy had nice shooting form too,2.2972877e-09,2.9827545e-20,4.2951003e-09,4.078701e-12,2.3612725e-09,1.4838995e-13
nnalic,Yeah his form was pretty nice. His releas was a little low but a shooting coach could fix that right up.,2.8324369e-08,3.1252607e-17,1.480709e-07,1.589197e-10,4.4835513e-08,7.1982533e-12
WorkingClassAmerican,"You're inserting your own version of reality here. I don't remember anyone saying he was going to shoot the cop, I remember them saying he reached for a gun. How do you react in stressful situations? Cool as a cucumber I'm sure, nothing you've ever done contradicts anything else.",1.3517065e-07,3.3749227e-17,1.752556e-07,4.054907e-10,2.2150222e-07,5.377884e-11
nnalic,"Idk how I would react in that situation, but it's not my job to be cool in “stressful” situations (stressful is in quotations because the cop was TOLD he had a gun. And the man had a woman and child in the car...) but that's not my job. It's his. If you don't believe your in danger don't fire your weapon....",0.00011001159,1.1480342e-13,9.998206e-06,7.833014e-08,2.3583658e-05,2.9666365e-08
WorkingClassAmerican,"Right, if you're afraid don't reach for the gun in your car with the kid and chick in it. If you decide that being black is what will get you killed then ask the cop to disarm you before proceeding.",0.8089206,0.000103931976,0.017490167,0.022416824,0.24275315,0.036036644
nnalic,"Right, and if you can't handle “stressful” situations maybe don't be a cop or handle a firearm. Lol it's not even a black/white thing. It's a “hey let's not fire 7 shots, 40 seconds into a routine traffic stop”",3.168889e-08,1.1028507e-19,1.16233885e-08,1.4132285e-11,1.970233e-08,1.6156846e-12
WorkingClassAmerican,"Cop did great. Cleared of wrongdoing. He killed a criminal that couldn't follow directions if his life depended on it. Oh wait, it did. Good on that officer for doing his job.",0.2576389,1.2869781e-06,0.005109825,0.00090297306,0.03867748,0.0010022675
NAN,[removed],8.9749235e-05,2.1757418e-09,0.00012858464,1.4669556e-05,3.952459e-05,1.0656653e-06
NAN,[removed],8.9749235e-05,2.1757418e-09,0.00012858464,1.4669556e-05,3.952459e-05,1.0656653e-06
NAN,[removed],8.9749235e-05,2.1757418e-09,0.00012858464,1.4669556e-05,3.952459e-05,1.0656653e-06
NAN,[removed],8.9749235e-05,2.1757418e-09,0.00012858464,1.4669556e-05,3.952459e-05,1.0656653e-06
NAN,[removed],8.9749235e-05,2.1757418e-09,0.00012858464,1.4669556e-05,3.952459e-05,1.0656653e-06
NAN,[removed],8.9749235e-05,2.1757418e-09,0.00012858464,1.4669556e-05,3.952459e-05,1.0656653e-06
NAN,[removed],8.9749235e-05,2.1757418e-09,0.00012858464,1.4669556e-05,3.952459e-05,1.0656653e-06
NAN,[removed],8.9749235e-05,2.1757418e-09,0.00012858464,1.4669556e-05,3.952459e-05,1.0656653e-06
nnalic,Idk if you can say it's “typical” for democrat strongholds to fail. Houston is blue and it's the fastest growing city in America. If you elect bad representatives you get a bad product regardless of red or blue,1.8383312e-07,8.620666e-17,9.890494e-08,7.5653983e-10,2.9909e-07,8.8965314e-11
WorkingClassAmerican,Wrong,0.00060219143,1.299403e-09,5.213386e-05,3.952889e-05,7.070605e-05,5.9372937e-06
nnalic,What part?,3.194977e-05,5.646758e-10,3.799802e-05,8.047825e-06,2.5091756e-05,7.04952e-07
WorkingClassAmerican,All of it.,0.012452386,8.272071e-07,0.0013361272,0.0010238147,0.0013510456,0.00034808667
nnalic,Houston is blue. It's the fastest growing city. So maybe the last part? But that's not really debatable. George Bush wouldn't be a good president if he was blue so,2.0839002e-08,1.10117865e-17,7.1630964e-08,1.2263042e-10,3.4740363e-08,6.8574946e-12
WorkingClassAmerican,Wrong,0.00060219143,1.299403e-09,5.213386e-05,3.952889e-05,7.070605e-05,5.9372937e-06
nnalic,Just lmk what specifically you think is wrong,0.0016002458,5.7379854e-08,0.00033028115,0.00026803807,0.0008409739,7.063483e-05
WorkingClassAmerican,You.,0.85141045,0.020045536,0.19003645,0.052783724,0.36795375,0.06450149
nnalic,Right but what did I say specifically,0.0008255788,1.1634501e-08,0.0001377011,0.000101368605,0.0003406019,2.4877367e-05
WorkingClassAmerican,Wrongness.,0.024387825,0.00053074193,0.022858959,0.014404937,0.008237867,0.0034397608
nnalic,See you say workingclass. But based on the responses and speediness of the responses I wanna say freshman in high school. But I digress. I'm bored now.,0.049045082,1.1351669e-07,0.0045300764,9.210949e-05,0.0008823028,3.4053708e-05
WorkingClassAmerican,Cool story. Tell me about this glorious homeland of yours that you ran away from,0.0035658162,1.7382344e-11,5.976937e-05,8.9321793e-07,3.6501784e-05,2.789631e-07
nnalic,“Cool story”. My G even I don't say that anymore. Definitely high school. And I already did. It's beautiful. I wish they would elect people that weren't corrupt but I think they'll figure it out eventually.,0.0013340767,4.385703e-11,5.204147e-05,2.0400032e-06,5.9208433e-05,7.9540655e-07
WorkingClassAmerican,What race so you think is best?,0.00015078191,2.2751391e-10,4.0832037e-05,9.832776e-06,7.683232e-05,1.6780215e-06
nnalic,I don't watch nascar but the Indy 500 Ig? That was random,1.0709503e-07,1.5184395e-14,5.7665494e-07,1.1624719e-08,5.321501e-07,6.8062644e-10
WorkingClassAmerican,NASCAR? Sad,0.083243005,4.880395e-05,0.007937232,0.012867096,0.009314632,0.0049113748
nnalic,IKR. That's why I'm confused,0.00015576639,3.443548e-10,5.75147e-05,8.097087e-06,4.7758236e-05,1.2656366e-06
mylivingeulogy,Jesus... Why did I read this entire thread. I would have given up on that troll a long time ago.,0.00071585295,1.3361969e-11,3.025485e-05,1.0945707e-06,3.510099e-05,3.5983504e-07
hangoverDOTTED,"He didn't reach for the gun. In fact, you can very clearly hear the cop saying, ""Don't reach for the gun"" and Philando calmly say ""Ok. I'm not reaching for the gun."" ""Don't reach for the gun."" ""I'm not reaching for the gun.""",0.001421784,3.1177225e-10,0.00040500565,3.7110842e-06,0.00018863677,1.0237853e-06
WorkingClassAmerican,Except the part where he did and got killed for it. Yeah minus that part he did not reach for or around the gun,0.0010405757,3.2410437e-08,0.00049183035,0.00011268074,0.00075568963,3.063601e-05
hangoverDOTTED,"He didn't reach for the gun, though. The cop requested he not reach for it and he very clearly agreed not to reach for it. Then he did not reach for the gun.Stop trying to make up what happened.",0.112904504,4.215598e-11,0.00021130008,9.547272e-07,0.00032840765,1.2136932e-06
WorkingClassAmerican,"In very jealous of how you think. It must be nice. This all started as a shitting on cops conversation and as usual the worst example was picked because you people have an agenda. Want to talk about a real case where a guy was obviously murdered by the police? Great, there's many out there. This is not one of those.",7.832622e-05,5.6196524e-13,1.1644241e-05,1.4441052e-07,1.3881518e-05,3.8789842e-08
hangoverDOTTED,Except this is a case of a cop murdering someone for doing exactly what that person was supposed to do.,0.00036964283,1.6883074e-13,1.0722155e-05,5.522926e-08,9.1892025e-06,1.6922579e-08
WorkingClassAmerican,Reaching for a gun isn't what you should do when you get pulled over. Just thought I'd let you know,2.9636092e-05,9.951696e-11,5.2313942e-05,5.3978874e-06,4.8312875e-05,5.205045e-07
hangoverDOTTED,"And there you go again, making things up.He didn't reach for the gun.",0.096792944,2.2667801e-07,0.0011064416,0.00057784247,0.0043934146,0.0003560489
WorkingClassAmerican,Go reenact this in your car and tell yourself how obvious it was that nothing happened some more.,0.1212891,3.9470842e-07,0.0012918691,0.0003255935,0.0066150636,0.0002478921
WorkingClassAmerican,Go reenact this in your car and tell yourself how obvious it was that nothing happened some more. It seems to be working so far.,4.5379258e-07,3.4070372e-12,5.8336227e-06,4.916523e-07,6.86663e-06,3.231957e-08
hangoverDOTTED,There is no need for re-enactments. We have video.I'm done though. You obviously are just trying to gaslight everyone.,9.591401e-05,2.8858815e-10,4.3938497e-05,1.18344005e-05,0.00011739884,1.9809306e-06
WorkingClassAmerican,Bye sweetheart inshallah,0.021495717,5.630869e-06,0.0023493224,0.0016997658,0.003724296,0.0005089772
My_Ex_Got_Fat,"Lol yeah lets talk facts, like how the police aren't trained in de-escalation, are militarized, most worship the vigilante justice style of Marvel's The Punisher, think it's US vs THEM, will defend their coworkers regardless if said coworkers did anything wrong, have been caught multiple times on tape that they then tried to destroy planting/manipulating evidence, and find no wrongdoing when they investigate themselves.If cops actually cared, their unions wouldn't spend millions of dollars trying to keep marijuana from being legalized, or lobbying to keep civil asset forfeiture from being changed so THEY'RE the ones that actually have to prove the money was from illicit sources.You're probably right though, this pig was probably way different than all the rest.",9.213397e-07,7.347506e-17,3.0802022e-07,3.6943454e-10,3.2279718e-07,7.38762e-11
AfterReview,I haven't seen someone take their seat that fast since 5th grade.Something oddly wholesome about this entire situation.,1.234201e-05,8.597022e-17,1.337431e-07,1.915071e-09,2.9952986e-07,4.2448478e-10
ImSoBasic,I think it had more to do with the fact he had the money to afford court-side seats.,1.409532e-08,9.654029e-16,1.4515669e-07,3.5818863e-09,1.6739459e-07,1.4175405e-10
Ass4ssinX,Username checks out.,1.8873205e-05,7.418747e-13,8.006052e-06,1.525058e-07,3.088908e-06,1.4229706e-08
sarcasm24,Victim blaming bullshit,0.9940665,3.1451153e-05,0.90181524,8.435887e-06,0.021848056,2.3417435e-05
incharge21,"What? I don't think it's blaming the victim, you just have a better shot of getting away from the cops without consequence if you completely cooperate. That doesn't mean it's always justified what happens if you don't cooperate, just that cooperation lowers harsh consequence. Of course there are times that doesn't happen, it's a generality, there are going to be exceptions.",3.7198004e-06,6.685981e-15,8.260411e-07,1.0924121e-08,1.621938e-06,2.1043414e-09
Im-A-W1zard,Sometimes its the victims fault.,0.00026915487,3.2802894e-10,3.166205e-05,9.183525e-06,4.8063484e-05,1.7731703e-06
sarcasm24,That's not what the word victim means,1.369689e-05,5.568207e-12,8.6757245e-06,5.254746e-07,8.210984e-06,5.5128638e-08
Im-A-W1zard,"If I ask someone to stab me and I get stabbed, am I not both the victim of a stabbing, and at fault?Ever hear of The Darwin Awards? Those people are they not both victims, and to blame?",0.007131169,1.6241252e-09,9.610599e-05,2.7715469e-05,0.0005438184,1.6891925e-05
Im-A-W1zard,"Also here is the definition of a victim ""a person harmed, injured, or killed as a result of a crime, accident, or other event or action.""It says nowhere that it can't be their fault.",0.06510603,2.5781468e-08,0.00027871542,0.00019267194,0.0025119188,0.0001653419
Bubonic_Butters,A few bad examples you see on the bias driven hate machine (media) isn't indicative of the rest of the millions of police officers.,1.5097882e-09,2.1671647e-20,2.5836047e-09,4.9147314e-12,2.8121683e-09,2.2734351e-13
niuguy,"Dude, I know what you're saying, and I'd agree with you if it wasn't so fucking hard to punish cops who make terrible choices. Yes, in any group of people you're going to have some assholes that ruin it for everyone. The blue shield is just too strong and a significant number of people will defend the officer no matter what just as you have those who will blame the cop no matter what. In the army we didn't have a union to save us. We fuck up we get punished. It wouldn't necessarily kill our career but it would hurt and it kept you in check. We didn't have this blue shield to save us when we ruined people's lives. A staff sergeant in my unit accidentally shot his rifle on base. Dude was canned from his job that night and reassigned.",0.029295357,3.3166803e-09,0.165144,6.048262e-07,0.00091936626,1.6564044e-07
ChrisGaylor,"Except for the fact cops generally get found not guilty by civilians when they go to trial and people still get angry and blame the ""Blue shield.""",3.0655397e-06,4.422965e-12,1.3153649e-05,6.032887e-07,1.5424273e-05,8.414311e-08
niuguy,"True, it's a bit both imo.",8.362736e-05,2.9376508e-11,1.102552e-05,2.2594709e-06,2.514882e-05,4.0127838e-07
4_5_6,"That's a fair point, edited.",7.470561e-05,2.632778e-13,1.4350445e-06,1.6921004e-07,4.423655e-06,3.654869e-08
thenhe,"Yikes! That old narrative again? Take a few minutes and go research the citizen complaint statistics against cops before and after body-cam testing. It was (is) far, far more than a ""few bad apples."" We can put apologists like you out to pasture as your opinion has been proven wrong EVERY time a new body-cam study results is released.",4.1008004e-08,2.5133847e-16,3.0389504e-07,1.3609889e-09,2.3524544e-07,6.670569e-11
NAN,[deleted],0.0017408743,3.435744e-08,0.0002800833,0.00013391736,0.0001293075,2.2895694e-05
ruok4a69,I reject your surveillance state and choose to rely on the humanity of my fellow people instead.,0.16419932,3.2258722e-08,0.00077244034,9.897608e-05,0.0044562295,9.254521e-05
myeeeeeeeeeeeeeeeers,yikes...,0.00027981453,1.15825785e-08,0.00012727318,6.818415e-05,9.254098e-05,7.846441e-06
ruok4a69,"You realize that just because you think something is a good idea, doesn't necessarily mean everyone agrees? I'm all for “watching the watchers”, but you don't get to watch me. What I do is none of your business, and your statement re: surveillance of citizens is chilling.",2.5418872e-08,4.554784e-15,9.68443e-07,7.0999517e-09,9.4649647e-07,4.9640747e-10
Mocha_Bean,"If a cop is watching you with their eyes, *you're literally already being surveilled by the state.* The camera just keeps it objective. I trust the digital camera more than I trust the cop's meat cameras.",2.4471448e-05,1.1012072e-11,1.826154e-05,8.16532e-07,9.5621675e-05,2.255812e-07
ruok4a69,"- We explicitly trust those people to watch us to some extent, with many, many restrictions, which restrictions I'm quite in favor of. - I wasn't arguing against police body cams; I was arguing against general surveillance of the citizenry (a la London). - The cop's “meat eyes” can only pick up so much. I don't need cameras watching my every move and streaming it to the world. It's not the world's business what I do.",3.5172554e-06,2.088649e-14,1.5436033e-06,3.211059e-08,2.290133e-06,4.457585e-09
Mocha_Bean,"""Streaming it to the world?"" What? You think they've got it up on facebook live or something?",3.8794246e-06,8.0006905e-13,3.926723e-06,4.2369177e-07,1.0931491e-05,5.858382e-08
ruok4a69,Many surveillance cameras are streamed live. The city nearest me streams dozens of traffic cameras and at least ten street level cameras.,1.3806881e-08,2.5391402e-19,8.234548e-09,1.7753908e-11,7.060465e-09,1.1216503e-12
speed3_freak,You got more conformation bias than a 90 year old Fox News watching granny in rural Alabama.,3.0710572e-09,3.283151e-17,5.1058556e-08,3.094198e-10,4.03928e-08,1.149225e-11
speed3_freak,You got more conformation bias than a 90 year old Fox News watching granny in rural Alabama.,3.0710572e-09,3.283151e-17,5.1058556e-08,3.094198e-10,4.03928e-08,1.149225e-11
pistilpete,"Yeah guys, cops are full of integrity.",6.898241e-06,5.717545e-12,4.7355434e-06,5.886108e-07,4.896785e-06,5.5804655e-08
LeeroyOfHouseJenkins,>SIT THE FUCK DOWN AND STAY THERE,0.9895934,0.058862202,0.99459547,0.0013610265,0.17980261,0.0022616275
speed3_freak,"He is probably either important or with someone who is. If this guy had been in the cheap seats, he would have at least been asked to leave if not arrested for trespassing.",1.9366271e-07,3.6512537e-15,6.2057325e-07,4.296108e-09,3.4652322e-07,3.424834e-10
91seejay,I feel like he handled it well gave him a stern finger point. I don't think the guy will do it again.,2.2545489e-08,4.3753367e-21,1.7706275e-09,3.6146177e-12,2.4313531e-09,3.1077495e-13
Painting_Agency,Finger + old guy mustache = authority.,0.00036651356,9.3235204e-11,1.596639e-05,7.1111062e-06,7.133917e-05,1.7812447e-06
Gella321,So that was my dad's secret all these years. The goddamn mustache.,0.6797871,5.3208496e-06,0.09434653,0.00040388928,0.021756452,0.00039271565
Tparkert14,Sure sounds like my uncle.,0.0041345707,4.4316425e-07,0.001105644,0.0005763222,0.00070038065,0.0001375414
AthleticsSharts,How often did you get fingered by him?,5.7168563e-05,3.7450887e-09,0.00037058737,2.4813251e-05,0.00014502465,2.4332576e-06
Boston_Jason,> gotta pay the troll toll,0.0049026087,5.0946433e-14,1.2930752e-06,8.394658e-08,7.4073655e-06,7.002677e-08
DickDastardly404,sometimes that also equals sexual assault though,0.00043739463,4.846872e-10,6.43884e-05,1.0318778e-05,5.421719e-05,2.0047248e-06
fantacyfan,"""Nice shot, hayes. Don't ever fucking do it again.""",0.9981573,0.13522832,0.9971323,0.00211316,0.5982129,0.005482349
vVvMaze,"Honestly that guard was real cool about it. Could have potentially kicked the person out but just escorted him back to the chair and said dont do that again. I think if you are the person doing this, this was the best possible reaction you could have gotten from security.",9.4768325e-07,1.6038827e-15,7.4889897e-07,3.005099e-09,8.316311e-07,4.175723e-10
MrSnoutfair,At least he didn't get kicked out of the arena,2.4783196e-05,1.7102398e-13,4.07828e-06,7.010589e-08,1.8582346e-06,1.0145877e-08
tinglingearballs,This motherfucker has every last drop of my respect. If only I had his balls... That smile at the end ... that says all I need to hear!,0.9934995,0.19988868,0.9949883,0.0051641925,0.75916666,0.011860082
Electric_Tiger01,Turns out all you have to do to get his balls is do some uncoordinated active stretching for a few seconds then call for the ball. Someone will then pass you his balls.,0.0007156289,7.624478e-16,1.3845575e-06,1.1219043e-09,2.2879128e-06,8.9360247e-10
funkmastamatt,and that's how I met your mother.,0.08668704,1.7212534e-06,0.0046053757,0.0009193115,0.004357046,0.00042632324
eesamanomercy,He just sat down like it's no big deal lmao,0.11446702,2.017751e-07,0.0014314416,0.00044518104,0.004085079,0.00028469568
uoYredruM,"""RAIN DANCE!""",1.5631513e-05,2.0305736e-12,3.5361875e-06,4.6356087e-07,3.6255185e-06,4.8665427e-08
MiamiPower,Kobe more giving and in a pass happy move. The Shaq sit down a bunch.,0.96346575,1.7721085e-08,0.0022735677,4.9213308e-05,0.051489796,0.00018928107
NAN,[deleted],0.0017408743,3.435744e-08,0.0002800833,0.00013391736,0.0001293075,2.2895694e-05
wizardsfucking,"well yeah, people sit court side every game. hardly terrifying my dude",1.48910885e-05,2.4941826e-12,6.714454e-05,7.905238e-08,8.882072e-06,6.9020154e-09
__-_-__-___-__-_-__,TERRIFYING! HUMANS INTERACT WITH OTHER HUMANS IN AN UNSANCTIONED MANNER FOR GIGGLES - IS YOUR CHILD NEXT?!,0.9575588,0.0002889495,0.050348256,0.008594399,0.24964556,0.022120627
smashsmash341985,IT'S 9PM. DO YOU KNOW WHICH MOLECULE OF AIR YOUR CHILD IS BREATHING RIGHT NOW??MORE AT 11,0.8961017,0.0020408197,0.18817018,0.027468035,0.48967165,0.08518159
Fuckoff_CPS,Whats to stop some lunatic sitting courtside and running out to kill some player before he kills himself in front of the stadium?,0.8552251,3.504861e-05,0.009135227,0.008651953,0.12293185,0.020164393
SuperKato1K,"That sort of what-if is what keeps people indoors, out of abject fear that they may be killed by a twenty pound frozen ball of shit dropped out of an airliner.",0.9456779,1.3440095e-07,0.111824095,5.807129e-06,0.0042419154,1.2020889e-05
wizardsfucking,gonna have to stay in the basement too because those things can penetrate a roof. actually an underground bunker would probably be best,7.8295336e-08,3.278497e-16,4.075051e-07,1.011428e-09,1.8594955e-07,6.9367574e-11
somethingpunful,"OMG that's a thing?!! I was going to go to the grocery store to feed my family, but now I'm staying in for the rest of the day",8.992528e-05,2.1882917e-11,2.7083324e-05,1.3840624e-06,6.8170106e-05,3.0898315e-07
SuperKato1K,"Yep lolhttps://timesofindia.indiatimes.com/city/bhopal/Stink-from-the-blue-Plane-poop-hurts-woman-on-ground/articleshow/50476552.cmsThis Indian woman was hit by a frozen brick of shit and piss. It crashed through her roof, so she lived, but if it had struck her outside they say it would have crushed her skull.I'll add another lol, because I think it needs it for some reason. lol",0.9747386,1.4708652e-05,0.3810207,3.423155e-05,0.18666564,0.0003336186
skoolboyjew,Well they have metal detectors to keep people from bringing in weapons.,5.2138066e-06,1.1980985e-09,6.5196065e-05,1.0870778e-05,4.4564436e-05,7.893687e-07
ciocanmihai,I love how he got the ball,0.018129347,8.5259527e-10,0.00038381413,7.5087883e-06,0.00011761801,3.3093029e-06
Saneless,And I love how all they did was ask him to sit back in his seat. I expected him to get tackled and carried out.,0.28618357,8.754538e-07,0.0051681893,0.0007105938,0.0047404147,0.0004991229
FreeRideJunkie,"This was my favorite part. He clearly wasn't a hazard, and was cooperative when thy told him to sit down. Hilarious.",0.01979442,5.052233e-09,0.01675569,5.8157584e-06,0.0016638214,2.207423e-06
SeattleMana,Guy originally had nosebleeds and got disciplined with courtsides.,0.00070340576,1.0908256e-08,0.00026034575,5.290428e-05,0.0001569213,9.808248e-06
FalconsSuck,"“Sit here the rest of the game and do not move”“*Sweet!* I mean, yes sir”",1.9097093e-05,4.638695e-12,1.1591823e-05,4.183285e-07,4.269446e-06,4.430767e-08
NAN,[removed],8.9749235e-05,2.1757418e-09,0.00012858464,1.4669556e-05,3.952459e-05,1.0656653e-06
CaptainDogeSparrow,That pic makes me sad everytime. I wonder why this wasn't on national news when it happened. He was just a boy trying to have fun!,0.0007678677,8.0677416e-11,3.0426952e-05,5.3217173e-06,6.0204464e-05,1.6055327e-06
sillyblanco,"I wish I could un-see that picture, such a tragedy. He was just a boy.",1.8599278e-05,5.383371e-16,9.4667456e-08,1.4335596e-08,9.734878e-07,2.7268636e-09
I_Am_Ed_Edd_n_Eddy,Thanks for the heads up.,3.6026755e-05,4.2089054e-11,1.8194789e-05,2.6553332e-06,4.658435e-05,4.2977905e-07
Percussionist9,I think everyone needs to see this picture at least once.,4.401405e-07,5.658005e-13,1.967518e-06,3.156972e-07,3.0873648e-06,2.1844295e-08
CrimsonNova,This comment made me actually nut-up and go back to open the image in solidarity with you. You. Fucker.,0.9987997,0.03391491,0.9638932,0.004243406,0.97912544,0.07929312
Percussionist9,"I know it hurts to see, but at least you know now how important this is.",0.0005904414,1.09472145e-11,1.808587e-05,1.4771084e-06,2.2305772e-05,4.0917104e-07
RalphIsACat,I think everyone has seen this picture at least once.,3.0318772e-05,3.2577185e-10,2.595649e-05,1.2723283e-05,3.6643454e-05,1.457771e-06
CudaDisagrees,It's worth a look.,0.0052373777,1.5424436e-09,6.917874e-05,5.4508073e-05,0.00023990293,2.3036697e-05
mysticsavage,God damn it.,0.9731694,0.000494923,0.4429569,0.00076031336,0.11504443,0.0015702948
NAN,[deleted],0.0017408743,3.435744e-08,0.0002800833,0.00013391736,0.0001293075,2.2895694e-05
zSplityy,"I followed this far, do I click it.....or do I not?",4.966664e-06,3.3401452e-12,5.510238e-06,6.171078e-07,4.491398e-06,5.8503755e-08
Yourwoman,"Don't, I certainly won't look either",0.0012490643,2.7178674e-11,2.0786043e-05,2.4091262e-06,3.525141e-05,8.2243866e-07
zSplityy,I looked. I won't be sleeping for 17 years and won't eat ever again.,0.0013801956,1.2268359e-09,0.00025821239,1.9480558e-05,0.000367558,5.840085e-06
GokudaGod,Yolo,0.024387825,0.00053074193,0.022858959,0.014404937,0.008237867,0.0034397608
vbullinger,"I bought the whole story until he linked to the picture. Then I was like ""oh... It's going to be Manning face, isn't it?""",0.00014194795,1.7561366e-11,1.09403345e-05,2.6187624e-06,5.6180466e-05,6.6113813e-07
YOU__DESERVE__ANAL,#,0.024387825,0.00053074193,0.022858959,0.014404937,0.008237867,0.0034397608
KingKreole,he does deserve anal,0.835092,0.05550769,0.3540816,0.096031226,0.3291996,0.16585441
ItalicsWhore,More like a heads *open*...,0.0010082676,5.0507276e-10,5.2333653e-05,7.28117e-06,0.00022128636,2.0520129e-06
iismitch55,Take your upvote and head out!,0.7290459,0.009813764,0.101943485,0.14567752,0.3116063,0.1483432
iismitch55,Nice joke you cracked there.,0.00033427286,2.4798714e-08,0.00038480255,5.4526685e-05,0.00026778085,6.9492876e-06
shaven_neckbeard,Wrong kid died...,0.0016622997,1.4120606e-09,9.4615425e-05,3.8157395e-05,0.00011720053,7.999686e-06
-fuck-off-loser-,He had a bad case of being cut in half,0.053624865,4.5532273e-05,0.006183055,0.010909483,0.011668975,0.004087899
Rocketterollo,Why are you like this dad,0.0045323716,1.4165852e-08,0.00040536412,5.915978e-05,0.00032840765,1.6838625e-05
