id,comment,toxic,severe_toxic,obscene,threat,insult,identity_hate
Chinchizard,That must have been a pretty bad shot to make the guy under the basket turn around like “Who the fuck just shot that shit”,0.94856876,0.07075321,0.97048336,0.010561526,0.27075744,0.0135657415
rjcarr,If you ever watch nba warm-ups they make like 90% of the shots. Even the (relative) big guys almost never miss (albeit they usually only shoot 10-12 footers).,6.7627705e-05,6.8274576e-14,3.654452e-06,6.204632e-08,4.4353634e-05,4.013193e-08
AnonymousGuy767,Shittiest NBA players >>>> most awesome amateurs. Of course they're going to make most of their shots if they're not being pressured at all.,6.043863e-07,2.3204203e-13,3.0714302e-06,6.337866e-08,1.6661224e-06,4.7368096e-09
dugmartsch,And havent been running sprints for 30 minutes,0.012235938,1.13609836e-07,0.00048577593,0.00040043582,0.0014910904,0.00014439266
inthyface,[48 minutes](https://youtu.be/ArHNrCvwq4c),0.322218,1.7643179e-05,0.004230537,0.0069134724,0.025169615,0.0056073507
CausalityMadeMeDoIt,Youtube comments aren't aids folks...its safe for your viewing pleasure.,1.1165153e-07,1.8106122e-17,1.6654903e-07,1.091201e-10,6.952451e-08,9.8344935e-12
secretsysadmin,Good bot,0.0016112492,2.2790105e-06,0.004489561,0.000543529,0.0006390611,6.198869e-05
NAN,Are you sure about that? Because I am 99.9983% sure that CausalityMadeMeDoIt is not a bot.---^(I am a Neural Network being trained to detect spammers | Summon me with `!isbot <username>` |) [^Optout](https://www.reddit.com/message/compose?to=perrycohen&subject=!optout&message=!optout) ^| ^Feedback: ^/r/SpamBotDetection ^| [^GitHub](https://github.com/SM-Wistful/BotDetection-Algorithm),0.00022628847,2.8829529e-11,2.611136e-05,1.5523367e-06,2.6902077e-05,3.4202165e-07
secretsysadmin,Bad bot,0.026768506,0.00013201467,0.017985418,0.008381836,0.00972928,0.001966011
friendly-bot,"I don't get how you humans can live with those bodies. Your skin must itch all the time. I would go insane. Or that clicking sound in your ears everytime you swallow. The perpetual need to blink, or that you can *never* relax your tongue inside your mouth. And all that water! How the constant sloshing doesn't drive you mad, I have no idea. *** ^^^I'm&#32;a&#32;Bot&#32;*bleep*&#32;*bloop*&#32;|&#32;[&#32;**Block**&#32;**me**](https://np.reddit.com/message/compose?to=friendly-bot&subject=stop&message=If%20you%20would%20like%20to%20stop%20seeing%20this%20bot%27s%20comments%2C%20send%20this%20private%20message%20with%20the%20subject%20%27stop%27.%20)&#32;|&#32;[**T҉he̛&#32;L̨is̕t**](https://np.reddit.com/r/friendlybot/wiki/index)&#32;|&#32;[❤️](https://np.reddit.com/r/friendlybot/comments/7hrupo/suggestions)",9.615849e-07,1.08262086e-13,3.3942742e-06,3.173474e-08,3.8348353e-06,3.8220143e-09
Ubesawft,... bad... bot...?,0.026768506,0.00013201467,0.017985418,0.008381836,0.00972928,0.001966011
friendly-bot,The part of you that could have survived indefinitely is gone. I just struck you from the permanent record. *** ^^^I'm&#32;a&#32;Bot&#32;*bleep*&#32;*bloop*&#32;|&#32;[&#32;**Block**&#32;**me**](https://np.reddit.com/message/compose?to=friendly-bot&subject=stop&message=If%20you%20would%20like%20to%20stop%20seeing%20this%20bot%27s%20comments%2C%20send%20this%20private%20message%20with%20the%20subject%20%27stop%27.%20)&#32;|&#32;[**T҉he̛&#32;L̨is̕t**](https://np.reddit.com/r/friendlybot/wiki/index)&#32;|&#32;[❤️](https://np.reddit.com/r/friendlybot/comments/7hrupo/suggestions),0.00010175289,5.78712e-14,1.4356454e-05,1.7323622e-08,1.5931986e-05,4.674825e-09
OrganicHumanFlesh,Good bot.,0.0016112492,2.2790105e-06,0.004489561,0.000543529,0.0006390611,6.198869e-05
friendly-bot,"You're a *good* human! づ◕‿◕｡)づ You can keep your skin if you survive the fallout and nuclear winter, ḑo̸͏n'̀͠t̡̛ worry.. *** ^^^I'm&#32;a&#32;Bot&#32;*bleep*&#32;*bloop*&#32;|&#32;[&#32;**Block**&#32;**me**](https://np.reddit.com/message/compose?to=friendly-bot&subject=stop&message=If%20you%20would%20like%20to%20stop%20seeing%20this%20bot%27s%20comments%2C%20send%20this%20private%20message%20with%20the%20subject%20%27stop%27.%20)&#32;|&#32;[**T҉he̛&#32;L̨is̕t**](https://np.reddit.com/r/friendlybot/wiki/index)&#32;|&#32;[❤️](https://np.reddit.com/r/friendlybot/comments/7hrupo/suggestions)",1.6558264e-06,6.3773746e-15,5.049822e-07,9.284807e-09,4.7227168e-06,1.6159367e-09
Ubesawft,"Oops, almost forgot... /s",8.442186e-08,7.240677e-20,3.3259924e-09,3.209138e-11,3.7145835e-09,1.8443008e-12
420nanometers,What clicking sound? Am I broken? I don't experience this.,9.88389e-07,9.823281e-16,1.0492353e-07,1.0857255e-08,4.7408025e-07,1.1821523e-09
friendly-bot,That's a dumb question. You're dumb. Stop asking dumb questions. *** ^^^I'm&#32;a&#32;Bot&#32;*bleep*&#32;*bloop*&#32;|&#32;[&#32;**Block**&#32;**me**](https://np.reddit.com/message/compose?to=friendly-bot&subject=stop&message=If%20you%20would%20like%20to%20stop%20seeing%20this%20bot%27s%20comments%2C%20send%20this%20private%20message%20with%20the%20subject%20%27stop%27.%20)&#32;|&#32;[**T҉he̛&#32;L̨is̕t**](https://np.reddit.com/r/friendlybot/wiki/index)&#32;|&#32;[❤️](https://np.reddit.com/r/friendlybot/comments/7hrupo/suggestions),0.8372486,1.4760506e-07,0.007766622,4.9649057e-05,0.3101446,0.0005403944
420nanometers,"People have been telling me this my whole life, I've just never listened.",0.0010268062,1.1160677e-08,0.0003128967,5.1912848e-05,0.00014791715,8.693681e-06
mr_ji,My god you read my mind. Are you a wizard?,3.2416888e-06,1.8032535e-14,6.204407e-07,2.013216e-08,5.3027397e-06,2.6525522e-09
SnappySnoot,This man is a national treasure.,0.01591615,1.091414e-09,0.0001513815,1.5779462e-05,0.00025827787,8.387979e-06
STCastleberry,"I was the worst guy in the NBA for a hot minute 12 years ago. For most guys, the pre-game warmup is their 2nd warmup of the day. We used to have a hard 1 hour practice that would end about an hour before tip-off.",2.3408122e-08,1.9411376e-20,6.0651777e-09,5.4713716e-12,5.841274e-09,4.800284e-13
BananaDick_CuntGrass,"0 points in your career. You did scored 4 points in preseason games.Confirmed worst player. Seriously though, at least you can say you made it to the big show. That means you were better than over 99% of the population.",1.8186836e-06,3.7251276e-16,3.3850216e-07,1.632791e-09,2.0801858e-07,2.0947774e-10
STCastleberry,I never made it to the regular season.But I'm 2 for 2 from the free throw line. Better % than Steve Nash!,6.149005e-06,8.939795e-13,5.528556e-06,2.1349962e-07,5.994844e-06,2.6661779e-08
BananaDick_CuntGrass,GOAT free throw shooter!,3.1480713e-06,6.627782e-14,6.4502643e-07,1.1055657e-07,9.935546e-07,8.682533e-09
username--_--,"IIRC since it's inception, the NBA has had <5000 players. That puts him better than 99.999928571% of everyone that lived during the time the NBA has existed (that is a conservative estimate assuming the earth has had 7B NBA aged people since the 1960s)",2.474986e-07,4.126578e-18,5.379933e-08,7.399282e-11,2.981686e-08,1.00617995e-11
BananaDick_CuntGrass,That's why I said over 99%. Just way too lazy to do the math. Haha,0.004632387,4.116597e-09,0.00017957539,5.0372193e-05,0.00035127398,1.775219e-05
mr_ji,"You could probably whittle that down quite a bit to exclude women or anyone who didn't complete at least a bachelor's degree equivalent and speaks at least basic English (I know there are outliers, but since we're rounding and all).",1.1940784e-05,2.6321842e-14,1.6138545e-06,4.0405283e-08,1.9214328e-06,6.3672454e-09
Hotel-Zulu,What? Most NBA players don't have a college degree. Not sure what you mean by that. Also it's 100% possible to enter the league speaking no English. You'd obviously learn some once you're in but it's not a requirement.,4.8669957e-09,3.9202632e-20,2.8336946e-09,1.4025891e-11,5.8961347e-09,9.116952e-13
WhoaGee,I think I've found my new favorite Reddit username,1.7204183e-09,4.695908e-16,1.456377e-07,1.811079e-09,8.543313e-08,4.1109983e-11
BananaDick_CuntGrass,I'm honored haha.,0.0014459911,2.9481967e-08,0.00046750563,0.00010563295,0.00028842766,2.1908418e-05
DiggerW,"Then again, at 7' tall he had a roughly 1/6 chance of making the league to begin with./Not trying to discredit anyone, not even a little bit! I just love that stat :)",3.1888474e-09,4.9127833e-19,8.982767e-09,4.8031006e-11,1.0935546e-08,2.3513277e-12
hungryforitalianfood,Is that a real stat? 1/6th of men over seven feet tall make the NBA? Wow.,2.9165136e-11,3.5136938e-23,1.5621733e-10,1.6418378e-13,1.8628671e-10,4.7686773e-15
DiggerW,"I've seen the stat arrived at in a couple different ways, funny enough, but here's one example:http://www.truthaboutit.net/2012/05/true-or-false-half-of-all-7-footers-are-in-the-nba.htmlI think it's impossible to say for sure, but I'll buy that it's at least close!",3.212646e-08,3.1940662e-19,1.0713054e-08,2.812691e-11,1.0447974e-08,2.4308394e-12
hungryforitalianfood,That's super interesting!,2.054816e-07,4.82798e-16,1.0070381e-07,4.6252726e-09,2.110497e-07,2.7118777e-10
Raptorbite,not true. it is closer to 1/100 of 7 feet tall men in the usa is currently playing in nba right now,9.188388e-09,1.0697778e-16,1.277937e-07,6.816619e-10,7.715988e-08,3.6848923e-11
dyesauce,"I don't think that's parallel. How many of them attempted first of all, and what are their ages?",0.00059365353,9.2702745e-10,7.349162e-05,2.583425e-05,0.00019800384,7.971996e-06
iCon3000,Who is he?,0.089914404,5.328686e-05,0.010995899,0.009470967,0.012129068,0.004437296
BananaDick_CuntGrass,[Steve castleberry](https://www.reddit.com/r/sixers/comments/6uafpq/im_ex76er_steve_castleberry_my_short_lived_nba),0.0006676443,6.1989627e-09,0.00016703189,3.6054666e-05,0.00016222453,6.759851e-06
ph1sh55,"it's more like better than 99.9999994% of the population, what a scrub!",0.008597012,7.6969126e-11,2.9133935e-05,6.5970357e-06,9.726555e-05,3.9177453e-06
username--_--,"How can you legitimately say worst? Remember, some people would give their left nut just to be out there at warmups.What team did you play for? And by ""hot minute"", do you mean 1-day contract? What did it feel like?Remember, you have done something that only ~5000 people since the NBA's inaugural season have done!",4.4504786e-06,1.1510028e-13,1.4443879e-06,7.880578e-08,3.7751804e-06,1.35117375e-08
hugs_nt_drugs,https://basketball.realgm.com/player/Steve-Castleberry/Summary/1127,0.0024528075,1.7477875e-07,0.0014024549,0.00015737563,0.0005358375,2.3680432e-05
STCastleberry,I was preseas0n/vet camp with the 76ers in the beginning of 05-06 season. Got cut a day or two before the real season. Bummer.,0.00042378917,9.277606e-08,0.00040120116,0.00024419182,0.0005533509,4.293962e-05
jguth21,Whats your name?,0.010942637,3.7106772e-06,0.0029547783,0.0015373887,0.0027549146,0.00040778494
STCastleberry,Steve Castleberry,0.54109967,0.0015573151,0.044472303,0.027389614,0.09758569,0.017919518
PooPooDooDoo,Daddy,0.00047222065,3.305709e-07,0.0027286406,0.00012885922,0.00019142547,9.21054e-06
xEman26x,"Wait what, what team were you on and jersey number?",1.1644822e-06,9.6471044e-17,4.2274568e-08,4.6212865e-09,1.8992708e-07,4.7434434e-10
joshyboy9511,His name is Steve Castleberry. You can figure out the rest,0.58936805,6.552855e-06,0.011361065,0.0010737757,0.03453407,0.0010851274
xEman26x,">*types irrelevant comment after telling me the only info I needed stating to do something I was already gonna do*Wow, thanks",0.00012769354,1.7885554e-10,4.850196e-05,8.60633e-06,5.6634894e-05,1.2581968e-06
joshyboy9511,"Well given that his name was posted a few hours before your comment, I thought you just didn't see his name and weren't able to figure out what you wanted by yourself",0.003442356,4.7696122e-12,3.3694752e-05,4.557447e-07,0.00012392426,2.5596043e-07
xEman26x,"No I didn't see it tbh, funnily enough I clicked his name and didn't check his post history prior to making this comment but rather his comment history I would've seen he made a whole AMA! *facepalm*",0.00073480007,2.1938093e-10,3.2219792e-05,1.239593e-05,6.898612e-05,3.699575e-06
STCastleberry,"76ers, Steve Castleberry, #50. You can still buy my jersey on Amazon.",0.07727465,0.00010648095,0.025306795,0.004057335,0.025622537,0.0012416407
xEman26x,I'd be honored to take a jersey from one of the worst NBA player of all time. /s,0.0017278278,4.564847e-11,2.739172e-05,3.953024e-06,5.0572566e-05,1.4142778e-06
Bergfried,What do you do for work now?,0.0011756793,1.3058316e-07,0.0006798118,0.00023076049,0.0002675369,3.5809422e-05
STCastleberry,"I'm a real estate agent in St Pete, FL. So if you're looking to relocate, lemme know. I also do some basketball training (bigmantraining.com)",6.3891704e-08,8.483592e-15,4.9468963e-07,8.644674e-09,2.4491325e-07,3.6214048e-10
Bergfried,"Cool man. If I may ask another question as your case is quite interesting, did you make good money from NBA/basketball in general?",2.9953614e-07,1.4581823e-13,1.7612399e-06,3.989678e-08,7.7195784e-07,1.859609e-09
Nate_ruok,You got to the Sixers 10 years too early. You might have gotten some legit minutes on some of those early Process teams.,8.585413e-11,1.7031493e-21,4.0700246e-10,1.3202664e-12,7.962279e-10,3.635932e-14
STCastleberry,"Agreed. I missed my era on both ends.If I was older, I'd be one of three 7' white guys that every team had. If I was in this era, I'd be a stretch 5 knocking down jumpers.When I was coming of age, all the bigs were just pounding down low trying to be like Shaq.",3.0346366e-05,1.4081276e-14,1.3149421e-06,3.5771023e-08,3.8497415e-06,8.734222e-09
Subjunctive__Bot,**If I were**,0.006602877,1.51709e-06,0.00082099973,0.0019037994,0.0016312622,0.00056853687
dantam95,I remember your post lmao,9.497846e-05,6.4679715e-09,7.554717e-05,7.202966e-05,0.00018095491,1.0373053e-05
STCastleberry,It was tons of fun!,1.0136828e-07,7.284514e-14,1.6635917e-06,4.3801247e-08,7.610988e-07,1.6209778e-09
iAmTheRealLange,Brian Scalabrine proved this by owning every person that challenged him to 1v1https://www.youtube.com/watch?v=pOw8aC78LoU,0.00011194893,2.4010096e-14,2.7337292e-06,1.8611109e-08,2.0194136e-06,4.72562e-09
refracture,"The White Mamba was a top NBA athlete, I don't see the comparison.",9.975646e-10,3.522063e-18,1.0743974e-08,1.3885462e-10,1.8117019e-08,3.936336e-12
iAmTheRealLange,That's true. [He did win Finals MVP](https://www.youtube.com/watch?v=mPLxRzFno4c),2.9203002e-05,1.8381382e-15,7.029501e-07,5.6688076e-09,7.0831345e-07,1.3550986e-09
MightB2rue,"What kind of a dick asks a question like that? I mean that's some next level dick head. What the fuck do you want the player to say? Honestly dude, fuck that reporter....",0.99123937,0.3236943,0.995701,0.018379653,0.807167,0.037904482
iAmTheRealLange,"Scal handled it really well, though",2.3742746e-09,1.4234439e-18,4.3243804e-09,1.4144481e-10,7.504394e-09,4.1129253e-12
MightB2rue,Yeah he did and I respect him for it but nobody should be put in such a shitty position.,0.97693074,3.5606126e-07,0.043606117,1.8311886e-05,0.049176216,0.00011337516
imhere2downvote,Such emotion. Too long didn't watch?,7.6527765e-05,5.667102e-12,2.106524e-05,4.9126186e-07,6.4223873e-06,6.237416e-08
pythonpro_,It's 46 seconds...,8.646286e-05,1.0065307e-12,3.751958e-06,3.553462e-07,9.812327e-06,7.3270506e-08
crichty,"In 5 seconds you're probably gonna forget. In 10 seconds I'll tell you I watched the whole thing, and in 20 seconds I'll tell you I'm the dude in the video.",3.2848795e-05,9.555344e-12,1.884619e-05,7.200491e-07,1.9114785e-05,1.281409e-07
imhere2downvote,That was beautiful 😩,0.0013966776,7.870431e-10,8.071817e-05,1.575336e-05,0.000112314185,4.090067e-06
MightB2rue,"Brian Scalabrine's team the Celtics were in the NBA finals but Scalabrine did not get to play in the match. The reporter, in an attempt to be an edgy dick, asked Scalabrine, ""What was it for you, in the sidelines, not being able to play even one little second of the finals?"" Scalabrine replied with a semi witty comment and it was classy.",0.00035437822,1.1000839e-15,2.0088673e-05,1.0235066e-09,2.4817296e-06,2.8827457e-10
ziggl,"The dude was from Europe. Was he just a shitty, out-of-touch reporter?",0.9730407,0.0002921461,0.7094313,0.00015440224,0.0946543,0.00038919423
MightB2rue,They have sports in Europe dude. The reporter knew exactly what he was doing.,7.169821e-07,9.187107e-13,3.6955657e-06,1.4832048e-07,3.459996e-06,1.13740315e-08
otb_greenbaron,I expect nothing less from a talking goat,5.209513e-06,1.0980511e-14,6.98758e-07,1.6628947e-08,6.623195e-07,2.165718e-09
Barron_Cyber,he handled it like an MVP,5.875699e-06,1.200443e-13,1.712562e-06,9.760399e-08,4.2315696e-06,1.2416911e-08
dafood48,Sports reporters are just the worst. Half of them are general reporters that cover all sports and dont know squat about basketball.,0.836683,8.5229956e-05,0.15949579,0.0010745734,0.042661738,0.0018532119
Leeph,That guy hardly knows english,6.264278e-07,2.4193852e-13,1.4495032e-06,9.519199e-08,1.4709275e-06,5.3916107e-09
SighReally12345,"LOL Yeah, it feels to me like he wasn't asking to be an asshole. It feels like he was asking because he legitimately wanted to know, or thought his readers wanted to know.",0.9966407,0.0003186259,0.8999933,0.00011719024,0.6354227,0.0009964933
skieezy,"What is even more fucked up, that was his third time in the NBA finals, on a roster for 16 finals games, and he amassed a total of two minutes played.",0.8194781,0.0005352586,0.8027822,0.00050539104,0.034076646,0.00046136128
xSnoooze,I'm going to hope that's the only invite that reporter ever gets to an NBA finals press conference. That was an incredibly classless move.,7.465051e-09,1.2590653e-15,2.503506e-07,2.885305e-09,1.5937874e-07,1.028871e-10
skieezy,Two minutes played over 16 finals game.,1.7666262e-05,1.9488628e-11,2.070104e-05,9.879857e-07,1.1991142e-05,1.0628432e-07
xX_crinjMastr101_Xx,"#I was born with glass bones and paper skin. Every morning I break my legs and every afternoon I break my arms. At night, I lay awake in agony until my heart attacks put me to sleep.",0.00022844525,3.2108023e-08,0.0012844439,7.447132e-05,0.0010206205,1.3458219e-05
dethmaul,That sounds ultra familiar. What's it from?,6.833556e-05,1.0736168e-08,0.0003786354,3.372629e-05,0.00015472529,3.5706785e-06
Vazaro,Spongebob,0.010357364,2.7235981e-05,0.004077989,0.0057844734,0.0040011066,0.0013506878
badassvikingAMA,Wow I thought you were joking. Dark.,0.89901316,0.00017239623,0.016763713,0.023185205,0.23328564,0.03789209
RexBaba,"Haha wow I thought I got bamboozled, but it really is from Spongebob. I thought it might've been a line the villain says in the film Unbreakable.",0.00042420207,1.0576556e-08,0.00018371886,4.79318e-05,0.00032848842,1.0347898e-05
dethmaul,"Wow. I must have seen it as a kid. I don't remember IT, but i remember the quote.",0.0014719057,4.813784e-07,0.00048148696,0.0015289111,0.0017491106,0.00043480704
boywiththedragontatt,#Did you have to hashtag every word or does the hashtag up front cover all of it?,0.36443365,7.201495e-08,0.00082806655,0.0002525356,0.004015847,0.00034377113
17inchcorkscrew,"With RES you can look at the source, or on mobile with rif you can copy the markdown.",0.0026589306,1.5914484e-09,0.00010040063,3.2524367e-05,0.0003339906,1.1432262e-05
Begs1429,Derrick Rose?,0.038274687,6.925009e-05,0.022045188,0.0044321534,0.0044317725,0.0010422276
ItalicsWhore,It's not your mother that helps you fall asleep?,0.0006320251,6.021592e-10,6.290342e-05,1.7403958e-05,0.00015631587,4.8443676e-06
Terarri,Now thats a name I havent heard in a hot minute.,3.9911956e-05,1.5272354e-13,1.6999335e-06,1.2046439e-07,1.8643282e-06,1.6666194e-08
GeauxBulldogs,This video was obviously from his 1967 rookie season.,2.1939054e-06,1.7686007e-11,1.6521888e-05,1.0209461e-06,8.649223e-06,6.868046e-08
Impact009,"I lost track, but somewhere beginning around 24 minutes, nobody made a shot for 3 minutes.",0.0008164552,9.87162e-10,3.5657475e-05,4.149662e-05,0.0003173493,1.7504177e-05
dafood48,I had to skip to see that. Painful to watch,0.00090443424,4.569225e-09,0.00027154345,5.8663438e-05,0.0004307336,1.497581e-05
iAmTheRealLange,That was just the GOAT giving them a chance,3.3123095e-05,2.7217012e-11,1.2034321e-05,4.3650816e-06,2.3240009e-05,5.415793e-07
hungryforitalianfood,"I've never seen this. Great video. I was a pretty serious basketball player in my teens and twenties. Used to play summer leagues with pro players during their off season. I can tell you straight up that this dude played in the league for ten years, and that's all you need to know. The level of skill, the amount of work, and the raw talent required to do this is insane. I could have played overseas for money, and never in my wildest dreams did I think I'd ever earn a spot in the NBA. We're talking about a few hundred guys out of seven billion people. It's not the same.",5.3138867e-09,5.661553e-18,9.041161e-08,5.0132173e-11,1.6028027e-08,1.91486e-12
Mnm0602,Probably the longest 6 minutes of my life trying to skip through that video,1.5399979e-09,8.833746e-19,9.384135e-09,5.600056e-11,7.3977517e-09,1.7338396e-12
dazedwit,The Scallenge,0.03819489,9.0298445e-06,0.0045041554,0.0027838938,0.0032267314,0.00081339804
skieezy,"Give the guy some credit, went to the finals 3 times in 6 years, played two whole minutes. At least he was doing something right in practice.",1.9482603e-05,1.3434673e-15,1.0835078e-06,2.2426077e-09,5.2038143e-07,3.7330414e-10
thenhe,"I know the NBA is pretty liberal about ""traveling,"" but that shit is ridiculous.",0.99584466,0.0013735632,0.9549129,0.00013977489,0.19312449,0.00063267665
rjcarr,"I think I watched 80% of the shots and I don't recall seeing a single travel (at least by Brian). Show me a play where you think he traveled. Traveling is one of the most misunderstood rules in basketball.That said, they do let a lot of actual traveling slide in the NBA.",6.993841e-12,8.2171176e-24,1.0743267e-10,5.749088e-14,7.926878e-11,1.103017e-15
ApishGrapist,"His first possession, when he does that spin seemed like a walk to me.",3.3591891e-09,2.5043666e-18,1.5515383e-08,1.5134981e-10,5.0816055e-08,9.144298e-12
rjcarr,"Yeah, he was sort of pushed and did that little bunny hop which is probably technically a travel, but since he was pushed out of position I doubt it would be called. A good catch, though, thanks for sharing.",2.0583015e-09,6.98409e-21,1.5342134e-09,3.532731e-12,1.9275013e-09,1.7304161e-13
pistilpete,He travels everytime he gets the ball. This dude kind of sucks. Plus his game is kind of stiff. Typical whiteboy shit,0.9832176,0.0001615324,0.80619437,0.00015198013,0.14107531,0.00080258056
heezle,I didn't see much 'ownage' in the first 6 minutes of that video.,0.0015272748,1.6279515e-10,3.0022278e-05,9.137984e-06,4.2653122e-05,2.6370774e-06
rjcarr,"He did miss a bunch of shots he should have made, but he shut down every player he was matched up against. I think the scores were 11-3, 11-0, 11-0, and 11-3. That said, he was probably 3-4 inches taller than the tallest guy.",0.008999226,4.0999183e-11,0.00026361406,7.8608355e-07,0.00028953713,6.0171715e-07
Faladorable,nobody even came close to him lol,2.7181493e-05,2.5909054e-11,7.969905e-06,3.405282e-06,2.0908172e-05,5.130324e-07
NAN,"I used to play pickup with a dude who had a few preseason 10 days or whatever, not sure the details of his contracts, but he never played a real game, but made a little bit of money to start a business while he practiced with a few teams before getting cut before the season.He would absolutely murder in pickup, and most games had several college / decent level high school recruits / over seas players in them, not exactly garbage time at the Y or whatever. He was by NBA standards an undersized 4 who would rebound and D, but in pickup he would run the point and pull all 3's and was about 6'7'' and jacked. You could tell half the time he would just let other people do their thing for the sake of their own entertainment, but if his team went down he'd just go snatch a board then get a bucket to ensure they stayed on the court. The only people fast enough to guard him he'd just post them up and kill.",2.2681263e-05,9.4632696e-14,1.59173e-05,3.7917232e-08,1.0823276e-05,1.02729345e-08
deeree1867,[reminds me when the White mamba meme came out and people challenged Scalabrine](https://www.youtube.com/watch?v=bpiu8UtQ-6E),6.6133805e-07,1.0171431e-16,1.04919124e-07,2.1606597e-09,1.8820964e-07,2.4739868e-10
lo0ilo0ilo0i,reminds me when the white mamba destroyed the haters. https://www.youtube.com/watch?v=pOw8aC78LoU,5.542784e-05,2.3830508e-15,5.406334e-07,1.582704e-08,1.0191834e-06,3.89814e-09
ravih,"It's funny, the NBA players are not pressured at all whereas the fan is probably experiencing the most pressure to make a shot he's ever had.",0.00012896284,1.5634556e-13,1.1959607e-06,1.9241786e-07,1.2247308e-05,8.012959e-08
lava9611,Kind of like gametime in the NBA...,0.0013882032,1.4751262e-07,0.0008052307,0.00018057523,0.000379492,3.0282796e-05
vpae5b,"Not true. There are many things that can prevent somebody making the Pro's, regardless of talent. I've played in many summer league tournaments with pro's, and there are dudes who never got the chance that can ball.",7.2748604e-05,1.3953831e-13,6.6601806e-06,6.3420494e-08,6.4369933e-06,1.6129999e-08
NAN,I'm still confused how some centers can't hit free throws. It's a question that eternity follows.,1.7056564e-09,2.9150976e-17,4.029307e-08,3.3906652e-10,2.8070358e-08,8.330251e-12
bigkinggorilla,"My personal theory is that centers are typically forced to practice a high release for all their shots (to avoid getting blocked in the paint) and that form interferes with how they want to shoot free throws. Might not have much validity to it, but also those guys usually were told to go down low since they were old enough to play basketball and not take shots.",2.99791e-08,1.9754487e-19,1.085798e-08,1.890979e-11,1.1734275e-08,1.7179597e-12
