id,comment,toxic,severe_toxic,obscene,threat,insult,identity_hate
Tr0nKl0ndike,"If you guys liked this, you'll love Barry Bremen, ""The Great Imposter""https://vimeo.com/100848182Definitely worth the watch.",0.88452417,2.7413464e-05,0.007646887,0.010289491,0.18637398,0.022524446
Rdt767,They were going to arrest him but decided being a Pelicans fan and letting him watch the game was punishment enough.,0.00014404269,4.0036377e-11,1.590994e-05,3.9270935e-06,2.9154306e-05,7.947363e-07
AttackOfTheThumbs,> Don't do that againI can hear the cop,0.75531673,2.0337371e-05,0.058314268,0.0012868501,0.012398915,0.0013343806
dillonfalano,"This is amazing and it looks like the cop was being a good sport, it's nice to see things like this end on a positive note.",2.8693321e-05,6.7294767e-16,2.172302e-07,3.7943475e-09,1.0813203e-06,1.214135e-09
ChevroletSparkSS,"I love how the cop was just like ""Dude, sit down, that shot was terrible.""",0.9549913,1.6224225e-05,0.024076454,0.0023375424,0.1014822,0.0059870947
wizholt7,"I love how the security guy just pointed his finger at him all serious. Like ""Hey! Just knock it off! Okay? Okay!""",0.24667974,6.094203e-09,0.00026266472,8.7129476e-05,0.018396683,0.00012136678
hstisalive,That was cool. They could have banned him and everything but im glad they didnt. This was funny as hell,0.88047975,2.7421813e-06,0.024850342,0.0003543436,0.015975514,0.00071295234
Xanny_Tanner,"All you gotta do is own it. I used to work construction and one day i went to pick up some windows for a house we were remodeling. Halfway back to the site, I had to shit so bad I knew I wasn't gonna make it back. I was in an area that was just a huge office park, so no gas stations, fast food joints, basically any type of public restroom. So I parked in front of some software company, grabbed one of the windows from the truck, strapped on my tool belt and l walked up to the secretary with the window and told her I was meeting “Scott in maintenance” (because every maintenance team has a “Scott”) to replace a window in one of the restrooms. She gave me directions to where the maintenance team hung out, let me into the main building, where I did a number on a random bathroom. Then I left, passed the secretary, pointed at the window and said “still must be half-asleep, I brought the wrong size window from the truck”. She laughed and said she'd see me in a second. Hopped in the truck and returned to work undetected.",9.666441e-10,7.685988e-21,4.212853e-09,1.8494438e-12,1.2970284e-09,8.732501e-14
FlipperJungle19,This looks like something that Jazz from Fresh Prince of Bel-Air would have done.,5.3165454e-12,7.5639305e-24,4.9719937e-11,8.21636e-14,8.4462166e-11,1.5725667e-15
Zmo_1ndone,THIS IS HILARIOUS AF LOL....ONE QUESTION ON EVERYBODYS MIND IS DID HE MAKE THE SHOT & THE ANSWER IS HELL NO LOOK AT THAT GARBAGE ASS FORM LOL,0.99592847,2.9314172e-06,0.81788987,1.4670944e-06,0.035449244,1.0735006e-05
BroadwayBully,"lucky he didn't get tossed out, pretty lenient security over there.",0.00016621985,1.7653474e-12,1.7684231e-05,1.8022813e-07,6.0437005e-06,2.7964228e-08
Chitown2354,Funny how the cop scolds him like he's a little kid,0.96844405,4.7775023e-07,0.00280316,0.00048761262,0.08911863,0.0016797266
sprandel,"""BAD, NO""",0.42144865,0.00071420975,0.030443862,0.02584403,0.06295355,0.017711071
macwillivray,I honestly thought it was IT warming up lol then I realized it was the pelicans,1.4591825e-05,1.965511e-12,4.1869193e-06,6.717859e-07,9.390946e-06,9.5717255e-08
KB17ROY,Didn't know the Pelicans traded for retirement Melo,1.2994313e-07,7.7062946e-16,1.6718032e-07,4.9948397e-09,2.3559681e-07,2.571931e-10
GrandmasSpaghetti,👈 Nooooo!!!!,0.024387825,0.00053074193,0.022858959,0.014404937,0.008237867,0.0034397608
syracusehorn,Who hasn't wanted to do that?,1.6174326e-05,3.3133047e-12,9.041521e-06,3.8574558e-07,3.5553505e-06,3.7751114e-08
SweetToothKane,Good guy cop. Gave him an admonishing and left it at that.,0.12821332,9.495441e-09,0.0011271981,2.849494e-05,0.0012403759,2.5089652e-05
tymink,Lmao I love the random stretches and warm up routine,3.5354296e-05,3.232123e-12,7.5131293e-06,7.1211514e-07,1.8661853e-05,1.4678514e-07
goldgibbon,"I know he's just trying to play an innocent prank. But the fear is that lots of other people will start trying to do this too, which will get annoying for security.",0.00017159592,2.6738788e-11,2.0210482e-05,1.7517906e-06,3.325968e-05,3.1921329e-07
E404_User_Not_Found,Lol the officer just escorts him two feet back to his chair. I wonder if he threatened time out too.,8.407088e-05,1.0246297e-09,0.0001378765,1.6405766e-05,8.992117e-05,2.1966707e-06
shozzlez,"Classic parent move - the finger point and stern ""NO!"".",2.0537496e-05,7.53182e-18,3.199505e-08,5.1570875e-10,8.833778e-08,1.4416773e-10
xi_GoinHam,"When you put all your points into stealth, but the guards are OP.",2.0560874e-06,6.758861e-15,1.5348777e-06,6.1369887e-09,3.5925385e-07,5.07849e-10
Nuwanda84,Pretty cool of the cop to not throw him out right away.,0.26943254,3.9851148e-08,0.0039179004,5.7271693e-05,0.00090162066,3.68081e-05
B00TYMASTER,Cop could've been a lot more of a dick about it. Could've easily been kicked out. Stern telling off is probably a fitting punishment for someone who dished out the amount of money to sit courtside.,0.034018192,6.4204066e-08,0.017023064,4.5405057e-05,0.0076935356,2.4175584e-05
constrictor63,"yes, inconspicuous with the athletic frame of a pregnant gazelle",1.3667642e-06,2.8307123e-13,1.0117575e-06,2.9921324e-07,2.038801e-06,1.983899e-08
DynamoPro,AMA Request: this Pelicans fan.,1.0063513e-05,2.7367646e-12,1.9282486e-06,1.1624606e-06,3.2628666e-06,1.1097954e-07
k2duff,r/actlikeyoubelong,0.009686889,1.12369835e-05,0.0047983383,0.0026819983,0.0022483177,0.0005792061
RollingThunderPants,Can check that one off the ol' bucket list.,0.0045085256,1.3735764e-10,4.842912e-05,4.3601385e-06,0.000122243,1.8902301e-06
mightbedylan,Wilford Brimley looked pissed.,0.012567203,1.765213e-08,0.00056861574,8.418544e-05,0.0011146866,3.1843978e-05
_Dad_Jokes,"Ouch, he received a stern pointing at",3.260903e-09,1.0723409e-21,2.4106095e-10,2.879226e-12,6.805486e-10,1.1377604e-13
d_smogh,That was definitely a finger wag.,0.5180497,3.055806e-07,0.0021641902,0.00028009852,0.011306935,0.00041582424
petepete16,This guy is a champ,0.066329725,4.074004e-06,0.0038620022,0.0019578554,0.0057505327,0.0009378073
AndrewWonjo,that brick he put up gave it away,0.0004323641,2.750596e-12,1.5748448e-05,3.4350407e-07,1.8513114e-05,1.0477034e-07
poopiepuppy,I lol'd at that jumping jack,0.000104650106,3.2569185e-09,9.4416326e-05,2.0459927e-05,8.8214045e-05,3.1937116e-06
sno2787,*skippity beep boop bada moop diggity doop*,0.024387825,0.00053074193,0.022858959,0.014404937,0.008237867,0.0034397608
Jalespino,"Well played, prankster.",0.00038711043,3.72575e-10,5.776254e-05,7.139728e-06,4.3169875e-05,1.2488459e-06
FoghornLeghornAhsay,Yea but he had a court side seat. A peasant would have been instantly thrown out.,8.748612e-09,3.5287657e-15,5.668567e-07,5.1889795e-09,2.7862757e-07,1.8051119e-10
PopoFace,That is gold!!,0.010838112,3.890306e-06,0.002374669,0.0024038602,0.0018168084,0.0006270267
Herry_Up,Quite the scolding lol “Big NO NO!”,0.13210744,4.0757573e-06,0.003226072,0.0027220568,0.0059423055,0.0018081055
skeliskull,I wanna be friends with this guy,0.03156187,2.3704988e-06,0.0019647381,0.002027284,0.003373698,0.0008784328
Pi11r0113r,Good for that guy. Got to live out a dream,0.019877393,1.4747775e-06,0.0026402636,0.0011084873,0.0023138644,0.0003654686
indifferentmod,"Wow, what an honor to meet Wilford Brimley in person. #lucky",0.024744458,1.8460432e-06,0.0031482037,0.0010915867,0.00237533,0.0003435893
UnchartedShark,"Just act like you belong. 60% of the time, it works every time.",0.7788761,2.266141e-06,0.0020616062,0.002111351,0.14678878,0.0072596944
kenziefrenzie,That's not a cop that's colonel sanders,0.39979702,6.330399e-08,0.010369082,3.6482958e-05,0.0010551402,2.2840562e-05
gaatikah,/r/ActLikeYouBelong,0.009686889,1.12369835e-05,0.0047983383,0.0026819983,0.0022483177,0.0005792061
letdemfite,Who passed him the ball? He deserves a gold star.,5.1687246e-05,3.6258258e-15,5.8422745e-07,1.05239355e-08,1.1548606e-06,3.1327037e-09
AllynSea,"""And DON'T do it again!""",0.01425435,5.735808e-07,0.001999098,0.00063065474,0.0009696055,0.00019417
geromeo,What a legend. And a great story to tell your mates,2.893209e-06,1.1604198e-13,8.59832e-07,1.05590445e-07,1.2683273e-06,8.559114e-09
Astro_Kimi,r/actlikeyoubelong,0.009686889,1.12369835e-05,0.0047983383,0.0026819983,0.0022483177,0.0005792061
DealArtist,"Good security guard, this didn't warrant anything more than a stern pointing.",1.0271329e-08,7.679511e-21,2.6381117e-09,2.8965656e-12,1.4179036e-09,1.5250609e-13
Cetun,Michael Jordan should do this and they should see how long it takes for them to figure out it's him.,0.07823905,2.13706e-09,0.00065633876,1.0665371e-05,0.0005941613,7.1427175e-06
practicalguy,"Glad to see cops in America sometimes do what Australian cops do. You know, not shoot them, tell the person off and wag their dissapointed finger at them like a naughty child.",0.86335915,2.156922e-05,0.01766173,0.006905555,0.20225081,0.014312846
toreycarter16,"This is a perfect representation of when you get a job you're not really qualified for, and someone finds out.",0.2991149,4.8406732e-06,0.005965249,0.0056504486,0.17437856,0.0058016297
futureformerteacher,Still in better shape than Charles Barkley in his prime.,7.379391e-07,7.0871437e-15,7.7903184e-07,1.36951765e-08,5.0572925e-07,9.1279273e-10
_Barringtonsteezy,What a legend,1.6580575e-06,5.3022636e-13,1.3771514e-06,2.3613532e-07,1.9864813e-06,1.4171662e-08
jetlibrucellee,Who passed the ball lmao,0.003516621,6.0264346e-12,2.1786596e-05,6.3939854e-07,3.1506326e-05,2.8739157e-07
Empole,r/actlikeyoubelong,0.009686889,1.12369835e-05,0.0047983383,0.0026819983,0.0022483177,0.0005792061
OldWoodenFap,Wait.....this exists and is amazing.,4.4853205e-05,1.2941555e-11,6.535331e-06,1.7039328e-06,1.5092e-05,2.3226761e-07
theknightlynews,Just act like you're supposed to be there,0.0010587273,6.73846e-11,1.0784556e-05,9.546312e-06,0.00010563989,3.2330997e-06
Clews207,Legend,5.369078e-07,4.234822e-13,8.7314004e-07,2.0556979e-07,1.2117744e-06,9.032918e-09
thewebabyseamus,I bet if he was 6'6 he could've gotten at least 2 more shots in.,1.7644272e-05,2.8425112e-10,0.00010094514,3.6907122e-06,5.3694224e-05,4.2487773e-07
DMann420,"""now don't you get back up again""And in baseball you get booted out and banned for life for touching the field accidentally",1.6569556e-05,4.6524045e-11,4.2683558e-05,1.2949782e-06,4.462908e-05,1.6008312e-07
Selfless-,There's a team called the Pelicans now?,1.1379661e-06,1.9095893e-16,7.310648e-08,5.661849e-09,1.82548e-07,5.547001e-10
Jock_fortune_sandals,New Orleans Hornets got renamed when Charlotte went back to being the Hornets,2.9183605e-07,7.550811e-17,2.633516e-07,3.1953848e-10,5.661355e-08,2.1769975e-11
TheOnlyYoYo,r/actlikeyoubelong,0.009686889,1.12369835e-05,0.0047983383,0.0026819983,0.0022483177,0.0005792061
xclame,Guy had front row seats and he does this risking being thrown out? Dang.,3.407962e-06,5.2733376e-13,5.0054227e-06,9.257208e-08,3.2318728e-06,8.738154e-09
faulkque,How about a smile you pig!!,0.9857157,0.00062372827,0.05451173,0.009971645,0.8362803,0.11020784
Chemical_Robot,Years ago. Maybe 15 years ago. A guy did this during a Manchester United champions league game. Went on to the pitch and actually lined up with the squad. I remember watching the game with my mate and we're like trying to figure out who this player is. He looks too old to be some unknown youth player making his debut. A few minutes later the he's gone and the commentary team mentioned he was an imposter. Fucking brilliant.Edit: he was called Karl Power.,0.75518125,8.102903e-11,0.016113348,1.2727872e-07,0.001029826,2.420216e-07
guybillout,https://www.youtube.com/watch?v=pRUMC7JCkeU,0.0013896828,4.789447e-13,6.5112617e-06,1.5229055e-07,7.5261305e-06,5.952693e-08
AverageCollegeMale,"I can imagine the cop at the end saying, “DONT do it again.”",1.4913949e-06,1.2506398e-16,2.4069556e-07,2.0281845e-09,2.5624766e-07,2.358422e-10
Jilgebean,The most Louisianan cop I have ever seen. Coonass if you will.,0.54222965,6.7220634e-07,0.006650761,0.00049359794,0.0044636372,0.00037565213
ngunray,“It's hard God damn work!”,0.84627587,2.2623324e-05,0.34058863,0.00023740929,0.009462605,0.0001464155
LordOfKhaos,The shot and stretching is what gave him away,0.8405228,1.3261441e-06,0.011522093,0.00036211545,0.020307716,0.00075144594
VocationFumes,"Him stretching just made my day, they should have a fake NBA where this happens nightly",0.002099713,5.8341787e-10,0.00016994888,7.4929653e-06,7.5970514e-05,1.9952415e-06
the_drizzter,Too cool.,0.00013256844,9.1169317e-10,4.502467e-05,1.5266152e-05,3.132128e-05,1.6608159e-06
BostonSportsFan1234,Someone on the Pelicans Staff had to look at that guy and say “Yeah he looks like one of our players throw him a ball”,0.0011746399,4.434487e-12,8.12388e-06,1.1883219e-06,3.2585933e-05,5.7013784e-07
gdogtlaw21,"Are we sure this isn't a Pelicans player??? hahaha...i also love the fact the cop takes him back to his seat, doesn't even escort him out of the arena.",0.014608592,9.88364e-10,0.00124103,4.0007044e-06,0.00023261007,1.8258539e-06
stupidbullcrapmom,“SIT DOWN AND THINK ABOUT WHAT YOU'VE DONE MISTER”,8.0452126e-05,7.744825e-09,0.00014113574,4.41905e-05,0.00015189045,5.5393857e-06
downside_saveit,That's why they are called pelican fans not pelican't fans,2.5406247e-05,2.3014263e-14,3.0122276e-06,1.9582107e-08,2.0205578e-06,3.7162489e-09
lolol_idontcare,Cop should have waited and blocked his next shot before escorting him off,0.024478875,8.316488e-08,0.0034763436,0.00013555582,0.001475735,4.1587777e-05
press3tocollude,Jumping jacks? Lordy.,0.0036573368,3.097327e-06,0.002605167,0.00094105146,0.0023584825,0.00018625951
v1nnyMac,We need more heros like this,0.014580173,1.2926536e-06,0.0017088376,0.0015981073,0.0051808804,0.0006425933
Aaaaand-its-gone,“Hey! You're not tall enough to be on here”,0.00018048674,7.573017e-11,2.7480837e-05,6.4391356e-06,7.025239e-05,1.2411795e-06
Ghraysone,"The cop was all "" If you do that again, I will give you such a pinch!""",0.9255943,8.427541e-06,0.012503351,0.0015703891,0.06338582,0.0033192476
NAN,[deleted],0.0017408743,3.435744e-08,0.0002800833,0.00013391736,0.0001293075,2.2895694e-05
shiteymate,Why is this downvoted lol it's funny,0.00023494467,4.6691616e-11,1.4796427e-05,4.653291e-06,1.7377719e-05,8.249547e-07
Ceiphone,How white folks goofing off get treated. Privilege returns them to their seats. Now pretend this guy was bla...wait...hmmm. This doesn't fit my narrative at all.,3.5395216e-09,5.5691005e-19,4.2037453e-08,1.536707e-11,9.1329655e-09,5.5077535e-13
modmoderate,Jesus are you seriously trying to turn this funny gif into some race relations flashpoint?Get a grip dude.,0.0034783909,1.05909984e-14,1.4459122e-06,2.4461697e-08,2.072909e-05,2.9162619e-08
Ceiphone,"Race relations flashpoint?I was mocking the tendency of folks who say ""now, imagine he was black""', implying he'd be thrown to the ground and hauled off to jail.In this awesome gif, you clearly see folks treating each other as humans...which is what happens the vast majority of the time, contrary to the posts I was mocking.",1.6510218e-07,6.861412e-18,2.4446194e-07,7.759027e-11,7.619872e-08,7.999551e-12
blahblahyeaok,truth hurts,5.8455457e-06,9.926847e-14,7.468848e-07,1.0675507e-07,1.0702893e-06,9.2741175e-09
modmoderate,Sure dude..,0.08410346,3.7495764e-05,0.0166273,0.0052056275,0.008686832,0.002054416
sixtynineningbeavers,Get a grip dude,0.9697347,0.00067660847,0.07462556,0.0057882126,0.39698097,0.025374135
jimm_er,"Damn, this is hilariously funny lol.",0.060598943,8.365781e-07,0.028930394,0.00014645922,0.0006211873,2.5999472e-05
legitbean,""" NO. DONT DO THAT""",0.0022535718,2.661131e-07,0.0007842735,0.00037253078,0.00045148042,7.561283e-05
Pint_and_Grub,When you are in courtside seats you are allowed to get away with stuff.,0.014880752,2.9459545e-07,0.00077571144,0.00080570887,0.004296729,0.0003505903
YorockPaperScissors,Ha! That was awesome. If he was a little skinnier he may have gotten an extra three minutes before anyone noticed anything.,0.012270016,1.4107476e-08,0.00031326563,0.0001435343,0.0028215782,9.828358e-05
Basedgod4real,[Come on BOYS!!](https://youtu.be/Vwh0lBPHg9o?t=25),0.0026412182,1.7976599e-06,0.00090363494,0.002169693,0.003410574,0.00061204314
shapu,"I love how the cop is just ""No. NO.""",0.5331419,3.3042056e-07,0.004442108,0.00040874488,0.0034800624,0.0004221256
lost_prodigal,There's a reason why they call it the Big Easy.,1.4401981e-05,3.6150077e-10,3.2551703e-05,1.0215402e-05,4.770644e-05,9.3088266e-07
Klin24,"""DO THAT ONE MORE TIME AND IMA GONNA TASE YA, BRO!""",0.90441275,5.8355618e-05,0.015294205,0.009456672,0.12944543,0.01606396
liverpoolwin,I love it when people get away with this,0.013996556,3.447626e-08,0.0005721116,0.00016803155,0.00063966674,6.930671e-05
zenchop3,That just made my day,0.0024365264,5.996017e-08,0.00049204327,0.00025314817,0.00034291876,5.527277e-05
flyboy3B2,"Cool of the cop to let him stay, though.",0.03774282,2.3831899e-09,0.00093356107,1.54951e-05,0.00021514646,6.5720938e-06
onlybrad,More power to this guy!,0.022481196,1.3501914e-07,0.00065843633,0.0003633574,0.0015102791,0.0001668757
l0fid3lity,This guy sports.,0.0030703812,5.7138497e-08,0.00021815072,0.00035108632,0.00047548115,9.484324e-05
KratosAK,R/actlikeyoubelong,0.009686889,1.12369835e-05,0.0047983383,0.0026819983,0.0022483177,0.0005792061
Sub_Corrector_Bot,"You may have meant r/actlikeyoubelong instead of R/actlikeyoubelong. --------------------------------------- ^^^Remember, *^^OP ^^^may ^^^have ^^ninja-edited.* ^^I ^^correct ^^subreddit ^^^and ^^user ^^links ^^with ^^^a ^^capital ^^R ^^^or ^^U, ^^^which ^^are ^^^usually ^^unusable. ^^**-Srikar**",0.8973879,6.6235806e-08,0.06466218,7.809593e-06,0.020521754,1.6233882e-05
NAN,[deleted],0.0017408743,3.435744e-08,0.0002800833,0.00013391736,0.0001293075,2.2895694e-05
pinkalligator333,Why,0.011724019,1.1271824e-06,0.001672908,0.0011639168,0.0012895929,0.00030842362
GloomyLights,He's out there just a groovin' though.,0.0052869404,6.4809893e-07,0.0007997014,0.001169908,0.0012999394,0.00023210452
BrianPillmansGun,All he got was a stern talking to? I would totally walk on court if I knew I wouldn't get kicked out and possibly sent to stadium jail.,1.0611028e-08,9.8885025e-18,7.875274e-08,1.669787e-10,3.7305675e-08,7.661391e-12
Anonymous7333,Next level stealth there,4.6530727e-07,5.5919035e-14,3.48226e-07,9.5385744e-08,9.1870663e-07,5.268422e-09
imperial_age,That's one ugly shot he took,0.014224031,2.9311862e-11,2.1505979e-05,3.593087e-06,6.624397e-05,2.4475266e-06
chris_vader17,This is legendary,0.0132307075,4.9913847e-08,0.0005592563,0.0001733632,0.0005563333,6.594383e-05
006ahmed,What a legend,1.6580575e-06,5.3022636e-13,1.3771514e-06,2.3613532e-07,1.9864813e-06,1.4171662e-08
treellogreen,He looks limber.,0.0016217622,2.310086e-10,2.185777e-05,8.854745e-06,0.00010319301,3.0900515e-06
ferociousonyx,Did he win?,0.00040922582,2.1556243e-10,2.734049e-05,1.0125201e-05,5.4939443e-05,2.1457033e-06
Johnpecan,Did he make the shot?,0.032349303,1.6676406e-06,0.0017904473,0.0017258773,0.0036735751,0.00062201
ApeMillz93,hope he made the shot,0.020701386,8.170101e-06,0.0012846862,0.007555128,0.007448768,0.003527504
Deltaechoe,"There was The Office, Shameless and now they're Americanizing Remy Gaillard.",0.79951215,4.032376e-05,0.026005542,0.003854706,0.09332947,0.005524964
shoony43,Ray Felton got traded to NOLA??? Damn,0.44219238,2.4380677e-07,0.09961748,2.2163069e-05,0.0016483896,8.782386e-06
Ubarlight,*Officer used impotent finger waggling!*,0.1376681,2.0332287e-08,0.002489498,1.847486e-05,0.002116532,1.5178892e-05
XxThreepwoodxX,"He ""stretched"".",0.3189814,1.5644757e-05,0.00877117,0.0025521843,0.017399592,0.0017956892
harten66,Fake it til you make it,0.06087558,5.3933e-07,0.0022980464,0.00043467834,0.0026635535,0.00019255605
topredditbot,"Hey /u/JF_112,This is now the top post on reddit. It will be recorded at /r/topofreddit with all the other top posts.",2.434264e-05,1.5061397e-11,1.1409237e-05,1.4911702e-06,1.0693225e-05,1.5572267e-07
AFlaccoSeagulls,"My man....if you get a once in a lifetime chance to take a practice shot with an NBA team, you gotta *at least* get 2 inches off the ground on your vertical. That was embarrassing.",1.6784952e-06,7.048747e-16,4.2544536e-07,1.7888429e-09,6.7479607e-07,3.2204897e-10
Rick-powerfu,If he had of landed it in would he have been on the team,3.8740414e-05,1.2409002e-12,5.2231135e-06,3.3606207e-07,6.7786887e-06,4.8784763e-08
pokemondeckbuilder,"The Cavs need to be doing this to IT. Anytime he leaves the bench, a stern no and sit him back down.Also, it would be funny if that wasn't his seat. He is also pretending to have that seat too.",0.00021326888,3.8411738e-14,6.525883e-06,2.791994e-08,4.5033557e-06,8.559407e-09
nogoodgreen,The cop scolding him was great.,0.5743942,5.379513e-07,0.006206984,0.00026677022,0.0066744583,0.00028048226
aldorn,"""Snuck onto court"" - his seat is court side",1.1761399e-10,2.5917723e-17,1.3596066e-08,6.6441486e-10,1.619588e-08,9.9353425e-12
SatTierce,"This is some ""That's So Raven"" shit right there",0.9752455,7.064627e-09,0.022753393,1.3317828e-06,0.0016143096,3.6044848e-06
daemon7,I love how exaggerated and serious he took this. He was obviously committed.And did the security officer scold him for his bad behavior like a child,0.04872842,1.1600896e-10,6.663082e-05,7.65625e-06,0.0013713293,7.9464535e-06
JaminDime,"The cop scolding him like an angry parent was my favorite part. I bet one of the players who saw that came over after and was like, ""Popo didn't like that."" *low five*",3.1643644e-06,1.1126741e-14,1.0477175e-05,2.4902362e-09,9.780858e-07,2.435464e-10
ASDFGHJKL_101,Lmfaoo,0.024387825,0.00053074193,0.022858959,0.014404937,0.008237867,0.0034397608
poseidon2466,Pretty chill cop.,0.0060210647,7.287433e-10,0.0009765583,4.036861e-06,0.00013293275,1.1614445e-06
mikerftp,"Holy crap, security actually looked like they treated him decently and didn't used it as an excuse beat the shit out of him. Don't see that too often.",0.08058503,2.5161984e-10,0.06348655,9.514861e-08,0.00015010167,3.8825302e-08
angelsilva,no police brutality??? This must be a fake video!!!,0.03284391,1.1728066e-10,5.700193e-05,4.8792203e-06,0.00016504215,3.1028083e-06
Mathizsias,"Good cop, have a donut! =D",0.7828081,7.922594e-05,0.03765765,0.005921987,0.03476203,0.006311167
Alex1nChains,Cop should have waited and blocked his next shot before escorting him off,0.024478875,8.316488e-08,0.0034763436,0.00013555582,0.001475735,4.1587777e-05
paul_miner,Sneak: 100,0.0001236464,1.566866e-08,0.000361406,5.744361e-05,0.00032642117,7.1790623e-06
Wakenbake585,Probably didn't kick him out because of what he paid for floor seats. Might get a little more leniency that way.,0.000102275575,1.7586629e-12,5.034031e-06,6.8332224e-07,1.2256317e-05,1.5401005e-07
felula,Looool,0.024387825,0.00053074193,0.022858959,0.014404937,0.008237867,0.0034397608
POWERRL_RANGER,I thought the cops were gonna make a big deal of it haha. He was like “no! Bad boy!”,0.0487265,6.352224e-07,0.0009262168,0.0017950023,0.003493398,0.0010128297
cardinals1996,I'm amazed they didn't kick him out entirely. I've been on fields before football and baseball games and they raise a stink if you step a foot out of the designated area.,5.710393e-09,1.2838165e-20,2.3617095e-09,5.0897823e-12,4.294101e-09,3.787182e-13
lifesabeach13,"If this was an OKC game, they'd just assume it was Ray Felton",5.77914e-07,5.2550815e-14,1.856419e-06,2.5935694e-08,1.0262644e-06,1.8462182e-09
bloatedkat,I don't get why that's such a big deal to security.,0.034149397,1.5528741e-07,0.0014242282,0.00017691898,0.0024038067,9.436979e-05
Bleedlikeink,They should have let him suit up at SG... maybe they could have found themselves a starter.,0.00024170545,8.904114e-12,1.3528117e-05,1.0703127e-06,2.812521e-05,2.8061825e-07
I_R_Teh_Taco,Well did he make it?,0.0020769264,2.7694636e-08,0.00040963423,9.158347e-05,0.00033500916,2.2628525e-05
TheLightingLord007,Free the man!!,0.025667123,9.709551e-06,0.0055124545,0.0026095293,0.003078232,0.0006417631
jeremycanandwill,"Oooooo, he got the stern finger! Oooooooo, he is in so much trouble!",0.0014034804,1.0016226e-15,6.9309016e-07,8.366601e-09,1.6057915e-06,3.639785e-09
treditor13,1st place in the MVP voting!!,2.1049833e-07,4.375796e-17,1.5107445e-07,3.2283556e-10,4.2437193e-08,1.5375045e-11
the_taco_baron,Did he make the shot though?,0.0066260025,3.6440005e-07,0.0010336688,0.0005300195,0.0011060238,0.00012380556
aord2120x,r/actlikeyoubelong,0.009686889,1.12369835e-05,0.0047983383,0.0026819983,0.0022483177,0.0005792061
njcon321,My city is England and who are the pelicans?,0.005107903,1.0112983e-06,0.0019727752,0.0007750545,0.0012536723,0.00017623322
skypetutor,This made my day.,0.0010291296,7.187248e-09,0.00018615989,7.196127e-05,0.00012797865,1.4124785e-05
AshFaw,with Marcus Cousins out they should have let him stay,0.0043286732,6.8442716e-08,0.0006076333,0.00020047782,0.0005234258,4.6907677e-05
pissin_in_the_wind,Who is this Marcus you speak of?,0.00024847162,2.3024693e-08,0.0003135196,8.766193e-05,0.0003882354,1.2801505e-05
AshFaw,oops DEmarcus,1.9232648e-07,1.2947219e-17,1.3057764e-08,9.724267e-10,3.7757523e-08,4.981363e-11
WarpedRecall,this is gonna be a hell of a mardi gras,0.97844076,0.0013482292,0.09871927,0.00938721,0.6965546,0.08008211
vedaddy_,Heard it was the comedian Tony Roberts,5.9108424e-06,1.3104625e-11,9.8716555e-06,9.832042e-07,5.4764064e-06,7.045791e-08
Tarrolis,It just so happens the Pelicans need a new Power Forward.,1.1175906e-06,3.2359102e-12,4.1893e-06,4.6605027e-07,4.1600856e-06,3.471526e-08
