id,comment,toxic,severe_toxic,obscene,threat,insult,identity_hate
sirblowhard,because this cop knows how to access the situation and didn't power trip and escalate.,0.000105657025,9.681579e-16,1.5896205e-06,2.8353435e-09,1.1420169e-06,9.2678876e-10
Lookmorecloselier,"""Lie down on the ground, or else...""",0.04002402,1.3572587e-06,0.0052425954,0.00055837,0.0014495682,0.00018750667
EarthAllAlong,"""Get on your knees. now cross your ankles. now extend your arms straight out in front of you, palms down. now crawl across the floor toward us, but without using your arms. you fucked up, now you die.""",0.98863864,0.19030657,0.9711397,0.040627826,0.8816086,0.14949165
xiutehcuhtli,"this makes me wonder if it was staged, personally",0.0016291847,3.0170433e-10,6.0239552e-05,8.324419e-06,9.112447e-05,2.9221558e-06
Ralphusthegreatus,He got a quick scolding too.,0.039901484,3.2742545e-08,0.0005666545,0.00011313401,0.0010235475,5.816028e-05
toppercat,I told you last week Jim. You gotta stop this.,0.0025942174,8.3003075e-12,5.3790127e-06,2.4752226e-06,7.152336e-05,1.3003664e-06
ajd341,Those are pretty expensive seats!,4.1095485e-05,9.908706e-10,0.00018068252,6.425806e-06,3.5293357e-05,4.5887472e-07
jahmezz,"Probably cause this was during warmups, huh? Note to self: get on court when the game hasn't started yet.",1.1365985e-08,8.2234645e-21,1.4344861e-09,5.63724e-12,3.3530823e-09,4.5022306e-13
note-to-self-bot,A friendly reminder:get on court when the game hasn't started yet.,3.0710556e-10,1.3635581e-21,5.197416e-10,2.4658955e-12,9.0216534e-10,8.029856e-14
reggie4gtrblz2bryant,Its mardi gras down here. There are so many more things to worry about than this.,0.007316715,8.5262855e-08,0.0004636439,0.00035872482,0.0009080202,0.00012319341
Sirtopofhat,He's probably a season ticket holder. Can't say much to those people,0.00079664413,1.2212583e-09,6.865195e-05,3.250037e-05,0.0002481605,8.530061e-06
Saneless,"Eh, for those seats I'm sure there's someone ready to take 'em instead.",1.849067e-05,1.2774562e-12,5.0880294e-06,2.7460283e-07,2.0268793e-05,5.3339548e-08
Sirtopofhat,Idk man it is the Pelicans and Boogie is done for the year.,0.002154602,8.672639e-08,0.00053313636,0.0003046824,0.00051830866,7.232031e-05
Mlawless,I love how he sat back down in a FRONT ROW seat. Anyone sitting courtside is a millionaire or celebrity or family of the team.,0.00013749249,9.386027e-14,2.4398312e-06,8.5208235e-08,4.7848434e-06,1.8827043e-08
simjanes2k,"that cop talked him down like an angry dad""SON I WARNED YOU ABOUT THIS, DON'T YOU LISTEN??""",0.25276533,4.744344e-07,0.01952856,0.000116138195,0.0030720457,5.0688297e-05
Allstarcappa,"Looks like he paid for front row seats, maybe hes a vip or something.",0.009273518,1.7866877e-09,0.0005552656,7.6136616e-06,0.0013042253,4.1263143e-06
bitJericho,"Hey, this isn't a school board meeting.",5.650149e-05,5.286654e-12,4.349013e-06,1.5226036e-06,2.1945116e-05,3.0248862e-07
Z0idberg_MD,This is America after all.,0.0011275536,2.0351325e-09,0.0001289658,2.3849725e-05,0.000116519004,6.148108e-06
jaybrese,He has front row floor seats. He is too rich to throw out.,2.6284797e-05,4.8015435e-11,1.8953595e-05,3.2571927e-06,3.350458e-05,4.0947316e-07
masszt3r,'Murica!,0.024387825,0.00053074193,0.022858959,0.014404937,0.008237867,0.0034397608
Eyehopeuchoke,I feel like the security at nba games have always been way more chill than any other professional sports games I've been to.,3.1822022e-08,7.178642e-17,4.8701455e-08,6.4575767e-10,5.1516363e-08,4.1535907e-11
OilersFansDontMatter,Listen here young man...,0.0007062484,9.249694e-11,2.4274415e-05,4.567451e-06,2.5205749e-05,1.0159984e-06
tcmaddox,Yeah props to that dude not kicking him out.,0.937216,0.0009909378,0.13188493,0.006586264,0.20958547,0.015328434
The_Hylian_Loach,Good guy old guy.,0.06797073,0.00020993131,0.010401009,0.020625632,0.030763276,0.010167676
jingle_of_dreams,"I mean, that was some stern pointing at the very end.",8.2135386e-07,1.9429703e-17,3.5948236e-08,8.4478485e-10,5.7924716e-08,8.1148116e-11
win95ismyjam,He's in the court side seat. That might have influenced their decision.,1.8978451e-10,1.9873087e-18,8.926285e-09,8.688504e-11,7.7474995e-09,1.7302453e-12
musclecard54,Well he clearly got a very firm warning,0.009080445,1.2145658e-07,0.0005287429,0.00039106567,0.000993565,0.00013934173
Plu94011,Santa just puts you on the naughty list.,0.091424234,1.4741355e-10,8.643409e-05,9.910991e-06,0.0004974074,9.496579e-06
TriggeredScape,wHitE pRiViLeGe,5.1134652e-06,1.9121382e-11,4.245037e-06,2.435259e-06,8.615371e-06,1.7216524e-07
giveitago,I don't know. I think he was resisting just a tiny bit. A little stick time would have driven the lesson home.,1.4291373e-07,3.377307e-16,7.707707e-08,2.5473317e-09,2.2532319e-07,2.1710689e-10
kfmush,That cop's finger wag was classic.,0.0039800447,3.13887e-09,0.00019720307,3.0138312e-05,0.00019653444,1.0715777e-05
here2amaze,How do we know that's his seat? His real seat is probably in the nose bleed section and he probably just got a free upgrade.,2.232926e-06,2.9306687e-13,2.390595e-06,1.0697601e-07,2.3125563e-06,7.958791e-09
Harriet_12_3,"Granted it's a bit different since the pitch is more separate from the crowd than a basketball court is but a UK comedian got as far as pitch warm ups during a football match and we arrested, fined and I think banned from attending matches also.",1.71604e-09,2.4106374e-21,1.0406005e-09,1.7314172e-12,1.3345198e-09,1.1324129e-13
MontiBurns,The privileges of sitting Courtside.,0.1085147,2.438105e-07,0.00075467536,0.00031802987,0.0053651687,0.0001835814
zzyul,"Seeing as how it's in America I expected the police to shoot him, Obama's to claim he looks like his son, Trump to claim he was a threat to the police and the flag, Reddit to over react and upvote every story about him, 4Chan to meme him and finally allow Harambe to rest as a worthy successor takes his place. But all we got was a finger point. Jesus cops in America suck",0.3019638,1.8991675e-13,0.000312761,1.4540228e-08,0.0002484991,4.2299323e-08
HighPriestofShiloh,Dude's got front row seats. One percenters get a warning for EVERYTHING.,0.00028105648,3.1344322e-12,1.0155759e-05,6.9184006e-07,1.8824725e-05,2.0116066e-07
ThisIsntGoldWorthy,He probably told him to wait there while he called in more people to escort him out.,0.0009877689,6.982444e-12,7.638884e-06,1.8286788e-06,3.0441784e-05,5.9887077e-07
Touchit88,"Absolutely. Now the guy has an awesome story to tell without any of the consequences of being arrested, detained, etc.",2.754495e-07,8.747245e-16,6.3612816e-07,1.8235192e-09,1.048301e-07,7.1619245e-11
readmymind5,I'm glad they didn't shoot to kill,0.788773,4.754575e-05,0.0072892746,0.02308606,0.074824095,0.040127646
Airsh,"Do we have to stereotypical all cops just because there's some rotten ones in the world? Everyone has no tolerance for stereotyping races, but no one mines when it's about law enforcement...",4.875081e-07,7.5082763e-16,2.8540893e-07,2.8443783e-09,4.977244e-07,3.2560163e-10
Saneless,"I wasn't even stereotyping cops. More how people who run sports are zero fun, and what they demand of their security/cops. Overall I think cops are great, but I'm very polite and obeying to them (even while I was being arrested), white, dressed like a normal guy, normal car, so my experiences may vary.",4.9636345e-08,2.809503e-17,8.035533e-08,2.8893238e-10,7.255596e-08,2.4892933e-11
Airsh,"Sorry. I've just seen many Reddit users bring up cops in a negative light in general and how surprised they are when one acts chill. Yeah, experiences may vary. I've had my encounters with police and were reasonable people.",5.6552576e-08,3.5016565e-20,1.2348749e-08,4.4950853e-12,3.9363868e-09,4.5474448e-13
Saneless,"I figure most of them see shitty people all day, so they're probably a bit on the ""oh another shitty person I have to deal with"" kind of attitude by default, regardless of how nice of a person they are (it's probably an easy mode to fall into). I try to change that perception for them as much as I can as fast as I can.",0.053283244,3.04239e-09,0.010809727,1.0966302e-05,0.0071414337,9.727633e-06
Airsh,"Something like working for customer service probably doesn't help. It sucks how one shitty person can potentially ruin everyone's day.On another note: My only ""No fun allowed"" moment with an officer was because some neighbor complained about me and my friends doing fireworks within the city limits. (Even though many do fireworks within the city limits anyways...) It sucked, but we cooperated and lit them elsewhere. It's funny because they really don't enforce this city law until a complaint happens. They turn a blind eye and let people have their fun on New Year's and July 4th.",0.0238401,1.368146e-13,0.00037705462,1.1920905e-08,6.438736e-05,1.1079613e-08
whatdoy0uknow,For having some harmless fun you think it's appropriate if he got kicked out?,9.911793e-07,3.6942481e-13,4.540715e-06,1.1978918e-07,2.9463106e-06,9.270544e-09
FiREorKNiFE-,"He just said he expected it, not that he thought it was appropriate.",0.0004993841,9.611622e-09,0.00026341606,5.4975604e-05,0.0004975634,1.3597329e-05
Saneless,"I just assumed most places have a zero-bs policy about people being anywhere near players or the court. They usually don't have human sides to them. Hell, at one nhl game some dick in a suit tried to get me arrested for selling tickets within x-yards of the entrance (I was a season-ticket holder and just couldn't make the game that night).",0.00010785181,7.034379e-15,0.00013897762,7.515578e-10,2.3287607e-06,1.4732277e-10
OneNDPAlbertan,no. but it's what i;ve come to expect from any form of security in the US,4.347255e-06,5.994301e-16,4.5399776e-07,1.5633187e-09,3.1793908e-07,2.939939e-10
ieatlittleasians,Welcome to New Orleans beb,5.6399937e-08,3.6025436e-13,1.3574386e-06,1.0492912e-07,8.159442e-07,3.0217153e-09
wizardsfucking,i'd really like to see where he shoots it. guessing he air balled it by like 15 ft,0.004023025,6.8417656e-08,0.0004183344,0.00028247377,0.0020100668,0.00011463927
fzsage,That shot form is likely what gave him away,2.0153739e-07,1.3470787e-17,7.48106e-08,2.2480198e-10,3.4958255e-08,1.6082266e-11
Jeffk01,Nope. It was his pear-shaped physique,1.4508867e-08,3.9904288e-17,4.112024e-08,7.8110607e-10,4.391962e-08,2.7382959e-11
fzsage,Boris Diaw disagrees,4.698865e-08,3.9673144e-16,1.197154e-07,3.0199463e-09,1.67381e-07,1.0767165e-10
pencil-thin-mustache,Boris Diaw is a saint! A saint!,1.7035584e-10,4.465276e-21,6.011528e-10,6.7755987e-12,1.4353728e-09,1.3198428e-13
KapitalLetter,Shout out to all the pears,2.0023917e-06,4.2458438e-14,8.318286e-07,9.7576255e-08,1.8893993e-06,8.480367e-09
mac3theac3,🤙,0.024387825,0.00053074193,0.022858959,0.014404937,0.008237867,0.0034397608
wizardsfucking,i thought it was the single jumping jack,3.8534225e-07,2.9536503e-12,4.3320583e-06,4.3605195e-07,3.9816728e-06,2.8875085e-08
match_,"TIL I am in shape... pear is a shape, right?",1.2318669e-05,7.632781e-10,6.723257e-05,1.7202019e-05,0.000119326665,2.0367102e-06
AlphakirA,"Nah, could've just been Tony Allen.",3.7971514e-08,1.1868682e-15,7.541648e-08,7.625611e-09,1.6667678e-07,3.1824599e-10
RocketMoped,Joakim Noah would be proud of that one,0.29534405,2.666903e-07,0.0035600725,0.00029859177,0.003644707,0.0002665005
Four-In-Hand,"Yeah, inquiring minds want to know. Did he get the J?",0.05287789,2.679635e-07,0.001673714,0.00034618794,0.0017433396,0.00018449372
cunninglinguist96,Probably after the game,0.0008461463,3.9059547e-09,0.00024210862,2.1462052e-05,0.00014022597,4.1537387e-06
TheOtherCoenBrother,"I think it hit the rim and bounced back, that's why he gave it away instead of trying again. If someone else had caught the ball and thrown it to him I feel like he would have gone for another shot",0.0011987905,5.0374067e-12,5.1959156e-05,3.8790148e-07,4.29221e-05,1.7752434e-07
sleepslate,Is it really sneaking onto the court when he just got out of his chair and walked 3 steps to the right?,1.544519e-07,2.4714822e-14,6.3962847e-07,3.4189828e-08,1.2379793e-06,2.6482805e-09
Jeffk01,"I love the scolding finger in the face. “You, sir, are no longer welcome at Bushwood Country Club!”",0.0005898581,1.6182269e-11,3.0066001e-05,9.0133597e-07,2.2145363e-05,2.5138152e-07
amerikaninjunwarrior,he shoots like my dad,0.08095079,6.244076e-07,0.0090993345,0.00014143657,0.0025534786,5.641169e-05
PartTimeTulsa,"I know. That security officer was like, ""You only get one!"" And I'm thinking that was totally worth using it on.",0.0008500483,8.0542725e-11,0.00016364577,7.0382686e-07,0.0001191151,2.317943e-07
richardparkeeer,I love how he got the balls,0.112196006,2.6617553e-07,0.004051251,0.00027989352,0.0011199915,0.00013433238
veeno__,A lot of people don't know that this is comedian Tony Roberts lol,4.163321e-05,1.4765329e-10,3.5422163e-05,4.4485773e-06,2.1125676e-05,5.0450086e-07
Yeebuss,"Thats how your uncle asks for a shot, then airballs.",0.0023184547,1.0565275e-10,1.28230595e-05,1.4104985e-05,9.2383154e-05,4.8703173e-06
pencil-thin-mustache,Someone find this man!,0.0021842613,1.02072164e-07,0.0006159566,0.00020403576,0.00033553384,3.7313454e-05
Karl_Marx_,Probably some kid playing ball boy.,0.070714876,2.2675556e-08,0.0008738417,7.9660094e-05,0.001205011,4.361417e-05
monkeybrain3,Hey Pelican fans are just trying to help out their team. Cousins got injured and out for the rest of the season so the fans are stepping up to fill his shoes for the playoffs. The guy in OP had his chance and was immediately thanked and they'd get back to him.,3.8702646e-07,3.5528958e-19,2.2593875e-08,3.747957e-11,1.8621229e-08,4.5627295e-12
BismuthCurious,r/actlikeyoubelong,0.009686889,1.12369835e-05,0.0047983383,0.0026819983,0.0022483177,0.0005792061
northbathroom,I love how the cop tried to give him the shaming finger... As though this guy cares what you think old man...,0.71056795,4.643892e-07,0.010790414,0.00023385494,0.008277631,0.0003070365
whoooooooooooooosh,I too enjoyed the gif,7.26276e-07,2.0268513e-12,2.4502824e-06,4.253967e-07,4.236649e-06,2.4423795e-08
bradleygrieve,I love that he put up a shot rather than got shot,0.0032883235,9.626708e-08,0.0004254137,0.0003739412,0.00084915943,0.000104906576
BillsMafia607,"""Sir, well done we're upgrading you to floor seats, now sit there and enjoy the game!""",3.828336e-05,4.480337e-12,1.420844e-05,5.9014417e-07,9.971686e-06,7.74601e-08
Encyclopedia_Ham,"When he points ""YOU are awesome"" ""Here's season tickets""",0.49663794,9.56923e-07,0.15300877,4.1271982e-05,0.003836775,2.2532526e-05
fickit1time,Please someone make the gif.,2.5161482e-08,1.7749571e-15,9.7593016e-08,6.5183023e-09,1.6832914e-07,2.5209781e-10
SexlessNights,"Sure, I'll get to it later.",3.9427462e-07,5.4713212e-15,4.6946593e-07,1.6350981e-08,7.86577e-07,8.884377e-10
piponwa,Ah the old redditor-aroo,0.0010074817,5.485672e-10,3.1749372e-05,2.1554766e-05,0.0001517208,6.4490487e-06
Double___Dragon,"Hold my hightops, I'm going - err there's no link...",2.5216588e-08,9.998002e-19,1.0320521e-08,1.5507438e-10,1.4727627e-08,6.9716784e-12
hellerzin,its already very later plz,4.6790912e-08,3.311022e-17,9.983212e-08,4.954511e-10,7.279424e-08,2.0184536e-11
Charishard,RemindMe! Later,7.494085e-08,2.224477e-16,7.812036e-08,3.4312697e-09,1.5135738e-07,1.3347763e-10
Solomanrosenburg,Relevant username,6.761721e-06,2.9512948e-13,1.1444165e-06,2.0926556e-07,2.1994588e-06,1.78983e-08
blairnet,a little late to the game but [here's the best I could do](https://imgur.com/gallery/R390EId),0.0011753411,1.1462762e-11,3.4826713e-05,1.18259e-06,4.6611636e-05,4.0587997e-07
addandsubtract,https://www.youtube.com/watch?v=3bAU0hfDVIo,0.0013896828,4.789447e-13,6.5112617e-06,1.5229055e-07,7.5261305e-06,5.952693e-08
CJShort,I can only get German captions and audio. I'm bummed man.,1.414039e-06,1.3983339e-11,1.6132488e-05,9.064019e-07,9.7388e-06,6.114383e-08
addandsubtract,"Yeah, I figured it'd be a long shot to post, but it's definitely fitting and funny if you understand German. Basically, the idea is that his boss is obviously pissed, but instead of yelling at him and telling him to get his shit together, he's giving out compliments. Things like, ""I've been keeping an eye on you all morning and need to tell you... what an *awesome* guy you are! I'm taking these to practice!"" – (while walking away) ""You're promoted!"" – (while pointing at his eyes) ""You have beautiful eyes!"" and the catch phrase is ""Hear what you want to hear – Deezer"".",0.015284939,1.1390545e-13,8.757712e-05,1.8317015e-08,8.7365515e-05,2.44429e-08
frivolouslyfurious,"Agreed. I've already watched a sequence of Deezer commercials but I can't understand a single one. Except for the biker one that someone kindly translated.That fella has such a tranquil smile whenever he's getting yelled at though, ginger man must be screaming some very kind things.",1.5607126e-08,1.4307871e-19,3.3241725e-09,6.6772525e-11,1.0186149e-08,4.1405217e-12
CrudelyAnimated,I'm sure the Pelicans just appreciate someone with that kind of enthusiasm.,1.2480448e-06,7.807627e-12,1.1950478e-05,5.370921e-07,6.5839063e-06,3.3752407e-08
purpgoblin,r/thathappened,0.009686889,1.12369835e-05,0.0047983383,0.0026819983,0.0022483177,0.0005792061
PooPooDooDoo,"Says in a stern voice: ""Don't you go not enjoying the game!""",0.00011960462,1.5006167e-15,5.6025635e-07,8.388812e-09,1.0480477e-06,1.8923447e-09
Erlian,r/thathappened,0.009686889,1.12369835e-05,0.0047983383,0.0026819983,0.0022483177,0.0005792061
CoolHandLukeZ,And that officer's name? Albert Einstein.,0.00068878365,1.2835697e-08,0.00023894368,6.8070134e-05,0.00013009396,1.0956727e-05
Stackhouse_,Right then everyone started clapping,0.0045596813,3.165011e-08,0.0002835677,0.0002034394,0.0007602112,6.794412e-05
JF_112,How nice of the cop :),0.8435349,6.725373e-05,0.13120605,0.0012622747,0.017346218,0.0013119614
partofthevoid,Smooth,1.7945827e-05,2.3545207e-10,2.6621754e-05,7.653687e-06,3.0062989e-05,6.254488e-07
roogoff,Enjoy this succulent Chinese meal on us,0.01716188,6.0128635e-08,0.0017919767,5.7293924e-05,0.00063296675,2.028693e-05
Gurrb17,GET YOUR HANDS OFF MY PENISSSSHHHH,0.7405318,8.9340305e-05,0.10456692,0.0026425938,0.024896182,0.0019891055
Pioneerpie26,"This is the bloke that got me on the penis, people!",0.9157871,0.00021018388,0.17905216,0.002055434,0.03525087,0.0030582559
SirLotsaLocks,Are you wait to receive my LIMP PENIS?,0.99178857,0.002333589,0.3196876,0.0033118527,0.6420632,0.034475755
GroceryScanner,HOW DARE YOU,0.89805466,0.0058321618,0.09468999,0.04334636,0.2763965,0.07249776
TokiMcNoodle,This is democrrrrrracy manifest!,0.006063525,4.510665e-08,0.00046953163,0.00014373276,0.00039046243,4.241389e-05
dog_eat_dog,ahhh yes...I see that you know your judo well...,7.4783085e-05,6.0536987e-10,2.0535012e-05,3.2127835e-05,9.8682234e-05,5.115851e-06
svenhoek86,Are you ready to receive my limp penis sir?,0.9799518,0.00063640316,0.27993017,0.001635438,0.24393857,0.007399858
TesticleMeElmo,I see you know your judo well.,0.0061541875,2.9135276e-07,0.0003995733,0.0006694816,0.0013937943,0.00023141994
Pioneerpie26,I'm under WHAT?!,0.00040579366,1.2449678e-07,0.0008934711,0.00016524718,0.0006237069,2.8651486e-05
plz_send_noods,what? r/outoftheloop,0.0075337947,5.990312e-06,0.0038423757,0.0020786824,0.0018732606,0.00045685252
Joshyybaxx,https://www.youtube.com/watch?v=XebF2cgmFmU,0.0013896828,4.789447e-13,6.5112617e-06,1.5229055e-07,7.5261305e-06,5.952693e-08
plz_send_noods,thank you sir looooooooool,1.0059032e-05,7.399945e-11,2.3427507e-05,6.4860624e-06,3.5939494e-05,5.9489184e-07
sweetcuppingcakes,r/WholesomeGifInterpretations,0.009686889,1.12369835e-05,0.0047983383,0.0026819983,0.0022483177,0.0005792061
NoSoupFor_You,"A reverse gif would make for a great make a wish story.""Local kid asked by cop to shoot around with NBA team during pregame warm ups""",3.3164102e-07,3.177234e-20,7.166086e-09,1.2857362e-11,8.792942e-09,1.5814003e-12
ethandsmith6,“You're gonna have to teach me those stretches after the game!”,0.004386027,7.320747e-09,0.00030510538,5.9940437e-05,0.0003159088,2.0705244e-05
anti_zero,>- Wilford Brimley,0.024387825,0.00053074193,0.022858959,0.014404937,0.008237867,0.0034397608
lolzfeminism,He very obviously had a floor seat so “snuck onto the court” part of the story is pretty bullshit.,0.8830083,4.9097336e-05,0.7157934,7.3984185e-05,0.0099062165,8.077053e-05
ChosenBrad1322,"Dunno why, but I had a buddy in high school who somehow found a McDonald's uniform. Put it on, just walked in and started working lol... he got away with it for about 30 minutes before they removed him.",6.222184e-08,2.6859234e-17,8.8296346e-08,5.404354e-10,9.511867e-08,4.3016875e-11
COMPUTER1313,"""Why don't you know how to operate this equipment?""""I don't think I was ever trained to use it.""",4.1788182e-05,2.5865148e-12,5.165572e-06,1.1774966e-06,2.1354277e-05,2.4267013e-07
Merppity,"Where I worked, they'd tell you to figure it out, then don't let you leave even if they find out you're not actually an employee",1.0477575e-05,1.4504037e-14,1.2089349e-06,2.4643962e-08,3.5135206e-06,5.315641e-09
COMPUTER1313,"Let me guess, those ""Hiring Now"" signs were not merely decorations?""Alright, jokes over guys, I'm not actually an employee here. Guys? Guys?""",2.172325e-09,1.1679577e-18,1.0197716e-08,8.548142e-11,1.6448071e-08,3.3495296e-12
D33nMach1ne,"I have a security uniform from a job that never panned out, a subway uniform from I job I quit because fuck that, and a reflective vest and coveralls. I'm just waiting for someone to suggest a heist where those 3 things are exactly what we need.",0.11698653,7.2494237e-09,0.09383915,1.2981993e-06,0.0013761006,7.641512e-07
DeltaDragonxx,I'm more than willing to help put this together,2.8295966e-05,3.272423e-13,2.9674936e-06,2.6964696e-07,9.063838e-06,5.5353603e-08
D33nMach1ne,Oceans 3157.,0.024387825,0.00053074193,0.022858959,0.014404937,0.008237867,0.0034397608
DeltaDragonxx,"Here's the plan. We find a mall with a subway. About an hour before closing, you sneak in the subway, and ask like you belong. We get some dude in the coveralls to cause a scene outside, I'll be in the security uniform to hype up said scene. While everyone is distracted, you open the registers, grab the cash, coveralls dude and I go outside to ""have a chat about public decency"", you just casually walk off. You sure our cuts into our accounts, we go to another location a few states over every so often to keep it up.",4.01144e-06,4.7154737e-16,1.1753078e-06,8.280708e-10,1.2244459e-06,2.0323192e-10
D33nMach1ne,Well make literally dozens of dollars each per hit. Brilliant. (If you think I'm not stuffing my pockets with roast beef you're nuts. Pocket meat son!),5.8310226e-05,1.0193767e-12,2.0535557e-05,9.3354025e-08,1.9876823e-05,2.3715014e-08
DeltaDragonxx,"Hey, once we get this down, we move up in the world. I say we end up going full Union Depository at the end.",0.16567169,7.869703e-06,0.0051600393,0.0032651005,0.00955786,0.0020983177
D33nMach1ne,"""Subway sandwich delivery. Got this order straight from the vice president of the USA. He says leave it in the vault and take what you think is fair as a tip."" ""VICE PRESIDENT PENCE? right away sir!""",1.0741402e-10,2.2897033e-23,1.6282156e-10,1.2233027e-13,1.4234795e-10,3.9059578e-15
DeltaDragonxx,"Perfect. After Pence, we go straight for Putin. He may look like a hard badass, but no one can resist those cookies",4.106661e-09,4.6629685e-18,1.9834676e-08,1.6564637e-10,1.7998811e-08,6.303771e-12
D33nMach1ne,"Da! Come in, come in! Usually I don't let anyone in the presidential office where I keep my Russian bonds, but for a macadamia nut...",0.002732137,4.0838137e-09,0.00036455772,2.5021649e-05,0.0011615747,1.2051904e-05
DeltaDragonxx,Who do we hit after Putin? Bill Gates? Elon Musk? Both?,3.035882e-08,2.5765814e-17,3.1555054e-08,7.4458917e-10,6.955488e-08,4.047209e-11
D33nMach1ne,Then I say we go back for more pocket meat,0.000947304,1.4256249e-08,8.859973e-05,0.00013282214,0.0002340104,2.8230628e-05
DeltaDragonxx,I like the way you think!,0.07526743,2.2245356e-05,0.007289299,0.006094116,0.014723211,0.0028822976
WintertimeFriends,I kept a Police reflective vest I acquired. I ended up throwing it away because I wouldn't want to be tempted to use it.,1.6593232e-06,8.069018e-15,6.4105194e-07,2.291735e-08,1.3587909e-06,2.9921674e-09
theslideistoohot,"With great power, comes great responsibility.",1.3774947e-08,2.7841137e-15,2.4024516e-07,5.049112e-09,1.9361119e-07,1.3127573e-10
FlawedPriorities,F the police but who's stopping you from killing me?,0.8735975,2.1371077e-10,0.00016517234,3.0801157e-06,0.003035729,9.90809e-06
DirtyButtPirate,So that's why I found a police vest in someone's trash,0.0030416213,9.721976e-12,2.6468673e-05,1.0434919e-06,1.9135978e-05,3.7946864e-07
D33nMach1ne,"""Acquired'",0.024387825,0.00053074193,0.022858959,0.014404937,0.008237867,0.0034397608
NSA-SURVEILLANCE,Right...,0.0028660137,8.0899326e-07,0.0007335956,0.00086849555,0.0018964633,0.0001854974
LIVERLIPS69,*the great philly steak heist*,0.9433672,8.541685e-05,0.07271949,0.0015387712,0.06331515,0.002622462
stratcat22,You would be a great heist team member in GTA V.,0.00092313794,5.672568e-14,0.000121221165,6.57681e-09,7.2651756e-06,1.8115697e-09
SleepyFarmingRIP,I own a car. And some gloves.,0.0024604439,2.679937e-09,0.00012759032,2.5425974e-05,0.00013577573,8.007655e-06
WildBird57,We should make a sub for planning heists,0.089093104,4.1296339e-10,0.0001303587,1.2262128e-05,0.00040631622,1.033834e-05
D33nMach1ne,/r/pocketmeat. They'll never know,0.007195927,3.6513234e-06,0.002074548,0.0021975134,0.0017097724,0.00051499344
WildBird57,/r/heists,0.009686889,1.12369835e-05,0.0047983383,0.0026819983,0.0022483177,0.0005792061
GlowInTheDarkNinjas,I feel like the subway one would be the hardest to abuse because there's only ever two employees in the store.,2.8540103e-07,1.0763529e-14,3.827196e-07,2.6887548e-08,9.854365e-07,2.0601594e-09
