id,comment,toxic,severe_toxic,obscene,threat,insult,identity_hate
jam_pudding,THEY TURNED THE FROGS FUCKING *GAY*,0.9986121654510498,0.4270654618740082,0.9800829291343689,0.06642279028892517,0.9058786034584045,0.2768935263156891
adamzzz8,"Omg thank you, I never heard about this guy, now I'm in stitches watching him scream about gay frogs, lol. What a gem.",0.048337291926145554,1.073434646059468e-06,0.0050428747199475765,5.239606980467215e-05,0.003829146269708872,0.00040993638685904443
AthleticKiwi,Btw many Americans actually think he is a reliable source of information. I even recall watching a video of a woman breaking down in tears after she met him. Let that sink in.,0.005858238786458969,4.099509709476479e-08,0.0009437595726922154,2.514472498660325e-06,0.0005078536341898143,3.5876793845091015e-05
TamestImpala,What does the sink want this time?,0.06455476582050323,2.3221711671794765e-05,0.006010035984218121,0.0006701825186610222,0.006362488493323326,0.0036667261738330126
El_Peregrine,brilliant; also love the username,0.000562560569960624,9.042520510149643e-09,0.00023134493676479906,3.386045079878386e-07,8.087519381660968e-05,7.0230275923677254e-06
AthleticKiwi,Lul,0.016463201493024826,1.9275947124697268e-05,0.004478128626942635,0.00026728041120804846,0.003357982262969017,0.001453277189284563
JustMetod,"He is a showman who loves conspiracy theories. Yeah he says insane shit but the scary part is he ends up being correct sometimes, thats why a lot of people believe him. I personally just view him as a source of entertainment and dont take what he says very seriously. If you really want to know the guy watch the Joe Rogan podcast with him(episode 911) where he gets drunk and high and explains where he is coming from.",0.5347334742546082,1.7308238966506906e-05,0.12126888334751129,0.0002479944669175893,0.038182057440280914,0.0020395449828356504
jam_pudding,That episode is an absolute trip. Honestly.,0.0003329748287796974,6.828408949388631e-10,7.94294974184595e-05,7.107447430598768e-08,3.279380325693637e-05,2.5764368274394656e-06
AthleticKiwi,"> personally just view him as a source of entertainment and dont take what he says very seriously.Great. If only other people percieved him the same way I would be content. Unfortunately, some peopleâ€”believe it or notâ€”take his word as Gospel.",5.33576931047719e-05,2.4889942537575926e-11,2.5564610041328706e-05,2.519445985171842e-09,5.92263540966087e-06,1.570000023320972e-07
DivingJudge,"Wasn't he right as well? Like the frogs actually did turn ""gay"" and some of them even became female. I am pretty sure this all turned out to be true.",0.7463667988777161,0.0009658018825575709,0.06582429260015488,0.018633635714650154,0.16670969128608704,0.04806596785783768
shr3dthegnarbrah,[WITH CHEMICALS](http://www.salviaerik.com/store-1/obama-turned-my-frog-gay-t-shirt?category=Apparel),0.5849778652191162,7.990012818481773e-05,0.03156786784529686,0.002490819664672017,0.07531972974538803,0.010482866317033768
LEGALIZEMEDICALMETH,"I'M A HUMAN, I'M A PIONEER",0.07743575423955917,1.5772286133142188e-05,0.009816030040383339,0.00029152262140996754,0.007343122269958258,0.001493291463702917
yuyo874,"This reminds me of the ""Benzema: A broken man"" post",0.0004037472535856068,1.5121283114538642e-09,0.00011158858251292259,1.0529300453754331e-07,4.438828909769654e-05,3.08092648992897e-06
ClassyChickens,The best post on here,0.004972915165126324,1.318516780202117e-07,0.0009333632187917829,5.1230326789664105e-06,0.00047489727148786187,7.829411333659664e-05
sabret00the,Link?,0.0006964542553760111,7.322339179438586e-09,0.0001565120037412271,3.951366522869648e-07,8.129753405228257e-05,8.374558092327788e-06
NAN,[deleted],0.003765546018257737,5.964062665952952e-07,0.0009973300620913506,1.694911225058604e-05,0.0005632698885165155,0.00017409920110367239
sabret00the,Dammit. Reddit so needs an edit history. I wanted to read the bit he removed. I'm assuming that's where he said that Benzema was a broken man?,0.0001294808607781306,3.238235235514253e-10,8.549483027309179e-05,1.892959389238058e-08,1.9284772861283273e-05,7.637228804924234e-07
calbertuk,You know it:>Edit: removed the emotional and over dramatic part,8.439338125754148e-05,1.6661123869443628e-10,6.204351666383445e-05,1.1108538977566695e-08,1.6566822523600422e-05,4.867879965786415e-07
adamzzz8,"Lol I totally forgot about that post, but I remember this particular line like it was yesterday.",5.597901326837018e-05,3.387793170994691e-11,2.4918303097365424e-05,3.3075768790524762e-09,6.049235707905609e-06,1.9964660680216184e-07
IswtiadYswsanwtm,Use uneddit,0.010756192728877068,1.0032408681581728e-06,0.0019698322284966707,2.5180666852975264e-05,0.001505946391262114,0.0002114532544510439
dngrs,is it the same as ceddit?,0.002281423192471266,8.361228509556895e-08,0.0006074951961636543,3.0122389489406487e-06,0.00027521929587237537,4.541037924354896e-05
SenoraRamos,"Lmfaoo, how did I miss this?",0.001571086817421019,9.270933354343924e-09,0.0002515374217182398,5.9633117643898e-07,0.0001068812416633591,1.2710549526673276e-05
reddit809,Be scored a brace that very day.,0.016125954687595367,1.8980987306349562e-06,0.0022754690144211054,6.325959111563861e-05,0.001806488260626793,0.0005073011270724237
pale_cerulean_dot,https://www.reddit.com/r/soccer/comments/5h0atj/benzema_and_his_poor_form/He then scored twice against Dortmund later that day,0.007425304036587477,9.469887629620644e-08,0.0010591535829007626,4.753207122121239e-06,0.0006958943558856845,5.775769386673346e-05
cowk,> Benzema: A broken manhttps://www.reddit.com/r/soccer/comments/5h0atj/benzema_and_his_poor_form/,0.00030730184516869485,1.0331880906377933e-09,0.00012158129538875073,5.944387027057019e-08,3.9607417420484126e-05,1.7135488405983779e-06
GourangaPlusPlus,Dearth of left back tho...,0.07047135382890701,1.1680620445986278e-05,0.0072354828007519245,0.0002729841216932982,0.006193882320076227,0.0015637254109606147
Infinite_Otaku,Saddest backflip of my career,0.003419809974730015,1.2292225903820508e-07,0.0007438003085553646,5.002974376111524e-06,0.00041142565896734595,6.109018431743607e-05
El_Spacho,Rhubarb,0.016463201493024826,1.9275947124697268e-05,0.004478128626942635,0.00026728041120804846,0.003357982262969017,0.001453277189284563
Niloy_123,Link please,8.073118078755215e-05,1.201104493642191e-10,3.183778244419955e-05,9.666888622916758e-09,8.941537998907734e-06,5.084756367068621e-07
GourangaPlusPlus,https://www.reddit.com/r/undelete/comments/3dcink/442865719_dearth_of_left_back_rsoccer/,0.005058004055172205,1.4783003621232638e-07,0.001279976568184793,4.2543870222289115e-06,0.000512097030878067,5.705860166926868e-05
Niloy_123,Lol what the fuck ðŸ˜‚,0.9845051169395447,0.02120174653828144,0.9745247960090637,0.004492997657507658,0.379617840051651,0.025105534121394157
imGnarly,"I don't know man, the ""I figured Messi's secret: play on your tip toes"" thing destroyed my sides.",0.006463373079895973,7.620248965167775e-08,0.0010533264139667153,4.757297574542463e-06,0.0006659117061644793,6.403239967767149e-05
molokoplus359,"Neymar to Qatar NT.Short story:* Ronaldo comes to Monaco* Monaco dominating over PSG* Sheiks are angry* Messi and Gabriel Jesus become WC 2022 ambassadors* Messi and Jesus come to PSG* Neymar's in the shadow of Messi again* Jesus develops playing with Messi* Neymar's in the shadow of Jesus in NT* Neymars are unhappy to be in the shadow everywhere they go* Sheiks find a way to work around FIFA rules* Neymar comes to Qatar national teamLong story:Dmitry Rybolovlev, Alexey Fedorichev and Jorge Mendes...",0.01858549937605858,2.493976580808521e-07,0.0018344389973208308,1.3623534869111609e-05,0.0016603636322543025,0.00015641815843991935
cowk,> Gabriel JesusIs he that good?,0.001119631459005177,3.558062999786671e-08,0.0003437483392190188,1.60971046625491e-06,0.00016234182112384588,2.612673051771708e-05
HailHelix123,"Just the brazillian version of [Insert young promising player who will DEFINITELY be the best in the world here]But yes,he's quite good",2.40275858232053e-05,1.1827440936362787e-11,1.680780405877158e-05,9.068613637808198e-10,3.6655933399742935e-06,8.214754387836365e-08
TomShoe,"Tbf, the Brazilian version of [Insert young promising player who will DEFINITELY be the best in the world here] very often *does* become the best in the world.",7.58655442041345e-05,6.511560735056321e-11,3.9365218981401995e-05,4.478498016879939e-09,1.0652197488525417e-05,2.818377708990738e-07
HuckFinn69,I've heard people call him the Brazilian Pulisic.,0.0026933338958770037,5.127951752115223e-08,0.0004929546848870814,2.7018209038942587e-06,0.00027982841129414737,4.1912302549462765e-05
buttlovingpanda,Let's not get carried away,0.0014155713142827153,4.508091677735138e-09,0.00016196547949220985,4.1101895931205945e-07,8.937711390899494e-05,1.0909900993283372e-05
NAN,[deleted],0.003765546018257737,5.964062665952952e-07,0.0009973300620913506,1.694911225058604e-05,0.0005632698885165155,0.00017409920110367239
Aerialist_SS,"No, Christian ""Christian Pulisic"" Pulisic.",0.013740058988332748,1.1563704447326018e-06,0.002462777541950345,3.4295528166694567e-05,0.0015361850382760167,0.00027980998856946826
DivingJudge,Is this Pulisic guy a meme or something that I am not getting?,0.0036501672584563494,5.054283747085719e-07,0.0014043861301615834,1.3782268979412038e-05,0.0006447124178521335,0.00013193738413974643
LordMangudai,He's a very hopeful prospect for the USMNT. Meaning some Americans occasionally get a bit too hopeful about him.,0.05649304389953613,4.729829015559517e-06,0.005378345493227243,0.00015130169049371034,0.005421623587608337,0.0009415133390575647
PurePandas,Always wondered what could have been of Pato,0.00029808434192091227,2.0312895809837528e-09,0.00011820650252047926,1.0589015175810346e-07,4.0562030335422605e-05,3.1570400551572675e-06
_fmaule,He's very good,0.01576336659491062,8.879276720108464e-06,0.0036501793656498194,0.0001758028956828639,0.0029910109005868435,0.001018705777823925
TheKingInNorth0,Flair checks out,0.051534004509449005,4.145002822042443e-05,0.00888762529939413,0.0007119115325622261,0.007399567402899265,0.003077905625104904
_fmaule,"Well, I did see him in our games and he was brilliant! And every time I watch City he's having a great match!",0.002830024342983961,3.688730032536114e-08,0.0005950155900791287,1.9627220808615675e-06,0.0003228991408832371,2.9483335310942493e-05
RevelacaoVerdao,"And how about those NT showings, right!?",0.0015034540556371212,1.075802025241046e-08,0.0003511965915095061,5.495741106642527e-07,0.00017494455096311867,9.618954209145159e-06
_Wastrel,A right proper lad,0.006091161631047726,4.4299693513494276e-07,0.0012909711804240942,1.3482344002113678e-05,0.0008994266972877085,0.00011970947525696829
DaniielJ,The new Paulinho,0.012583236210048199,2.9947864277346525e-06,0.002484533004462719,6.6701955802273e-05,0.0018475500401109457,0.0004934981698170304
kemahkeming,Better than Rashford+Martial+Lindgard+Pogba+lukaku,0.0013587058056145906,1.2637757507150127e-08,0.0002724040823522955,7.874499488025322e-07,0.0001425477530574426,1.5754079868202098e-05
Mr_Self__Destruct,Better than Rashford and lingard yes. Not so sure about the others,0.002119719050824642,1.4999638864310327e-08,0.00042144974577240646,9.807534979699994e-07,0.00019101431826129556,2.0253333786968142e-05
SeducedByGravy,I can see the headlines now,0.004383206367492676,2.768888407445047e-07,0.0009962298208847642,8.537540452380199e-06,0.0005498110549524426,9.901307930704206e-05
simplysuperman,> Neymar comes to Qatar national teamWouldn't have been the first time a non qualified Brazilian has played for the Qatar national team,0.0002548912016209215,3.444638463356853e-10,7.168854062911123e-05,3.008501536783115e-08,2.695030161703471e-05,1.0679422075554612e-06
robizzle89,"Sounds credible. Only waiting for the first ""news"" sites to report it :D",0.00016923880320973694,1.2075362931796008e-10,3.6408888263395056e-05,1.8853132388585436e-08,1.2736018106807023e-05,1.126737402046274e-06
69memelordharambe420,>Messi and Jesus come to PSGWhat's Jesus's buyout clause?350 million loaves of bread?,0.8198224902153015,0.0022041720803827047,0.1140277236700058,0.025539455935359,0.27670368552207947,0.0657946765422821
Rerel,> Jorge MendesJorge is a peasant compared to Pini Zahavi.,0.03362752124667168,5.779245384474052e-06,0.004201539326459169,0.00012849528866354376,0.0038448956329375505,0.000808242242783308
farqueue2,> * $hâ‚¬ik$ find a waÂ¥ to work around FIFA ruÂ£â‚¬$,0.009756989777088165,2.1740438569395337e-06,0.0021803893614560366,5.389454963733442e-05,0.001658703899011016,0.000380283483536914
Monarki,Why did I just read all of that.,0.008849123492836952,1.0855453638214385e-06,0.0016643773997202516,3.211665534763597e-05,0.001113691134378314,0.00027428148314356804
CharltonFugative,"We are witnessing history mate, you will be able to tell your grandchildren about this post.",0.000859841878991574,2.7089077647701743e-08,0.00034834095276892185,1.0249596016365103e-06,0.0001562231918796897,1.5987387087079696e-05
fcinterprofezionale,It's the best thing to happen to this subreddit since rhubarb.,0.005789104383438826,1.3162691914203606e-07,0.0008592898375354707,6.218319413164863e-06,0.0005585001781582832,8.400165097555146e-05
maplemario,"When this transfer first broke on this subreddit, I replied to the only other person in the post with a Ukraine flair. I'll tell my grand-grandchildren about this moment with a time capsule.",0.0003166146343573928,1.6163521909806633e-10,5.876013165106997e-05,2.435671042633203e-08,2.4009401386138052e-05,1.1027999562429613e-06
CharltonFugative,Ð‘ÑƒÐ´ÑŒÐ¼Ð¾!,0.016463201493024826,1.9275947124697268e-05,0.004478128626942635,0.00026728041120804846,0.003357982262969017,0.001453277189284563
maplemario,"Ð¢Ñ–Ð»ÑŒÐºÐ¸ Ñ Ð´ÑƒÐ¶Ðµ Ð¿Ð¾Ð³Ð°Ð½Ð¾ Ð¿Ð¾-ÑƒÐºÑ€Ð°Ñ—Ð½ÑÐºÑ– Ñ€Ð°Ð·Ð¼Ð¾Ð²Ð»ÑÑŽ, Ñ‚Ð° Ð·Ð°Ð²Ñ‚Ñ€Ð° Ð²Ð¸Ñ—Ð¶Ð´Ð¶Ð°ÑŽ Ð· ÑƒÐºÑ€Ð°Ñ—Ð½Ñ– :((Ð¡Ñ‚ÐµÑÐ½ÑÑŽÑÑŒ, Ð½Ð¾ Ð² Ð¾ÑÐ½Ð¾Ð²Ð½Ð¾Ð¼ Ð¿Ð¾-Ñ€ÑƒÑÑÐºÐ¸ ÑƒÐ¼ÐµÑŽ Ñ‡ÐµÑ‚ÐºÐ¾ Ð³Ð¾Ð²Ð¾Ñ€Ð¸Ñ‚ÑŒ :p",0.06042177975177765,1.0369789379183203e-05,0.007361747790127993,0.00020651399972848594,0.005427097901701927,0.0010918986517935991
CharltonFugative,"> Ð¢Ñ–Ð»ÑŒÐºÐ¸ Ñ Ð´ÑƒÐ¶Ðµ Ð¿Ð¾Ð³Ð°Ð½Ð¾ Ð¿Ð¾-ÑƒÐºÑ€Ð°Ñ—Ð½ÑÐºÑ– Ñ€Ð°Ð·Ð¼Ð¾Ð²Ð»ÑÑŽ, Ñ‚Ð° Ð·Ð°Ð²Ñ‚Ñ€Ð° Ð²Ð¸Ñ—Ð¶Ð´Ð¶Ð°ÑŽ Ð· ÑƒÐºÑ€Ð°Ñ—Ð½Ñ– :((> > Ð¡Ñ‚ÐµÑÐ½ÑÑŽÑÑŒ, Ð½Ð¾ Ð² Ð¾ÑÐ½Ð¾Ð²Ð½Ð¾Ð¼ Ð¿Ð¾-Ñ€ÑƒÑÑÐºÐ¸ ÑƒÐ¼ÐµÑŽ Ñ‡ÐµÑ‚ÐºÐ¾ Ð³Ð¾Ð²Ð¾Ñ€Ð¸Ñ‚ÑŒ :pÐŸÑ€Ð¸Ñ”Ð¼Ð½Ð¾ Ð¿Ð¾Ð·Ð½Ð°Ð¹Ð¾Ð¼Ð¸Ñ‚Ð¸ÑÑ Ð”Ñ€ÑƒÐ³, Ð¦Ðµ Ð½Ðµ Ð¿Ð¾Ð³Ð°Ð½Ð¾",0.011407826095819473,1.5491673366341274e-06,0.002161557786166668,3.923509211745113e-05,0.0014744988875463605,0.00030357539071701467
virtualKuma,"In that case, let me seal my legacy",0.0022063483484089375,6.658833484607385e-08,0.0007716041873209178,1.7428787941753399e-06,0.00028309764456935227,2.2809999791206792e-05
YoungPotato,"This post is nothing special, calm down. Just more dumbass filler.",0.7683336734771729,0.0005842388491146266,0.21499469876289368,0.0046160570345819,0.09843165427446365,0.017461691051721573
Radgost,"I tried but failed, you're my hero.",0.005028292071074247,1.5639700734482176e-07,0.0008564553572796285,5.75607782593579e-06,0.0005297210300341249,7.237211684696376e-05
johnsom3,"Why did I read all of that, and why does it feel so plausible?",0.015726469457149506,2.236887894468964e-06,0.002544101793318987,6.359419057844207e-05,0.0020361507777124643,0.00045177439460530877
yoshi570,"Well for you, I don't know, but personally I sometimes put cream on my hands and can't touch the keyboard for a minute or two while the cream dies up a bit, so I tend to look for a long post on reddit on read it during the process to pass time. It was far from the worst post.",0.00033793639158830047,1.20911558543213e-09,0.00017348640540149063,7.295534487639088e-08,5.510188566404395e-05,2.2999120119493455e-06
colenboozey,Time to stop drinking,0.14773999154567719,0.00016783716273494065,0.016819670796394348,0.0024260436184704304,0.023436030372977257,0.007577750366181135
mydogsnameishugo,"Shit, I was thinking it was time to start.",0.9570571780204773,0.023723764345049858,0.8671982288360596,0.01601291075348854,0.3516852557659149,0.07063041627407074
5states1life,I've got the glue ready,0.007422992028295994,2.818132998072542e-07,0.000925640226341784,1.236468870047247e-05,0.0006639987695962191,0.00013539961946662515
MbappesBaps,relevant flair,0.02597963996231556,9.676780791778583e-06,0.004655556753277779,0.00018486879707779735,0.003460909705609083,0.0010639536194503307
anathemalegion,Nope that's enough for me today. Time to put the bottle and the grass down. Fantasy and real life are blurring,0.005995829589664936,1.504323705603383e-07,0.0010578203946352005,6.477729584730696e-06,0.0007968172430992126,7.933918823255226e-05
aeternias,It's 5 o'clock somewhere,0.002989833941683173,4.1571951214791625e-08,0.0004660330596379936,1.9768524452956626e-06,0.00026902632089331746,2.8210741220391355e-05
Hrvat1818,This story is making me drink because of the excitement,0.001354037318378687,1.2610813726610104e-08,0.0002372334711253643,8.706173275641049e-07,0.00014113089127931744,1.5519442968070507e-05
captainkaba,"If this happens, I'll tattoo ""Wenger almost signed me"" on my butt cheek. 100% no bamboozle",0.621726930141449,0.00029049356817267835,0.18164417147636414,0.0025695820804685354,0.0635223463177681,0.007953977212309837
tnarref,Yeah my bamboozle sense is tickling,0.041446033865213394,2.352354749746155e-05,0.00625961646437645,0.000460668932646513,0.005954694468528032,0.0022935899905860424
nmrt,Bamboozle-man?,0.009788811206817627,1.1755560990422964e-05,0.0036603750195354223,0.0001843762438511476,0.002236749278381467,0.0011445011477917433
SgtPepper1000,He was probably bit by a tatto-less ballsack,0.019888971000909805,9.764929700395442e-07,0.002300599589943886,3.494898555800319e-05,0.0020447992719709873,0.0002839605149347335
tnarref,No but I was raised by one.,0.007830271497368813,4.1064950551117363e-07,0.0012153196148574352,1.4147662113828119e-05,0.0008525215671397746,0.00013636310177389532
armoredapron,"i don't know, it's a pretty safe place.no one's ever going to see that shit.",0.9258594512939453,0.00387906888499856,0.8258464336395264,0.0039595142006874084,0.19301117956638336,0.02002662792801857
tnarref,no one was gonna see that other dude's ballsack tattoo either,0.003926389385014772,1.6100850075417839e-07,0.0007159119704738259,6.4956630012602545e-06,0.00042467040475457907,7.938777707749978e-05
JeMoederHeeftEbola,/r/soccercourt,0.033884644508361816,8.997643817565404e-06,0.005862041842192411,0.0001864684745669365,0.0036755006294697523,0.0010495290625840425
not_a_morning_person,Remind me! 1 month,0.00022069260012358427,1.1400588251220256e-09,7.542507955804467e-05,7.657241951619653e-08,2.81365337286843e-05,2.368053856116603e-06
nuclearpowerrangers,Remind me! 24 days,0.00834497157484293,1.2706422012342955e-06,0.002165199490264058,2.7765549020841718e-05,0.0011343229562044144,0.00022259328397922218
Thgbrandao,Does this actually work?,0.0016954279271885753,1.8417864566799835e-07,0.0006739627569913864,4.570248165691737e-06,0.0002771877043414861,6.397160905180499e-05
AdamDXB,"It does, but you don't put a space its likeRemindMe! 24 days ""matey might have to get Wenger tattoo""",0.09447872638702393,2.0702222172985785e-05,0.008901664987206459,0.00040364370215684175,0.011731093749403954,0.0017635292606428266
nuclearpowerrangers,Thanks for letting us know the actual formatting! Remindme bot still responded even with the space though hahah,2.2034575522411615e-05,7.738464383177934e-12,2.0756844605784863e-05,7.114276390218777e-10,3.7407860418170458e-06,6.229225135712113e-08
i_am_sogeking,RemindMe! 1 month,7.275581447174773e-05,2.496145790065185e-10,3.6563236790243536e-05,1.671298832661705e-08,1.0494405614736024e-05,7.967070700942713e-07
NAN,"Man, i've been hurt before, dont you dare make me relive that pain.",0.2783604860305786,2.4440196284558624e-05,0.01369817741215229,0.0006765069556422532,0.019652588292956352,0.003049429040402174
callzor,And I will tattoo ASM7 on my thigh,0.09685707837343216,0.00010784184269141406,0.014056838117539883,0.0016463130014017224,0.0128128407523036,0.006058125291019678
Qwerterton,No bamboozle,0.026035089045763016,1.2264630640856922e-05,0.0049696858040988445,0.0002507634926587343,0.003564156126230955,0.0015016160905361176
FartStainsAreBad,Remind me! 25 days,0.0020417727064341307,8.812339302721739e-08,0.0005648378282785416,3.2486893815075746e-06,0.0002688368549570441,4.682932558353059e-05
EMINEM_4Evah,Bamboozle = banboozle m8 don't forget,0.0059673418290913105,3.7133074215489614e-07,0.0013288846239447594,9.592113201506436e-06,0.0006630035350099206,9.102441981667653e-05
mxox2kL,"I'm here to officially confirm your bet, see you over at r/soccercourt",0.00016227620653808117,5.4717702591133843e-11,7.695022941334173e-05,6.401206675832327e-09,1.8188802641816437e-05,3.4665740145101154e-07
chrismikehunt,I fear nutsack man has drained some of the fun out of a no bamboozle bet :( rip in peace,0.10722044855356216,5.2107319788774475e-05,0.011609027162194252,0.0010862329509109259,0.012376188300549984,0.004406587220728397
Odesit,"I haven't been on r/soccer for a while. What happened? Did he bet Neymar wouldn't get to PSG and promised to tattoo his nuts and didn't deliver, and got banned?",0.009283924475312233,9.935134670513435e-08,0.001027152524329722,5.246522050583735e-06,0.0006479985895566642,6.347592716338113e-05
chrismikehunt,"Yup that's pretty much it. Said he would tatto 'Wenger almost signed me' on his nuts if Neymar moved to PSG. Confirmed it was no bamboozle, even had a bit of a complain at people who make claims like this and then don't go trough with it and then, obviously, didn't go through with it himself.",0.00030006971792317927,8.038776311281026e-10,0.00021380005637183785,4.228932226624238e-08,5.114261875860393e-05,1.2453565432224423e-06
ArturoMC,RemindMe! 23 days,0.0017936895601451397,1.1946346489821735e-07,0.0005793239688500762,4.098277713637799e-06,0.000270434538833797,5.704831346520223e-05
Red32_26,RemindMe! 1 month,7.275581447174773e-05,2.496145790065185e-10,3.6563236790243536e-05,1.671298832661705e-08,1.0494405614736024e-05,7.967070700942713e-07
ojajaja,Bamboozle has lost all its sanctity here. For shame.,0.07702364027500153,1.1439099580456968e-05,0.007429891731590033,0.000262510497123003,0.006839267443865538,0.0014555688248947263
badiban,RemindMe! 1 month,7.275581447174773e-05,2.496145790065185e-10,3.6563236790243536e-05,1.671298832661705e-08,1.0494405614736024e-05,7.967070700942713e-07
FixDieWeed,RemindMe! 1 month,7.275581447174773e-05,2.496145790065185e-10,3.6563236790243536e-05,1.671298832661705e-08,1.0494405614736024e-05,7.967070700942713e-07
thexviews,RemindMe! 1 month,7.275581447174773e-05,2.496145790065185e-10,3.6563236790243536e-05,1.671298832661705e-08,1.0494405614736024e-05,7.967070700942713e-07
helikestoreddit,Can any butt doctor confirm that there are no medical complications to this?,0.7212644219398499,0.00031081726774573326,0.2517210841178894,0.0022760536521673203,0.06397318840026855,0.008203891105949879
JimiMcCheese,You can't claim impotence as a defence if it's on the butt. Bold move cotton.,0.07179415971040726,1.771885649759497e-06,0.02124192751944065,3.560759068932384e-05,0.004792675841599703,0.0002551810466684401
Vash2P,Now i want Ronaldo to go to Monaco to happen ! Because i doubt you will do it ! And WE WILL SUE YOU SIR,0.7137236595153809,0.0012306624557822943,0.07513096928596497,0.01857205666601658,0.15677107870578766,0.04035881906747818
StigDoesntFart,Dont hurt me. I have been bamboozled too many times. My heart can take no more.,0.10603451728820801,5.10582176502794e-05,0.013266676105558872,0.0008552692597731948,0.011241872794926167,0.00362482201308012
send420nudes,Ima join that,0.0057527171447873116,1.7936103802185244e-07,0.0007942913216538727,8.11806421552319e-06,0.0006919040461070836,9.200705244438723e-05
Soundurr,"[80's cop movie music]""You're fucking insane Mac - so insane I think you just might be right.""",0.9972416162490845,0.17953163385391235,0.9717734456062317,0.030122069641947746,0.8925450444221497,0.1492222547531128
yoshi570,"No way, this reads more like a LA Noire kinda story.",0.0006069185328669846,9.319173877031517e-09,0.00020010540902148932,4.69592265517349e-07,8.996035467134789e-05,1.0153096809517592e-05
eddydoubled,Are we allowed to post fan fiction?,0.0005188207142055035,5.494292132368628e-09,0.00022010569227859378,2.3647808689020167e-07,7.435047155013308e-05,5.417665306595154e-06
El_Spacho,"If yours contains Giroud, Pulisic and a bottle of lube, then yes!",0.00015426949539687485,2.735567050660137e-10,6.185754318721592e-05,2.496186368716735e-08,1.7781620044843294e-05,1.0576980002952041e-06
portugueseamerican,"""My friend, is ok, no?""",0.0011924442369490862,1.24252981237305e-08,0.0002893577911891043,7.441793741236324e-07,0.000117211471660994,1.60148847498931e-05
fuckimbackonreddit9,This guy r/gunners,0.04513784125447273,1.6366931959055364e-05,0.0076057869009673595,0.00031686891452409327,0.004905400797724724,0.0016697858227416873
eddydoubled,"Pulisic? I'm down for the rest, but what has Pulisic to do in this equation?",0.00022935052402317524,1.5074689274641173e-09,0.0001185856235679239,7.438418236915822e-08,3.175245728925802e-05,2.3517193312727613e-06
El_Spacho,Something for our american friends!,0.00866792630404234,1.1446632015577052e-06,0.0018077484564855695,2.899413084378466e-05,0.0012626672396436334,0.00023273320402950048
