id,comment,toxic,severe_toxic,obscene,threat,insult,identity_hate
grizzleh,"Ronaldo still has a few left in the tank, but this would indeed be a horrible deal for Monaco. Especially because they can't really capitalize on Ronaldo's popularity like bigger clubs can.",0.014819015748798847,5.83715063839918e-07,0.002022890606895089,2.2675660147797316e-05,0.001693163183517754,0.00020461672102101147
WhitneysMiltankOP,Well he is finished. He has finished his way to be the perfect football player.,0.00040524761425331235,1.4736049047670008e-09,0.00010198067320743576,9.534027611834972e-08,4.912750227958895e-05,2.9631016786879627e-06
Cheewy,it's all just purly business,0.033624738454818726,8.474826245219447e-06,0.003988577052950859,0.00019583389803301543,0.003986535128206015,0.0011198181891813874
jengo54,Most woke shitpost I've ever seen,0.002795459935441613,3.373979140519623e-08,0.0003918884031008929,1.9122032881568884e-06,0.00024483268498443067,3.0948358471505344e-05
nmrt,#STAYWOKE,0.016463201493024826,1.9275947124697268e-05,0.004478128626942635,0.00026728041120804846,0.003357982262969017,0.001453277189284563
Stratifyed,#MONACO BE CREEPIN',0.019083702936768532,9.017761840368621e-06,0.00421098293736577,0.00017384490638505667,0.0031412290409207344,0.001028974773362279
lxgvn,### THEY GON FIND YA ###,0.1257353574037552,0.00010346377530368045,0.01704312115907669,0.0017228573560714722,0.02034652978181839,0.0054107350297272205
_choose_,most shit wokepost,0.974030077457428,0.027194853872060776,0.9266958236694336,0.010678563266992569,0.35100510716438293,0.05211712792515755
vdude007,The school holidays need to be over already,0.0038939109072089195,2.598875994408445e-07,0.001090291771106422,7.078764156176476e-06,0.000530331046320498,8.03113216534257e-05
poppajay,"Every fucking summer, Reddit takes a complete shift the insane, like every Mcdonalds at 3:30pm",0.9924823641777039,0.18473871052265167,0.9639140963554382,0.03545844182372093,0.7699013352394104,0.15637104213237762
Danoco99,You would have called me insane if I told you Neymar was gonna move to PSG at the end of last season.,0.37500855326652527,2.3009142751106992e-05,0.016510166227817535,0.0007165546412579715,0.027127759531140327,0.0035873213782906532
ProstZumLeben,that's probably where the insane posters are using the wifi from,0.05161074921488762,1.3691371805180097e-06,0.004183151293545961,4.887469913228415e-05,0.0035011949948966503,0.000376646697986871
tnarref,What's goin on at 3:30,0.0004976506461389363,1.2171197383281651e-08,0.00020070771279279143,5.679129344571265e-07,7.544421532656997e-05,1.2219868949614465e-05
poppajay,School day ends at 3:15. You will find hoards of kids hanging out after school. Least in all the ones near me,0.04689681902527809,3.19418700200913e-06,0.005558558274060488,8.48730924190022e-05,0.005610289517790079,0.0005015549249947071
tnarref,ah got it,0.020159505307674408,5.897643859498203e-06,0.0038288282230496407,0.00012903085735160857,0.002564363880082965,0.0008387739071622491
SouthgateTaylor,"well if youre right youre going to be a legend, but in the mean time hahahahahahahahahahahahaha",0.8951963186264038,0.0015567392110824585,0.6507660746574402,0.00276991818100214,0.18474511802196503,0.01867290958762169
ayala559,I picked a bad week to quit meth,0.13411268591880798,6.383888103300706e-05,0.012872149236500263,0.0012156565207988024,0.014389894902706146,0.004816422238945961
_rickjames,Meth's a hell of a drug,0.950088381767273,0.016633624210953712,0.39831772446632385,0.03790770843625069,0.662165641784668,0.12769728899002075
illegal1amigo,Saka primo,0.016463201493024826,1.9275947124697268e-05,0.004478128626942635,0.00026728041120804846,0.003357982262969017,0.001453277189284563
HeyItsN0b0dy,Tenia que irle a Pumas.,0.01865985058248043,1.1873216863023117e-06,0.002659823279827833,4.401923069963232e-05,0.002549519995227456,0.0003140787302982062
tallmotherfucker,this is going to be one of those posts that people look back on once the deal is done,0.0008876353385858238,1.3937135889818819e-08,0.0002930276095867157,6.437886668209103e-07,0.00012137719022575766,1.1910985449503642e-05
BoredGamerr,"And shout proudly, ""I was there.""",0.0011358718620613217,3.7697219568144646e-08,0.00041120880632661283,1.4051814787308103e-06,0.00018590569379739463,2.32241927733412e-05
fiif,Everyone laughing in the comment section of the Neymar 95% done thread. Normally I'd think this is just taking the piss but..,0.005078971851617098,6.631879490015535e-10,0.0002925806911662221,1.1477529682224485e-07,0.00017099338583648205,3.2785592338768765e-06
GioMeow,"And people will say ""I was there, between the first 1652 comments.""",0.008115909993648529,7.981618068697571e-07,0.0015442711301147938,2.047612906608265e-05,0.0011472075711935759,0.00019040297775063664
Chesney1995,Ronaldo not picked tonight. Clearly because the Monaco deal is as good as done.,0.0012606742093339562,9.415981594429468e-08,0.0005291038542054594,2.735554744504043e-06,0.0002524855372030288,3.6517591070150957e-05
soj_football,"My Goodness:""Jorge Mendes and Florentino Perez have verbal agreement that Cristiano can leave for around five times less)...now that Neymar was sold for â‚¬222M, it means that Ronaldo will cost more, simply because he wants to be the most expensive player in the history, it's important for image and hype, so he's price is around â‚¬230M, in other words Monaco will have to add â‚¬50M to Mbappe (â‚¬180M) to buy Ronaldo, they will do it, it's a done deal...Ronaldo's current salary is â‚¬21M after taxes, Messi has â‚¬25M after taxes and Neymar has â‚¬30M after taxes, so Cristiano will get something between â‚¬30M and â‚¬35M per year (no taxes in Monaco) and he'll sign 4-year or 5-year contract, so he'll be 36 or 37 when his contract ends.""",0.19098502397537231,3.6521909350994974e-05,0.021087415516376495,0.0005724306683987379,0.025974970310926437,0.0026271422393620014
your_pet_is_average,"> they will do it, it's a done dealWhat more is there to say.",0.0026427789125591516,2.345295229133626e-07,0.0008986895554699004,6.672800282103708e-06,0.00041042378870770335,7.61368137318641e-05
Fgge,The dream will become the reality.,0.00022534026356879622,2.028753387506299e-09,9.316405339632183e-05,9.676614354248159e-08,3.244874460506253e-05,3.073481366300257e-06
KRIEGLERR,â‚¬222M+1,0.005710023455321789,7.427457830999629e-07,0.001310760504566133,1.6097077605081722e-05,0.0008258038433268666,0.00014784438826609403
Primigeniuss,Ok,0.0003435797698330134,2.2033084245975942e-09,9.876846888801083e-05,1.5217050020055467e-07,3.974309584009461e-05,4.3846403059433214e-06
sabret00the,Everyone should upvote this so it gets on the front page,0.18766257166862488,7.955798355396837e-05,0.018489651381969452,0.0013918477343395352,0.021146897226572037,0.005352980922907591
cptsteve21,I'm upvoting everything in this thread. Brilliant.,0.0029608572367578745,4.949557208533406e-08,0.0006253678584471345,1.8843643374566454e-06,0.0002993530943058431,2.6897330826614052e-05
NAN,[deleted],0.003765546018257737,5.964062665952952e-07,0.0009973300620913506,1.694911225058604e-05,0.0005632698885165155,0.00017409920110367239
sabret00the,Tune in next week and /u/MartelCB will tell you how.,0.022084342315793037,1.8500828673495562e-06,0.0029514592606574297,5.889730164199136e-05,0.002082346472889185,0.0004536261549219489
enwhykiid,must suck to type all that out then get laughed at,0.9392269849777222,0.007234557997435331,0.6036603450775146,0.013432114385068417,0.32982897758483887,0.06484169512987137
gjftw,It's all some people want,0.04879764840006828,2.6195786631433293e-05,0.0060153198428452015,0.0005961376009508967,0.006477725692093372,0.0031401151791214943
NewAccountPlsRespond,he'll be the one getting the last laugh,0.0035546382423490286,8.788201455445233e-08,0.0005247951485216618,4.531781087280251e-06,0.0003174252633471042,6.43635357846506e-05
Jrelis,"If you look the source, he just copied and pasted it from the Monaco fan forum post.",0.0022025848738849163,5.896710320030252e-08,0.0005236034630797803,2.425454795229598e-06,0.00029311393154785037,3.375653250259347e-05
Stakoman,I wonder if this really happens... Jesus!,0.000418394454754889,6.787648776374056e-10,7.228487083921209e-05,7.421157732778738e-08,3.453217868809588e-05,2.7047935873270035e-06
Molineux28,He's Portuguese and a client of Jorge Mendes. The only logical destination is Molineux.,0.0008942738641053438,1.5862671176591903e-08,0.0003079218149650842,8.120442203107814e-07,0.0001355795975541696,1.4674857993668411e-05
little_legz,Nephew,0.0017948868917301297,1.572013559325569e-07,0.0005961403949186206,5.005475031794049e-06,0.0003068220103159547,6.610003038076684e-05
ImpatientPedant,https://i.imgur.com/aVISrz4,0.4223254323005676,0.0002658690791577101,0.05025400593876839,0.003491736715659499,0.04156607761979103,0.01130280364304781
FernandoTorresIMO,son of brother,0.2181687206029892,0.00012898693967144936,0.026965487748384476,0.002002894878387451,0.02135417051613331,0.00704553397372365
PM_ME_PARTY_HATS,"Written like a true psycho, I like how it gradually turned into the rantings of a madman",0.48489516973495483,0.00031629393924959004,0.030451780185103416,0.005377982743084431,0.06516683846712112,0.015435216948390007
RZAAMRIINF,MODS PLEASE KEEP THIS!,0.00556581374257803,1.3684307020866981e-07,0.0009676094050519168,4.708272626885446e-06,0.0005091431667096913,5.468217204906978e-05
Aurify,STICKY PLEASE,0.0010744740720838308,1.8047661143327787e-08,0.00029358998290263116,9.491882906331739e-07,0.0001246305473614484,1.8512389942770824e-05
FiskoSC,"Everyone will laugh at this but when you know the story of Rybolovlev and Monaco this is far from being stupid. This guy goes way too far into details to made this up, he knows what hes talking about. Not saying that will happen and I really dont want to see this happening ...",0.10636047273874283,6.097774871705042e-07,0.006357561331242323,3.799102705670521e-05,0.006248035468161106,0.0002961205318570137
Karigalan,You don't want to see this happening ? Why ?,0.011951403692364693,1.655919618315238e-06,0.002539680339396,4.590745083987713e-05,0.0016294802771881223,0.0004085405671503395
xyop,"Not that guy and I'm 99% sure this is nonsense but I'd fucking love to see it actually happen. Not because I think it would be good for football or anything I'd just love to see everyone's heads exploding over the fact the ~~4th~~ 5th best league in the world would be saying a massive fuck you to the established order and spunking cash around on top talents for fun. The transformation of interest into the French league once they had 2 of the world's most marketable players would be pretty interesting to see too.Still, 98% sure it won't happen...ok...97...",0.4253566861152649,6.476308954006527e-06,0.38224896788597107,2.7588550437940285e-05,0.022020693868398666,0.00024052910157479346
autslash,4th best league? :(,0.000801295624114573,7.71613262173787e-09,0.0002689842658583075,3.670697026336711e-07,0.00010198281961493194,8.477073606627528e-06
xyop,"5th, my bad.",0.0006575966253876686,1.6088174126238641e-09,0.0001271653309231624,1.8691406467041816e-07,6.290353485383093e-05,5.243875875748927e-06
JustMetod,"The bundesliga is definetly behind Ligue 1 right know. Its not competetive, they are failing in the CL, Bayern is the only consistent team, newly promoted teams are finishing second and also Bayern is the only team that can attract big names.",1.853638059401419e-05,5.047089048776376e-13,9.372077329317108e-06,9.827166858045189e-11,1.6749340829846915e-06,1.8617251740238316e-08
Osamabinbush,Didn't a newly promoted team just win the PL 2 seasons ago?,7.3658948167576455e-06,6.437337642106744e-13,4.27952272730181e-06,9.446819715375199e-11,8.923196332943917e-07,1.4178962004507412e-08
JustMetod,Thats true but the diference between the two is that the PL has insane money and still attracks lots of big names. You also cant predict who will win the premier league.,0.0004421172779984772,2.311603131133211e-09,0.00014461477985605597,1.3224459394223231e-07,5.501902342075482e-05,3.840647423203336e-06
Foolonthemountain,"5th best in Europe, imo",2.0027603113703663e-06,1.4224297466888108e-13,2.6416712444188306e-06,2.4750240051885086e-11,3.8610846786468755e-07,5.509602996056628e-09
Leeloo_Lizzywizzy,1. Spain2. England3. Italy4. Germany5. France?,6.971763923502294e-06,3.1076146430469853e-12,6.047436272638151e-06,3.375881241218792e-10,1.251766207133187e-06,3.4023489803303164e-08
Foolonthemountain,"I would potentially swap Germany and Italy, but I don't have too much trouble with your order... the Italian league is on the up again and was a great watch last year.Edit: is that the official??",0.24572740495204926,2.310064883204177e-05,0.019766977056860924,0.0004960387595929205,0.020910074934363365,0.002600794192403555
Foolonthemountain,"The official UEFA rankings are:1.Spain 2.Germany 3.England 4.Italy 5.France For me the Italian and English leagues are more balanced and the rankings lean to favour the obvious giant clubs that are dominating Europe, rather than the 'strength' of the league. But it is what it is.",3.6148103390587494e-05,4.208230985902617e-11,4.981410165783018e-05,2.6988138390748873e-09,8.140057616401464e-06,1.6370194089176948e-07
xyop,"Shit I just messed up the rankings, it is 5th. Thought the guy above was getting into the France vs Portugal argument before I read your comment.",0.20265550911426544,7.386855571667184e-08,0.04079754650592804,2.0588795450748876e-06,0.0032797702588140965,3.718223888427019e-05
loosednes,Fuck. The percentages have begun,0.9926493763923645,0.16301491856575012,0.9854920506477356,0.01795751228928566,0.6635656952857971,0.08853444457054138
NAN,[deleted],0.003765546018257737,5.964062665952952e-07,0.0009973300620913506,1.694911225058604e-05,0.0005632698885165155,0.00017409920110367239
xyop,"Not one of them would actually go through with it, but sure, that too.",0.0041215019300580025,1.4157294003780407e-07,0.0007706852629780769,5.125778898218414e-06,0.00039245272637344897,6.153195863589644e-05
fernplant4,Why not? Even i want to see this happen,0.004768184386193752,1.9970411813119426e-07,0.0009276258060708642,7.371833362412872e-06,0.0005241979379206896,8.596318366471678e-05
FiskoSC,[Made a more argumented post here](https://www.reddit.com/r/soccer/comments/6setxs/ronaldo_to_as_monaco_rumor/dlcfz3y/),0.0028169387951493263,7.840128546376945e-08,0.0008216982241719961,2.9687530513911042e-06,0.00041231143404729664,3.729374293470755e-05
ffca,Drugs were never this good back in my day,0.17848889529705048,3.8696663978043944e-05,0.01422851625829935,0.000762103998567909,0.013846526853740215,0.0036219125613570213
hotlunchbox,"all i see is ""no taxes in Monaco"" & ""plus he wants to live in Monaco full time and he has some business ventures that are perfect fit for the principality...""i'm sold.",0.05890071764588356,7.002195161476266e-06,0.00569124985486269,0.00021623002248816192,0.006929969415068626,0.0013083677040413022
fuzzyfeels,This has potential to become a copypasta,0.005188457667827606,9.642474196880357e-08,0.00099303072784096,3.845023002213566e-06,0.000610140326898545,4.5688160753343254e-05
interneti,shit lmao u rite as hell,0.996756374835968,0.16218708455562592,0.971659779548645,0.02446567453444004,0.8827584981918335,0.12122787535190582
Schnye,One long ass copy pasta,0.8505918979644775,0.0002627591311465949,0.6333630084991455,0.0007483334629796445,0.06758955866098404,0.004378437530249357
bigderivative,Who needs Game of Thrones when there is this much drama in the transfer season? This could be a 10 episode HBO special.,1.620002876734361e-05,6.321651101898196e-12,1.2980288374819793e-05,6.707994160137787e-10,2.631984671097598e-06,5.387079937690942e-08
Springsteemo,"You only get GOT once a week, this stuff you can enjoy daily.",0.022649627178907394,3.1711435894976603e-06,0.002709990832954645,9.977301670005545e-05,0.002718862611800432,0.0007187629817053676
chutzpahisaword,"Gonna put $10 on it. If it happens I get, $400. If it is a fiction, it is $10.",0.07650385797023773,1.6435831639682874e-05,0.009031095542013645,0.00033894681837409735,0.009172751568257809,0.0015034504467621446
th3_hampst3r,where did you find 40-1 mate?,0.0003048637299798429,2.5284194737906773e-09,0.0001393346901750192,1.1607585292949807e-07,5.5321335821645334e-05,2.9817599624948343e-06
chutzpahisaword,Fuck..it was 40-1 an hour ago. Now it is 22-1. Thanks to this post. Lol,0.8882218599319458,0.0003596119931899011,0.7485519051551819,0.000668724300339818,0.10208779573440552,0.0048790560103952885
th3_hampst3r,Found 33-1 @betfred,0.036916591227054596,6.181194748933194e-06,0.005988729186356068,0.00010792331158882007,0.0036468079779297113,0.0006895050755701959
leonmate,Can't find better than 10-1 now.. seems like most bookies have stopped taking bets,0.00014426880807150155,2.0128876343505908e-10,5.6101871450664476e-05,1.597937071551314e-08,1.5419009287143126e-05,6.676414159301203e-07
th3_hampst3r,yeah skybet down to 9-1. managed to get 6 quid on @33 at befred but they wouldnt let me place 10 - and then wouldn't give me the 30 quid in freebets for joining when I placed it! salty.,0.0015870740171521902,3.307022922172109e-08,0.0007067061960697174,1.3484262808560743e-06,0.00025566908880136907,2.1330035451683216e-05
metamorphicism,"It's actually happening, boys",0.0003339403192512691,5.972604188997366e-09,0.00017475232016295195,2.2679671474179486e-07,5.577929186983965e-05,5.450910975923762e-06
SirFluck,Did you just make this up? Your source is the post itself on some french forum.I hope some papers pick up on this.,0.00017864139226730913,2.337557092335629e-10,0.00010409276001155376,2.3057697973172253e-08,2.8106844183639623e-05,1.0121175364474766e-06
subcrazy12,It will be in the Sun tomorrow,0.002799307694658637,1.1203145078297894e-07,0.0006353641510941088,4.535573225439293e-06,0.0003615216410253197,6.257370114326477e-05
necrosteve028,You edit that letter out right now!!!,0.017302649095654488,2.219480620624381e-06,0.0026563548017293215,5.441733810584992e-05,0.001957395114004612,0.0003954912826884538
MOmoalas92,Remindme! 25 days,0.0007181834080256522,1.982098574160318e-08,0.00026282452745363116,8.998106864055444e-07,0.0001061034927261062,1.810984394978732e-05
Freefailing,"You won't need a reminder... If this happens, I'm sure you'll hear about this thread.",0.0006028480711393058,1.007946615061428e-08,0.0002784960379358381,4.4280602651269874e-07,0.00010157944780075923,9.025169674714562e-06
DarthBane6996,In before the Sun uses this post as a source for their next article.,3.6645724321715534e-05,5.1040949244907097e-11,2.3086553483153693e-05,3.325979713864058e-09,5.0826270125980955e-06,2.0136967293638008e-07
willfred29,OPs going all in on this one. If any of this comes true he will be a r/soccer legend for all eternity. Otherwise he's a nut who can't spell or punctuate.,0.010832205414772034,8.106095350512987e-09,0.0008335189195349813,7.650750717402843e-07,0.0007528637652285397,1.2809468898922205e-05
Dannybaker,It literally links to the forum the post is from. The reddit user didnt make it,0.0025498447939753532,6.304986044369798e-08,0.0006446221377700567,2.2190761228557676e-06,0.0002581658773124218,3.3479191188234836e-05
MobiWanKenobi,#Se Queda,3.931903120246716e-05,5.597172378357662e-11,2.296825550729409e-05,5.844149608691396e-09,6.407619366655126e-06,3.3646807651166455e-07
Goan_Andres,Holy fuck. What did I just read? Suddenly woke af. Will be mad if this happens.,0.8755572438240051,0.0006677336641587317,0.741098940372467,0.001108248601667583,0.1448112428188324,0.007723545655608177
HowardPhillips9,In stitches. I want what this dude is taking.,0.03250301629304886,3.831706180790206e-06,0.0036432044580578804,9.929039515554905e-05,0.003002503886818886,0.0006393297226168215
MattJamesThirtySix,school holidays,0.0039284806698560715,2.2371922625552543e-07,0.0009369824547320604,7.252265277202241e-06,0.0005230821552686393,8.071778574958444e-05
RobbieWard123,"Funnily enough, since this post his odds to go to Monaco have gone from 40/1 to 33/1.",0.09597811102867126,1.601749681867659e-05,0.008264790289103985,0.00032442749943584204,0.008732897229492664,0.0016482240753248334
sumercedrafa,It's 9/1 on skybet now.,0.010478658601641655,9.456230145588052e-07,0.0018409902695566416,2.599855542939622e-05,0.0011717231245711446,0.0002124203892890364
CollosalFlame,how long did this take you?,0.13903158903121948,2.1381360056693666e-05,0.017066573724150658,0.00034538109321147203,0.01050861831754446,0.0015891320072114468
IkiOLoj,It's not OC it's a copypasta from a french forum.,0.0012993686832487583,2.7666390067793145e-08,0.0004520844086073339,1.0656134463715716e-06,0.00023061421234160662,1.5575220459140837e-05
ammjr,Imagine reading this,5.5642914958298206e-05,3.7697740762343557e-11,2.4573948394390754e-05,4.7012744808228035e-09,6.706140084133949e-06,3.0320055088850495e-07
jam_pudding,Imagine commenting on this,0.0003912131651304662,9.202748008085848e-10,8.241381146945059e-05,1.1090462948004642e-07,3.93030968552921e-05,3.6151120639260625e-06
necrosteve028,"I love drama and I'm torn between believing if it's real or fake. I just saw Neymar go to PSG, I'm vulnerable.",0.00017374349408783019,1.634968549435456e-10,8.815232285996899e-05,1.1929548016098579e-08,2.1093383111292496e-05,5.694890319318802e-07
NAN,"Honestly this might just be the shitpost we needed as a collective sub after the whole Neymar and now Coutinho clusterfucks,",0.009340346790850163,3.4491131373215467e-07,0.0012754659401252866,1.6013998902053572e-05,0.0009365009609609842,0.00016516054165549576
jam_pudding,I hate when Career Mode gets broken by these nonsense transfers three seasons into my save.,0.1188468486070633,6.994206955823756e-07,0.003250004956498742,6.466906052082777e-05,0.00543644092977047,0.0006258630310185254
TheAwakened,"If Ronaldo moves from Real Madrid to any other team in this transfer windows, I'd get a tattoo of Perez on my balls - health risks or not.",0.00026454436010681093,4.9976075361390926e-11,4.0139413613360375e-05,8.790260075386414e-09,1.769045411492698e-05,4.1308121012662014e-07
TheDirtyHipHop,"Saved. Please Monaco, don't let me down.",0.001243536826223135,1.6313661532763035e-08,0.00034032485564239323,8.225359238167584e-07,0.00012755030184052885,1.6478112229378894e-05
Vash2P,"Posting just to see if you gonna do it or not ""If ronaldo goes to Monaco""",0.18448178470134735,0.00011278963938821107,0.019167551770806313,0.001971689984202385,0.02028893120586872,0.0072118667885661125
freeflowfive,r/soccercourt legalized,0.033884644508361816,8.997643817565404e-06,0.005862041842192411,0.0001864684745669365,0.0036755006294697523,0.0010495290625840425
ChaBeezy,I believe!https://m.imgur.com/a/skxT2,0.44310617446899414,0.00018241842917632312,0.037324611097574234,0.0027540172450244427,0.04541267827153206,0.008611654862761497
varzaman,If I wasn't in the U.S I'd bet on this.,0.04348079487681389,3.251540874771308e-06,0.004486167337745428,9.673737804405391e-05,0.00309371598996222,0.0006308380397967994
11_RMA,I'm scared.,0.08252278715372086,4.28853581979638e-06,0.006924868561327457,0.00011096539674326777,0.005030809435993433,0.0007740691653452814
UsernameNumberZero,"Ronaldo to Monaco, Messi to PSG, Neymar tired of being in the shadow of Messi again, Neymar to Nice.",0.008703642524778843,8.056010756263277e-07,0.001518281758762896,2.7503541787154973e-05,0.0009535748977214098,0.0002471393090672791
DnDoofus,"Sneijder to Man Utd.. Wins the Ballon d'Or becausr Ronaldo, Messi and Neymar play in France.",4.956324846716598e-05,7.188460937612717e-11,2.6464003894943744e-05,6.40131680995637e-09,8.340445674548391e-06,3.3016320344358974e-07
SOB200,"LOL, Messi trolling Neymar, following him club to club for the rest of his life.Neymar leaves the bathroom, Messi is waiting!",0.033669497817754745,4.172955414105672e-06,0.0029844671953469515,0.00015313178300857544,0.0029282488394528627,0.0011314454022794962
PM_ME_YOUR_IBNR,Looks like I picked the wrong week to quit amphetamines.,0.040399689227342606,3.2469456527906004e-06,0.0034842072054743767,0.00010616319923428819,0.003016975475475192,0.0007395390421152115
calbertuk,/r/conspiracy is leaking,0.0017088985769078135,5.5049941494189625e-08,0.0005945346201770008,2.3446182240149938e-06,0.0002457944501657039,3.2292788091581315e-05
Playboi_Icardi,Not enough anti semitism,0.0020888119470328093,8.261611128546065e-08,0.0005036655347794294,3.1172792205325095e-06,0.0002794919128064066,4.4590193283511326e-05
Volitient,lol wtf,0.8177630305290222,0.00037465771310962737,0.12463056296110153,0.00524976197630167,0.1332220584154129,0.017904335632920265
z_102,I've never wanted anything more than for this to be true. NEVER.,0.0035748803056776524,1.4851708840524225e-07,0.0006978139281272888,6.602630946872523e-06,0.0003949436650145799,8.36438630358316e-05
NoonecanknowMiner,"Mate, no.",0.0009874273091554642,1.5040262368870572e-08,0.0002983834419865161,7.09271944288048e-07,0.00014034983178135008,1.4898077097313944e-05
omegaxLoL,This is my favorite post of all time,0.004027836490422487,1.028132885494415e-07,0.0007522226078435779,6.034536909282906e-06,0.0004945372347719967,8.219123265007511e-05
mufcAleksi,hahahah what is this guy smoking,0.0478581078350544,9.297255019191653e-06,0.0036300611682236195,0.00031606454285793006,0.004740774165838957,0.001707335701212287
Hrvat1818,"Some good weed, hopefully he's a dealer",0.141276016831398,5.501729901880026e-05,0.00926818884909153,0.0013831985415890813,0.017326705157756805,0.006510595791041851
moonboots_runner,But is his decision irreversible?,4.400407851790078e-05,7.304253729634169e-11,3.376393942744471e-05,6.3677312311938294e-09,8.072707714745775e-06,3.1057845717441523e-07
NAN,"Posting in dis thread as proof that I was part of the biggest shitpost of our times. Meme him to Monaco, boys!",0.001567071652971208,3.50962103823349e-08,0.0005383854731917381,1.5488128610741114e-06,0.00022162547975312918,2.21652262553107e-05
