id,comment,toxic,severe_toxic,obscene,threat,insult,identity_hate
CaptainSkull22,what the fuck,0.9889134764671326,0.07080178707838058,0.9830101132392883,0.009480024687945843,0.5043483972549438,0.04736746475100517
cvbk12,What does Ronaldo do when a player goes for more money than his transfer after he retires?,0.12771648168563843,1.5699966752436012e-05,0.0073311300948262215,0.0004893544828519225,0.011284141801297665,0.002476372057572007
thefakeiitian,"True or not, this post is going to be historic",0.00040251461905427277,7.492523934615747e-09,0.00019673224596772343,2.7473041086523153e-07,7.071407890180126e-05,6.152442438178696e-06
NAN,Spicy,0.016463201493024826,1.9275947124697268e-05,0.004478128626942635,0.00026728041120804846,0.003357982262969017,0.001453277189284563
veteran_t,Show me on the screencap,0.02337980642914772,5.809272352053085e-06,0.0032253297977149487,0.0001587056613061577,0.0025666493456810713,0.001063282834365964
AssFuckMyGapingAnus,This isn't serious right,0.00480547733604908,1.945182361851039e-07,0.0009224301902577281,6.4256223595293704e-06,0.0005517555982805789,7.638239185325801e-05
MapleHamwich,"Despite the ridiculous nature of this post, the most astonishing thing to me is the absurdly long run on sentence that is the last paragraph.",0.005383837502449751,1.679885341943077e-09,0.0002449954336043447,2.97675740057457e-07,0.00026413306477479637,1.0083610504807439e-05
vegan_swag,TL;DR plz,0.0006025390466675162,2.1850032894121796e-09,0.000190303340787068,1.227459591746083e-07,5.018429146730341e-05,3.5870648389391135e-06
xthecreator,I can't believe you've done this,0.005865947343409061,4.533111734872364e-07,0.0010976074263453484,1.419259569956921e-05,0.0007414005813188851,0.00014316878514364362
Lovetan9,"fuck it, if Ronaldo went to Monaco I wouldn't even be mad. you gotta appreciate a twist NOBODY could've foreseen(except OP because he is a genius beyond our comprehension.",0.7853952050209045,0.0002135545655619353,0.6268571019172668,0.0006052961107343435,0.10108175128698349,0.003966962452977896
DopamineJunkies,not reading this however upvoted for effort.,0.003775504883378744,1.8144967839361925e-07,0.0009537807782180607,6.011188361298991e-06,0.0004833735874854028,7.796235149726272e-05
Cvein,:thinking:,0.00698147201910615,8.803079367680766e-07,0.001435505342669785,2.8042160920449533e-05,0.0009267842979170382,0.00025791223742999136
tr2727,Wikipedia should use this example to define Peak delusion,1.26297663882724e-06,5.997794898541728e-14,1.4842096334177768e-06,1.1400381506876389e-11,2.424908416287508e-07,2.5844768547500507e-09
CookieForVanessa,I don't think anybody wants Fabinho lol,0.01501548197120428,3.940159785997821e-06,0.0032428870908915997,8.92434036359191e-05,0.0021799930837005377,0.0006247212295420468
SpongeBurner,Shite,0.0011298367753624916,3.1931339350421695e-08,0.0004371353716123849,1.178920342681522e-06,0.00014991729403845966,2.1836227460880764e-05
kokin33,don't know if serious,0.002139342948794365,9.520525168227323e-08,0.0004803556075785309,3.920735707652057e-06,0.00027318019419908524,5.8150799304712564e-05
guynm,This is legendary,0.03554951399564743,8.09861649031518e-06,0.005339063238352537,0.00015633496514055878,0.0035619977861642838,0.0009407596080563962
Darknite_BR,"Ronaldo to Monaco, irreversible.",0.021243009716272354,1.1080087460868526e-05,0.00410330668091774,0.00021650607232004404,0.003577128052711487,0.0011857835343107581
fooslgold,fantasy,0.001495033735409379,1.0100563230253101e-07,0.0005390650476329029,3.1279162158170948e-06,0.0002894400095101446,4.216092202113941e-05
fleamarketguy,Bro I think I saw you in Amsterdam today,0.14100849628448486,9.308208973379806e-05,0.018509548157453537,0.0016032906714826822,0.019722672179341316,0.005354824475944042
Darknite_BR,Is there any free space on that guy's ballsack?,0.02592392824590206,3.791980589085142e-06,0.002912877593189478,0.00011581482249312103,0.003281650599092245,0.0008417198550887406
LogicalTampon,I guess the irreversible decision to leave is still there,4.311355223762803e-05,5.140782244339448e-11,3.066160934395157e-05,4.8871351410184616e-09,6.840401510999072e-06,2.9135969725757604e-07
RicardoLovesYou,"the state of this fucking sub, man.",0.9738336801528931,0.028109660372138023,0.9630037546157837,0.00714939646422863,0.38233768939971924,0.03197886422276497
COMPLETEWASUK,Mate I hope you enjoy your time in the asylum.,0.06981988251209259,5.871022040082607e-06,0.004755330737680197,0.00023075367789715528,0.006291926372796297,0.0014486863510683179
Lintal,Theres a tax joke in here somewhere,0.0193929523229599,3.6858335761280614e-07,0.0019834190607070923,1.1784451999119483e-05,0.0014641309389844537,9.852455696091056e-05
moneypennycashdollar,Can i have some of whatever you're smoking lad,0.00431130500510335,3.6909125356032746e-07,0.000995400594547391,1.092959337256616e-05,0.0006853241357021034,0.00011718118912540376
ouguy2017,I just wanted to be able to say that I too was here to witness this shitpostRemindMe! 23 days,0.0008656942518427968,3.852617425081917e-08,0.0004335275152698159,1.4326789141705376e-06,0.00016627009608782828,2.388111170148477e-05
struckmatch,wut,0.6782949566841125,0.005595064256340265,0.11331595480442047,0.0535319559276104,0.2013825923204422,0.08851923793554306
lolwatbot,**RONALDO TO AS MONACO RUMOR**,0.00040941641782410443,5.612112108366318e-09,0.00018731100135482848,2.700883499073825e-07,7.088806887622923e-05,6.131753707450116e-06
rightwardsloping,Ronaldo: A broken man,0.0010205843718722463,8.806420481732857e-09,0.00022136424377094954,6.57857526675798e-07,0.00011917360097868368,1.3486729585565627e-05
bolitebriga,Mate mate mate mate mate.,2.009377794820466e-06,7.713805722647793e-13,3.033896064152941e-06,5.490557314358213e-11,5.780502192465065e-07,1.00080885800935e-08
Facel_Vega,Yeah...Nah.,0.040552083402872086,3.713210026035085e-05,0.007207327522337437,0.0006104829371906817,0.007119753398001194,0.0027348720468580723
Fourplealis,Spot for sale,0.0001798315643100068,1.4613008580965925e-09,0.00010610014578560367,8.320692046481781e-08,3.176748214173131e-05,2.3774036890245043e-06
RektSquared,Please be true. Just the bit that implies we're still in for Fabinho is enough,0.0005678875022567809,5.822198723137717e-09,0.00017309743270743638,3.3811789990068064e-07,6.706160638714209e-05,7.911829015938565e-06
KiraXY,This is fucking hilarious,0.9938149452209473,0.22766993939876556,0.985236644744873,0.02473474107682705,0.7369279861450195,0.10933764278888702
BodaciousSalacious,This will either get downvoted to hell or make the front page,0.7175176739692688,0.00012530990352388471,0.08313456922769547,0.0024337719660252333,0.0748581513762474,0.007982355542480946
ALLout_,"Just posting something, so that if this becomes true, by any small tiny little chance, I can say that I was one of the first people to know about it.",0.010590685531497002,4.667191788598757e-08,0.000971721950918436,4.2261413000233006e-06,0.0008493026834912598,6.747047154931352e-05
Mdiasrodrigu,lol,0.001193771604448557,9.715284932099166e-08,0.0004959931829944253,2.681777459656587e-06,0.00019510052516125143,4.016296225017868e-05
mattsatwork,When this transfer happens and this thread is linked to I want it to be known that I was here. I saw this with my own two eyes and it was glorious.,0.030250580981373787,9.726758207762032e-07,0.0027815704233944416,5.20040666742716e-05,0.002422442426905036,0.0005049295141361654
SemiCurrentGuy,S C A R Y,0.043686479330062866,1.979344233404845e-05,0.007931875996291637,0.00033828019513748586,0.0062451912090182304,0.0015769536839798093
Cykablet,So they are selling all their talented youth to get a 32-year old Ronaldo with the reasoning that they wan't to become a bigger club? Seems logical. Because Falcao turned out so well. Also I can't imagine Ronaldo spending this year in a non-competetive environment if he's really giving the world cup a shot.,0.010046074166893959,1.1148596712473591e-07,0.001013117260299623,7.555341653642245e-06,0.0011322118807584047,9.010270150611177e-05
orcsrox,why does all the meme stories always have to be about RM players,0.003019054187461734,1.0659066163043462e-07,0.0006761850090697408,5.112139660923276e-06,0.0003695459454320371,6.758567178621888e-05
ky2rie,Imagine if..,1.7020447558024898e-05,8.50182858141979e-12,1.1886861102539115e-05,1.1835351587663467e-09,2.6755392354971264e-06,1.0687567453260272e-07
shitshow_schizo,"If this happens I'll tattoo my ball sac with a ""CR7"" /s",0.24900588393211365,0.00015888629422988743,0.020781805738806725,0.002675114432349801,0.028580278158187866,0.008552118204534054
JimblesSpaghetti,what,0.014603697694838047,1.8324687971471576e-06,0.0021418749820441008,5.4380820074584335e-05,0.0015910190995782614,0.0004300599393900484
xiqat,I upvoted this shit to be part of history,0.854179859161377,0.003597803646698594,0.7507060766220093,0.00569784315302968,0.16767935454845428,0.01828283630311489
Hans-Blix,Wat,0.17249950766563416,0.00037519706529565156,0.027499904856085777,0.0037705402355641127,0.035861242562532425,0.009160923771560192
flancresty,If this happens I'm tattooing Monaco's crest on Neymar's nutsack.,0.015088429674506187,2.7638809569907608e-06,0.002593384589999914,7.18537557986565e-05,0.001904027652926743,0.0005300099146552384
wouterkw,"Zidane: ""one of BBC will leave to make room for Mbappe""...Zidane: ""ffs""",0.00018323234689887613,1.9810524748420377e-11,3.854201713693328e-05,3.910777923721298e-09,1.2991780749871396e-05,2.693639657991298e-07
310BrownGuy,Nice.,0.008502370677888393,3.742795115613262e-06,0.0024651167914271355,7.549560541519895e-05,0.0015276777558028698,0.000553897290956229
NAN,W O K E,0.4589712917804718,0.0011778997723013163,0.07236719876527786,0.01196514442563057,0.06835450977087021,0.030700044706463814
MBDTFisGOAT,Wow.,0.02276349440217018,6.1930013544042595e-06,0.0037705115973949432,0.00011612832895480096,0.002926183631643653,0.0006984130013734102
unorigionalscreename,We'll see this reported in the Sun soon enough.,0.006278196815401316,2.7080042741545185e-07,0.0009442767477594316,1.2367801900836639e-05,0.0006508493679575622,0.0001625142031116411
IAmCowGodMoo,"Still doesn't make sense.Monaco are selling all their best players so they can have 1 of the best players.But what does Ronaldo get out of it, it's a step down going from Real Madrid and playing alongside those type of players to Monaco.Sure it's nice to live there and I'm sure it fits Ronaldos lifestyle but....OP says they are going to sell Mbappe, Fabinho and Lamar for 1 Ronaldo.",0.02332490123808384,3.303392759335111e-07,0.0032756528817117214,1.4113164979789872e-05,0.002661737846210599,0.0001490301947342232
Cadllmn,Whoa...,0.0004905909881927073,3.2324669607675105e-09,0.00013934372691437602,1.8694490222515014e-07,6.0402744566090405e-05,4.651241397368722e-06
elbak91,Pepe Silvia,0.016463201493024826,1.9275947124697268e-05,0.004478128626942635,0.00026728041120804846,0.003357982262969017,0.001453277189284563
arkaitus,"Wow, just wow",0.018471574410796165,3.7491004150069784e-06,0.0030238088220357895,7.300789729924873e-05,0.0022114338353276253,0.00048582410090602934
S-Kell,Never. He'd destroy his brand.,0.006920573767274618,2.82698351838917e-07,0.001029139501042664,1.266615254280623e-05,0.0006624451489187777,0.00013479622430168092
MJDiAmore,"Are you kidding? Ronaldo in Monaco marketing luxury lifestyle products? Any ""regular people"" branding value he would lose would be multiplied in that space.",0.018033789470791817,9.482450025188882e-08,0.0012910664081573486,6.7936066443508025e-06,0.0013186290161684155,6.933374243089929e-05
S-Kell,No TV exposure in that sub-par league.,6.360969109664438e-06,1.9879820446072616e-12,6.457677500293357e-06,2.421360334459166e-10,1.2248254961377825e-06,2.7795445944889252e-08
MJDiAmore,"If Ronaldo's there, you can be sure SOMEONE will go pick it up or partner with whoever has bad rights.",0.12539854645729065,4.068313501193188e-05,0.011215904727578163,0.0009631610009819269,0.015551412478089333,0.004016135353595018
tabelz,This is incredible,0.04648968204855919,1.7640906662563793e-05,0.006417525466531515,0.000346745626302436,0.005572632886469364,0.0018658539047464728
Hirshologist,My eyes hurt and my brain is crying.,0.6328007578849792,0.0015077937860041857,0.0865650475025177,0.016208747401833534,0.12175268679857254,0.03974342718720436
Redbullsnation,No,0.026035089045763016,1.2264630640856922e-05,0.0049696858040988445,0.0002507634926587343,0.003564156126230955,0.0015016160905361176
orangeway69,make this a movie,0.006853231694549322,5.267390292829077e-07,0.001240807818248868,1.6590933228144422e-05,0.0007928318227641284,0.0001694516249699518
jmikesyo,Nah.,0.015651170164346695,6.960357495700009e-06,0.003457973711192608,0.00012764435086864978,0.002543873153626919,0.0008249182719737291
jam_pudding,This is being posted on Instagram and printed in tomorrow's newspapers as we speak.,0.000609031761996448,1.81559691725397e-08,0.0004756146518047899,6.91927141360793e-07,0.0001465719542466104,1.1799014828284271e-05
xHardStyle,I'll drink your tears when this happens,0.26377934217453003,5.967640845483402e-06,0.006180260330438614,0.0004374186391942203,0.012903274036943913,0.003203521715477109
Blanchimont,Saving this for later.,0.000749568163882941,3.798583669833988e-09,0.00017205646145157516,2.2644465502708044e-07,8.808484562905505e-05,4.992574304196751e-06
isnotlamybad,Holy shit the transfer banter keeps on giving,0.8479975461959839,0.0006391423521563411,0.6511437296867371,0.0015365375438705087,0.0980817973613739,0.008754855021834373
HakunaMatata69,Just marking myself on this piece of r/soccer history,0.03306769207119942,1.5714142591605196e-06,0.004151900298893452,4.60931369161699e-05,0.002366395201534033,0.0003526414220687002
NAN,fuck right off with that nonsense,0.9941895008087158,0.2238728255033493,0.98826664686203,0.021748455241322517,0.7100205421447754,0.10434825718402863
MentalJack,The fuck?,0.9914394617080688,0.16049887239933014,0.9882510304450989,0.016718361526727676,0.6094456315040588,0.07021237909793854
HakunaMatata69,Scenes when this ends up to be true,0.0009479211294092238,1.8569446424976377e-08,0.0002942249411717057,9.028225349538843e-07,0.00012201647768961266,1.851345041359309e-05
sticky_green,"I was smelling bullshit, but when he said they will add 50M so Ronaldo can be the most expensive player ever it sold me. 100% legit.",0.7479677796363831,3.9869846659712493e-05,0.30481743812561035,0.0003050096856895834,0.03511588275432587,0.0017646822379902005
Nickavick,"This is great if it comea true, good story tho",0.018528440967202187,1.869265020104649e-06,0.0028514533769339323,5.8003977756015956e-05,0.0022313932422548532,0.0004438960168045014
aIfr3d,Sounds legit. Anyone requested a bet???,0.0003017108829226345,4.8921006134960976e-11,4.7230456402758136e-05,7.032643356552626e-09,1.9268614778411575e-05,4.016922900973441e-07
not_old_redditor,"This doesn't make sense to me. Why do Monaco rush to sell Mbappe, and then blow the profits plus 50m more on an old striker? They could use those Mbappe funds to pick up many good players. I wouldn't even say a straight trade of Mbappe-Ronaldo is worth it. Monaco are not the type of team that needs Ronaldo at any cost.",0.00010541830852162093,5.4219760625695557e-11,3.525289139361121e-05,5.9592561996169024e-09,1.0733419003372546e-05,3.568918316432246e-07
watdude,a lot of words that mean literally nothingkudos,0.008182668127119541,1.5610525849751866e-07,0.0012792921625077724,7.412417744490085e-06,0.0008052510675042868,6.786933226976544e-05
renome,I want to believe.,0.021867850795388222,8.751961104280781e-06,0.004022560548037291,0.00018567506049294025,0.003120103385299444,0.0011190638178959489
Zdar78,How would Monaco pay his wages with FFP? And why would he come to Monaco if you guys sell all your players?,0.26506245136260986,6.500014569610357e-05,0.014253908768296242,0.0016397427534684539,0.024906838312745094,0.0067556328140199184
rmrql21,man's gassing,0.011288643814623356,1.6052356386353495e-06,0.0027452216017991304,3.8319267332553864e-05,0.0012972813565284014,0.0003093775303568691
boywithtwoarms,There's silly season and then there's this,0.09046191722154617,2.301592394360341e-05,0.007114554289728403,0.0006133520510047674,0.009392984211444855,0.0030150983948260546
reddit1902,"Basically this outlines the fact that it is financially feasable for Monaco to buy Ronaldo if they sell all their players. There is no truth to this story because it doesn't factor in Ronaldo's desire to play for Madrid and not Monaco. So even calling it a rumour is a big stretch. But if you are a believer with a wild imagination you can go ahead and bet money on the move and earn 34X your betting amount. https://www.oddschecker.com/football/football-specials/cristiano-ronaldo/club-after-summer-transfer-windowThats how you know the story is BS, the odds don't move.",0.0005147605552338064,1.8629462417152354e-09,0.00022796787379775196,9.959324387409652e-08,7.30893953004852e-05,2.548400516388938e-06
Chell_the_assassin,Can confirm: my dad is Monaco Forum,0.00013696083624381572,8.745319468594914e-10,8.657258877065033e-05,3.86211560510219e-08,2.1334979464882053e-05,1.3277968946567853e-06
RikaMX,But I thought he was coming to United :(lol,0.0021555647253990173,9.859473237838756e-08,0.0006179640768095851,3.2901450595090864e-06,0.0003132674319203943,4.326569978729822e-05
Enjyk,I'm waiting for confirmation but there's 98.5% chance that Marseille's American owner is planning on buying Messi. The Grand Ligue 1 conspiracy to crush la liga's supremacy will be complete then,0.0005877698422409594,2.914953611821147e-09,0.0001708314084680751,1.7815898445405765e-07,6.76652489346452e-05,4.580536824505543e-06
Tigrafr,Marseille was in talk for Ibrahimovic ^^,0.000573880213778466,2.0791240729067795e-08,0.0002882772823795676,7.076611723277892e-07,9.950688399840146e-05,1.508106379333185e-05
lemonfreedom,This is bullshit right?,0.9667783379554749,0.017514685168862343,0.9523353576660156,0.005210220813751221,0.307929664850235,0.026767132803797722
Rekt270,"If this is true, you deserve lots of karma for calling it early. Also if this is true: wow this would be the craziest window ever.",0.19392003118991852,4.026585156680085e-05,0.011806058697402477,0.0014877659268677235,0.021163228899240494,0.0062815179117023945
JestersHat,This is incredible,0.04648968204855919,1.7640906662563793e-05,0.006417525466531515,0.000346745626302436,0.005572632886469364,0.0018658539047464728
king_poise,You almosttttt had me until you said Tielemans has been promised the #10 jersey as if he actually even played that role/position,0.007806864101439714,3.9123099782045756e-07,0.0017952483613044024,1.0542956260906067e-05,0.0013922129292041063,0.00010424741776660085
sandith752,lol,0.001193771604448557,9.715284932099166e-08,0.0004959931829944253,2.681777459656587e-06,0.00019510052516125143,4.016296225017868e-05
Super_Magikarp,O Boavista foi campeÃ£o em 2001,0.0005220690509304404,1.4500007861073527e-09,0.00013404076162260026,1.4875665499403112e-07,5.654337292071432e-05,4.429590717336396e-06
nquinn444,I have witnessed history.,0.0011762975482270122,3.9018615893837705e-08,0.0003984872600995004,1.4033238358024391e-06,0.00018058967543765903,2.3231657905853353e-05
Liget17,Same,0.0009908986976370215,4.042840373585932e-08,0.00036584504414349794,1.4418556020245887e-06,0.0001594349305378273,2.4771003154455684e-05
Jordamuk,End this wild ride,9.166524978354573e-05,1.9597033718010692e-10,4.460618947632611e-05,1.4009897242317493e-08,1.2351712939562276e-05,6.457736390075297e-07
matthewjc,Nice fanfiction,0.008502370677888393,3.742795115613262e-06,0.0024651167914271355,7.549560541519895e-05,0.0015276777558028698,0.000553897290956229
PM_Me_Zico,What is Donaldo doing in the Monaco Zone?,0.010400989092886448,9.97703978100617e-07,0.0019561955705285072,2.8635369744733907e-05,0.0011740659829229116,0.0002515474916435778
freeflowfive,"Dude, what the fuck even",0.981181800365448,0.03443232178688049,0.9693812131881714,0.007316985633224249,0.39081382751464844,0.039163775742053986
FallenHero1,"If Ronaldo goes to Monaco, you can ban me from the subreddit for the season. No way this happens.",0.14305230975151062,5.4658557928632945e-05,0.01071926299482584,0.0012646194081753492,0.015136250294744968,0.006144708022475243
Mnyx,"Saw the post earlier, 500 upvotes. How come people are up voting this I think to myself ? I Come back later. 1000+ upvotes so I actually read the thing.I can belive that Jar Jar Binks is a sith lord much more than I can believe Ronaldo will come to PSG. Then again in a very Fox Mulder way... I WANT TO BELIEVE.",3.646577170002274e-05,9.209977919200085e-11,5.7199264119844884e-05,5.935310021243367e-09,1.1526013622642495e-05,3.0675644779876166e-07
fuckparalysis,Quality shitpost,5.3587722504744306e-05,1.3507626961395403e-10,2.993530870298855e-05,1.0345828194147089e-08,8.543201147404034e-06,5.285777433527983e-07
MockingDude,wokest shit ive ever seen,0.9765601754188538,0.09888546913862228,0.9017871618270874,0.04384129121899605,0.49986281991004944,0.15556365251541138
ChopSpot,Well.,0.006879944819957018,1.3801308114125277e-06,0.0016204541316255927,3.5272259992780164e-05,0.0010996608762070537,0.0002977449039462954
deusos,Nope,0.006451638415455818,1.4327730468721711e-06,0.0017441456438973546,2.9677667043870315e-05,0.0009969101520255208,0.0002533947117626667
popopsychy,No.,0.026035089045763016,1.2264630640856922e-05,0.0049696858040988445,0.0002507634926587343,0.003564156126230955,0.0015016160905361176
baaimasheep,I will eat my own shit if this happens,0.9509940147399902,0.054647475481033325,0.8534336686134338,0.033670034259557724,0.3677680492401123,0.11797649413347244
piedraa,So specifixc,0.03673013299703598,2.1377260054578073e-05,0.006725610233843327,0.00036216049920767546,0.005025906953960657,0.0018709672149270773
hackerino_cupertino,Rafa pepe Zuka Gepeto putao facadas Bafonso e lenda. Eu fiz parte disto,0.03333793208003044,1.3336930351215415e-05,0.005626296624541283,0.00024944887263700366,0.004299389664083719,0.0013597861398011446
Tigrafr,"I think everything is possible, since we had Neymar in Ligue 1, i know it's crazy, but his post is just incredible he knows stuff and very well, the ip adress (is weird for them), even the part of when the guy who posted that is so strange. People think he is one troll... But i want to believe that maybe it's can be true to that...",0.001064361771568656,4.820865040500166e-09,0.00033642255584709346,3.7269660424499307e-07,0.00013537987251766026,7.143446964619216e-06
spoofex,If this happens it will be insane. But it won't. And we have a new ITK knobhead.,0.07964546978473663,7.244149855978321e-06,0.006858004257082939,0.0001817888260120526,0.007497632876038551,0.0009535912540741265
badalhoc,I will be very scared of what football becomes if this happens.,0.0002753562876023352,2.7289953630216246e-10,7.698200352024287e-05,3.533627790375249e-08,2.554097409301903e-05,1.520480736871832e-06
melih4646,Do you work with hbo or something,0.014351780526340008,4.559225999400951e-06,0.003202548949047923,0.00010276534885633737,0.0022801330778747797,0.0006781530100852251
nmrt,Giant ass copypasta? Yeah,0.9869431257247925,0.16357849538326263,0.9520407319068909,0.0390278659760952,0.6811361312866211,0.1518540233373642
arctic_meerkat,Lay off the weed bro,0.7897816896438599,0.0032364202197641134,0.14174430072307587,0.02846345491707325,0.22674165666103363,0.06393168121576309
alexis7sanchez,"7 could also be for Alexis, with Lemar coming to us and Alexis going to them, don't really know but I've heard some rumors on it",0.0008747101528570056,1.6573977745792945e-08,0.0003357456880621612,7.732185167697025e-07,0.00013256288366392255,1.372733368043555e-05
yeerth,"IT'S TOO MUCH. SLOW DOWN, 2017!",0.024704420939087868,8.236614121415187e-06,0.003895146306604147,0.00020457517530303448,0.0030620961915701628,0.0013210518518462777
86278_263789,"Lol, no",0.004924531560391188,3.15438086317954e-07,0.0011417081113904715,1.0256340829073451e-05,0.00052598025649786,0.0001273740635951981
sanriver12,i wouls shadowban your ass. asswipe.,0.9953786134719849,0.3648673892021179,0.9569160342216492,0.0753197968006134,0.8635828495025635,0.26931723952293396
hassantg,What the actual fuck is up with posts on this r/soccer today!,0.9160159826278687,0.0008108431356959045,0.8136024475097656,0.0012841123389080167,0.09140951931476593,0.006446199957281351
bas,That was entertaining. Anything is possible.,9.483085159445181e-05,1.4979097129330654e-10,5.640948438667692e-05,1.087024692481009e-08,1.4352224752656184e-05,4.5958114469613065e-07
Fafouf,The info comes from the cousin of the sister in law of his neighbour. It's right there in the source.,0.0008963365689851344,1.6599003060946416e-08,0.0003351232153363526,7.539151170021796e-07,0.00012913683895021677,1.2359925676719286e-05
PM_me_Squanch_pics,"The first line makes this very unlikely, Jorge Mendes is probably the best agent there is so as every other single offer to Ronaldo, it's just smoke trying to get some pay raise or check the terrain. Please PM me your insults if this turns out to be true but this is just believing a PR stunt.",7.204655412351713e-05,2.928118511547062e-11,2.8055670554749668e-05,3.3093374707249268e-09,8.140546924551018e-06,2.2309600922199024e-07
200_7,wtf,0.901049792766571,0.010957897640764713,0.2986544370651245,0.04004434123635292,0.3939344882965088,0.10983997583389282
wingnut5k,"Sure bud, why not.",0.0035639123525470495,1.816377022123561e-07,0.0009179067565128207,5.985304142086534e-06,0.0004361634491942823,7.902334618847817e-05
Raalph,Summer...,0.006689079105854034,6.370187293214258e-07,0.001367654069326818,2.132649751729332e-05,0.0009311838075518608,0.00019505625823512673
xydroh,"I really think Tielemans is destined for great things, but to me this seems a bit early to already get the number 10",0.0024539558216929436,2.132207832516997e-08,0.0004518967180047184,1.2873058494733414e-06,0.0002604095498099923,1.9936280295951292e-05
