id,comment,toxic,severe_toxic,obscene,threat,insult,identity_hate
bolah,"Ronaldo goes to Monaco and marries Carlota Casiraghi. Suddenly every single person in front of her in the line of succession for Monaco's throne starts dying in suspicious circumstances, but nobody asks question as it would compromise the stability of Europe. The year is 2022, Ronaldo and Carlota become King and Queen of Monaco after Prince Albert resignation. Ronaldo's first words as he accepts the crown are: SIIIIMMMM. Carlota looks cringed, but it's too late now.",2.235658212157432e-05,4.197655244231324e-12,1.566529863339383e-05,5.227310806432683e-10,3.223592557333177e-06,5.814809611592864e-08
Playboi_Icardi,"Born a peasant in a tiny Portuguese island, died as King of a tiny semi French province. Ronaldo: the man, the myth, the legend.",2.136931288987398e-05,7.490998273074201e-12,1.7145139281637967e-05,6.197753976699971e-10,3.704623850353528e-06,7.330237394853611e-08
ShrimpToothpaste,Prince* you cant get the king title by marriage (unless they have a different system for that stuff in Monaco),0.0005390247679315507,3.361616818242652e-10,8.825081022223458e-05,4.0531251244146915e-08,4.0430037188343704e-05,1.4345641830004752e-06
oplontino,"Monaco doesn't have a king full stop, only a prince.",0.0013613778864964843,7.482912067757752e-09,0.00034170752041973174,3.87568661608384e-07,0.00017142780416179448,7.5599041338136885e-06
See_i_did,Not yet,0.01775149255990982,1.284816107727238e-06,0.002440209034830332,3.261058373027481e-05,0.0017333372961729765,0.00025605648988857865
NAN,[deleted],0.003765546018257737,5.964062665952952e-07,0.0009973300620913506,1.694911225058604e-05,0.0005632698885165155,0.00017409920110367239
S-BRO,Have you heard the tragedy of CR7 the wise?,0.010322768241167068,1.2882206874564872e-06,0.0019108642591163516,3.571403431124054e-05,0.0013574556214734912,0.0002746015088632703
SaxMan100,Not from a Blaugrana,0.1590469926595688,2.8307920729275793e-05,0.010390383191406727,0.0006070469389669597,0.013597222045063972,0.002492798725143075
JoeMagician,Fetch me a block.,0.12279359251260757,7.845516665838659e-05,0.012085945345461369,0.0012688187416642904,0.015336546115577221,0.0047637782990932465
JJMFB417,I see.,0.01431436650454998,4.070909199072048e-06,0.0026734776329249144,0.00010148990259040147,0.0018715602345764637,0.0007641944102942944
Chazzwazz,...and thats when the MonÃ©gasque nation attacked,0.015033130533993244,1.3461391290547908e-06,0.0017249032389372587,5.119029083289206e-05,0.0013319439021870494,0.0004523456154856831
Blunt-as-a-cunt,Based on their rulers:Monaco is a (princ)ipalityUK is a (king)domUSA is a (cunt)ry,0.9722979068756104,0.022116001695394516,0.8685832023620605,0.011278520338237286,0.552692711353302,0.07376610487699509
ShrimpToothpaste,Oh...completely different then I suppose,0.003203741041943431,6.330967039502866e-08,0.0005643279291689396,2.7702060378942406e-06,0.0003438787825871259,3.9037920942064375e-05
NAN,[deleted],0.003765546018257737,5.964062665952952e-07,0.0009973300620913506,1.694911225058604e-05,0.0005632698885165155,0.00017409920110367239
perkel666,That only depends on how line of successions is constructed.,0.08509138226509094,1.9664750652736984e-05,0.007955368608236313,0.00043950992403551936,0.008038356900215149,0.0021480293944478035
EinesFreundesFreund,Women are useless,0.24908798933029175,6.013411984895356e-05,0.015340883284807205,0.0015084536280483007,0.024772776290774345,0.00572420796379447
EinesFreundesFreund,So you're saying Ronaldo has to levy the millions of pre-teen fans he has and conquer Monaco to be a King?,0.000463135918835178,1.8914886323884161e-10,0.0001400686742272228,2.262444809275621e-08,5.510839764610864e-05,1.055423808793421e-06
pringleking_,"After which Lebron James starts snapchatting passive aggressive messages like ""I'm the one true king"" ""People always trying to dethrone me""",0.00019418315787333995,4.4078271588254836e-10,9.108815720537677e-05,2.6361060889712462e-08,2.766421494015958e-05,9.934893796526012e-07
buticat,And then t'he Game of Thrones start,0.0028665056452155113,1.9226193614940712e-07,0.0007231408962979913,5.730493739974918e-06,0.0004187549347989261,6.535516877193004e-05
thepresidentsturtle,"What? No. You fool. King of Monaco is not the last step, only the beginning of his post football career road to world domination. Monaco is just the beginning.",0.5853601098060608,4.0634618017065804e-06,0.017676925286650658,0.00022297626128420234,0.03618815168738365,0.0014363157097250223
caried,The Grace Kelly of our day.,0.019972696900367737,3.718672587638139e-06,0.0037747356109321117,8.723697828827426e-05,0.002501670503988862,0.0005749220727011561
kdrisck,What if I told you....,0.07375945895910263,1.0969511095026974e-06,0.004431290552020073,4.144058402744122e-05,0.0037113165017217398,0.00029752246337011456
Sixcoup,"> tiny semi French provinceMonaco has nothing do to with France, it's a fully independant state.",1.3220276741776615e-05,3.912973244035722e-12,9.645124009693973e-06,4.161848365935583e-10,2.2639637791144196e-06,4.047786461569558e-08
SOB200,HBO would buy that for the next season of Game of Thrones!,0.0011891316389665008,3.0946672779919027e-08,0.00036318128695711493,1.1434249245212413e-06,0.00015897843695711344,2.001085340452846e-05
HillaryLostAgainLOL,"Sometimes, when a /r/FIFA and /r/CrusaderKings fall in love, they produce something very beautiful.... Deus Vult!",0.011189854703843594,1.4515990187646821e-06,0.0028635766357183456,3.4833192330552265e-05,0.0016657700762152672,0.00024065824982244521
EliGranger,Never thought the two biggest time-wasters in my life could cross paths like this,0.005627617239952087,8.2565073000751e-08,0.0006881144363433123,4.688611170422519e-06,0.00046134236617945135,6.083160769776441e-05
_thedarkknight,You heathen.,0.019817635416984558,3.1080680855666287e-06,0.003091047750785947,8.357713522855192e-05,0.0025853500701487064,0.0005430144956335425
ahab_,"A son with Attractive, Genius and Strong?",0.05163033679127693,4.096851171198068e-06,0.007343396078795195,9.97347742668353e-05,0.005044205114245415,0.0006681522936560214
YeezusTaughtMe,Master Seducer as well,0.03402142971754074,1.0441664926474914e-05,0.004647599998861551,0.00025726703461259604,0.00449429452419281,0.0014782455982640386
WildVariety,"+ Midas Touched, Zealous, Lustful",0.036453984677791595,4.310701842769049e-05,0.008864155039191246,0.0005986063042655587,0.0069825430400669575,0.0025466682855039835
Booyanach,you forget the Crusader trait...He went to the Euros and fought for our prize,9.373203647555783e-05,2.2667273613663497e-10,4.83612748212181e-05,1.615617151173865e-08,1.4686828762933146e-05,6.14822681654914e-07
NAN,[deleted],0.003765546018257737,5.964062665952952e-07,0.0009973300620913506,1.694911225058604e-05,0.0005632698885165155,0.00017409920110367239
Savemahsoul,His children will keep the bloodline pure.,0.0998687744140625,7.960037692100741e-06,0.009584551677107811,0.00021295799524523318,0.009190002456307411,0.001082398695871234
ominousgraycat,"I know very little about Portugal, but I like to just assume that everyone there are first cousins, and I don't let little things like logic or facts get in my way.",0.22962263226509094,9.146128286374733e-05,0.017326518893241882,0.0019144718535244465,0.027154741808772087,0.00737421540543437
eagle177,can i get a quick [rundown?](http://i.imgur.com/cCEYeDu.jpg),0.10998440533876419,9.646715625422075e-06,0.008345859125256538,0.00020453089382499456,0.008682118728756905,0.0009644543752074242
tnarref,people here aren't ready for a bogpill,0.18472491204738617,7.988435390871018e-05,0.01539353746920824,0.0015769641613587737,0.023426422849297523,0.005463047884404659
Odesit,"You're right, we're not ready for a forced 4chan meme",0.0011458663502708077,3.664234693445678e-09,0.00018225864914711565,3.517311881751084e-07,0.00010876894521061331,8.900463399186265e-06
Dmbender,Intrigue focus op,3.1634442620998016e-06,2.2303945528597685e-13,3.206462224625284e-06,4.010584919722504e-11,5.032370609114878e-07,7.355064557401647e-09
Joltie,> Ronaldo and Carlota become King and Queen of Monaco after Prince Albert resignation.> King and Queen of Monaco> #King and Queen> after Prince Albert resignation.> #after Prince [...] resignationI don't think this is quite right.,0.0001260418794117868,6.282588338457629e-11,4.465223537408747e-05,6.127280460788143e-09,1.5016655197541695e-05,4.2596380467330164e-07
cowk,I'ld move there,0.000644808285869658,1.452348818986593e-08,0.000233324637520127,6.182281140354462e-07,9.120027243625373e-05,1.2455059732019436e-05
-MiddleOut-,Hear there's a nice cupboard going for 20k per month,6.621024658670649e-05,2.771516349753256e-10,4.666981112677604e-05,1.930533777283472e-08,1.2743623301503249e-05,8.10327549061185e-07
NotMattHardy,You can't camp there!Why not?You cant afford it.,0.043505992740392685,7.49037917557871e-06,0.0048525589518249035,0.00019049231195822358,0.004304301925003529,0.0011757452739402652
RuledbyShmoopie,That's a steal. Do I get whatever is stored there as well or is that extra?,0.0021278487984091043,5.413252068819929e-08,0.0005458200466819108,2.4768257844698383e-06,0.00028063420904800296,3.478389771771617e-05
-MiddleOut-,"Monegasque cupboards are a bit of a lottery, you could find anything in there from a dead ocelot to Grace Kelly.",0.005451143253594637,3.4771497325891687e-07,0.001189013128168881,1.1618916687439196e-05,0.0007887543179094791,0.000109408276330214
Jahoby,TSUUUUUUUUUUUUUUUUUUUU,0.016463201493024826,1.9275947124697268e-05,0.004478128626942635,0.00026728041120804846,0.003357982262969017,0.001453277189284563
Monstermart,Today was the day I learned that Monaco was separate from France,7.262051803991199e-05,8.150426167308211e-11,4.2653486161725596e-05,8.652230043537656e-09,1.5629366316716187e-05,3.7587415135931224e-07
PUDDING_SLAVE,Its a principality m8,0.30467328429222107,0.0004649712354876101,0.031982872635126114,0.006518736947327852,0.05534461885690689,0.014900749549269676
WildVariety,"Originally, if the Prince died without an heir, Monaco would be left to France in the last Prince's will, but they've since changed it to pretty much guarantee there's always a valid heir.",6.493321961897891e-06,7.391389475301657e-13,5.532437626243336e-06,1.0113773707409734e-10,9.539935490465723e-07,1.4454205832237221e-08
wafino1,Charlotte*,0.13047103583812714,0.0001094870749511756,0.017059599980711937,0.0013980962103232741,0.01637638919055462,0.0050116535276174545
floydabc123,lmfao,0.27059534192085266,0.0001428432879038155,0.02619020827114582,0.0020042189862579107,0.030529841780662537,0.0063780685886740685
ProfaneTank,This is the best timeline.,0.008746554143726826,3.122171392533346e-07,0.0013929085107520223,1.3235199730843306e-05,0.0008316616876982152,0.00016113504534587264
ionised,"So, you're saying... even I might have a shot at becoming the King of Spain since my lady is something like 6735^th in line, yes?",0.015217620879411697,4.152948065438977e-07,0.0019110534340143204,1.98195284610847e-05,0.0013224227586761117,0.00019419204909354448
AlainS46,"I'd love to see that happen, just for the SIIIMMM moment",0.0008547119796276093,1.2033231300279112e-08,0.00022921500203665346,6.277087436501461e-07,0.00010885050141951069,1.1589268979150802e-05
markisdead92,This sounds like Brons story in the game of thrones books,4.9890735681401566e-05,5.5368508389275206e-11,2.599701656436082e-05,5.3221840268236065e-09,7.821249710104894e-06,2.8439029620130896e-07
Sulavajuusto,There is no king in Monaco :>,0.021679218858480453,1.7076760059353546e-06,0.0035163871943950653,4.448783511179499e-05,0.001971727702766657,0.0003672181046567857
grympy,"There are a lot of words here...EDIT: 1,466 words, 8,495 characters",0.0008165264734998345,5.874559061425089e-09,0.0003138470638077706,3.064535292196524e-07,9.183577640214935e-05,7.512398497055983e-06
blueradium,People say WWII started because Gandhi wrecked Hitler in career mode. Not saying it's 100% true but...,1.9388075088500045e-05,7.849719138586231e-12,1.8488783098291606e-05,8.674880258574547e-10,3.7105924093339127e-06,6.171784150410531e-08
Andrex316,"I mean, if that were true, there would have been no Hitler because of the amount of nukes Gandhi would have used on him",0.0010333959944546223,1.0964325447559986e-08,0.00036477239336818457,6.349329169097473e-07,0.00014200509758666158,1.350837919744663e-05
Pippelitraktori,I need Hitler in civ instead of bismarck. And Stalin. And Pol pot. They would have killer unique traits,0.00025913206627592444,1.5053398527697937e-09,0.00020471078460104764,8.919379723693055e-08,5.649787999573164e-05,2.2224351141630905e-06
fairlyrandom,I'd be willing to bet that there's mods for that.,0.00011789378913817927,1.0492416657736925e-10,3.409461714909412e-05,1.2651505620908665e-08,1.0650846888893284e-05,6.898911806274555e-07
wildguy13,There most definitely are mods for that.,0.0004332746902946383,1.8124439726818764e-09,0.00012059477012371644,1.2581639907693898e-07,4.311063457862474e-05,3.8141624827403575e-06
Bunde35,Hitler is a Pretty fun mod in Civ V check og out man! :-),0.0006210295832715929,5.685461879068043e-09,0.0003326312289573252,3.137791964036296e-07,0.00010337589628761634,7.916703907540068e-06
ICrazySolo,"Hitler is no Gandhi tho, that little cunt!",0.9772969484329224,0.05443388968706131,0.8824936747550964,0.024664005264639854,0.6559140682220459,0.12243553251028061
SuperMrTiddles,Stalin used to be in Civ.,0.00012493431859184057,1.4079479249140547e-10,4.294772952562198e-05,1.495008383756158e-08,1.2068810974597e-05,7.474370136151265e-07
Sulavajuusto,"Well, there's Genghis.",0.010395101271569729,2.508546913304599e-06,0.0021412463393062353,6.756222137482837e-05,0.001515416894108057,0.0005404430557973683
joze1337,~~Ghandi~~ Gandhi I miss that bot,8.33049271022901e-05,1.0751445567169782e-10,3.7501700717257336e-05,9.982521476104012e-09,9.706227501737885e-06,5.525027972907992e-07
Andrex316,fixed :O,0.009165736846625805,3.56508792265231e-07,0.0012752703623846173,1.3898325960326474e-05,0.0008444158593192697,0.00014237264986149967
Jganzo13,Firminho bot is the best,0.010680267587304115,3.281720353243145e-07,0.001448351889848709,1.5020378668850753e-05,0.0009226059773936868,0.00018076022388413548
paultmanteau,How could Hitler not see that nuclear weaponry is the future?!,0.0012461583828553557,5.1453710625537497e-08,0.00043621379882097244,1.812602477002656e-06,0.00018851486674975604,2.609995863167569e-05
offiziersmesser,He did see it. Germany was the first country to start the programme. Then the allies kidnapped their scientists.,1.876427086244803e-05,9.565337237560367e-12,1.6016030713217333e-05,1.135044724875911e-09,3.680059307953343e-06,8.646063776041046e-08
camfa,"It also helped that Einstein was a jew. Seriously, they politicized everything, including science and nuclear power, and early academics and physicists who would have had a chance at developing nuclear weapons first were either purged or forced to join the army, or they emigrated by their own means before things got ugly, like Einstein. We got lucky that many key german/european scientists at the time were jewish.",2.4648819817230105e-05,2.2408555046260492e-12,1.944093673955649e-05,4.6031362055387604e-10,4.324421752244234e-06,4.916166673751832e-08
paultmanteau,"And then used their knowledge for the space program, yeah, but I'm just extending the civ meme here",9.712095925351605e-05,3.798379111241701e-10,7.411326805595309e-05,2.3425942075050443e-08,1.845411679823883e-05,8.275944765046006e-07
mattoljan,Well you're not wrong actually,0.013493337668478489,1.5174720147115295e-06,0.0023314363788813353,3.759695027838461e-05,0.00149064464494586,0.0003105643263552338
paultmanteau,"Oh I know, and a lot of atrocities committed by the Japanese in China aided understanding of what it would take to send a human into space, too, and a whole lot of other things presumably",0.005937598180025816,1.6425035198608384e-07,0.0009518778533674777,7.825286047591362e-06,0.000806798692792654,9.44323546718806e-05
mattoljan,Well WWII in general taught us how to kill humans in mass numbers quite easily,1.2560180948639754e-05,1.8123824923471643e-12,9.022071935760323e-06,2.98277541554981e-10,1.7790157471608836e-06,3.2615016465342705e-08
weasdasfa,I think the brits were already pretty good at that stuff.,0.0022140636574476957,1.3590873493285471e-07,0.0007587853469885886,4.4295438783592544e-06,0.00033117347629740834,5.75441044929903e-05
offiziersmesser,"Ah, fair enough.",0.01392337866127491,5.565639185078908e-06,0.0027991789393126965,0.00013589112495537847,0.0023850039578974247,0.0009536630823276937
JustMakinItBetter,"Pretty sure they weren't doing so well. If I remember correctly, the Nazis were world-leaders in missile technology, but well behind on nuclear weapons. That's why so many Germans ended up working at NASA and on ICBMs, but fewer on developing the actual warheads.Source: Visited the PeenemÃ¼nde factory and museum a few years back, where they built the V1 and V2 rockets",3.6745808756677434e-05,4.4946244642796174e-11,2.834109000104945e-05,3.093019174116307e-09,6.509746526717208e-06,1.9399561779209762e-07
THEnimble_mongoose,> Then the allies kidnapped their scientists.Operation Paperclip.,5.488358056027209e-06,1.0755126173336849e-12,5.906869773752987e-06,1.5329022773347134e-10,9.758450687513687e-07,2.1645957914984137e-08
camfa,That was after the war tho,0.06519544124603271,1.3221789231465664e-05,0.006585028488188982,0.00033713821903802454,0.0066430470906198025,0.0018316052155569196
El_Spacho,I heard it was because Gandhi t-bagged Adi in CS:GO...,0.0211213119328022,1.154784627033223e-06,0.003281106473878026,4.125478517380543e-05,0.0028939407784491777,0.00024543804465793073
TheCousCousNonce,Neymar carried Gandhi,0.0009774104692041874,1.5110392936890094e-08,0.00034606599365361035,7.997177249308152e-07,0.00012764848361257464,1.57434624270536e-05
Animastarara,Fanendo Adi would probably be a pretty bad CS:GO player so this I can see,0.001800897647626698,6.5119429848437e-08,0.0005279763718135655,2.2909957806405146e-06,0.00024091583327390254,3.3557436836417764e-05
GhandisFlipFlop,Can confirm,0.0008017148938961327,1.524928094909228e-08,0.00033714447636157274,5.433921046460455e-07,0.0001131854805862531,1.0377822036389261e-05
EvenGandhiHatesLVG,FRAUD you can't even spell the name properly,0.4438454508781433,5.904790305066854e-05,0.032409097999334335,0.001132847392000258,0.03658053278923035,0.004352865740656853
DepletedMitochondria,I thought it was Gandhi declaring war on Hitler in Civ?,0.002408356172963977,4.9127727663744736e-08,0.0005965425516478717,2.6091897780133877e-06,0.0002748873084783554,3.949535675928928e-05
goontzz,"> sponsor with his Fedcom company, it's already 20 years how his company is involved with Monaco...Fedorichev was alsoand he took the swastika",0.03279341384768486,3.21900728295077e-07,0.0035361077170819044,1.2643427908187732e-05,0.0022201479878276587,0.00013750298239756376
akafernando,https://i.imgur.com/MnsEtw1.jpg,0.3297269642353058,0.00020274576672818512,0.03513677790760994,0.0025630861055105925,0.035536568611860275,0.008686598390340805
FlabbySatchel,"50,000 people used to live here...",0.0011242137989029288,5.3928264520664015e-08,0.0004936635959893465,2.0595864498318406e-06,0.0001939427893375978,3.137138264719397e-05
Cubbll17,And now its a ghost town...,0.00014147069305181503,4.511056250766643e-10,7.007435488048941e-05,2.9055131633981546e-08,2.4290578949148767e-05,9.885379768093117e-07
votedh,MY HEART IS A GHOST TOWN,0.0025859663728624582,3.1971680414244474e-08,0.0004931091098114848,1.7337856661470141e-06,0.0003511020331643522,2.4183262212318368e-05
NAN,[deleted],0.003765546018257737,5.964062665952952e-07,0.0009973300620913506,1.694911225058604e-05,0.0005632698885165155,0.00017409920110367239
wildus3,I don't know whether to cry or laugh at that gif.,5.2056908316444606e-05,2.0001089673371553e-10,4.229885234963149e-05,1.6488057141827994e-08,1.1631532288447488e-05,7.150523515520035e-07
Pemoniz,And most of them are stupid.,0.9721065759658813,0.013398288749158382,0.46643438935279846,0.030069468542933464,0.6328504681587219,0.1338108777999878
Cornelius_Poindexter,">8,495 character Brendan Rodgers would orgasm at this",0.005505886394530535,4.202274510589632e-07,0.0010920594213530421,1.5089292901393492e-05,0.0006919364095665514,0.00015504741168115288
atropicalpenguin,I have college assignments shorter than this post.,0.001670621451921761,8.724236266743901e-08,0.0005813043680973351,2.6152033569815103e-06,0.00028536119498312473,3.9389360608765855e-05
hardgour,I recognize a few of these words,8.86130965227494e-06,8.656339534063306e-13,4.7830371840973385e-06,1.7633335069877631e-10,1.0402914085716475e-06,2.2446929648367586e-08
akashdavidp,The ultimate shitpost,7.953977910801768e-05,1.1656657583625218e-10,3.389860285096802e-05,1.020250195438166e-08,1.0851450497284532e-05,4.864891138822713e-07
color_thine_fate,">8,495 charactersWill still never touch /r/Soccer",0.001811218447983265,1.4200050202362036e-07,0.0008874628692865372,3.5290117921249475e-06,0.0003298535302747041,4.266325413482264e-05
ronqbicle,I read every one of them.,0.01274656318128109,1.5209941466309829e-06,0.0019268208416178823,4.8523790610488504e-05,0.0014934578211978078,0.0003875696274917573
Razzler1973,Only 2 probably needed in response: **no**,0.002195327077060938,5.501121336237702e-08,0.0006637584301643074,2.1012176603107946e-06,0.0002247444208478555,3.1569004931952804e-05
shao_kahff,I don't know shit all about football leagues and I read it all ðŸ˜‚,0.8210189938545227,0.00014641230518464,0.40590307116508484,0.0009459574357606471,0.05708126723766327,0.00503840995952487
fletcherDCE,One of them has to be true,0.003374937456101179,9.865831884781073e-08,0.000529531214851886,5.033435172663303e-06,0.00032678109710104764,6.787644815631211e-05
AHighLine,And I definitely didn't read more than a few sentences,0.00013197916268836707,9.173288795238932e-10,9.984477947000414e-05,3.862962572043216e-08,2.5505121811875142e-05,1.3561485729951528e-06
ForcadoUALG,I was here.,0.014542964287102222,3.318904646221199e-06,0.0031255288049578667,7.167411968111992e-05,0.0018229089910164475,0.0005476347869262099
Sovereign__Boaby,I would like it on the record that I too was here.,0.05514221638441086,2.2639533199253492e-05,0.007269013207405806,0.00044076191261410713,0.0064346385188400745,0.0024323079269379377
aiben16,"Me too, the F5ing is real ðŸ™ˆ",0.062200941145420074,2.4156317522283643e-05,0.009104220196604729,0.00038883357774466276,0.007449815049767494,0.0017408254789188504
OmastarLovesDonuts,Room for one more?,0.22251972556114197,1.2535732821561396e-05,0.009658441878855228,0.00047326929052360356,0.014378543943166733,0.0027688448317348957
Kama__,"everybody in the history train, baby",0.05013618618249893,1.1515498954395298e-05,0.005801412742584944,0.00028321726131252944,0.0057172696106135845,0.0014628696953877807
EchteMijnBrasserie,Choo choo!,0.016463201493024826,1.9275947124697268e-05,0.004478128626942635,0.00026728041120804846,0.003357982262969017,0.001453277189284563
haplo34,Tchtktchktchktchktchk,0.016463201493024826,1.9275947124697268e-05,0.004478128626942635,0.00026728041120804846,0.003357982262969017,0.001453277189284563
frenchiefanatique,Fuck did the train leave yet??,0.9800628423690796,0.06326084583997726,0.9708573818206787,0.012546946294605732,0.4575231969356537,0.06045640632510185
mitmap1,"Nope, because I just hopped on",0.03823740407824516,1.4322622519102879e-05,0.004924482200294733,0.0003179986379109323,0.004522460047155619,0.0017777255270630121
RafaelNadalFTW,I'm a couple hours late but is there any space left?,0.0030953767709434032,2.0266838873794768e-07,0.001240108977071941,4.606909897120204e-06,0.00048395583871752024,4.775636989506893e-05
Arthurs_Boi,I hope so I just got my tickets,0.3468419909477234,0.00040265428833663464,0.0543251670897007,0.004684407729655504,0.039482373744249344,0.014198865741491318
shriek,"Shit, I lost mine. Can I use yours?",0.9446898698806763,0.010964985005557537,0.881731390953064,0.00712196808308363,0.3012842833995819,0.03679783269762993
ykeloy,"Here, just shift in next to me - they won't notice",0.007540571969002485,3.026917738679913e-07,0.0010975170880556107,1.1780250133597292e-05,0.0008119336562231183,0.00012556240835692734
SomeNYIFan,I'll also join for the fun of it,0.00037829604116268456,2.48279952153041e-09,0.00012323935516178608,1.3732049808368174e-07,4.2585001210682094e-05,4.0869667827792e-06
Reus5c,"I brought some beers, can I sneak in?",0.006555355619639158,3.5174863910469867e-07,0.0016091848956421018,1.2448338566173334e-05,0.0010477503528818488,0.0001210522823384963
soupy_e,"Hey, I'm The ticket inspector and your ticket isn't valid... But one of those beers would make me look the other way...",0.036292534321546555,3.463666871539317e-06,0.0036322553642094135,0.0001236932148458436,0.0036508715711534023,0.0008571717771701515
rkodand,"Screw you man, I'm hoppin on top of the train",0.89497971534729,0.011183450929820538,0.23893101513385773,0.05188821256160736,0.3361237943172455,0.15058036148548126
azcii_,I'm joining you,0.024644605815410614,4.2961227109117317e-07,0.0025087844114750624,1.8465101675246842e-05,0.001615547458641231,0.00015442771837115288
ClearSearchHistory,"I chased it down after it started rolling, but I'm here",0.004877377301454544,2.528457514472393e-07,0.0015542967012152076,5.997302650939673e-06,0.0005459204548969865,6.702388054691255e-05
Dickinmymouth1,"I'm also very late but can confirm, just hopped on at my local station",8.64940375322476e-05,3.1930696975379647e-10,6.795287481509149e-05,1.8321347994287862e-08,1.539952245366294e-05,7.604058964716387e-07
night-watchman,Had to hop the ticket barrier but just managed to make it on also.,0.0009537302539683878,3.943204518463972e-08,0.0003967068041674793,1.3423625659925165e-06,0.00016874363063834608,2.050655530183576e-05
