comment,id,toxic,severe_toxic,obscene,threat,insult,identity_hate
That cop is the man for letting him off with a warning,father_goose6766,0.13766026280767338,0.008693749278808543,0.054947089989513455,0.0037173034986636598,0.04549638268809391,0.010352709101650625
I loved the parental scolding he gave.,modmoderate,0.08357440143850156,0.008931242372953306,0.03698015642846302,0.003536512639526326,0.0362907271977912,0.010153666380180882
I love how the policeman pointed at him once he sat down. “Now stay there this time”,EnderColt,0.08743677967750882,0.007151626822772908,0.03553652671240112,0.0034396074512611364,0.023623160282049978,0.008444586551737144
"I happened to be in Cleveland for work a few years back when the cavs and the warriors were playing in the NBA finals. I watched the final game when the warriors won just outside the arena. When all of the angry cavs fans were storming out of the arena, I snuck inside and wandered around for a while and watched the trophy ceremony. I made my way down to he floor, got onto the floor and then got caught and escorted off the floor by a security guard. It was really fun!!!",brando56,0.08926700965032187,0.0071625227467120465,0.04169096963667292,0.0034096103831649832,0.03234104210147298,0.008412121300910297
How did they eventually figure you out? I figure during a ceremony like that there are so many people around it would be hard to discern. Did everyone who wasn't a player and allowed on the court have a credentials badge or something?,Erityeria,0.08878596831820373,0.006465428144429072,0.03938173362654863,0.003103591972471506,0.04143769469794535,0.008842069466390257
"By he time I had gotten to the floor all of he players had made their way into the locker room. The only people left were media (ESPN/TNT type sports anchors) and security personnel with badges and media passes. I was holding my phone to my chest, recording it and security guard spotted me and quickly made me leave. Like you said, there were lots of people and because I had made it that far, I assumed I'd be able to walk around for a while without being caught. Kudos to that security guard who caught me.Edit: I was on the floor for about 5 seconds before getting caught.",brando56,0.08875514669186291,0.00658099826764654,0.04021315592224754,0.003322607958274288,0.03667442901377955,0.00827124259406976
No you didn't.,preeetygood,0.163805964284769,0.011571246008381636,0.06007693070216899,0.004410191206638545,0.07389263179980943,0.00992678229789243
I've got pictures and a video to prove it so you're welcome to believe what you would like! Have a nice day!,brando56,0.13443150407237678,0.008264347101440056,0.045958408283134224,0.0036658575332112883,0.06053669770348619,0.012275698963334187
a better jumpshot than rondo,BROWNIECORES,0.08253036311470131,0.00778063672013583,0.041339561827946764,0.003611751756180049,0.03759418842813431,0.008982423710789703
I think he knew a roster spot was opening up. /cry,rolytron,0.09936881145620369,0.008985385559335791,0.043015283499838776,0.0037375037040304907,0.04068957277880411,0.009959842755935477
Did he make the shot?,bostonbruins922,0.0802954888994158,0.008603067142060168,0.0407354760907125,0.0036070025213994637,0.03569755452939263,0.008835737442427032
Shot looked about 4 feet short,boygeniusjr,0.08468477651625485,0.00971865925000718,0.04338123890359157,0.003944529592433595,0.04045861316981648,0.010565809727851485
i mean u can tell hes not on the team by body shape. Hes a shape not in shape,Justokmemes,0.13676095849883974,0.010519651926442225,0.06516211583580706,0.004131655198023684,0.06317869686027602,0.011801905532249662
When you're sitting in $1k seats you don't get kicked out for a stunt like that. They just wag their finger at you,drdrillaz,0.3240261859184721,0.011148893133910131,0.11786365718423437,0.00392456233516035,0.12748770031147752,0.013343129124668989
That is an appropriate amount of police brutality,behaaki,0.07393836788572002,0.008172784628566594,0.03529095421310096,0.003332497699868691,0.034879722452616814,0.008954712084374714
I was like “why aren't they throwing him out of the arena”...then I saw him returned to his expensive court side seat.,MediumDrink,0.10916219439278783,0.0075406302184096,0.04365278122049971,0.00342627832195725,0.0425887080264657,0.00998074343825142
"He's trying to replace Boogie.Cop ""AINT NO ONE REPLACING BOOGIE SIT DOWN""",aprimmer243,0.09911343833035194,0.008320186440434356,0.04241240350386352,0.003688276528865044,0.038174871124541036,0.009971691001696145
The important question - Did he make it?,TomBradyWinsAgain,0.0401366647605603,0.00682456268260109,0.026752440089711713,0.0031367567596553843,0.02370528190346117,0.0067122842783414825
I'd be surprised if he did. That shot was kinda ugly. A+ for getting a shot off in the first place though.,dro13,0.08494907415524575,0.008635518571027045,0.04215187607161735,0.0037507600968543,0.03873725335728953,0.009161103322987377
Maybe if he did more than one jumping jack he wouldn't have been found out.,chilepablo68,0.0762667354050909,0.007809517886217889,0.03865595700229687,0.003604313793050974,0.03526742012455584,0.008530380085705174
Great finger point at the end! Nice guard for letting him stay though,Xenphenik,0.0691683862739202,0.007800469400151897,0.03363724362081691,0.0035170055115467465,0.03056217562400897,0.00950744818533568
My favorite part was that it was the new Colonel Sanders who told him to sit down.,MyRedditNameDoesntFi,0.07686375265593214,0.007352426426555195,0.03461969051095841,0.0033391433319103314,0.03162997849016162,0.009080129061970747
That cop is probably on his 11th pension,Tigerlove111,0.08848190035600002,0.008313481907312388,0.041830804400126285,0.003356742850464246,0.03736137807864145,0.009559361894154928
"Wow, people with courtside seats can get away with anything",krs0013,0.1669772543471893,0.00920346070548122,0.05618264042731673,0.0038552100352305897,0.05745003893122243,0.010810644030417838
[yes they do](https://m.youtube.com/watch?v=-kBkXcvb-28),Beware_fake_news,0.08738281287766936,0.009955329020685905,0.04289746117849635,0.0037982165799427614,0.038734073994637075,0.010076182854248735
He reminds me of kevin hart,priceaka14,0.09048178849152644,0.009354175073857461,0.0378835563564854,0.003730617551051203,0.03982380185313212,0.010285960749606497
"I dunno. That shot needs a lot of work. Sure, not as much as Fultz' shot....boom! roasted!",Buzz_Nutter,0.08756145039695439,0.009217673432102304,0.0534443755285032,0.0036744185061619193,0.04287963979547303,0.009659946586919729
Sitting baseline? No wonder he wasn't thrown out.,SonOfSite,0.10381218262441345,0.00885809144796267,0.04886056272319075,0.003638391982754559,0.04877473182231449,0.009416725354803465
Is that Carmelo,EmbiidThaGoat,0.08490498479343173,0.008589920326416634,0.039927381026300765,0.0034840338859935868,0.03547849222057445,0.00978977098021265
Well someone has to replace Boogie.,nbarry93,0.07145782920570058,0.008585711939881606,0.031811950468191096,0.003648321131382372,0.03311164750849393,0.009298494594957988
r/actlikeyoubelong,wasnew4s,0.1450208118183988,0.012974699814930235,0.06185835725047997,0.003977611495697565,0.07139497608032165,0.013734751964200187
There an echo in here?,thereal_pa4m3,0.09108780838703205,0.009986964991118008,0.04288006430537342,0.003910682858915433,0.046105602654932694,0.010597060448949541
What?,wasnew4s,0.12621072338249678,0.010568042577703305,0.053899327211990325,0.0037892100565850755,0.05407598938135493,0.012077472171070297
"Just a joke, someone posted the same thing a few hours ago.",thereal_pa4m3,0.09561681878118823,0.007400164174880131,0.03947955401668073,0.003382003827912235,0.040324180880765885,0.009102637624726243
Honestly I was just trying to summon u/AreYouDeaf,wasnew4s,0.17214621130264443,0.013362511010296882,0.09009902830011612,0.0042957489616583504,0.09028334766020017,0.014781050990773785
good old colonel sanders keeping the peace,Braydox,0.08099163536898621,0.009452353728943305,0.04121876301261674,0.00359810318137327,0.04070548162518502,0.009913873530212785
I love how they just let him sit down after.,Reading_that,0.1500421802298973,0.00940928848466544,0.06702987413134438,0.003559321218900865,0.04388509876961909,0.010144379704508441
"Plot twist; He makes the shot, ball gets changed, but he gives to security guard who ALSO makes a corner 3...Immediate contracts given, they start raining fire from 3 and are the Pelican's version of the 'Splash Brothers'...Years later, Disney movie made about 2 unlikely teammates who saved the Pellies and took down the Golden State juggernaut: #The #Jelli-cans *roll credits*",Giraffinated,0.06024358113085019,0.005720661140003186,0.02674734600193583,0.0030812382388790745,0.024395763307083256,0.007588969138421214
"In France, we have Rémi Gaillard.He once snuck on the field into the French Cup Ligue final at the end of the game. Cheering the fan, holding the cup,... https://www.youtube.com/watch?v=hN9imlEgvvU",MrSzed31,0.060223669108276784,0.00819529799849566,0.03349928280711183,0.003491876560229973,0.02795301372654881,0.008826591586584566
Stay Stay Good boy,Kingcam540,0.15560191570169313,0.010325003234619498,0.05022394547825122,0.004013738785396775,0.05468719491702523,0.014005643872988643
Did one of the players pass him the ball?,youngflash,0.07994605727867447,0.008353486654588904,0.03612406193078455,0.0033727997669534527,0.03342226283555472,0.008633866483886376
Yes lol,dsldrummer1,0.10279798405792828,0.010331451119006138,0.04736656227133638,0.0036746925215692455,0.05078685931709131,0.011272053393090961
"The cops like ""dammit Steve this is the last time!""",CelestialMeatball,0.10783177588045362,0.007939276351127705,0.04805771480174617,0.0033258744930988243,0.03936282522352845,0.010470022036094847
I love how someone actually passed him a ball,fihewndkufbrnwkskh,0.12355616194204201,0.009727227018411217,0.05325189425154396,0.0034677669266435893,0.04112457887832949,0.009455305938497796
"If you guys liked this, you'll love Barry Bremen, ""The Great Imposter""https://vimeo.com/100848182Definitely worth the watch.",Tr0nKl0ndike,0.11254026015294298,0.009823916566812113,0.054250146796504695,0.003998070562601647,0.048677878668106994,0.010819926756333009
They were going to arrest him but decided being a Pelicans fan and letting him watch the game was punishment enough.,Rdt767,0.11573834507251564,0.008355139746846074,0.04419098292293795,0.004242116518752985,0.0432883974859646,0.010910064385648708
> Don't do that againI can hear the cop,AttackOfTheThumbs,0.0965677435009169,0.007206587967213557,0.044420812498630745,0.0035577466145902802,0.035909374151237065,0.008951047253730809
"This is amazing and it looks like the cop was being a good sport, it's nice to see things like this end on a positive note.",dillonfalano,0.08476938253478654,0.006159117967889323,0.031809491174630306,0.002935655847597234,0.03073277793518193,0.008804746149849418
"I love how the cop was just like ""Dude, sit down, that shot was terrible.""",ChevroletSparkSS,0.17168937578054994,0.008538099545126632,0.06309128784276301,0.0035181061437156943,0.05301822916153708,0.011244485385054266
"I love how the security guy just pointed his finger at him all serious. Like ""Hey! Just knock it off! Okay? Okay!""",wizholt7,0.20610046369331556,0.009945101545295503,0.07369965730286229,0.0034048188881957812,0.06541497542518539,0.012906589096284251
That was cool. They could have banned him and everything but im glad they didnt. This was funny as hell,hstisalive,0.24755774122319563,0.009747605207986338,0.08487946255437856,0.00423436682916412,0.06042890415042636,0.011951902605338497
"All you gotta do is own it. I used to work construction and one day i went to pick up some windows for a house we were remodeling. Halfway back to the site, I had to shit so bad I knew I wasn't gonna make it back. I was in an area that was just a huge office park, so no gas stations, fast food joints, basically any type of public restroom. So I parked in front of some software company, grabbed one of the windows from the truck, strapped on my tool belt and l walked up to the secretary with the window and told her I was meeting “Scott in maintenance” (because every maintenance team has a “Scott”) to replace a window in one of the restrooms. She gave me directions to where the maintenance team hung out, let me into the main building, where I did a number on a random bathroom. Then I left, passed the secretary, pointed at the window and said “still must be half-asleep, I brought the wrong size window from the truck”. She laughed and said she'd see me in a second. Hopped in the truck and returned to work undetected.",Xanny_Tanner,0.06884228955151896,0.006413166129590963,0.041789409329758054,0.0035106907529316323,0.0298389919286339,0.007458414277735236
This looks like something that Jazz from Fresh Prince of Bel-Air would have done.,FlipperJungle19,0.08237925791846432,0.007853660986316102,0.035737167888424015,0.0032780645938268625,0.03725896039965474,0.010450041062132353
THIS IS HILARIOUS AF LOL....ONE QUESTION ON EVERYBODYS MIND IS DID HE MAKE THE SHOT & THE ANSWER IS HELL NO LOOK AT THAT GARBAGE ASS FORM LOL,Zmo_1ndone,0.23919116386432515,0.009621517140370482,0.0937530647789317,0.00406418341164535,0.0701324027964732,0.012304618964353904
"lucky he didn't get tossed out, pretty lenient security over there.",BroadwayBully,0.10501201501237654,0.00968885409385615,0.05208832849938663,0.003523452185030116,0.041541762626790144,0.009197046223281652
Funny how the cop scolds him like he's a little kid,Chitown2354,0.3139577901878308,0.011805412362891161,0.10119352058113233,0.003770249257348802,0.09952807662135196,0.014827763330187569
"""BAD, NO""",sprandel,0.12080738827279792,0.010566378729651183,0.049627361455429925,0.003956800078294838,0.05058924091577271,0.010893694904807998
I honestly thought it was IT warming up lol then I realized it was the pelicans,macwillivray,0.06579224590843906,0.007279331468590951,0.032314038811217714,0.0033910984457830597,0.03272115480203943,0.008863949086310993
Didn't know the Pelicans traded for retirement Melo,KB17ROY,0.059156363184868846,0.007199926560142744,0.02860815758127735,0.003164407476776815,0.030789841974654758,0.008078991265166325
👈 Nooooo!!!!,GrandmasSpaghetti,0.2828332631926328,0.016934135797658227,0.09493141342953682,0.004717163413031814,0.0926626838556834,0.015744903334548845
Who hasn't wanted to do that?,syracusehorn,0.08388461736505508,0.007696754086579964,0.03828265001795864,0.0033444668986349017,0.036967008103635186,0.008748479836928382
Good guy cop. Gave him an admonishing and left it at that.,SweetToothKane,0.10904614655500208,0.008382371307808447,0.046504470383150184,0.003495692549802022,0.048972064574249845,0.01118392802480536
Lmao I love the random stretches and warm up routine,tymink,0.1014491013886042,0.009854794142426512,0.048312582859993417,0.0037217992142083637,0.039432532036094675,0.01043623495145155
"I know he's just trying to play an innocent prank. But the fear is that lots of other people will start trying to do this too, which will get annoying for security.",goldgibbon,0.1070581412482036,0.006497528892225262,0.03999808997592744,0.0034012361322177786,0.03214468910394425,0.008714103353144738
Lol the officer just escorts him two feet back to his chair. I wonder if he threatened time out too.,E404_User_Not_Found,0.08481588873408723,0.00786483765045839,0.04222717922896423,0.00365589828699468,0.037333959949234184,0.009260289606056335
"Classic parent move - the finger point and stern ""NO!"".",shozzlez,0.07417680963396622,0.008475157960723055,0.033358765865520355,0.003622099892777851,0.033416603569004576,0.009651045007244433
"When you put all your points into stealth, but the guards are OP.",xi_GoinHam,0.17516522840647336,0.010262552790181685,0.05967705956099625,0.004751929439915228,0.07100580553940392,0.011242528099599991
Pretty cool of the cop to not throw him out right away.,Nuwanda84,0.08109004780301443,0.007591198459221347,0.03936493360086879,0.003563068371548694,0.03662243562506999,0.00995875932119481
Cop could've been a lot more of a dick about it. Could've easily been kicked out. Stern telling off is probably a fitting punishment for someone who dished out the amount of money to sit courtside.,B00TYMASTER,0.16056057614941668,0.011327295962456598,0.09444856695817266,0.003579699584063023,0.05971135592836951,0.00965563379536859
"yes, inconspicuous with the athletic frame of a pregnant gazelle",constrictor63,0.08517511091865808,0.008622959683857389,0.034482034076741254,0.0034848371244588245,0.03610445962149899,0.009867918388657748
AMA Request: this Pelicans fan.,DynamoPro,0.07198096309407394,0.00824427414366394,0.03421029949186324,0.0033277654385811544,0.03459094874139753,0.010874419758104041
r/actlikeyoubelong,k2duff,0.1450208118183988,0.012974699814930235,0.06185835725047997,0.003977611495697565,0.07139497608032165,0.013734751964200187
Can check that one off the ol' bucket list.,RollingThunderPants,0.112040932227108,0.012174274032619519,0.06357525122512857,0.0036540533438674575,0.05314014404628885,0.010747962005113387
Wilford Brimley looked pissed.,mightbedylan,0.11158178881909217,0.010045081256300832,0.05077140324473219,0.003780232084744896,0.05103224705697087,0.010851544923429239
"Ouch, he received a stern pointing at",_Dad_Jokes,0.0871809604785912,0.009745739881984105,0.04317794993307196,0.0036230539855716575,0.04396898170240213,0.010046507440531705
That was definitely a finger wag.,d_smogh,0.08829767618736348,0.009191655378079687,0.03918737478337076,0.003638567481885953,0.040689770005030115,0.010591364629164934
This guy is a champ,petepete16,0.19728375934259929,0.010147349308797137,0.06209545914221473,0.003588933865513392,0.07920830538466624,0.014709312566301671
that brick he put up gave it away,AndrewWonjo,0.185823954931177,0.011292562840577213,0.0652166256951671,0.004014161617251533,0.06644509650403665,0.011808305801815584
I lol'd at that jumping jack,poopiepuppy,0.11338338407524662,0.009946293416240697,0.05729967056410103,0.0038735349604321757,0.051134903241728286,0.011385617497779561
*skippity beep boop bada moop diggity doop*,sno2787,0.178408885472852,0.011457360428780022,0.06756929845685963,0.0039911480101117594,0.071403491156553,0.0132255671121603
"Well played, prankster.",Jalespino,0.08897194954845909,0.010050039079917143,0.04127609181480503,0.003818714618400876,0.04034491208391341,0.01068709934828598
Yea but he had a court side seat. A peasant would have been instantly thrown out.,FoghornLeghornAhsay,0.08173057807901622,0.007611832218131394,0.0354604576925633,0.003555950048373885,0.03723551722637082,0.009263373833711138
That is gold!!,PopoFace,0.15010090973930562,0.010624430096472579,0.057307814372138506,0.0037718267465951137,0.05605056419228825,0.011674967705947982
Quite the scolding lol “Big NO NO!”,Herry_Up,0.11989512437093727,0.010222331531748093,0.05960282713621272,0.003766939225520469,0.0512119635854584,0.011791507054175279
I wanna be friends with this guy,skeliskull,0.15982377190613192,0.010292903383834498,0.0634724585612071,0.0039758431558548695,0.0675993726623382,0.014104999161647152
Good for that guy. Got to live out a dream,Pi11r0113r,0.13418446913926205,0.009121281267968274,0.056743937940618085,0.003980122184771022,0.05602971224005859,0.013003705293623654
"Wow, what an honor to meet Wilford Brimley in person. #lucky",indifferentmod,0.1291379290230265,0.009664282711434158,0.05546214528766769,0.004010218772099943,0.05385108453178035,0.010132886597388457
"Just act like you belong. 60% of the time, it works every time.",UnchartedShark,0.16343371893629752,0.008695293094807837,0.0644187066689227,0.003788043559270059,0.06756679370763112,0.011161341959377461
That's not a cop that's colonel sanders,kenziefrenzie,0.08564498448137121,0.007303059106115444,0.03958036671166398,0.003297507678282613,0.0337964201496989,0.008133431996052766
/r/ActLikeYouBelong,gaatikah,0.14420725663615003,0.012951281488196553,0.06150619852162169,0.0039736178316340165,0.07074462408941351,0.013709531407306052
Who passed him the ball? He deserves a gold star.,letdemfite,0.13201151789977847,0.00936593137362873,0.04836984895163982,0.003978502594691789,0.05009750534359487,0.010365670239918509
"""And DON'T do it again!""",AllynSea,0.15804796283905517,0.007565385662738119,0.06381358881910185,0.0036178607688087264,0.04806693457067519,0.00889842332141563
What a legend. And a great story to tell your mates,geromeo,0.14522054207191643,0.010378343070916868,0.06056147830934515,0.004647067600373597,0.06838049280807279,0.011040792479483818
r/actlikeyoubelong,Astro_Kimi,0.1450208118183988,0.012974699814930235,0.06185835725047997,0.003977611495697565,0.07139497608032165,0.013734751964200187
"Good security guard, this didn't warrant anything more than a stern pointing.",DealArtist,0.0830154806910532,0.008025956484318161,0.03437086428992214,0.003346033146429127,0.03546145958876392,0.008752720460582796
Michael Jordan should do this and they should see how long it takes for them to figure out it's him.,Cetun,0.055488768421864884,0.006966913021329698,0.031599402497955155,0.003367731397997282,0.026033039409870565,0.00887461338693334
"Glad to see cops in America sometimes do what Australian cops do. You know, not shoot them, tell the person off and wag their dissapointed finger at them like a naughty child.",practicalguy,0.1570481261621708,0.008994765635970714,0.04867275299839301,0.00404567359555312,0.05320470324193429,0.011776719866546733
"This is a perfect representation of when you get a job you're not really qualified for, and someone finds out.",toreycarter16,0.1398839301900567,0.009363388543624538,0.049091615147790514,0.00365768000016688,0.06571338229741805,0.009248043641483971
Still in better shape than Charles Barkley in his prime.,futureformerteacher,0.08398511776283052,0.008112865433785449,0.04103748523091972,0.0038420385845638165,0.0392585843919497,0.00969528983226662
What a legend,_Barringtonsteezy,0.12452248346051306,0.009863019395811,0.052757257261381925,0.0036457142391745135,0.05460871970188874,0.011122606922132686
Who passed the ball lmao,jetlibrucellee,0.11598077833857923,0.009566598271301746,0.04639893541766514,0.0038011065059385877,0.047142480099033664,0.010217009374584292
r/actlikeyoubelong,Empole,0.1450208118183988,0.012974699814930235,0.06185835725047997,0.003977611495697565,0.07139497608032165,0.013734751964200187
Wait.....this exists and is amazing.,OldWoodenFap,0.12818490707830318,0.00901714509853589,0.04603521435483907,0.0035982691082513106,0.049371864954637516,0.01367586185784519
Just act like you're supposed to be there,theknightlynews,0.27354924272733233,0.009943389626560236,0.073875348824126,0.0034790465436160974,0.1085441117531181,0.012667330360028949
Legend,Clews207,0.09112277440616105,0.01044311318255431,0.04277387970112692,0.0038274913921781052,0.04325333743340979,0.011172154412236414
I bet if he was 6'6 he could've gotten at least 2 more shots in.,thewebabyseamus,0.0741713963680586,0.008508381851395727,0.03883597791052174,0.0036423429353773804,0.035990326608618776,0.009727721644471152
"""now don't you get back up again""And in baseball you get booted out and banned for life for touching the field accidentally",DMann420,0.2776395211101977,0.011631352830245925,0.10462933242295616,0.004873790772461219,0.1114776147874412,0.011899279298287555
There's a team called the Pelicans now?,Selfless-,0.08786709577192024,0.007239904177609906,0.03819422917633,0.0032352970946908652,0.036959998363768856,0.009506797097413108
New Orleans Hornets got renamed when Charlotte went back to being the Hornets,Jock_fortune_sandals,0.0936904394105856,0.008487080119931593,0.04571868120460759,0.0036769749861829733,0.03851439013405421,0.01014924233897349
r/actlikeyoubelong,TheOnlyYoYo,0.1450208118183988,0.012974699814930235,0.06185835725047997,0.003977611495697565,0.07139497608032165,0.013734751964200187
Guy had front row seats and he does this risking being thrown out? Dang.,xclame,0.1325717908849309,0.008428139157110546,0.05045973504541491,0.0037198222169260043,0.051521588902815475,0.01089391357828806
How about a smile you pig!!,faulkque,0.3312060466298938,0.014582139388096221,0.08914897179594337,0.004736811718333936,0.14398805907056478,0.01528521692246841
Years ago. Maybe 15 years ago. A guy did this during a Manchester United champions league game. Went on to the pitch and actually lined up with the squad. I remember watching the game with my mate and we're like trying to figure out who this player is. He looks too old to be some unknown youth player making his debut. A few minutes later the he's gone and the commentary team mentioned he was an imposter. Fucking brilliant.Edit: he was called Karl Power.,Chemical_Robot,0.16112463784587064,0.010362614911453965,0.08360512366891272,0.003698267502405021,0.058623500574524694,0.011157107732793747
https://www.youtube.com/watch?v=pRUMC7JCkeU,guybillout,0.09630625464329992,0.011329880395854676,0.04875671029421365,0.0038752747590244012,0.04513065675341386,0.010475818577266005
"I can imagine the cop at the end saying, “DONT do it again.”",AverageCollegeMale,0.07607930157410621,0.007498225099292961,0.04114306491317663,0.0034800029653997287,0.03149398337434001,0.010097824358030666
The most Louisianan cop I have ever seen. Coonass if you will.,Jilgebean,0.13612029164827313,0.00943390211008469,0.049397410373756855,0.0043549783097640545,0.05232124355586794,0.010468318154443509
“It's hard God damn work!”,ngunray,0.23512847826379166,0.011031949253128745,0.09720098036279042,0.0038465082198982713,0.07699718919683793,0.010871639088187213
The shot and stretching is what gave him away,LordOfKhaos,0.15735655316262678,0.00976183087972746,0.05702033666590886,0.003963115167958525,0.05706834383616894,0.011191103638826996
