comment,id,toxic,severe_toxic,obscene,threat,insult,identity_hate
Except the part where he did and got killed for it. Yeah minus that part he did not reach for or around the gun,WorkingClassAmerican,0.08405372620922946,0.007343468768406486,0.03791459097683657,0.0041204055758621,0.033343372520766135,0.008519949960638474
"He didn't reach for the gun, though. The cop requested he not reach for it and he very clearly agreed not to reach for it. Then he did not reach for the gun.Stop trying to make up what happened.",hangoverDOTTED,0.04602673941820532,0.006170431794907448,0.025523354350704425,0.003427776584463553,0.0226738584490531,0.006738875502110116
"In very jealous of how you think. It must be nice. This all started as a shitting on cops conversation and as usual the worst example was picked because you people have an agenda. Want to talk about a real case where a guy was obviously murdered by the police? Great, there's many out there. This is not one of those.",WorkingClassAmerican,0.1041833033634006,0.005768876537403795,0.03716869694203855,0.0029633911224030847,0.03412024576401569,0.007448118512318238
Except this is a case of a cop murdering someone for doing exactly what that person was supposed to do.,hangoverDOTTED,0.06596910753519372,0.006211194176538357,0.026472163082152653,0.0032224241668325194,0.025735026976044555,0.007472785764678806
Reaching for a gun isn't what you should do when you get pulled over. Just thought I'd let you know,WorkingClassAmerican,0.1434731874800429,0.00936718912552766,0.06362651140908551,0.004288654456376919,0.07248093766528728,0.009898979162024315
"And there you go again, making things up.He didn't reach for the gun.",hangoverDOTTED,0.12365885835038556,0.010099727102326681,0.04618651756884711,0.004480900781711449,0.050254278634711824,0.008892088892625162
Go reenact this in your car and tell yourself how obvious it was that nothing happened some more.,WorkingClassAmerican,0.15266874762831448,0.00931926580443455,0.05071119767052405,0.004445055480837621,0.056199367503181843,0.009592126090060679
Go reenact this in your car and tell yourself how obvious it was that nothing happened some more. It seems to be working so far.,WorkingClassAmerican,0.10586124476676412,0.00857384446645255,0.042993319867435736,0.004132964910995705,0.04572404790962099,0.008799419406078004
There is no need for re-enactments. We have video.I'm done though. You obviously are just trying to gaslight everyone.,hangoverDOTTED,0.07648454601895673,0.006309671609891943,0.03487479517453013,0.003206527440598899,0.03967084765431462,0.00891940145957808
Bye sweetheart inshallah,WorkingClassAmerican,0.12337281659020405,0.009703622555588987,0.05202510115138384,0.004010530404336992,0.05387401186563725,0.011002983642211391
"Lol yeah lets talk facts, like how the police aren't trained in de-escalation, are militarized, most worship the vigilante justice style of Marvel's The Punisher, think it's US vs THEM, will defend their coworkers regardless if said coworkers did anything wrong, have been caught multiple times on tape that they then tried to destroy planting/manipulating evidence, and find no wrongdoing when they investigate themselves.If cops actually cared, their unions wouldn't spend millions of dollars trying to keep marijuana from being legalized, or lobbying to keep civil asset forfeiture from being changed so THEY'RE the ones that actually have to prove the money was from illicit sources.You're probably right though, this pig was probably way different than all the rest.",My_Ex_Got_Fat,0.04568572930233889,0.003943206593491412,0.022042733512870963,0.0027560370273417944,0.020264642284416212,0.0064460669052455065
I haven't seen someone take their seat that fast since 5th grade.Something oddly wholesome about this entire situation.,AfterReview,0.06738781672118915,0.006404904052666576,0.03150751157400291,0.0029999270687209043,0.02846522304818674,0.007698116403216093
I think it had more to do with the fact he had the money to afford court-side seats.,ImSoBasic,0.07290887658210844,0.007135109702628587,0.033600039353916616,0.00343646068824628,0.033626494227362025,0.009486194251553918
Username checks out.,Ass4ssinX,0.09324370514158993,0.01122972707202977,0.04541990408588974,0.0037169841305152124,0.04597630125359294,0.010851028172374164
Victim blaming bullshit,sarcasm24,0.374613566837509,0.012476191524174904,0.18650545563889243,0.004161617814099023,0.08124090658086251,0.013128779984621631
"What? I don't think it's blaming the victim, you just have a better shot of getting away from the cops without consequence if you completely cooperate. That doesn't mean it's always justified what happens if you don't cooperate, just that cooperation lowers harsh consequence. Of course there are times that doesn't happen, it's a generality, there are going to be exceptions.",incharge21,0.07264525885349805,0.005069001849659797,0.032287723377547914,0.003109911299147269,0.026960340232280267,0.006354978002897225
Sometimes its the victims fault.,Im-A-W1zard,0.0856156225810131,0.009449345105036104,0.03934959409325233,0.003614116444352273,0.03745418685819469,0.010549289480081868
That's not what the word victim means,sarcasm24,0.07018140852440163,0.006446415657553496,0.030985589365209086,0.0030729808230712304,0.02467667324379024,0.00781271297751197
"If I ask someone to stab me and I get stabbed, am I not both the victim of a stabbing, and at fault?Ever hear of The Darwin Awards? Those people are they not both victims, and to blame?",Im-A-W1zard,0.09973275384835786,0.007614440864270053,0.037166622445005945,0.003484646726261061,0.03859427238167669,0.009673970236273186
"Also here is the definition of a victim ""a person harmed, injured, or killed as a result of a crime, accident, or other event or action.""It says nowhere that it can't be their fault.",Im-A-W1zard,0.056133704761887504,0.006015389709201529,0.024031103728628156,0.003316827062541166,0.024585158520530948,0.00751609521625236
A few bad examples you see on the bias driven hate machine (media) isn't indicative of the rest of the millions of police officers.,Bubonic_Butters,0.09612733574750255,0.007536868408381638,0.03267675113738213,0.003510495655909708,0.0371555599627432,0.008533889701966411
"Dude, I know what you're saying, and I'd agree with you if it wasn't so fucking hard to punish cops who make terrible choices. Yes, in any group of people you're going to have some assholes that ruin it for everyone. The blue shield is just too strong and a significant number of people will defend the officer no matter what just as you have those who will blame the cop no matter what. In the army we didn't have a union to save us. We fuck up we get punished. It wouldn't necessarily kill our career but it would hurt and it kept you in check. We didn't have this blue shield to save us when we ruined people's lives. A staff sergeant in my unit accidentally shot his rifle on base. Dude was canned from his job that night and reassigned.",niuguy,0.4126242675532858,0.017595608122612596,0.22699568255596755,0.006322828482978541,0.13931149280412267,0.012413790675637686
"Except for the fact cops generally get found not guilty by civilians when they go to trial and people still get angry and blame the ""Blue shield.""",ChrisGaylor,0.12937831512619102,0.00819876782148573,0.04563852469753174,0.0036890497566615522,0.04371993223345639,0.010505613007487416
"True, it's a bit both imo.",niuguy,0.1116794192913456,0.010373580922575162,0.058534123084573564,0.0035292733192199013,0.05340528187273943,0.010286031706883948
"That's a fair point, edited.",4_5_6,0.08073043073786837,0.007638704720754305,0.03628459768841518,0.0031958531795619103,0.03164057678424838,0.009344713467793433
"Yikes! That old narrative again? Take a few minutes and go research the citizen complaint statistics against cops before and after body-cam testing. It was (is) far, far more than a ""few bad apples."" We can put apologists like you out to pasture as your opinion has been proven wrong EVERY time a new body-cam study results is released.",thenhe,0.0693626014652676,0.00637400736066257,0.034940741650551776,0.00329465246288949,0.03516099783504667,0.008660294358479119
[deleted], ,0.09502247768760716,0.00940936318058241,0.039266305361672194,0.0036465953230684247,0.04498680653263952,0.008979608278197769
I reject your surveillance state and choose to rely on the humanity of my fellow people instead.,ruok4a69,0.1343740389030593,0.008846610292195137,0.043766943100316126,0.003938265220120532,0.05632055284001087,0.009791605217114842
yikes...,myeeeeeeeeeeeeeeeers,0.15096825917331563,0.010922610900838911,0.059013107323284866,0.003831017336604929,0.059642138278301025,0.013426456823939347
"You realize that just because you think something is a good idea, doesn't necessarily mean everyone agrees? I'm all for “watching the watchers”, but you don't get to watch me. What I do is none of your business, and your statement re: surveillance of citizens is chilling.",ruok4a69,0.1262386468206069,0.006730520675272409,0.0544252108084666,0.003483012420065211,0.05099861449656644,0.008517969033307734
"If a cop is watching you with their eyes, *you're literally already being surveilled by the state.* The camera just keeps it objective. I trust the digital camera more than I trust the cop's meat cameras.",Mocha_Bean,0.10137325274877348,0.007775274560354534,0.04582049928803956,0.003480403404306236,0.04491893075495872,0.008715522471067124
"- We explicitly trust those people to watch us to some extent, with many, many restrictions, which restrictions I'm quite in favor of. - I wasn't arguing against police body cams; I was arguing against general surveillance of the citizenry (a la London). - The cop's “meat eyes” can only pick up so much. I don't need cameras watching my every move and streaming it to the world. It's not the world's business what I do.",ruok4a69,0.06531038772015221,0.005248080412184863,0.03269851512708603,0.003091007840190242,0.028375815801984245,0.007493355571013538
"""Streaming it to the world?"" What? You think they've got it up on facebook live or something?",Mocha_Bean,0.15946951383368943,0.00809118856395831,0.06153833605095481,0.004125584967109802,0.06257517913550693,0.012091460674704936
Many surveillance cameras are streamed live. The city nearest me streams dozens of traffic cameras and at least ten street level cameras.,ruok4a69,0.07472796580715947,0.0077239589807438875,0.03546918760579561,0.0035395247488590664,0.033771898328044996,0.009835052495894748
You got more conformation bias than a 90 year old Fox News watching granny in rural Alabama.,speed3_freak,0.08972441502444592,0.00993374454353178,0.046217823249878914,0.0036093362162126514,0.047341502195931556,0.011403937846770018
You got more conformation bias than a 90 year old Fox News watching granny in rural Alabama.,speed3_freak,0.08972441502444592,0.00993374454353178,0.046217823249878914,0.0036093362162126514,0.047341502195931556,0.011403937846770018
"Yeah guys, cops are full of integrity.",pistilpete,0.18388065323476158,0.011351332260142054,0.0795436313839477,0.003861633846524268,0.06967609747425578,0.013120695427745153
>SIT THE FUCK DOWN AND STAY THERE,LeeroyOfHouseJenkins,0.8732565598120219,0.11571818387144822,0.8337997833112961,0.007900921734707144,0.3909495131347316,0.034307140505376914
"He is probably either important or with someone who is. If this guy had been in the cheap seats, he would have at least been asked to leave if not arrested for trespassing.",speed3_freak,0.04758741886788552,0.005633492137240296,0.02600902411491355,0.00303329109672494,0.027521905446060837,0.007470097105365929
I feel like he handled it well gave him a stern finger point. I don't think the guy will do it again.,91seejay,0.13304823098795338,0.007195557728150003,0.04617841598580404,0.0036799287755599785,0.04329488850459554,0.01092760398537894
Finger + old guy mustache = authority.,Painting_Agency,0.1563238121925902,0.011312870979312594,0.0535530489350177,0.0037353025917493485,0.06309755300213697,0.013182976100232287
So that was my dad's secret all these years. The goddamn mustache.,Gella321,0.12677012235153623,0.008306376458672887,0.05865254773538206,0.0036895822349599554,0.05005461084843086,0.010152589867200825
Sure sounds like my uncle.,Tparkert14,0.11446975040552168,0.010170977745185978,0.057058504697345074,0.0035794350888267434,0.060439284812420974,0.01348181710527219
How often did you get fingered by him?,AthleticsSharts,0.11694369412339777,0.010415283350257303,0.05299273209630599,0.0038515274448674562,0.049247017140781016,0.009388972777586362
> gotta pay the troll toll,Boston_Jason,0.1661861159845677,0.009703790381025408,0.04827527253099713,0.0040759467113095265,0.05528265366296883,0.011323020026503162
sometimes that also equals sexual assault though,DickDastardly404,0.12865418595126055,0.009219131767280182,0.047558343598317954,0.0037411236249270024,0.04817431173211527,0.013088799097987927
"""Nice shot, hayes. Don't ever fucking do it again.""",fantacyfan,0.7863824300871071,0.07421266518749536,0.7429772995041503,0.008715451995196329,0.41642464591907735,0.031227969847349945
"Honestly that guard was real cool about it. Could have potentially kicked the person out but just escorted him back to the chair and said dont do that again. I think if you are the person doing this, this was the best possible reaction you could have gotten from security.",vVvMaze,0.08489064114828383,0.005730716602817442,0.03868161822038153,0.003292738629768269,0.03642026354460264,0.007983697815180185
At least he didn't get kicked out of the arena,MrSnoutfair,0.11049162270128139,0.008802643076200602,0.048685007121526735,0.0035820989130601923,0.04288731607785724,0.009304927633796143
This motherfucker has every last drop of my respect. If only I had his balls... That smile at the end ... that says all I need to hear!,tinglingearballs,0.22829536846684426,0.016696234288135797,0.12675533106450548,0.00467719141890858,0.10112767622948879,0.012182302671167076
Turns out all you have to do to get his balls is do some uncoordinated active stretching for a few seconds then call for the ball. Someone will then pass you his balls.,Electric_Tiger01,0.17875397602094226,0.008981824304529849,0.061328555040267414,0.004470259117073776,0.058758068124635514,0.010021109730371867
and that's how I met your mother.,funkmastamatt,0.3003202436449637,0.01715549713774685,0.11742676579830691,0.004779124359487766,0.12768535971162215,0.013467312472414629
He just sat down like it's no big deal lmao,eesamanomercy,0.21250855149023773,0.009470790835190217,0.0845652738737497,0.0035650982324620536,0.06959055898771496,0.01287571594062545
"""RAIN DANCE!""",uoYredruM,0.11520650542001136,0.011249495322639242,0.048285077847028735,0.004168804275459156,0.04748537498011248,0.011226671551920775
Kobe more giving and in a pass happy move. The Shaq sit down a bunch.,MiamiPower,0.13042449216890925,0.010236979004359397,0.05849665485228965,0.0038324646456461965,0.05877825468904111,0.010801167714871147
[deleted], ,0.09502247768760716,0.00940936318058241,0.039266305361672194,0.0036465953230684247,0.04498680653263952,0.008979608278197769
"well yeah, people sit court side every game. hardly terrifying my dude",wizardsfucking,0.20793037473454934,0.01001586876986587,0.07639923844169004,0.004044880369965195,0.07916715546580862,0.012382015734810476
TERRIFYING! HUMANS INTERACT WITH OTHER HUMANS IN AN UNSANCTIONED MANNER FOR GIGGLES - IS YOUR CHILD NEXT?!,__-_-__-___-__-_-__,0.14444519098482542,0.009820184733294298,0.04765391892425177,0.0038113686997566978,0.058627278930094034,0.01155195599209041
IT'S 9PM. DO YOU KNOW WHICH MOLECULE OF AIR YOUR CHILD IS BREATHING RIGHT NOW??MORE AT 11,smashsmash341985,0.1908463709823713,0.009810504151251823,0.06326430741711067,0.003969570176614079,0.083157150571931,0.011555419504539078
Whats to stop some lunatic sitting courtside and running out to kill some player before he kills himself in front of the stadium?,Fuckoff_CPS,0.20199812047366764,0.010202600723337276,0.054815324915698405,0.0074207511322365175,0.054806072430354916,0.010566578082484367
"That sort of what-if is what keeps people indoors, out of abject fear that they may be killed by a twenty pound frozen ball of shit dropped out of an airliner.",SuperKato1K,0.29906292496070636,0.012920976532126323,0.13331385586787947,0.004331411359280283,0.08479430491033733,0.012799433798809753
gonna have to stay in the basement too because those things can penetrate a roof. actually an underground bunker would probably be best,wizardsfucking,0.09150924277300294,0.0065592412139288524,0.041324336356312504,0.003631802542391603,0.042384131102006214,0.00880123975519765
"OMG that's a thing?!! I was going to go to the grocery store to feed my family, but now I'm staying in for the rest of the day",somethingpunful,0.09801493428666942,0.007678633849170289,0.043995213364370775,0.004295252704736547,0.03829324055308669,0.008790305141653267
"Yep lolhttps://timesofindia.indiatimes.com/city/bhopal/Stink-from-the-blue-Plane-poop-hurts-woman-on-ground/articleshow/50476552.cmsThis Indian woman was hit by a frozen brick of shit and piss. It crashed through her roof, so she lived, but if it had struck her outside they say it would have crushed her skull.I'll add another lol, because I think it needs it for some reason. lol",SuperKato1K,0.16947268423252063,0.01008218653755791,0.08669869485967281,0.003809740809565981,0.05750924177755573,0.010877701565897489
Well they have metal detectors to keep people from bringing in weapons.,skoolboyjew,0.09957215488056113,0.008834880335842073,0.040329483964460136,0.0036214074375079865,0.04426962692372309,0.009550433211124958
I love how he got the ball,ciocanmihai,0.15369922183689397,0.010563237936983196,0.06297006626931846,0.003924067961942448,0.0419677453202154,0.011597377792690277
And I love how all they did was ask him to sit back in his seat. I expected him to get tackled and carried out.,Saneless,0.12421429144741569,0.008865694956270669,0.05568989216570356,0.0035676330585205484,0.03811795777399798,0.009508695012373431
"This was my favorite part. He clearly wasn't a hazard, and was cooperative when thy told him to sit down. Hilarious.",FreeRideJunkie,0.10645278528993242,0.0070661814185848165,0.04169119167434616,0.003327891612573716,0.04053005510496442,0.00873944390929493
Guy originally had nosebleeds and got disciplined with courtsides.,SeattleMana,0.12196154261568966,0.008019347096659097,0.044288751163128526,0.0037476495326215975,0.047433073445016745,0.011884527383609853
"“Sit here the rest of the game and do not move”“*Sweet!* I mean, yes sir”",FalconsSuck,0.07438358612735294,0.007368944811408444,0.035602727825179606,0.0033928259150262123,0.03550318104960867,0.008640803753976566
[removed], ,0.05131823102544297,0.008121130863365014,0.033324453331462695,0.003353176445564288,0.028601077255820864,0.00802195078481025
That pic makes me sad everytime. I wonder why this wasn't on national news when it happened. He was just a boy trying to have fun!,CaptainDogeSparrow,0.09523590460927256,0.006844636165062783,0.04102710622982284,0.003247370404523788,0.03931900561709875,0.008886885949793219
"I wish I could un-see that picture, such a tragedy. He was just a boy.",sillyblanco,0.0970257983014561,0.008547571798000645,0.05033949794977453,0.00358917788403182,0.05183391242116611,0.011013752966624997
Thanks for the heads up.,I_Am_Ed_Edd_n_Eddy,0.03560006423339676,0.007239879969488193,0.022145109510841865,0.0033497420318916848,0.021018173579017137,0.007213095994600987
I think everyone needs to see this picture at least once.,Percussionist9,0.040110965401060225,0.007085769995429386,0.026274458399306005,0.0032566504429584566,0.029111788077800436,0.008506076381841338
This comment made me actually nut-up and go back to open the image in solidarity with you. You. Fucker.,CrimsonNova,0.2857477009185248,0.02088883440961528,0.15586471700356638,0.004928403254092781,0.13019031004143192,0.015494012425214448
"I know it hurts to see, but at least you know now how important this is.",Percussionist9,0.08208313541402264,0.007993980974039413,0.038456382682878106,0.0035694508390279856,0.044082408550443236,0.008650176403364077
I think everyone has seen this picture at least once.,RalphIsACat,0.04926848027444363,0.007199190385333147,0.028040784732903706,0.003263832740334439,0.029460526413477482,0.008595195021440592
It's worth a look.,CudaDisagrees,0.09117944841497407,0.008197750206311812,0.036467756385519995,0.0032650904599017443,0.03906095302799217,0.008857377870049912
God damn it.,mysticsavage,0.30566096289264283,0.013091262972262572,0.11680666032367848,0.004392708240394216,0.10273966587954105,0.011939143992510417
[deleted], ,0.09502247768760716,0.00940936318058241,0.039266305361672194,0.0036465953230684247,0.04498680653263952,0.008979608278197769
"I followed this far, do I click it.....or do I not?",zSplityy,0.10170333639079832,0.009855234744784211,0.05745979203137667,0.0035485104987602128,0.050813083531744706,0.010935486328929959
"Don't, I certainly won't look either",Yourwoman,0.08795253331668196,0.007310144054304239,0.03671463279751622,0.0032629809197010848,0.030889733477257812,0.008030182217076173
I looked. I won't be sleeping for 17 years and won't eat ever again.,zSplityy,0.13222007216394088,0.009481775452098285,0.0554074900556982,0.003954825834942956,0.054138892023864946,0.010067125858340869
Yolo,GokudaGod,0.1456639336247264,0.012572728814380398,0.06314672993675234,0.004249163789921468,0.07244429792296644,0.012293361039866292
"I bought the whole story until he linked to the picture. Then I was like ""oh... It's going to be Manning face, isn't it?""",vbullinger,0.11011796147089943,0.007317667904115166,0.05000307350790303,0.003890188265598115,0.04732399606016268,0.009475608828310209
#,YOU__DESERVE__ANAL,0.11371379335576753,0.011712838364398735,0.05077420160094964,0.003987155863626817,0.051809483641988244,0.011852263346932363
he does deserve anal,KingKreole,0.12647537945720538,0.00900353061702619,0.050583825952748164,0.004466589069725059,0.056487969881934295,0.010748897566402417
More like a heads *open*...,ItalicsWhore,0.22375899176503677,0.011087508536183366,0.07744390274696326,0.003802298499360127,0.09429219821991495,0.015003045800464337
Take your upvote and head out!,iismitch55,0.36983671366683607,0.016642643975125215,0.10736485310454019,0.005701454963007955,0.15298944500612194,0.013745209745808604
Nice joke you cracked there.,iismitch55,0.2351210113715023,0.012750387398456879,0.08525612384302385,0.004396417006061581,0.09313905721558441,0.011993122322280126
Wrong kid died...,shaven_neckbeard,0.1978095163819357,0.012256922116699986,0.07280715119316523,0.005078844318252609,0.06382438141459816,0.01187008517970055
He had a bad case of being cut in half,-fuck-off-loser-,0.12416204040712046,0.009855522476947572,0.05278274742211149,0.004251989671177943,0.05144522416741773,0.010167799052168398
Why are you like this dad,Rocketterollo,0.43244594428371247,0.014946651706046102,0.13465694978690126,0.004295666995206523,0.1616120360289034,0.01987295994093865
"Mmhmm, he was just a boy. Shouldna done that, poor little feller.",Ducman69,0.2121159597856557,0.010001036702980696,0.08095850630709761,0.0036400247073873336,0.1002685462968877,0.015048027916527457
Another sad case of police brutality. Where does it end?!,kliffard,0.08068318592187919,0.008038431846373218,0.032787834378500955,0.003263681266867179,0.03839118421828736,0.009309908836057808
I hear his brother stole his pail too. So sad.,Wildelocke,0.1484800082510581,0.009971851146670294,0.05731826868530594,0.003951127691701186,0.06584128152758702,0.0119391034170765
he was a skater boy.,doodruid,0.1389128255277598,0.009574950725697685,0.05767700046743458,0.0036785662791774167,0.06573858639545786,0.01434849049178983
I like where you're going but it just didn't fit champ,imakedadjokessorry,0.2432788683716105,0.010749893325001763,0.08605434619088038,0.00475440824077541,0.08893427799920745,0.011483690860099968
...she said see ya later boy,MrRezzZ,0.12891387043238967,0.010980093695915284,0.06319123433208039,0.004113196767060698,0.06853174856200178,0.013891708532999772
He wasn't good enough for her.,embryone,0.0654372015178727,0.008323678467634142,0.03670167972281119,0.0032644009184173923,0.03648174381446934,0.0086000030187192
Can someone share a link to a story that doesn't include a picture? Based on the replies I don't want to see it.EDIT: Never mind,Lefty21,0.05743139222759643,0.005278300035912258,0.026976537817494657,0.002721988059822806,0.02683431396642404,0.006874337886893352
A picture can speak a thousand muffled words,MisterDecember,0.07588560715499362,0.009274513738654476,0.03839460954094943,0.0035939611978359942,0.04459510757009794,0.010872607589095945
I'm not Mann enough to look,The_BromanEmpire,0.07826848136759884,0.008068118779658807,0.03566644011005919,0.003601646750162481,0.03434543584605599,0.008928901590163575
You....you...,TheWizard01,0.23692546642223616,0.012719831592552773,0.08023508199625971,0.004303591927407409,0.08992805445928312,0.014109157500883
Not not Leslie Mann enough to look at it,imdirrrrtydan,0.08230014793222909,0.008439007679258979,0.0343891381835782,0.0035140801735915493,0.03840755553840759,0.009720075645331705
It's really worth Manning up and doing it. It'll open your eyes and make talking difficult.,BlueFalcon3725,0.12434799357073431,0.008842532275783143,0.054186499292411656,0.0043265930559369965,0.051544127581627616,0.008542794329221703
It was at that moment I realized what was in the link and clicked,zbeara,0.059998214592977175,0.007171871517668489,0.03267972240207073,0.0031747725800480753,0.029228044237374216,0.008471879584820005
Someone would have to Pey me to look,notake_onlythrow,0.06482747855868667,0.007261076986135459,0.024078903428401598,0.00332340729774909,0.028681918924082127,0.008696421230727114
