comment,id,toxic,severe_toxic,obscene,threat,insult,identity_hate
A lot of people don't know that this is comedian Tony Roberts lol,veeno__,0.10025543750014689,0.006879316331005593,0.04464847555483773,0.003082173465538192,0.036849464225841226,0.008365676390609244
"Thats how your uncle asks for a shot, then airballs.",Yeebuss,0.14027427183117513,0.010422521977687576,0.06319202617251747,0.0043197566746793785,0.06020092968349698,0.011588810575425141
Someone find this man!,pencil-thin-mustache,0.10722440893326138,0.009245030138538779,0.04181594292584997,0.0037134959862295254,0.04174502040257861,0.010704586828243219
Probably some kid playing ball boy.,Karl_Marx_,0.18226945291271127,0.010894448521586273,0.06825963039334143,0.004063704734770103,0.07041485477927564,0.012544691543813052
Hey Pelican fans are just trying to help out their team. Cousins got injured and out for the rest of the season so the fans are stepping up to fill his shoes for the playoffs. The guy in OP had his chance and was immediately thanked and they'd get back to him.,monkeybrain3,0.08308009416945501,0.006291218561142644,0.036890358739458784,0.003249895311031727,0.03186488322084905,0.009384585671630556
r/actlikeyoubelong,BismuthCurious,0.1450208118183988,0.012974699814930235,0.06185835725047997,0.003977611495697565,0.07139497608032165,0.013734751964200187
I love how the cop tried to give him the shaming finger... As though this guy cares what you think old man...,northbathroom,0.1852191339591824,0.009458028876074737,0.06380360538372837,0.0035539587970908984,0.059115328740446,0.01233165262087909
I too enjoyed the gif,whoooooooooooooosh,0.09358952420095935,0.009136643642152114,0.040252288384567694,0.0036640870479709687,0.039492114222678294,0.010337300590572612
I love that he put up a shot rather than got shot,bradleygrieve,0.14149849349922483,0.0099941894956008,0.0584807031509155,0.004120629996534295,0.0429085534881475,0.010798994179349314
"""Sir, well done we're upgrading you to floor seats, now sit there and enjoy the game!""",BillsMafia607,0.14315310867187128,0.009752169794622364,0.055094166308707636,0.0039853164031084165,0.0658989202955233,0.010864835335163811
"When he points ""YOU are awesome"" ""Here's season tickets""",Encyclopedia_Ham,0.1508229934682978,0.010128199534115982,0.056426738472007944,0.0037097910133965573,0.06810161051120181,0.011620714012694105
Please someone make the gif.,fickit1time,0.05802221740837372,0.007718409772945014,0.03046553669007121,0.0032717043840124354,0.028921959396582923,0.008678154622263928
"Sure, I'll get to it later.",SexlessNights,0.06726219651368245,0.01080402119393095,0.03971300540043794,0.004650057387088188,0.03338359846964394,0.009419000741364328
Ah the old redditor-aroo,piponwa,0.08528600227892921,0.00947865799240744,0.03833147040918458,0.003471476137001462,0.04106224349776342,0.010288420791795826
"Hold my hightops, I'm going - err there's no link...",Double___Dragon,0.10723378111033927,0.00820740165609498,0.0435417135333642,0.004766773045782738,0.036273967811921,0.00953501134007351
its already very later plz,hellerzin,0.07755147814204136,0.00861122916760751,0.03957129734403299,0.003507349077565288,0.035323612080924355,0.009764121447787879
RemindMe! Later,Charishard,0.08731415635416652,0.009702645064592228,0.04002560074322196,0.0036988256216903643,0.039805468798120074,0.010153390825282759
Relevant username,Solomanrosenburg,0.0758421778060656,0.009460765568533074,0.03473573105696646,0.003521223219213429,0.03661923092512038,0.009903666150947095
a little late to the game but [here's the best I could do](https://imgur.com/gallery/R390EId),blairnet,0.07680407631238684,0.007617769628570586,0.033078871198891385,0.0033700642956041296,0.0360414347147446,0.00901151733914663
https://www.youtube.com/watch?v=3bAU0hfDVIo,addandsubtract,0.08651131827608771,0.010566663946965066,0.0429848617856232,0.00382726127955685,0.0408899349527057,0.010058000766118257
I can only get German captions and audio. I'm bummed man.,CJShort,0.09718273332422953,0.008446825281123067,0.04519827750236167,0.003713253547066325,0.04333384763017515,0.011681674319368613
"Yeah, I figured it'd be a long shot to post, but it's definitely fitting and funny if you understand German. Basically, the idea is that his boss is obviously pissed, but instead of yelling at him and telling him to get his shit together, he's giving out compliments. Things like, ""I've been keeping an eye on you all morning and need to tell you... what an *awesome* guy you are! I'm taking these to practice!"" – (while walking away) ""You're promoted!"" – (while pointing at his eyes) ""You have beautiful eyes!"" and the catch phrase is ""Hear what you want to hear – Deezer"".",addandsubtract,0.25634278642296504,0.00866186559194948,0.10272316254596438,0.0036735725290585504,0.0754546024867694,0.009760575585619227
"Agreed. I've already watched a sequence of Deezer commercials but I can't understand a single one. Except for the biker one that someone kindly translated.That fella has such a tranquil smile whenever he's getting yelled at though, ginger man must be screaming some very kind things.",frivolouslyfurious,0.0642759881917989,0.006655325482856831,0.03128689381102348,0.003276983477389081,0.028293312964162355,0.0073371706169326825
I'm sure the Pelicans just appreciate someone with that kind of enthusiasm.,CrudelyAnimated,0.05423171797406052,0.006344423281740652,0.031120839453197293,0.0032824315778861024,0.026564171217976343,0.007868117690232487
r/thathappened,purpgoblin,0.10060359025688488,0.011257406537674724,0.044603548056563004,0.0037436707297544627,0.048927919122704014,0.012293506462146766
"Says in a stern voice: ""Don't you go not enjoying the game!""",PooPooDooDoo,0.15649432163146268,0.009072008874699678,0.05602108396166537,0.003911788367537657,0.06190540043425651,0.010781980054562195
r/thathappened,Erlian,0.10060359025688488,0.011257406537674724,0.044603548056563004,0.0037436707297544627,0.048927919122704014,0.012293506462146766
And that officer's name? Albert Einstein.,CoolHandLukeZ,0.07613655618641947,0.008172183919075112,0.03791772461933702,0.0033853788513031006,0.036464407161503336,0.009375225209255062
Right then everyone started clapping,Stackhouse_,0.08204609981644735,0.00783752883838411,0.042660914098335674,0.003563886702247013,0.04082970930772084,0.010398782948432234
How nice of the cop :),JF_112,0.07533139629274803,0.009260219984292271,0.03927039426262045,0.003633277877873493,0.03584912306617948,0.010012215885027617
Smooth,partofthevoid,0.1336167154460399,0.011649101317957069,0.05087487328434081,0.00401058095769266,0.053287729992749465,0.011955241100745476
Enjoy this succulent Chinese meal on us,roogoff,0.12152169220344515,0.009780862120642761,0.04641010453826199,0.003608501278395629,0.04618849974457008,0.011029658996783778
GET YOUR HANDS OFF MY PENISSSSHHHH,Gurrb17,0.3988250019824027,0.01550698596268049,0.13370483309884676,0.0049340841954553325,0.13308544621759383,0.014730553586865895
"This is the bloke that got me on the penis, people!",Pioneerpie26,0.302227997437454,0.010005940314539582,0.10270371478778895,0.0036870107412084285,0.06146648552762785,0.012679677194375297
Are you wait to receive my LIMP PENIS?,SirLotsaLocks,0.35063605637217576,0.014860473383889568,0.12025431068297142,0.004595174952156227,0.10729858655482274,0.016371881990346882
HOW DARE YOU,GroceryScanner,0.35710173871660694,0.017942758222333776,0.10709865605659562,0.005630116168965288,0.1332234980705722,0.016392144402425222
This is democrrrrrracy manifest!,TokiMcNoodle,0.10893701635981991,0.009433144912379674,0.04697323801110002,0.0035835124869768643,0.0444879687991826,0.010809275251372593
ahhh yes...I see that you know your judo well...,dog_eat_dog,0.15596307343718596,0.010522770606528935,0.05530940407755872,0.00413956331898094,0.06765071131066286,0.01093406904742646
Are you ready to receive my limp penis sir?,svenhoek86,0.337488872130126,0.0145883433293893,0.12483420669784208,0.004435431845010055,0.11645154330211445,0.014078780079481332
I see you know your judo well.,TesticleMeElmo,0.20174533232901354,0.012997946449681018,0.07000017711294004,0.0046275636659077884,0.10127673784821511,0.012087590757330735
I'm under WHAT?!,Pioneerpie26,0.09200118434726588,0.00815906666824073,0.049576535508287736,0.004043886376411938,0.03976753465123677,0.009497146183744486
what? r/outoftheloop,plz_send_noods,0.14378735668396606,0.012034989446544785,0.0574708859124138,0.0037675999460776706,0.06467124856931311,0.013898100710113406
https://www.youtube.com/watch?v=XebF2cgmFmU,Joshyybaxx,0.08812861786808204,0.01068840069615365,0.04381821293374519,0.003854922807819947,0.04155601269194314,0.0102084839418626
thank you sir looooooooool,plz_send_noods,0.11411832853122471,0.012639008490282745,0.06462595680233955,0.004030949766038131,0.0796580728370746,0.01132577501750508
r/WholesomeGifInterpretations,sweetcuppingcakes,0.09439693321456774,0.011353307975921241,0.047357125572342985,0.0035017513336126726,0.053632411759588536,0.011791435366345488
"A reverse gif would make for a great make a wish story.""Local kid asked by cop to shoot around with NBA team during pregame warm ups""",NoSoupFor_You,0.09253594909623984,0.008594492464786375,0.03968748378426056,0.004206526203091736,0.03887956622172935,0.009718451607506054
“You're gonna have to teach me those stretches after the game!”,ethandsmith6,0.1612244748582242,0.010882384062105304,0.0639086258474015,0.004373962728961358,0.07569301234529045,0.012374152077601053
>- Wilford Brimley,anti_zero,0.09639048062512126,0.010034704628096098,0.045157951572542536,0.004194410272322388,0.046227291568163124,0.011041186201222686
He very obviously had a floor seat so “snuck onto the court” part of the story is pretty bullshit.,lolzfeminism,0.21011099776139724,0.010768932480265456,0.11885400811735117,0.0036383780869531615,0.05533414757058322,0.010465725924076246
"Dunno why, but I had a buddy in high school who somehow found a McDonald's uniform. Put it on, just walked in and started working lol... he got away with it for about 30 minutes before they removed him.",ChosenBrad1322,0.07703806200057611,0.006481319336204572,0.03318598052299456,0.0032561668058270895,0.03319924597671862,0.008173227507054752
"""Why don't you know how to operate this equipment?""""I don't think I was ever trained to use it.""",COMPUTER1313,0.09857141497662106,0.006547994524097753,0.04359004366531233,0.0033635633228488704,0.04109907709408338,0.008254797168989515
"Where I worked, they'd tell you to figure it out, then don't let you leave even if they find out you're not actually an employee",Merppity,0.13827796829247974,0.008581825397803786,0.06069335534726611,0.004195188360690189,0.06253895218481038,0.009354489802687469
"Let me guess, those ""Hiring Now"" signs were not merely decorations?""Alright, jokes over guys, I'm not actually an employee here. Guys? Guys?""",COMPUTER1313,0.0744434097601378,0.006873058123647175,0.03565079233778734,0.0032043932429144314,0.0323162412092047,0.008639010594473437
"I have a security uniform from a job that never panned out, a subway uniform from I job I quit because fuck that, and a reflective vest and coveralls. I'm just waiting for someone to suggest a heist where those 3 things are exactly what we need.",D33nMach1ne,0.22605197031478172,0.015686089625372195,0.1416910784934015,0.004003989872081813,0.07206471208287969,0.011334374425476405
I'm more than willing to help put this together,DeltaDragonxx,0.054808344152544264,0.006963055143906659,0.02774452881661961,0.0037925688753322577,0.02338237622985556,0.00782510327475954
Oceans 3157.,D33nMach1ne,0.10066264112149052,0.010703612959364735,0.0457357829324735,0.0037919196217365537,0.04575266536153196,0.011126917692887156
"Here's the plan. We find a mall with a subway. About an hour before closing, you sneak in the subway, and ask like you belong. We get some dude in the coveralls to cause a scene outside, I'll be in the security uniform to hype up said scene. While everyone is distracted, you open the registers, grab the cash, coveralls dude and I go outside to ""have a chat about public decency"", you just casually walk off. You sure our cuts into our accounts, we go to another location a few states over every so often to keep it up.",DeltaDragonxx,0.11182130406415894,0.007029776338832605,0.04108471226414355,0.0036389133338674516,0.04629158581992198,0.008584168573532423
Well make literally dozens of dollars each per hit. Brilliant. (If you think I'm not stuffing my pockets with roast beef you're nuts. Pocket meat son!),D33nMach1ne,0.21575855896906787,0.011106263465335295,0.08971098613663112,0.004303720270933054,0.08050279107874243,0.01125200701790421
"Hey, once we get this down, we move up in the world. I say we end up going full Union Depository at the end.",DeltaDragonxx,0.13831549113333869,0.00824410965811792,0.05513141477903346,0.0044384268770286915,0.04744876596713262,0.010821145218543859
"""Subway sandwich delivery. Got this order straight from the vice president of the USA. He says leave it in the vault and take what you think is fair as a tip."" ""VICE PRESIDENT PENCE? right away sir!""",D33nMach1ne,0.0756231830513084,0.006411780107931842,0.03534119597895255,0.0033236450354497595,0.03532777669429594,0.009007469149885122
"Perfect. After Pence, we go straight for Putin. He may look like a hard badass, but no one can resist those cookies",DeltaDragonxx,0.09942332949094632,0.008014607531542393,0.04413125502043365,0.003315649508695537,0.045587173372037826,0.010731552330815557
"Da! Come in, come in! Usually I don't let anyone in the presidential office where I keep my Russian bonds, but for a macadamia nut...",D33nMach1ne,0.0866140026931454,0.007468006744625867,0.04146695807279408,0.0035938125036157143,0.03830735051958998,0.009039497990764164
Who do we hit after Putin? Bill Gates? Elon Musk? Both?,DeltaDragonxx,0.14721001855695987,0.01022607873659374,0.055491258674388935,0.004325884691974036,0.05543327918060729,0.012248994563185437
Then I say we go back for more pocket meat,D33nMach1ne,0.1370514289771932,0.011754470178075599,0.06335388013696812,0.004077282542914512,0.056494899847884104,0.01183880370738037
I like the way you think!,DeltaDragonxx,0.23136239073502368,0.010949585181105862,0.07382761118113504,0.0037827736901367122,0.08627559599083624,0.014215875917454563
I kept a Police reflective vest I acquired. I ended up throwing it away because I wouldn't want to be tempted to use it.,WintertimeFriends,0.060294875688926296,0.0062039215443882275,0.028754469178210174,0.003318032331504625,0.026315751095104072,0.007476715015943615
"With great power, comes great responsibility.",theslideistoohot,0.06825115145024575,0.008649046400306677,0.03350345269192556,0.00346634789292635,0.03483287758532584,0.009583337871808595
F the police but who's stopping you from killing me?,FlawedPriorities,0.28369249905984684,0.013054853669702828,0.08392837984424868,0.005073110190943277,0.08275650455647092,0.011934182435625633
So that's why I found a police vest in someone's trash,DirtyButtPirate,0.09333649970107517,0.007386780748269058,0.03626332116946138,0.003308747360754451,0.03177873727600538,0.009055566684512063
"""Acquired'",D33nMach1ne,0.0900658481331398,0.010400833545646748,0.0426691574376373,0.003836706396853946,0.042784007051538835,0.01082494016321549
Right...,NSA-SURVEILLANCE,0.13137996334545166,0.009113975398280275,0.06716835046505354,0.003910754467243322,0.06641934897279707,0.013918382204516863
*the great philly steak heist*,LIVERLIPS69,0.08553649611989918,0.00924916229625752,0.039476033465703234,0.0038001498415859815,0.044448821208404675,0.01101008943080467
You would be a great heist team member in GTA V.,stratcat22,0.06633820519390755,0.008644165043413542,0.03701730283760537,0.003836024260247517,0.04070228173949324,0.009890989598995559
I own a car. And some gloves.,SleepyFarmingRIP,0.13177058265016778,0.010164817224752874,0.04709501096642181,0.003872926330483651,0.048761108745482014,0.011236223558644676
We should make a sub for planning heists,WildBird57,0.0976716681646876,0.009516360078877963,0.04450918493008463,0.0037754741755671633,0.04379197026611783,0.010682104495266574
/r/pocketmeat. They'll never know,D33nMach1ne,0.1156219321582009,0.01345163726543479,0.05884192893909623,0.0043601664488104545,0.05441653252108753,0.012052669393278979
/r/heists,WildBird57,0.13466134959567896,0.013066111213537769,0.05554561382028084,0.0038186732050605743,0.06302105641764277,0.014599840940400373
I feel like the subway one would be the hardest to abuse because there's only ever two employees in the store.,GlowInTheDarkNinjas,0.07801594430290475,0.006398016651217655,0.033000703953418975,0.003040841633446151,0.032195933213119705,0.008689661909008555
"Mr. Leland: I'm sorry, there's just no way that we can keep you onKramer: I don't even really work hereMr. Leland: That's what makes this so difficult",binzin,0.06536234739222185,0.0051365084207757004,0.03190074788691166,0.00287858040314681,0.02616233040555133,0.006009015724363825
"Two of my friends had reflective vests, and spent a solid 45 minutes directing traffic at an intersection during a big visiting week at my school. They even exchanged nods with a police officer they held up and then ushered through.",Xanny_Tanner,0.08152670228871817,0.007388336488242163,0.036764082719908914,0.0034746703733350257,0.0350212320867763,0.008974783811131341
"I work part time at walmart and one day some dude put on a walmart vest so that he could walk into the back. He went back to where the TVs were kept and upon realizing they have security wire around them, he attempted to cut it off. He ended up slicing his hand open and an ambulance had to be called.",Shanderson3,0.06751067792538717,0.006150702190610346,0.03090428670237818,0.003360431431066542,0.028053614673031402,0.007827720369805904
Talk about a fail...,ChosenBrad1322,0.09685863485368462,0.009032892670579013,0.04000778855630542,0.0033565956639801994,0.03746420836541505,0.009496204939101159
"Yeah. He had a solid plan, but the execution was botched.",Shanderson3,0.07473277770879845,0.007737392991508571,0.04120017564927618,0.003313718864239294,0.03676827178028134,0.009142856643133605
"He's almost there. Maybe the next time he tries this at a different Wal-Mart, he at least makes it the point of cutting his hand on the wire wrapped around the hedge-trimmers he's trying to use to cut the wire on the TVs",Xanny_Tanner,0.04502701074951535,0.005134190874213161,0.022009102285338884,0.003075015840382058,0.018281285577281946,0.006668570367634121
"It was a Ronald McDonald costume, and now he's required to introduce himself to neighbors",CptWigglesx,0.07639356497192577,0.007537313905142011,0.03145150105732813,0.003411257802508903,0.0318960957399973,0.008887541078389256
"Why not just got in, make himself free food then leave?",amorrell,0.11398139600804524,0.008008417571270814,0.04958082130920834,0.0034950635966915955,0.04592763321171628,0.009643808757858991
"Jokes on him, he just worked for free.",PooPooDooDoo,0.08433538162898577,0.007916863152901242,0.03988077922295928,0.003286430785522972,0.04099306138378203,0.008973115246823555
[Great episode](https://www.youtube.com/watch?v=bU6m5UqLx9M),Bartomalow2,0.07075843165648613,0.009764648236157221,0.03942774902928445,0.0037251334680946458,0.03702358972597701,0.009658555579110823
Back when I worked in sales I once walked into an empty dollar store and started working behind the counter. They actually had their best ever day of sales from the ~2 hours I was there.,Kid_Adult,0.05121466566191597,0.006800866030838784,0.02961928447354681,0.00341682959251441,0.027765438302378292,0.007944008958369336
“SIT DOWN AND THINK ABOUT WHAT YOU'VE DONE MISTER”,CockBronson,0.14217046675717446,0.008387459818025042,0.04923053822511315,0.0038636816956312578,0.0507485494235549,0.009966922058148125
That was expert level stern finger wag and point.,_WonderBeard_,0.07587875863642947,0.008256289262643834,0.03325897524954793,0.0036043031289159466,0.0320591682491444,0.009743267885692417
Its called power wagging you simpleton,Kosherlove,0.20471835758325688,0.011690179415844557,0.0732003690996687,0.0041384280254972506,0.08660124551954304,0.012329746489686336
"""Yer lucky we're not on the streets boy!""",cake4chu,0.1458362917615843,0.010781247956491588,0.07230297715218353,0.003710040754534509,0.0694244588715036,0.01262261246662701
/r/ActLikeYouBelong,ThatGuy0nReddit,0.14420725663615003,0.012951281488196553,0.06150619852162169,0.0039736178316340165,0.07074462408941351,0.013709531407306052
"This guy does not look like he belongs, but at least he's trying!",phl_fc,0.12709382168866148,0.007064387751746727,0.04485233836609109,0.00291358539024812,0.04843972286559406,0.011226427489700524
It's all about confidence my dude.,DickIomat,0.12768709805470363,0.008912784669609932,0.049126433839258354,0.0035722909075759897,0.04852501664329381,0.010042557407877446
"> It's all about confidence my dude.I firmly believe that if you have a hard hat, safety vest, and a clipboard you can go literally anywhere you want.",originalusername__,0.16623383573463563,0.00862887431718752,0.05939016817710429,0.003906272743581366,0.06966858973764939,0.011125223725687824
"Or a suit/tie, depending on where you find yourself.",Heyo__Maggots,0.21137315436411155,0.014372374763471467,0.07203087919417621,0.005366207157242845,0.10214055424325667,0.013043311616227507
"What if you have a suit, hard hat, vest, and clipboard",Tubarob42,0.1433056391480772,0.009813761395758156,0.058879634376569685,0.00388953055739626,0.06283382327713545,0.011830424811811726
Then you're literally a god,Volturnous,0.28921407465942384,0.013214568414342329,0.0835675038076505,0.004553920693826265,0.12950620266520413,0.013000816278923494
Thats how I turned the tables on them probin' aliens.,advertentlyvertical,0.07233220074986636,0.007607393117129438,0.03394121524784328,0.0035236606281892056,0.03144242585411904,0.009423528912885799
"""Sorry, I can't let you guys probe me. I still need to check for OSHA violations on this ship before you're allowed to continue your operations.""",daOyster,0.09248510001238802,0.009142133197017696,0.04471351582453413,0.0035764653102793504,0.05519779920257857,0.009346372840412946
Why the fuck are you talking. Just feign eye contact with everyone and walk at a fast pace.,DragonBank,0.6231955547386586,0.04050752719253232,0.4788128396270853,0.005585606890713134,0.23045581529817205,0.021498269999103363
"Also, talking just makes the aliens try to probe you harder. I think the dulcet tones of human speech really activates their gonads.",advertentlyvertical,0.12205955163998522,0.0071901299541907195,0.04652260768104623,0.003589728489885003,0.04896320970590213,0.009082219143126536
The illegal ones or the extraterrestrial ones?,ballsdeepinasquealer,0.06601851838660017,0.00796696103899044,0.030651812843406994,0.003519254979543661,0.028952261997088898,0.009529414311773282
You ever have a Mexican try to stick a churro up your butt?,advertentlyvertical,0.3640239934624944,0.015528586540083978,0.1290555396672939,0.004707494272569743,0.12442674413508363,0.014643221965422257
"This is the ""God of the factory"" ensemble. Also works in large warehouses.",Cuckius_Maximus,0.07761782614148702,0.0069672862456109244,0.03393758455800751,0.0033778353366186492,0.029084813852223033,0.0085664960531981
So an architect basically.,ByuntaeKid,0.11459423901868356,0.009557640114209238,0.046451914393557225,0.0036769447365638907,0.047654888881558256,0.010702325815133659
Can confirm. I'm an architect and all I have to say is I'm with the architects office. Free reign to the whole building. Depending on the type of building that is.,ksoltis,0.05701886673247386,0.006348120155132419,0.03177889157531062,0.0033195779693908894,0.026485708013583836,0.007816500498545225
"Then you're an engineer, and you can go Literally anywhere.",ionTen,0.23114859740882804,0.012706111654427458,0.07696834138087469,0.004392332858085125,0.12039167992857294,0.012604623166579529
Then you're a stock photo model,not-working-at-work,0.2776830437356287,0.016935251767572917,0.10429971990138384,0.0043248346108985996,0.1386364939347338,0.014166506289532825
Unstoppable Force,BobSagetsWetDream,0.07607442907510671,0.009792464981996247,0.035640693946128434,0.003738020891801607,0.038718419776872015,0.010222853927516255
Oh no. How will I handle this immovable object,Tubarob42,0.11273344432923145,0.008383580282472268,0.04019726371912652,0.004033645197856269,0.03884501717333844,0.010128644505213405
a suit and tie is insane. I sold insurance In a suit and tie and a name tag. A little training and people just open their doors up and and give you a check. It's honestly crazy,amagoober,0.2214791144635223,0.009212266587063573,0.06274542128540771,0.003932740608182316,0.08121697206278712,0.01047775823428098
this is so true lol.,fromtheill,0.12345100644453853,0.009433308063169778,0.05183993320962584,0.003435792614436091,0.05090111264260935,0.01199698705014812
"Can confirm. Work at steel plant. If you have a clean hard hat and keep your uniform clean and in check and carry around a clip board, people will not say a word to you. And will actually pretend to work when you walk in. I do it often. It's pretty funny.",Knight2043,0.11223628179823414,0.0077859087149094374,0.052634057794049595,0.0038322309708185105,0.04562091476366912,0.008889353620333914
Or a ladder. Nobody will stop a confident person carrying a ladder anywhere.,Fluffcake,0.15426084769783163,0.008719479759209458,0.04826696948925939,0.004287226557219691,0.053853529588783124,0.010245836579110516
"Pretty much any heavy object. A mirror or whatever. No one wants to be the one responsible for causing an accident. Find the office water cooler, hijack a thing of water and carry it around. Questions will be nullified as long as you don't make too many passes.",IDontDownvoteAnyone,0.06435847683666182,0.00630427327467646,0.03816985806314325,0.0034359472542118447,0.03204818414995894,0.007466491073571411
