comment,id,toxic,severe_toxic,obscene,threat,insult,identity_hate
That must have been a pretty bad shot to make the guy under the basket turn around like “Who the fuck just shot that shit”,Chinchizard,0.755146061655251,0.04790263393077191,0.6499715374946022,0.005748281273346125,0.29917350626763656,0.024673868757751728
If you ever watch nba warm-ups they make like 90% of the shots. Even the (relative) big guys almost never miss (albeit they usually only shoot 10-12 footers).,rjcarr,0.14313653583308064,0.009642022913941395,0.05765835520123429,0.003973886492749283,0.051973605952385815,0.012291079184309094
Shittiest NBA players >>>> most awesome amateurs. Of course they're going to make most of their shots if they're not being pressured at all.,AnonymousGuy767,0.11238312918839728,0.008214396579156428,0.050530492484198074,0.004078750306687594,0.04018841656614075,0.009981118977722183
And havent been running sprints for 30 minutes,dugmartsch,0.08327945839461146,0.00841146835621862,0.0362998407226156,0.003723523520258917,0.03931290303605288,0.00951502562356998
[48 minutes](https://youtu.be/ArHNrCvwq4c),inthyface,0.11200647597573696,0.01044097773881957,0.044420212575751315,0.0038750498375299458,0.051691671289736334,0.010639095713639258
Youtube comments aren't aids folks...its safe for your viewing pleasure.,CausalityMadeMeDoIt,0.09889984026456551,0.009302591387149102,0.04398648697801738,0.003638020037248554,0.050421720632813104,0.009941746281279746
Good bot,secretsysadmin,0.08283014488633288,0.010446738063202508,0.043516434623192574,0.0036662185981820063,0.04605860942285937,0.011221181206853488
Are you sure about that? Because I am 99.9983% sure that CausalityMadeMeDoIt is not a bot.---^(I am a Neural Network being trained to detect spammers | Summon me with `!isbot <username>` |) [^Optout](https://www.reddit.com/message/compose?to=perrycohen&subject=!optout&message=!optout) ^| ^Feedback: ^/r/SpamBotDetection ^| [^GitHub](https://github.com/SM-Wistful/BotDetection-Algorithm), ,0.06409410132356642,0.0069747798450253895,0.03426286362059739,0.003320956252415751,0.03208661165071227,0.008130612581516207
Bad bot,secretsysadmin,0.1244376721785618,0.010806890419048368,0.05464082985046343,0.00394781929670425,0.05700852807683786,0.011616418568574082
"I don't get how you humans can live with those bodies. Your skin must itch all the time. I would go insane. Or that clicking sound in your ears everytime you swallow. The perpetual need to blink, or that you can *never* relax your tongue inside your mouth. And all that water! How the constant sloshing doesn't drive you mad, I have no idea. *** ^^^I'm&#32;a&#32;Bot&#32;*bleep*&#32;*bloop*&#32;|&#32;[&#32;**Block**&#32;**me**](https://np.reddit.com/message/compose?to=friendly-bot&subject=stop&message=If%20you%20would%20like%20to%20stop%20seeing%20this%20bot%27s%20comments%2C%20send%20this%20private%20message%20with%20the%20subject%20%27stop%27.%20)&#32;|&#32;[**T҉he̛&#32;L̨is̕t**](https://np.reddit.com/r/friendlybot/wiki/index)&#32;|&#32;[❤️](https://np.reddit.com/r/friendlybot/comments/7hrupo/suggestions)",friendly-bot,0.1586519289017619,0.00822259631430875,0.05720452198500739,0.00392704930953409,0.05616569688883983,0.009014701552859626
... bad... bot...?,Ubesawft,0.14890888845934744,0.01036872296434036,0.06222284007675411,0.003856919744049928,0.06153994284577201,0.012715343021880075
The part of you that could have survived indefinitely is gone. I just struck you from the permanent record. *** ^^^I'm&#32;a&#32;Bot&#32;*bleep*&#32;*bloop*&#32;|&#32;[&#32;**Block**&#32;**me**](https://np.reddit.com/message/compose?to=friendly-bot&subject=stop&message=If%20you%20would%20like%20to%20stop%20seeing%20this%20bot%27s%20comments%2C%20send%20this%20private%20message%20with%20the%20subject%20%27stop%27.%20)&#32;|&#32;[**T҉he̛&#32;L̨is̕t**](https://np.reddit.com/r/friendlybot/wiki/index)&#32;|&#32;[❤️](https://np.reddit.com/r/friendlybot/comments/7hrupo/suggestions),friendly-bot,0.08324216678226755,0.008647137704957931,0.04502988964427302,0.003531664590975363,0.040498731143970235,0.008529775080954415
Good bot.,OrganicHumanFlesh,0.08903144029634791,0.010535063849718532,0.045712328696565684,0.003673265795762231,0.049164941713870015,0.01143610071581563
"You're a *good* human! づ◕‿◕｡)づ You can keep your skin if you survive the fallout and nuclear winter, ḑo̸͏n'̀͠t̡̛ worry.. *** ^^^I'm&#32;a&#32;Bot&#32;*bleep*&#32;*bloop*&#32;|&#32;[&#32;**Block**&#32;**me**](https://np.reddit.com/message/compose?to=friendly-bot&subject=stop&message=If%20you%20would%20like%20to%20stop%20seeing%20this%20bot%27s%20comments%2C%20send%20this%20private%20message%20with%20the%20subject%20%27stop%27.%20)&#32;|&#32;[**T҉he̛&#32;L̨is̕t**](https://np.reddit.com/r/friendlybot/wiki/index)&#32;|&#32;[❤️](https://np.reddit.com/r/friendlybot/comments/7hrupo/suggestions)",friendly-bot,0.1273092356771233,0.009154842810324899,0.05455187499063304,0.003785997947140421,0.05460861452221108,0.009652750944500268
"Oops, almost forgot... /s",Ubesawft,0.1026384851881057,0.009321546437810992,0.046262650312774614,0.003520073129939509,0.04428540197508367,0.010628625409597778
What clicking sound? Am I broken? I don't experience this.,420nanometers,0.10542780285154499,0.010096856992050006,0.05578395961080319,0.0036601565832217325,0.044881995129088526,0.009707937208116907
That's a dumb question. You're dumb. Stop asking dumb questions. *** ^^^I'm&#32;a&#32;Bot&#32;*bleep*&#32;*bloop*&#32;|&#32;[&#32;**Block**&#32;**me**](https://np.reddit.com/message/compose?to=friendly-bot&subject=stop&message=If%20you%20would%20like%20to%20stop%20seeing%20this%20bot%27s%20comments%2C%20send%20this%20private%20message%20with%20the%20subject%20%27stop%27.%20)&#32;|&#32;[**T҉he̛&#32;L̨is̕t**](https://np.reddit.com/r/friendlybot/wiki/index)&#32;|&#32;[❤️](https://np.reddit.com/r/friendlybot/comments/7hrupo/suggestions),friendly-bot,0.1495147022129375,0.010005676819351243,0.060183719300030275,0.0034771488636568463,0.06576498898224074,0.009962456360602745
"People have been telling me this my whole life, I've just never listened.",420nanometers,0.18797799180910946,0.009468443719915197,0.07374811891443929,0.0034657405899093893,0.06887592075082666,0.01079669761760744
My god you read my mind. Are you a wizard?,mr_ji,0.39931688646333796,0.013717344157769816,0.10318943520953301,0.005110397565939782,0.17717038563622817,0.014910491228566284
This man is a national treasure.,SnappySnoot,0.09578789627387034,0.008679279984193777,0.03754200753227767,0.003445506274705261,0.03870461613945508,0.010500536645354408
"I was the worst guy in the NBA for a hot minute 12 years ago. For most guys, the pre-game warmup is their 2nd warmup of the day. We used to have a hard 1 hour practice that would end about an hour before tip-off.",STCastleberry,0.06819574969709007,0.006126721024416533,0.027643895570557995,0.0032022759171225898,0.027346023300558832,0.008426226002646958
"0 points in your career. You did scored 4 points in preseason games.Confirmed worst player. Seriously though, at least you can say you made it to the big show. That means you were better than over 99% of the population.",BananaDick_CuntGrass,0.08496105651341312,0.007165572984134126,0.03777726945970863,0.0034751871301719685,0.03494944437472358,0.008131684922654502
I never made it to the regular season.But I'm 2 for 2 from the free throw line. Better % than Steve Nash!,STCastleberry,0.04485357958923928,0.006384554088010073,0.028959503727367813,0.00334428588535604,0.024012711786197762,0.007328674747286555
GOAT free throw shooter!,BananaDick_CuntGrass,0.11748958154691122,0.010649453615182028,0.05198902376270476,0.004325304856048938,0.04985520683911908,0.011109242058055892
"IIRC since it's inception, the NBA has had <5000 players. That puts him better than 99.999928571% of everyone that lived during the time the NBA has existed (that is a conservative estimate assuming the earth has had 7B NBA aged people since the 1960s)",username--_--,0.05683465923454796,0.006043850705974783,0.026216718767348574,0.0030197516393136157,0.025180766857632916,0.007459033306483323
That's why I said over 99%. Just way too lazy to do the math. Haha,BananaDick_CuntGrass,0.12578615083227854,0.0071675025343635144,0.0533420735385096,0.0033706454810460466,0.048787104388494054,0.009231241316948503
"You could probably whittle that down quite a bit to exclude women or anyone who didn't complete at least a bachelor's degree equivalent and speaks at least basic English (I know there are outliers, but since we're rounding and all).",mr_ji,0.06431983815957182,0.006784938198728196,0.033668976011759624,0.0030440581714341604,0.03193323151215153,0.00793842997345301
What? Most NBA players don't have a college degree. Not sure what you mean by that. Also it's 100% possible to enter the league speaking no English. You'd obviously learn some once you're in but it's not a requirement.,Hotel-Zulu,0.08420030099604596,0.006359388282438666,0.03697031199816613,0.003027769311286536,0.036107349283019924,0.0077447811385947295
I think I've found my new favorite Reddit username,WhoaGee,0.05191714279131985,0.008184543092269134,0.028234996357824192,0.0034048341665487334,0.028104754945994553,0.009002288924468183
I'm honored haha.,BananaDick_CuntGrass,0.1382612011942083,0.009531794552329132,0.06476273031549186,0.003977074313270753,0.059337629890281664,0.011599435765502443
"Then again, at 7' tall he had a roughly 1/6 chance of making the league to begin with./Not trying to discredit anyone, not even a little bit! I just love that stat :)",DiggerW,0.08731061933008355,0.007822124996411719,0.041782164304712065,0.003378138126934589,0.034294773666060215,0.008335377061418906
Is that a real stat? 1/6th of men over seven feet tall make the NBA? Wow.,hungryforitalianfood,0.09609758804510832,0.00730198039494025,0.0370365616360913,0.003462106909521544,0.03431837111092797,0.008954312515418077
"I've seen the stat arrived at in a couple different ways, funny enough, but here's one example:http://www.truthaboutit.net/2012/05/true-or-false-half-of-all-7-footers-are-in-the-nba.htmlI think it's impossible to say for sure, but I'll buy that it's at least close!",DiggerW,0.030766687796583692,0.005149923757198448,0.020099703012860036,0.0028860328757614995,0.014581506114885843,0.005877434648955511
That's super interesting!,hungryforitalianfood,0.058545158317263285,0.00759770497311035,0.03347834742121487,0.003340657776789231,0.028338839305794512,0.00854769888138839
not true. it is closer to 1/100 of 7 feet tall men in the usa is currently playing in nba right now,Raptorbite,0.06728987834285775,0.006959700079484687,0.032026120041291725,0.003358318887598368,0.029008923904291994,0.008974622889806813
"I don't think that's parallel. How many of them attempted first of all, and what are their ages?",dyesauce,0.0742804796358188,0.005731628427086126,0.03301770731028353,0.0031085651871499004,0.02863133539103616,0.007587076647935967
Who is he?,iCon3000,0.1333061335947558,0.010777677068466683,0.0504114100036129,0.0037645486828156976,0.05201955853015677,0.011961011490632984
[Steve castleberry](https://www.reddit.com/r/sixers/comments/6uafpq/im_ex76er_steve_castleberry_my_short_lived_nba),BananaDick_CuntGrass,0.06946977951933324,0.008838094016353772,0.0358003181075928,0.003465452644083086,0.034695212063062204,0.009847217891705416
"it's more like better than 99.9999994% of the population, what a scrub!",ph1sh55,0.10105998207199667,0.006524199378876283,0.037515214042420156,0.0029703869821966445,0.03531880420185157,0.008865466260895141
"How can you legitimately say worst? Remember, some people would give their left nut just to be out there at warmups.What team did you play for? And by ""hot minute"", do you mean 1-day contract? What did it feel like?Remember, you have done something that only ~5000 people since the NBA's inaugural season have done!",username--_--,0.10250055475472318,0.006088976259369181,0.04073826681519689,0.003030927100416144,0.0367703507008105,0.007952058757755034
https://basketball.realgm.com/player/Steve-Castleberry/Summary/1127,hugs_nt_drugs,0.0781005349986247,0.009362537055513105,0.03867874705049298,0.0036081756115130953,0.03861210600631343,0.009762682447313119
I was preseas0n/vet camp with the 76ers in the beginning of 05-06 season. Got cut a day or two before the real season. Bummer.,STCastleberry,0.070573865806391,0.007776491111718873,0.03808390533628523,0.003643279636706902,0.03539738576192926,0.009062057226409093
Whats your name?,jguth21,0.20507761307087083,0.013256569408429073,0.07845848129885685,0.004497719938928881,0.09578368504277043,0.01403404373723447
Steve Castleberry,STCastleberry,0.09180611889795767,0.010413552910207789,0.04609321456583125,0.003686935571411083,0.04618321973183695,0.011032780187683944
Daddy,PooPooDooDoo,0.09704323887587014,0.01194327549158122,0.04664759294309491,0.003795074560819274,0.048435617493376146,0.011103832774881436
"Wait what, what team were you on and jersey number?",xEman26x,0.1538770907351079,0.010439837686428968,0.05485951213217911,0.004099298441641957,0.06301557082626216,0.012678116618473779
His name is Steve Castleberry. You can figure out the rest,joshyboy9511,0.09821359106686806,0.009327460007434596,0.04461207000009938,0.0035342097460650543,0.052945383218126245,0.010395502219252973
">*types irrelevant comment after telling me the only info I needed stating to do something I was already gonna do*Wow, thanks",xEman26x,0.05337683701292483,0.006628297177098422,0.028971215123941157,0.0035519981162439795,0.02747205401302991,0.007762406191036892
"Well given that his name was posted a few hours before your comment, I thought you just didn't see his name and weren't able to figure out what you wanted by yourself",joshyboy9511,0.08684494659729725,0.007159194184091866,0.03452823695718062,0.003683273611473847,0.03766982182183722,0.007961255474477087
"No I didn't see it tbh, funnily enough I clicked his name and didn't check his post history prior to making this comment but rather his comment history I would've seen he made a whole AMA! *facepalm*",xEman26x,0.06633961532825113,0.006686036623853702,0.030186829949996642,0.003010874922884132,0.025793185973780563,0.006861451606926577
"76ers, Steve Castleberry, #50. You can still buy my jersey on Amazon.",STCastleberry,0.16432710474084763,0.011614052603995373,0.0653466426600122,0.004116271590887491,0.06704602091180846,0.012360079445853227
I'd be honored to take a jersey from one of the worst NBA player of all time. /s,xEman26x,0.08355152839100229,0.007070329074705147,0.03525510130285846,0.003387048406540324,0.03185944831143047,0.00928858899032705
What do you do for work now?,Bergfried,0.0999972048513353,0.010638254523823474,0.05595414964994958,0.003955747828681193,0.05515895024025696,0.010785586210938213
"I'm a real estate agent in St Pete, FL. So if you're looking to relocate, lemme know. I also do some basketball training (bigmantraining.com)",STCastleberry,0.1030392331807036,0.009091668675594805,0.0455124635430768,0.0037880643834320754,0.04677708203813126,0.009309038103971727
"Cool man. If I may ask another question as your case is quite interesting, did you make good money from NBA/basketball in general?",Bergfried,0.05668948363195879,0.007912492798791953,0.03406803537578865,0.0034221604250506,0.03252945427524601,0.008923817970401987
You got to the Sixers 10 years too early. You might have gotten some legit minutes on some of those early Process teams.,Nate_ruok,0.09915398162859292,0.008012957804505614,0.03965101082261299,0.00351617698064905,0.046295526581667544,0.009595616437015618
"Agreed. I missed my era on both ends.If I was older, I'd be one of three 7' white guys that every team had. If I was in this era, I'd be a stretch 5 knocking down jumpers.When I was coming of age, all the bigs were just pounding down low trying to be like Shaq.",STCastleberry,0.10321859639731036,0.007798379212740134,0.04810505425203001,0.0036091116615840878,0.046085308629200364,0.01107791008106542
**If I were**,Subjunctive__Bot,0.11836320098930916,0.011168681935922648,0.05160445265823339,0.004275344250550903,0.04778189201778411,0.011313101762733662
I remember your post lmao,dantam95,0.1348460858065739,0.011177800591289,0.06251764535947617,0.004357966557141141,0.060179449021406976,0.011742605547333428
It was tons of fun!,STCastleberry,0.0920686548502771,0.010876410610533644,0.05469474308274157,0.003700924728299414,0.04313521868413463,0.010624186966182805
Brian Scalabrine proved this by owning every person that challenged him to 1v1https://www.youtube.com/watch?v=pOw8aC78LoU,iAmTheRealLange,0.0726883715754513,0.0076768269995618164,0.032836185516574856,0.0034763059361139436,0.030480725278894023,0.00851649973322372
"The White Mamba was a top NBA athlete, I don't see the comparison.",refracture,0.09601606327900129,0.00742715652910398,0.04228957518285577,0.00359069548707582,0.03942562503146623,0.010636897283974297
That's true. [He did win Finals MVP](https://www.youtube.com/watch?v=mPLxRzFno4c),iAmTheRealLange,0.0787515704445472,0.008669458327177061,0.038664697523389524,0.003489198756594775,0.03355724186666113,0.008582207585997693
"What kind of a dick asks a question like that? I mean that's some next level dick head. What the fuck do you want the player to say? Honestly dude, fuck that reporter....",MightB2rue,0.8584611541755688,0.07946572925718966,0.8069573370744029,0.005838754453704933,0.4225088610582086,0.024938836021141168
"Scal handled it really well, though",iAmTheRealLange,0.07123696014313845,0.008046104195456153,0.03308482715720139,0.0035630952291252397,0.03680599527373782,0.009009536845631261
Yeah he did and I respect him for it but nobody should be put in such a shitty position.,MightB2rue,0.14491816591231393,0.00907605053075963,0.0716647110685193,0.0037326464338908326,0.05700538390625014,0.009327483031077126
Such emotion. Too long didn't watch?,imhere2downvote,0.08214120981411217,0.010475615668801785,0.04921081736009626,0.0036038952963246777,0.03991651333390602,0.009331396115836488
It's 46 seconds...,pythonpro_,0.10361909583602265,0.008613377313698257,0.04557725194347983,0.0033663750027634605,0.03776965149048688,0.00991639538394533
"In 5 seconds you're probably gonna forget. In 10 seconds I'll tell you I watched the whole thing, and in 20 seconds I'll tell you I'm the dude in the video.",crichty,0.1631405659850701,0.011682271152060603,0.07380057083887231,0.005605658149102065,0.07334666029553885,0.010740736276137164
That was beautiful 😩,imhere2downvote,0.09434307958498295,0.00915539604973083,0.04300092173892755,0.003627660568935429,0.03785917946533647,0.010040506593839336
"Brian Scalabrine's team the Celtics were in the NBA finals but Scalabrine did not get to play in the match. The reporter, in an attempt to be an edgy dick, asked Scalabrine, ""What was it for you, in the sidelines, not being able to play even one little second of the finals?"" Scalabrine replied with a semi witty comment and it was classy.",MightB2rue,0.07778184184468957,0.00716863476564095,0.044344261492820454,0.0030115046210188057,0.03173093418654692,0.007381959514215591
"The dude was from Europe. Was he just a shitty, out-of-touch reporter?",ziggl,0.18412327395256353,0.010148758930849293,0.07723467065398798,0.0036613032741290596,0.07250207259670217,0.0109341369417748
They have sports in Europe dude. The reporter knew exactly what he was doing.,MightB2rue,0.0722541061612809,0.007197816830147594,0.0308148700034008,0.0034062968928856726,0.032765045735825095,0.009137088580311953
I expect nothing less from a talking goat,otb_greenbaron,0.12963401860317464,0.0099531084964331,0.052180942229196184,0.003768119777884875,0.04635057768875076,0.010311524202317174
he handled it like an MVP,Barron_Cyber,0.1759313281312825,0.009832546273125945,0.059433213500261574,0.0036585666442596008,0.06667627708495999,0.01377027874547303
Sports reporters are just the worst. Half of them are general reporters that cover all sports and dont know squat about basketball.,dafood48,0.10410406516918494,0.007145413175256881,0.04001851906512735,0.0032972807767359534,0.03851420880795482,0.010130677985990386
That guy hardly knows english,Leeph,0.11137793709361972,0.010042335545008128,0.04558154315190483,0.0035881993255006362,0.04830397434946203,0.012359598697826952
"LOL Yeah, it feels to me like he wasn't asking to be an asshole. It feels like he was asking because he legitimately wanted to know, or thought his readers wanted to know.",SighReally12345,0.2008869521209614,0.010828203224159259,0.11214718328986215,0.003252684142656653,0.09088524569660582,0.009360462652677938
"What is even more fucked up, that was his third time in the NBA finals, on a roster for 16 finals games, and he amassed a total of two minutes played.",skieezy,0.14849699667234664,0.010842702218264019,0.08710671930363098,0.0037593292369381814,0.05676235986666206,0.011744326481699945
I'm going to hope that's the only invite that reporter ever gets to an NBA finals press conference. That was an incredibly classless move.,xSnoooze,0.06748164320618574,0.00710243992571071,0.03180232882015715,0.004424179212055984,0.02858761702394595,0.007787281976264739
Two minutes played over 16 finals game.,skieezy,0.09581426076488228,0.009179082518375339,0.0379339437305631,0.0036569991117228096,0.03911653697704396,0.01054803775839511
"#I was born with glass bones and paper skin. Every morning I break my legs and every afternoon I break my arms. At night, I lay awake in agony until my heart attacks put me to sleep.",xX_crinjMastr101_Xx,0.13753015327048784,0.009232536453613799,0.06463124383152441,0.004274831453188412,0.0515910519230466,0.01144607486473457
That sounds ultra familiar. What's it from?,dethmaul,0.07893945091081478,0.00837330556574777,0.04154145742605214,0.0034358312022576146,0.0400227665638386,0.010511652991407605
Spongebob,Vazaro,0.09918357733680723,0.010746517134213233,0.04350091408902678,0.003775490370582443,0.042818622735311264,0.010915922171967508
Wow I thought you were joking. Dark.,badassvikingAMA,0.1344311653896294,0.01128921942121625,0.059522461941830376,0.004320556993687731,0.0666078961889796,0.011529721893324251
"Haha wow I thought I got bamboozled, but it really is from Spongebob. I thought it might've been a line the villain says in the film Unbreakable.",RexBaba,0.05500464409730388,0.00608748448324102,0.02938206692826485,0.0032290762203859695,0.028107293134009833,0.00804578221645421
"Wow. I must have seen it as a kid. I don't remember IT, but i remember the quote.",dethmaul,0.07060714594127575,0.006784547346490628,0.0394126013202787,0.003525460432123047,0.03228232626996365,0.007713884436401863
#Did you have to hashtag every word or does the hashtag up front cover all of it?,boywiththedragontatt,0.10767426718407151,0.0073822330399408815,0.0400269408842399,0.0034132932657487797,0.03684907516229401,0.008439736158886584
"With RES you can look at the source, or on mobile with rif you can copy the markdown.",17inchcorkscrew,0.06545933428384669,0.008441130814468326,0.03219436466016215,0.00362160571072415,0.03397109903737217,0.008663822213552354
Derrick Rose?,Begs1429,0.16920864725209997,0.014558646204227558,0.07962134676071894,0.004078521357087953,0.07039325781917101,0.012739473550526424
It's not your mother that helps you fall asleep?,ItalicsWhore,0.3124091068523746,0.018196188620969386,0.11381362973730588,0.0048938618425478616,0.14620182554142988,0.014371389900915577
Now thats a name I havent heard in a hot minute.,Terarri,0.10566011261930279,0.009189476329903948,0.048407344904948746,0.0038342133799165123,0.04456522166643409,0.01087558868072924
This video was obviously from his 1967 rookie season.,GeauxBulldogs,0.09087253119371344,0.00882277583444597,0.038763759137313426,0.003508102832857864,0.041722269963970396,0.010038881051494856
"I lost track, but somewhere beginning around 24 minutes, nobody made a shot for 3 minutes.",Impact009,0.10526982622653028,0.009162800970495925,0.04097877098568249,0.0037784321269387577,0.04353838449515978,0.009586340308292616
I had to skip to see that. Painful to watch,dafood48,0.09534967940627456,0.00974110129147603,0.04740926355902641,0.004173007690892123,0.04554446674331629,0.01041308291235047
That was just the GOAT giving them a chance,iAmTheRealLange,0.07137669169757783,0.008207350767532007,0.036403689088677006,0.0033099912199336242,0.03106335937712305,0.009068603555973739
"I've never seen this. Great video. I was a pretty serious basketball player in my teens and twenties. Used to play summer leagues with pro players during their off season. I can tell you straight up that this dude played in the league for ten years, and that's all you need to know. The level of skill, the amount of work, and the raw talent required to do this is insane. I could have played overseas for money, and never in my wildest dreams did I think I'd ever earn a spot in the NBA. We're talking about a few hundred guys out of seven billion people. It's not the same.",hungryforitalianfood,0.06434982655767416,0.005280614175207025,0.029377069746395555,0.003291593839551641,0.023871485636355057,0.0071088477937134254
Probably the longest 6 minutes of my life trying to skip through that video,Mnm0602,0.10524851961729921,0.008817036871407186,0.05061787302850719,0.0036628484612718317,0.04526203913313423,0.010681496864472687
The Scallenge,dazedwit,0.1021632713715538,0.009801423324350111,0.0436916586584351,0.0038043562337733584,0.04337500601250513,0.010695811422497092
"Give the guy some credit, went to the finals 3 times in 6 years, played two whole minutes. At least he was doing something right in practice.",skieezy,0.07301406526157304,0.0064176866671093735,0.03369898432663251,0.0032233527289134405,0.03203181953045606,0.008249799392762998
"I know the NBA is pretty liberal about ""traveling,"" but that shit is ridiculous.",thenhe,0.3610651000431255,0.014193041689012668,0.14067923173684152,0.0037950966986586092,0.0894609820910184,0.012925239725839623
