Comment ID,Username,Comment
dx7e7ab,AutoModerator,"**Mirrors / Alternate angles***I am a bot, and this action was performed automatically. Please [contact the moderators of this subreddit](/message/compose/?to=/r/soccer) if you have any questions or concerns.*"
dx7enpb,Broka1979,[Penalty Call \(bt sport\)](https://streamable.com/j75t0)[Penalty AA \(bt sport\)](https://streamable.com/6xhnm)
dx7f86h,nocommentallowed,> AAis there an AA from behind for the penalty call?
dx7fn84,DaTripleJ95,Really want to see that ! There has to be!
dx7g1ke,CHOOCHOOLewRat,This is the one we need! Looks like Benatia's hands do grace Vasquez's back but from the front angle looks like he might not have pushed him
dx7flu4,Broka1979,"Wasn't shown on the bt sport feed. If they do manage to show it, I'll capture and post it."
dx7g742,Broka1979,"[Angle from behind, plus push by ~~Buffon~~ Douglas Costa](https://streamable.com/tqmh5) (bt sport)"
dx7h3a8,Butteschaumont,Ironically I think it's with the TV angle and at normal speed that the foul is the most obvious.
dx7h66j,jmontu1uc,"I don't know if it would change the game, but it doesn't seem clear to me that Buffon pushed him. Seems like Matuidi did it."
dx7hnsp,Broka1979,"Personally, I think it was a very soft sending off. Really could have given a yellow."
dx7izm7,Butteschaumont,We have no idea what he said to him. It probably wasn't very courteous.
dx7j94r,AchieveItAll,"Regardless of what he said to him, Buffon walked right through Michael Oliver and you **never** touch the ref. Not to mention being absolutely irate (of course it's going to be hard to control your emotions but still,) half an inch away from his face for a good 5 seconds. You'll be sent off every time."
dx7k0zz,lopsiness,Isn't Oliver the guy who sent off the United player for grabbing him after a call?
dx7ru2x,fonziGG,Yeah Di Maria against Arsenal in the FA Cup? Grabbed him from behind and Oliver's Face was priceless.https://www.reddit.com/r/soccer/comments/5z9xm8/michael_oliver_gives_di_maria_two_yellows_within/?st=JFVRY46S&sh=66076cf1
dx7pxy8,Burgru,He sent Veratti off (second yellow) after he yelled in his face.
dx7rrbs,Sputniki,Or be given a yellow. It's not as black and white as you suggest
dx7yuxk,AchieveItAll,"No, it's 100% always red for touching the ref like Buffon did. I can assure you of that as I'm one myself. You don't touch the ref ever, unless were buddies and you're putting ~~my~~ (edit: your*) hand on my shoulder/back because we're talking about something, otherwise you'll be off. Sure there's sometimes discrepancies at the top level (EPL off the top) but at any National/Provincial level it'll never be a yellow."
dx7jmn6,Broka1979,"I agree with you, I don't think any one of us would be courteous in such a scenario. Anyway, if you watch the replay the ref shows the red card once costa gives him a sly push/dig (coming through buffon' left side), thinking it was buffon. So I doubt it was down to what was said, more the physical nature."
dx7xa68,wise_comment,If you don't watch out I'll annoy you into headbutting meOr so I surmised.
dx7ljcv,notathr0waway1,"If you think about it, the ref punished the team appropriately. About 5 different guys were practicallyjostling the ref. Making physical contact with a ref should be a straight red already, so they are already pushing their luck.He held his peace and instead of backing off, the Italians doubled their efforts to physically intimidate the ref, so the ref sent off the goalkeeper. He could have sent off 4 players, but he only had to send off one to make his point.Remarkable restraint and cleverness by the ref if you ask me."
dx7rvst,Sputniki,"> He could have sent off 4 playersNo he could not have. The referee is supposed to exercise discretion in every instance and if he had sent off four players for that he'd probably never have refereed a CL game again. Players crowding referees in controversial circumstances happens in several games every year. I have never seen, in 20 years of watching football, something like that resulting in 4 red cards. Certainly never in any of the top leagues or the CL. Even suggesting he could have done that is ridiculous."
dx85od6,notathr0waway1,I should have said he could have sent off any one of 4 players.
dx7otcy,Broka1979,"Sure, I can respect your point of view. As a neutral, I never had a vested interest in either team, apart from the entertainment factor. So for me, it was a shame seeing Buffon sent off in that regard. But as someone who lives in the UK I can assure you, Michael Oliver is far from being a clever ref, he is more about ego than anything else (""touch me and i'll sue"" attitude). Don't get me wrong, he might not be the worst from the prem, but he's definitely no Clattenburg."
dx7p3ko,notathr0waway1,"Ok, thanks for the background info."
dx8no96,blompblomp,"Touch the ref, you get sent off. There is no exceptions, kids are watching this and an example is being set. Buffon should know, from all his experience in the game, how often has a ref changed their mind on a call if you push him and get in his face?"
dx7xvjf,SirMothy,yes too bad he was being paid by Real Madrid to make shitty penalty calls
dx7sfny,chrismark4,"Fuck that, so sick of players surrounding the ref like idiots.This needs to happen more."
dx7uo0b,Broka1979,"But he wasn't given a red for surrounding the ref, it was because Douglas Costa shoves Michael Oliver. Ref thought it was Buffon, hence the red. A few years ago, the FA introduced the 'respect' initiative, where only the captains of either team are allowed to approach/speak to the ref, not sure if the Italian leagues have something similar."
dx7vry0,chrismark4,Buffon lost his cool too. And did nothing to make sure his players didn't touch the ref. If anything his reaction lead to the push and instigated the over reaction from his players. Fair red.
dx7h1zm,smala017,"THANK YOU SO MUCH!!! This basically proves it was the correct call.Is there any video of the Buffon red card live as it happened? Also, I hope Juve gets a lot of punishment for that. It wasn't just Buffon, the whole Juve team has him surrounded."
dx7honf,Pele20Alli,"Curious to know. If that's a penalty, then why wasn't Ronaldo's in the first half?"
dx8eyll,WorkHappens,"You can touch a player in the box, you can't shove him neither can you kick him in the ribs."
dx8i7bk,Pele20Alli,"Kick in the ""ribs"" happens after Vasquez starts falling, so that should not be a penalty just for that. As for the shove, what makes it any different from Benatias shove on Ronaldo earlier in the match, other than it was to his front instead of his back? Both are pushes and apparently should be considered penalties"
dx8l7n5,WorkHappens,"One you can't even see any impact on Ronaldo, because he simply put his hands on him, the other you can see Vasquez's head snap from the impact on his back. Also yes, contact from the back is not and should not be treated the same way in football. As for the kick it's irrelevant if he was falling."
dx8u8iu,NuggetsBuckets,">Kick in the ""ribs"" happens after Vasquez starts falling, so that should not be a penalty just for thatHas it been confirmed that the foul was for the shove and not the kick?"
dx8w5vj,Pele20Alli,Vasquez himself only mentions the shove so...
dx8wa4z,NuggetsBuckets,But only the referee's decision matters so...
dx8ymhu,Pele20Alli,"If a referee gives a foul for something the player who apparently got fouled didn't even feel, then it is obviously not a foul. That's the whole point of the argument about the call, and the inconsistency with the refereeing"
dx8zay7,NuggetsBuckets,">If a referee gives a foul for something the player who apparently got fouled didn't even feel, then it is obviously not a foul Yeah, that's not how it works dawg. Referee give fouls based on whether **he** thinks it's a foul, not whether what the player feels"
dx8zg6y,Pele20Alli,"And when the referee thinks there is a foul which never happened, then that is a wrong call. Just because the referee calls something does not mean it is the right call"
dx8zmzy,NuggetsBuckets,">And when the referee thinks there is a foul which never happened, then that is a wrong callBoth shoving and kicking are fouls by the laws of the game. He obviously saw either one (or both) of this was committed, hence why he calls for the foul.And now after we have views on every possible angle, there is definitely a)shoving b)kicking being committed. So he made the right call in retrospect?"
dx8zrul,Pele20Alli,"The kick was not a foul, and the ""shove"" is debatable, which brings it back to my original point: what is the difference between the Ronaldo shove in the first half and this one? Both were minimal contact, with the player dropping to the ground, yet one is considered a dive and the other a penalty"
dx9023z,NuggetsBuckets,">The kick was not a foul, and the ""shove"" is debatableOliver obviously thinks either one (or both) was a foul."
dx907ww,Pele20Alli,"And that is why it was a bad call. If he thinks something is a foul and it isn't, then it's the wrong decision"
dx90x6p,NuggetsBuckets,"Wait, why is it not a foul? You just said the shove was ""debatable"", in which he probably ""debates"" it as a foulAnd do you seriously think if you kick someone in the ribs and completely missed the ball anywhere else on the pitch, the referee is gonna go ""yup, that's fair play"". I mean, if you've at least gotten the ball you could've argue that you're playing the ball. Is there any possible scenario where you could use your foot to touch your opponent's upper body and doesn't play the ball at all that doesn't result in the foul anywhere else on the pitch?"
dx911j5,Pele20Alli,"Vasquez was falling before there was any contact with Benatias leg. There is a clear screenshot of this but I'm on mobile right now and can't access it. Therefore, the kick is never really part of the argument. It really comes down to whether or not the ""push"" is enough to be a penalty, and IMO it is too soft"
dx916pr,NuggetsBuckets,">Vasquez was falling before there was any contact with Benatias legYou cannot kick your opponent whether they're jumping 10ft in the air, standing, or lying on the ground. It doesn't matter where Vasquez was. If you kick him when the play is still ongoing, that's gonna be called.He may very well have thought the push wasn't a foul, which means the play is still on and the kick is what fouled him. Or he may have thought the push was a foul and the kick was committed after the play has stopped. Without him confirming himself, we will never know.For it to not be a foul, both the shove and kick need to be deem not a foul. The shove is arguable but the kick is definitely not."
dx91ayu,Pele20Alli,"It is only considered a foul if the player is actively playing the ball. Vasquez is not, since he is falling. A penalty cannot be given for something that happens after the player has gone down, but Benatia could get a yellow for that easily, so in that sense I agree"
dx91psb,NuggetsBuckets,">It is only considered a foul if the player is actively playing the ball.Not really, if that's the case then late tackles by that definition is not a foul, since the play has already moved to another part of the pitch when the foul is committed."
dx7guld,nocommentallowed,THANKS! you are a hero!
dx7gvun,matt-lang,"Ah it's a pretty soft penalty but I can see why he'd have to call it in that situation. On the fence about this one.Personally I would be upset if it was called in a regular game, but just given the importance of this game I think the refs didn't want to let anything slide at the end.Unfortunate way to end the game, though."
dx7n2jp,syn506,How is running into someone from behind in a clear goal scoring opportunity directly in the 6 yard box not a penalty? [Not to mention kicking him in the chest to get to the ball?](https://i.imgur.com/c2G8Y2u.jpg)
dx7nq4i,matt-lang,I am just saying that from the video it's questionable how much of a shove he actually gave him. Some contact is expected while making a challenge but he just pushed off too hard.
dx7nrqv,syn506,"If you think it's questionable from that angle, boy am I glad you aren't a ref."
dx7nujh,matt-lang,I never once argued it wasn't the correct call... you're arguing for no reason.
dx7ny4h,syn506,"Then why are you calling it ""questionable""?"
dx7pvsa,matt-lang,"Because it is... Challenges in front of the goal happen and lot and it wasn't a super obvious penalty at first because it didn't look like he put his weight into Lucas, and the kick would have just been a clean challenge apart from that. but from the replay it showed that it was as enough to warrant a penalty. So, in this situation it was the correct call to award a penalty. But in an earlier part of the game the push was just soft enough that it might have been ignored. So that's why I said it's questionable."
dx8ai3c,moopoint,Is there an AA from behind for the goal? Want to see how far away from saving it the keeper was.
dx7l0n2,BiologyVirus,[With Ref angle](https://streamable.com/tqmh5)
dx7fb7v,,[deleted]
dx7fdsm,TheDrunkHispanic,>there you can see it's *clearly* a dive > I think
dx7flxh,,[deleted]
dx7g0xd,epicfishboy,"“Clearly a dive” and “I think” make literally 0 sense when together. How can it be clear, if you're not sure? It was a penalty. Benatia has only himself to blame."
dx7hk87,slidinggoal,I meant that 4 me it's clearly a dive. Lucas is diving when he feels Benatias approaching. Benatia then try's to circle around him but he is already in the process of diving. I mentioned that it's a tough call too because of the velocity of the play. Have you thought about something being clear to you personally? Convinced about something. (Even though the ref said otherwise) That's what I meant.
dx8qg3l,Pippelitraktori,Lucas does not even see benatia and fall only after benatia jumps on his back. You're tripping. Watch the slow mo again
dx7fkpy,Heblas,"The angles where you see Vazquez head on are terrible, since then you are trying to see Vazquez get pushed towards the camera."
dx7g0nz,slidinggoal,I agree. Wait and see the one from the other side.
dx7gsdl,nocommentallowed,https://streamable.com/biz84 here
dx7ih0e,Mister_Sassafrazz,"Thanks. I was on the fence myself initially but I finally see it pretty much was. From the front it looks iffy but those back angles kinda prove he pushes him, albeit softly."
dx7hsoh,slidinggoal,Thanks boy
dx7hr41,loopback123,Puta nos haces ver mal a los rayados
dx7izwq,slidinggoal,Que te valga mijo
dx7j524,loopback123,"Hahaha es peo, #noerapenal ches madridistas jotos"
dx7jpl3,slidinggoal,Jajaja estuvieron encima todo el 2ndo tiempo. Al chile merecían un gol porque la juve estaba fundida. Ahora el penal creo que fue muy riguroso porque se iba cayendo desde antes. Y Ronaldo pues un crack.
dx7g9qc,moush,"Will never see the light of day, it would look bad for the sport."
dx7gsrj,nocommentallowed,https://streamable.com/biz84 here enjoy
dx8i6p5,anterax,"Seriously, where do people get these ideas from?"
dx9jwzd,moush,The fact that news outlets must ask for permission to post stuff is pretty common.
dxbckue,anterax,Are you sure? There world over?Yeah evidently that isn't the case
dx8l66e,wumbo105,American
dx7fwa0,zawadz,Hi wish I could see Woj' s face when he got the call. Heartbreaking.
dx7t1c9,BlackDante,What was going on between Ramos and Allegri?
dx8aqmr,thesoccerone7,"""See what happens when you make stupid hot headed decisions? Stop making stupid hot headed decisions Ramos."""
dx7fc3f,LingardMillyRocking,Requesting the push from Gigi
dx7kcrq,Broka1979,https://streamable.com/tqmh5
dx7x7e9,wise_comment,Absolutely the right call IMO. Don't know what the announcers were talking about
dx8d3ld,clantz8895,"Agree. I think benatia's leg wrapping around vasquez is another major factor there. Pretty much stops him from any fair chance to play the ball, whereas benatia has no clear opportunity to get the ball."
dx8bkxf,sprkck,"But the short guy, D. Costa, was the one who pushed the referee. Watch it again."
dx84sl8,bar_kerd,Are you kidding me? How can you expect anyone to not react this way in the given situation? These guys are human after all.
dx85u1m,Noobricorn,"There's 4 million reasons a year Buffon shouldn't act this way. Nonetheless, there's no ""Get out of jail free card"" if you claim you're a human, with that logic no red would ever be given."
dx8ko8g,Professional_Bob,"Referees won't tolerate being pushed, hounded and harassed in any other sport, why should they in football?"
dx84f9x,EscapeSamsara,The push was from Douglas Costa. Got Buffon sent off
dx8unj5,justfor1t,Yup! I saw the same thing
dx7g9rj,justfetus,https://streamable.com/biz84
dx7xkvn,pisstacheerio,Went down in 4 hours wow
dx885ay,justfetus,that's not bad. I usually expect super popular soccer streamables to be gone within an hour.
dx7hln5,LingardMillyRocking,Thnx
dx7kr2d,rodinj,Well that's a nice final CL game :(
dx7e8tc,gemifra,[Match Highlights (Streamable) - BT Sport - English](https://streamable.com/pavhr)[All Goals (Streamable)](https://streamable.com/swi8a)[AA Mirror Replays (Streamable)](https://streamable.com/tgmpl)[Mirror (Streamable)](https://streamable.com/lds34)
dx7gkyh,rcma,There is a alternative angle from above that was showed only after the match ended. Does anyone have it?
dx7gxw0,,"I'm looking for it too, the foul was 100% clear in that angleEDIT : https://twitter.com/RodrigoGiacomet/status/984171280718028801"
dx7ibjc,Kasabiii,Anyone ?!!
dx7nehv,UniverseInH,This is the [angle](https://youtu.be/tgJGyPCQW-0). But the quality is very poor and they don't run it at normal speed to see what a proper shove that was.
dx8zptk,IsakLOL,Found ithttps://twitter.com/RMadridInfo/status/984459375166283777?s=09
dx905ua,rcma,That is the correct angle... still waiting for the video in normal speed though.
dx7h9zh,BFD88,This.
dx7jr9v,,[deleted]
dx7klxh,BFD88,oh fuck deleted.
dx7ksy2,,[deleted]
dx7l1jh,BFD88,oh it doesn't show the angle from above m8..
dx7lg3t,,[deleted]
dx7ln8q,BFD88,"Don't think so. It was one of the replays (a late one) before or after the penalty, not sure."
dx7lopo,,[deleted]
dx7m3of,BFD88,"It clearly shows that it was a penalty, you can see the impact from the back that benatia delivers. Too bad that footage is not appearing anywhere."
dx8uoa2,IsakLOL,Yes please someone find this
dx8l2v1,paicmhsc,I think we can say goodby to pomfe too https://t.pomfe.co/DMCA/2018/April/netresults.txt
dx91p71,gemifra,With DMCA and also host virus. pomfe no more.
dx7m06m,vikigenius,Requesting fan reaction in the lead up to the pen? I am sure a lot of people would have closed their eyes or would be praying to god.
dx7xkog,BrutonSpenstar,[Here's the live footage leading up to the decision + more fps than the eye can see ^^/s](https://streamable.com/zwyuk) [10 mins of BT Sport coverage of the pen+analysis](https://streamable.com/7r5jo)
dx7mw8j,ybenjira,[The Benatia foul](https://www.facebook.com/ibrahim.cena1/posts/171257023579534:6)
dx7e7mv,Xwarsama,Szczęsny looks to have aged 5 years in 5 minutes.
dx7ee5s,Cokey20,Tbf it would be such a Szczesny thing to come on and save that pen
dx7ejha,Almoe9,I was hoping . That was a nice penalty thou
dx7el6h,Cokey20,"Yes mate no keeper is stopping that, typical Ronaldo really"
dx7f2x3,Canefan101,Fucking glacier ice in his veins. Insane
dx7ok1t,japalian,"If you were to take some ice from a glacier, let it melt, then freeze it at home, would it still be glacier ice?"
dx7pm9k,abaram,Nah it has to be formed from natural snowfall
dx842j4,pollardfreek,You stole that from BT
dx8461s,Canefan101,Huh?
dx87bng,pollardfreek,Look up
dx7u20p,GallantGoblinoid,Not since Diego Alves left europe
dx7enk9,HakeemAbdulOlajubbar,it was pretty much perfect
dx7g0t7,,Shit was ice cold.
dx7fg5j,BoltSLAMMER,"That's what I thought, I was like wow one of the few keepers I could see stopping this especially with the situation"
dxbdtr8,the_james_howlett,"i wouldnt even be mad if he blocked that, that would of been a great situation!"
dx7eljp,roesti32,But the penalty was also executed a very Ronaldo like way
dx7f1a3,P0in7B1ank,There was nothing I wanted more than for that to happen. It honestly would have been mental.
dx7tb8f,Hemske,Nobody could have saved that one.
dx7g8uw,juviegar,I was hoping for it.
dx7e9hx,,[deleted]
dx7eg7z,simplysuperman,wtf did I just read
dx7f9yg,thetouristsquad,"I spend 5 hours masturbating before my prostate exams. I edge, and edge, and edge, until a butterfly sneezing on my taint could bring me to orgasm. I tactfully shuffle my way down to the doctor's office and when he lubes up I nearly cum every time. But I've trained my kegel muscles enough to the point where I can hold in Mount Vesuvius' wrath. Then as soon as he puts the smallest bit of pressure on my prostate I unleash with the fury of a lion hunting its prey. As the room gets covered in my hot sticky juices the doctor looks on disgusted and leaves the room. I always go to a hospital far away from where I live to get it so that I don't have to go in for surgery under the doctor that I busted to. Best thing is we have free healthcare here, so the doctor gets me off and it's covered by taxpayers. That's my fetish. Edit: [Source](https://www.reddit.com/r/insanepeoplefacebook/comments/8bhpop/thats_it_im_kinkshaming_nsfw/)"
dx7g3jb,,[deleted]
dx7ltp9,vadifuk,I got lost and desperately try to find the connection back to the penalty situation now.
dx7qnw8,tangledupinbetween,better than 50 shades
dx7fh7x,omgwtfroflcake,Wat
dx7g35f,TheGhostOfBabyOscar,Copypasta
dx7nrby,howsaboutyou,If it ain't before it be now
dx7grjr,four_four_three,"He said: **I SPEND 5 HOURS MASTURBATING BEFORE MY PROSTATE EXAMS. I EDGE, AND EDGE, AND EDGE, UNTIL A BUTTERFLY SNEEZING ON MY TAINT COULD BRING ME TO ORGASM. I TACTFULLY SHUFFLE MY WAY DOWN TO THE DOCTOR'S OFFICE AND WHEN HE LUBES UP I NEARLY CUM EVERY TIME. BUT I'VE TRAINED MY KEGEL MUSCLES ENOUGH TO THE POINT WHERE I CAN HOLD IN MOUNT VESUVIUS' WRATH. THEN AS SOON AS HE PUTS THE SMALLEST BIT OF PRESSURE ON MY PROSTATE I UNLEASH WITH THE FURY OF A LION HUNTING ITS PREY. AS THE ROOM GETS COVERED IN MY HOT STICKY JUICES THE DOCTOR LOOKS ON DISGUSTED AND LEAVES THE ROOM. I ALWAYS GO TO A HOSPITAL FAR AWAY FROM WHERE I LIVE TO GET IT SO THAT I DON'T HAVE TO GO IN FOR SURGERY UNDER THE DOCTOR THAT I BUSTED TO. BEST THING IS WE HAVE FREE HEALTHCARE HERE, SO THE DOCTOR GETS ME OFF AND IT'S COVERED BY TAXPAYERS. THAT'S MY FETISH.**"
dx7i1kf,miloca1983,Uhhhh...
dx7gas3,Somerrrrset101,Lol it was on r/insanepeoplefacebook earlier
dx7fyu9,KidDelicious14,wtf did I just read
dx7n14h,JesseLingod,Oh my sweet summer child.
dx7njwl,KidDelicious14,Dad?D-did you finally get your cigarettes?
dx7qpct,JesseLingod,"No I'm not your dad, just the dude who is here to fuck your Mom"
dx7sges,MrRoyce,Well that escalated quickly.
dx7xqt4,JesseLingod,Could have been quicker but OPs mom is so haggard it took a couple of extra minutes to finish
dx7haya,Xuzto,Nice
dx7hcoz,orubyqncnyrubefr,That's kind of hot.
dx7jhf7,abaram,I wish I could unread this
dx7nfg9,ojeleye_superfan,Every day we stray further from God's light
dx7fyxg,Communietzsche,da fuck
dx7gmgf,Abcdjdj123,WAT
dx7fzik,prettylittleredditty,"r/jesuschristreddit I don't do that often, but it belongs there"
dx7jdsz,pleasesayavailable,M M E E T T A T T E E M M
dx7k85n,Crankyshaft,M E T AETA
dx7nxgy,Tekki,Meta
dx7vd6v,hendrix67,This is amazing
dx7wg6v,illsmosisyou,[wat](https://imgur.com/ZHMGBRS)
dx85oci,Akmuq,How do I delete someone else's post
dx7enjk,,[deleted]
dx7evtb,Cunning-Stunt-,"I don't think he was concerned about the grammar, more the semen in space stuff."
dx7g544,BarneySpeaksBlarney,Somebody should ask Neil deGrasse Tyson if semen floats in space
dx7erkc,,[deleted]
dx7gqwd,JimminyCricket67,"And that kids, is the story of how I met your murder."
dx7g8s3,joe4553,Elon Musk's plan to get to mars.
dx7esta,tapped21,Oscar nominated dialogue
dx7f3br,Nicsefar,fan fiction
dx7hmms,sukkerpai,IF HE EVER HAD THAT PRESSURE ON HIS BALLS HE WOULD EJACULATE TO MARS
dx87asi,skool_101,North Korea things.
dx7ek8n,mugurg,"Save the penalty and you are a hero, concede it and noone can blame you. Still would be a nervous situation though."
dx7evlk,dac0605,"Yeah if anything the pressure was on Ronaldo, IMO."
dx7f4mo,TikkaMezzala,Thing is Ronaldo doesn't feel it.
dx7gr5f,CrAppyF33ling,Not after against Chelsea.
dx7jkfv,Commandophile,"Bull, he craves it."
dx8b3ws,ishin_rikku,Ronaldo IS the pressure
dx7f0zk,Xwarsama,"The man has ice in his veins, he lives for these moments."
dx7f46l,dac0605,Oh for sure. A lot of guys would mishit the ball and/or not put it in the right spot. Dude just drilled a perfect penalty that there was no chance of stopping.
dx7g4ne,19degreez,"Smashing it high up into the corner is always risky, let alone in the final minute of a knockout game when your team has been on the back foot all night long.That was a penalty with 100% confidence behind it if anything."
dx7jfn1,Commandophile,"This has been a dream of a quarter final for Madridistas. Ronnie's bike ride, Fraudiola, barca, and now Ronnie again in the final seconds. At this point, as long as it ain't Bayern, I won't even be upset losing now nor in the final."
dx7mbe4,chantlernz,> I won't even be upset losing now nor in the final.How can you say that you wouldn't be upset about your team losing such an important game? Doesn't seem like proper fandom to me.
dx7mejv,Commandophile,"> > > How can you say that you wouldn't be upset about your team losing such an important game?you know damn well why>Doesn't seem like proper fandom to me. tough shit, don't tell me how to support my club"
dx7p8z6,MeaMaximaCunt,Some people know they football is about more than a relentless march of success and individual narratives are just as important.
dx8nlxs,Skirtsmoother,Probably because they won it three times in four years. They can afford to lose some.
