Comment ID,Username,Comment
dx7f6tp,rainbow0o,I don't think Buffon deserved a red card.
dx7fd8x,LaRemontada,This kills the Juve
dx7fu4u,sm0r3ss,"Hala Madrid, and Forza Juve! Such a great game. Juve clearly deserved more, and honestly both teams deserve the win from performances in each leg. But i do think it was a penalty.. the balls from the ref to actually call it tho considering the circumstances."
dx7gyo5,rohaanahmed11,"Buffon should have headbutted ref, that would have been perfect."
dx7hn3v,ankeiii,"Poor Buffon. Had a stellar career, but last CL game get screwed over by UEFA/referee"
dx7io4o,plsmemberthisone,"""hmmm.. I haven't done much this game.. If I score this I still might not get the headlines. Best take my top off..."
dx7itcu,renome,"""Football is fucking unbelievable."""
dx7e8vg,ripper8244,Fuck this...
dx7eb7j,yungwave,Great penalty. Don't even love football but will be sad when Ronaldo retires.
dx7eqiw,SleepyDani,Messi would've choked.
dx7er3s,NZ_Diplomat,"Feel really bad for Juve and Gigi, but c'mon guys, it was clearly a foul. A soft one, but a foul nonetheless. Can't blame the refs for this one."
dx7ewga,,[deleted]
dx7ezpx,theglasscase,"There's clearly a shove before the ball reaches him, and then Benatia kicks up around his chest without touching the ball."
dx7f99w,seaocean87,Ronaldo is amazing but it's crap like how he celebrated under such bs circumstances that will forever keep me a hater.
dx7fbdg,Red-Tom,He's just put his team through to the semi finals after almost losing. Can't expect him to stand there like a lemon
dx7flco,seaocean87,"Class my friend class, shirt throw and posing was too much. Zidane knows what's up."
dx7fhih,alejpaz,To be fair it was a really good pen
dx7fi5d,likeastar20,+1 Ronaldo is a cry baby on the pitch
dx7f9jc,TomCosella,"That's a penalty. Buffon probably deserved the red as well. Sorry, but after what I saw in the Spurs/Juve matchup, Serie A defending seems to be closer to rugby than football."
dx7frfx,krisburturion,"That was a scintillating 90 minutes utterly ruined by the last few minutes. Real Madrid deserve no respect for this, and if they were capable of shame they would be feeling it now."
dx7iy10,Johnnysmith69,No respect for something Benatia did...
dx7ierg,ThePeoplesBard,Can someone help me out as a soccer noob? Why does everyone in this thread feel badly for Juventus? Didn't they still win by two goals?
dx7ip3m,Yinzumaru,"Because it's a two game elimination, One game on juve home and One in madrid, Madrid won 3 0 in italy so, lost in Madrid 1 3 but in The aggregate score, they won 4 3, hope i helped."
dx7iuy4,ThePeoplesBard,"Wow. Every ounce of my American perspective on sports gets squeamish about this and wants a best of three. My skin is crawling. I don't want to pretend my perspective is ""right""...this just sounds SO strange."
dx7km10,Suboptimal_Clearance,"Its not that strange when you consider it as a total goals competition, with 90 minutes at one venue and 90 at the other. Its gets a bit cloudy when you get to the tiebreakers, but the American NBA/MLB approach of best of 5 or 7 also has its faults."
dx7l6q5,ThePeoplesBard,You're absolutely right. There's no perfect system. I just had to express how *weird* this sounded. I'll try to learn to love it.
dx7jaxh,Yinzumaru,"Idk Man, its always been like this, group stage then 2 game eliminations till The finals that its just One game, idk, im south American, maybe thats why for me its so normal hahahah"
dx7iih8,,"They lost over two games, because the first ended 0-3 for Real Madrid in Turin. Tonight's 1-3 for Juventus Turin in Madrid was not enough and is only half the story."
dx7fo4u,Vegoran,"I wouldn't even be mad if Juve managed to win, but this was a clear penalty. And what an amazing kick from Ronaldo"
dx7fvqg,kurzjacob,In what world is that a clear penalty?
dx7g3at,Vegoran,He pushed and kicked him.
dx7g878,haymaker453,It isn't a penalty by any definition.
dx7g6yc,kurzjacob,He barely makes contact.
dx7gg87,Silversoth,In the one where you don't jump and kick hitting the other player on the arm at shoulder level. Not to say that Lucas Vazquez doesn't let himself drop extra easily.
dx7esgr,onemangoboi,What a fucking shame for football this was.
dx7eton,nomameswe,And they call suarez a diver. That was not a fucking penalty he got the ball as he made contact.
dx7fosf,Tepozan,Clear penalty. You are literally the only person disagreeing here
dx7gomk,LSSN,One of the best penalty kicks I have ever seen. In the 97th minute to decide the tie. Wow.
dx7h7dn,lambomrclago,Everyone saying its not a penalty is delusional. How about you don't barge into the guy with a tap in at the end of the game and you won't concede a penalty.
dx7hh0r,BlondedSeigfried,"UEFADRID, he falls like a feather"
dx7irzv,Chemache,"that wasnt enough for a pen, Vazquez helps way too much"
dx7k328,thedudeabides10188,Still can't believe this ref..... No balls to give Rinaldo a call for diving..the whole game the same shit...
dx7oxr2,Marchinon,Classic Penaldo
dx7eyzd,,[deleted]
dx7guvg,Toavc,"It is from behind, hands on the back, the leg coming around Vazquez and kicking him in the side. Did we see the same foul?93rd minute doesn't matter, he fouled him, stupidly, and was punished accordingly."
dx7fofs,iTLOP,"???? How people are still disputing this penalty call is beyond me, it's 100% a penalty, no doubt about it"
dx7fvbg,,[deleted]
dx7g0ax,iTLOP,"Yeah it is soft, and a very disappointing end for Juventus considering they played so well the whole game. This happens in football sometimes :'("
dx7ffva,cokecaine,Call was good. Plenty of contact.
dx7gas5,noodlebirdbrain,"lol...? let the players decide the game? Who fucking cares if it's minimal contact, it's still a foul in the box you absolute mong"
dx7f9f7,alextastic,Biggest load of shit I've ever seen.
dx7ea9g,Riahisama,What a joke
dx7lmec,bcm311,Milan is the real joke.
dx7vn9y,Riahisama,so is your mom
dx7ehsc,diccwett1899,Karma for that de sciglio pen tho
dx7e8l8,,[deleted]
dx7foef,Styphelus,"If penalties were easy, everyone would score them like he does."
dx7eai3,,[deleted]
dx7envq,crnimidzet,Ronaldo and scoring penalties. Name a more iconic duo!
dx7g1lk,42carats,Messi and choking in quarter finals
dx7g4hw,crnimidzet,Nice.
dx8a3io,TheLastBarbedWire,Look up the stats
dx7e91e,jmclarke5,oof
dx7e9hs,Zlatan132,What an end!
dx7e9s2,admsrl,Of course it would be
dx7e9s5,AdviceDanimals,Oh
dx7ea6p,tmressler,*takes off shirt*
dx7eab8,xrscx,what a fucking end
dx7ebdo,nesstor1891,"Buffon has had the worst luck towards the end of his career, the World Cup, last champions and now this"
dx7ebnz,pentrutaramea,lads it didn't happen
dx7ebp2,a_funky_homosapien,I can't breath
dx7ecaw,raj3sh1,Looks like these stories are written for ronaldo
dx7ecck,TheJordanO,Happening status: not :(
dx7eccw,greekhaircut,VAFFANCULO
dx7edov,Makalunga,Haha what a game
dx7eeb9,aaronkrucoff,Terrible
dx7eeje,Theweezo,Wow
dx7eewb,Deathmeter1,Bless
dx7eexg,mefaithfull,When you study all night long but still fail with 1 point.
dx7efa0,aspiringalcoholic,That could not have gone any other way. Almost felt scripted. Wow.
dx7efyh,DestroVX,"Red card for Buffon was ridiculous, he must have said something truly terrible. The penalty call was justified tho."
dx7eg2i,thelegendjamal,Nerves out of steel. This man is everything. Juventus was crazy tho.
dx7eg4h,themubz,What an end. God damn.
dx7egj2,-Twigs-,Buffon really deserved a better ending than this
dx7eglk,0aniket0,Absolute scenes!
dx7egrg,justcallmeupik,Penaldo to the rescue!!
dx7egs4,g_ferla,Fucking hate this shit.............
dx7eh9f,luisfigo7,Brutal ending for Juventus
dx7ehbc,rebel_wo_a_clause,**Football giveth...and football taketh away** :(
dx7ehc8,sukmecoque,I'm crying for the guy who killed us in 2006... Jesus this is fucked up
dx7ehg3,Stujel-mabok,"Always a penalty, such an idiot for going through the back like that."
dx7ehhz,ValhallaVikings90,What is Benatia doing there?
dx7ehjw,Theroqueanator,This episode of First Team Juventus going to be heartbreaking. Ronaldo strikes again
dx7ehu6,sebas8181,"From the creators of the Remuntada: ""No era penal de Benatia"""
dx7ei25,kotopulo27,Fuck MadridSame shit as every year
dx7ei3h,FreedomByFire,I'm here for the salt.
dx7ei4d,MobsidianTesla,gg Buffon
dx7ei7o,mrmasslehoff92,Literally put on bt sport and Madrid got the penalty.. my bad.
dx7eiaj,felix1824,Put your top back on you bellend you scored a penalty
dx7eib2,foshiiy,Even though it was a pen that ref acted like a child. Had no control over the game
dx7eibq,Billofrights_boris,Brutally sad for Juventus but it's a penalty anytime...
dx7eid6,DeAdLyDoCtOr-316,"nooooooooo, wanted OT so badly.Football though, holy shit"
dx7eidz,BukkakeRockstar,Tough pill to swallow for Juve... :(
dx7eied,Sagardas12,And he did it again. The absolute madman.
dx7eien,GoodbyeHello1,Why he got red lol
dx7eifk,yazandeeb13,No wonder there aren't any English refs going to the World Cup
dx7eifq,Brettis,hello operator id like to report a robbery
dx7eifz,sergio-sanchez,People actually think that isn't a penalty? Hahahaha
dx7eijy,,Well Benatia clearly didn't touch the ball. It was a penalty. Get over it.
dx7eik3,0jah,damn the second half of the netflix Juve documentary is going to GO OFF
dx7eilg,RedGSXR,Fucking smashed it top bins. No saving that.
dx7eimq,metsguy9978,This sucks... but it ultimately was a penalty
dx7eitx,dacia_1310,Well this is gonna cause some controversy isn't it
dx7eiw5,TarHeelG99,Yeah maybe don't kick him in the face there
dx7eiyr,-Mat27,:(
dx7ej1l,TheLimeyLemmon,"I'm sure it wasn't easy for Zidane to watch that sending off, not too dissimilar to his own red card in 2006."
dx7ej67,PraiseBacchus69,"Golazooooo, and a clear pen"
dx7ej6h,GloGangOblock,fuck
dx7ejah,heshboy,I am disgusted and just wow
dx7ejkb,blahblahquesera,bullcrap
dx7ejle,The__Upvote__King,Fucking cunts
dx7ejnj,LordOfDragonstone,The bottle from Ronaldo to wait four minutes and then do that. I was a nervous wreck from my couch lol and he does that
dx7ejqa,makewayforlawbro,Stupid fucking tackle. Awesome game.
dx7ejry,Sebrosen1,Unfortunate.. but that was a clear penalty
dx7ejtw,prraaa,For the sake of football don't upvote this shit.
dx7ejv0,torosFCP,Proper call. Can't being going through the back of somebody to get to the ball.
dx7ek1a,etsuited,"He didn't need to make that challenge. Was going to be on his chest, he wouldn't have had a clear first time shot so I'd fancy Buffon would have saved it anyway."
dx7ek2x,Srecocovic,I honnestly never hate a team more than i do now with Real... Or should i hate bthe ref or The football gods?God i love football..
dx7ek4x,mysticaltea,lapses in concentration from benatia and buffon in the dying seconds. shame.
dx7ekbz,Kakiblack679,Damn I was rooting for Juve
dx7ekeq,Jakudk,"Damn, that's heartbreaking."
dx7ekjc,thethomatoman,Fuck this
dx7eklc,crnimidzet,Fuck my life...
dx7ekmw,-TheFifthBeatle-,How is not a penalty.
dx7ekmx,SmokinArch36,Absolute garbage.
dx7eknf,bilsantu,Do you guys think the penalty is legit?
dx7eq8o,etsuited,Yup
dx7eknw,halfmanhalfvan,Shakespearean
dx7ekqw,eddsters,"Bitter sweet. Buffon is such a gentleman, very sad it ended this way :\("
dx7ekxx,MonsieurLaPadite,"I swear on my three beautiful daughters' life,that is beautiful."
dx7elc1,bannedfordays,Deserved. That's a pen
dx7elf8,DildoSwagginz8918,Who else lol
dx7elhm,idk108,I 100% couldn't have been a player. I would have snapped the ref in half and probably started a riot.
dx7ellf,libertod,for me the penalty is soft
dx7eloh,Heliotex,Oh these comments are going to be good.
dx7em3x,iAruban,"im really not sure if that was a pen, he wouldnt have time to shoot either way since he was trying to control it with his chest while benatia was already super close to him"
dx7emml,StarLordOMT,Well that is unfortunate.
dx7emss,Aaaaaaaaaaaaarghs,Penaldo does it again
dx7en4c,Danielfifa1337,PISS RIGHT FUCKING OFF
dx7en5k,DontKnoName,Come on Snjezni you have to save that
dx7eng3,creativeself_,Hello /r/all
dx7enj2,pjsol,Zidane is red carded in his last match in World Cup and loses to Buffon. Buffon is red carded in possibly his last match in CL and loses to Zidane. (semi final though)
dx7eny5,Outten,That's a pen for me. I understand it isn't the fairy tale most of you guys wanted and emotions running high but come on you can't come in around the back and not even get the ball like that in the box. It's a foul no question.
dx7eo1a,RedMoon14,"I hate it because I wanted Juve to go through, but sadly Michael Oliver made the right call."
dx7eo5k,ButthurtFeminists,As a barca fan: worst two days
dx7eo6d,ElBluntDealer,Clearly a penaltyNot even a Madrid fan...
dx7eo88,Heblas,"I mean, look how clearly Vazquez gets pushed when Benatia jumps into him. The circlejerking here is really pathetic."
dx7eocr,callzor,Weak pen call but I think Real woulda won it anyway
dx7eoeq,HailHelix123,Y'all are just letting the narrative get to your heads. That penalty was the easiest I've seen in a while
dx7eog3,The_Gooch_Median,#INJUSTICA.gif
dx7eoht,post_punker,VAFFANCULO
dx7eoi6,Redchilli007,Oliver with no fucks given but the right decision. Clear push in the back and kick to the ribs with no ball contact. Poor way to end the match but the right decision.
dx7eoie,chqKv,Benatia for the man of the match.
dx7eojj,OptimysticWanderer,Oh Buffon...what a cunt you are...lose all the respect that I have for you..very immature and childish for 40 yo man
dx7eola,AllisGreat,"Yah no one is saving that penalty, no wonder he's called penaldo"
dx7eop0,onyxflye,THE ICEMAN
dx7eoyf,DJellyman,Definitely a penalty. No question about it. Hate it for Juve to climb all the way back only to have that happen.
dx7eozm,Givewood,"So gutted for Juventus, they deserved to go to ekstra time"
dx7ep04,maxoys45,Wtf was Benatia doing.... cretin
dx7ep06,longboardingerrday,"Juventus put it on themselves by letting it be 3-0 starting in the second leg. Sure, it's a bit of a lackluster way to go out but they really have no one to blame but themselves"
dx7ep0t,LottaNerves,"Gigi, you've got to keep a cool head. What sad end to a great career."
dx7ep0u,,Fuck this gay Earth
dx7ep1h,manchesthairy,#siiiiiiiiiu
dx7ep75,seesame,WAS IT PENALTY???
dx7epak,solarandlunar,"In what world was that not a penalty? Even if he touched the ball (which he didn't), he still strikes Lucas Vasquez in the rib and pushes him forward."
dx7epb8,delta_77,Siiiiiiiiiiiiii
dx7epf6,The_trumpster_lad,lol szczesny
dx7epk5,MinimalConjecture,"Think he goes down way too easily. Been doing it all game. There's a difference between having your hands on someone's back and actually pushing them. Even if I'm wrong though, what an awful way for that to end."
dx7eptq,charcoal7777,Ridiculous
dx7epvw,Tin_Tin_,gg juve bros :(
dx7eq1g,Macooz,Im frustrated. As hell.
dx7eqb8,Kouraz95,"It just had to be that way, C.Ronaldo scoring a penalty or Ramos scoring a header in the last minute."
dx7eqll,SD_19xx,Poor Buffon.
dx7eqnv,twistedtheorist,"Well, that sucks."
dx7eqrm,PM-Me-Salah-Pics,"Buffon has to keep his head there, he of all people could have saved it."
dx7eqz3,xiqat,Best week of football in a long time
dx7er0u,Toast_My_Muffinz,Fuck you michael Oliver what a knob
dx7er1a,edd1948,Karma is a bitch. Do u remember Muntari's goal?
dx7er1k,Tin_Tin_,michael oliver got the biggest balls i've ever seen
dx7ercl,4ghosts,What a crazy game lol and ron clutch as usual
dx7erf5,AC_memelan,Just Penaldo things
dx7erla,zoogly123,I'm not even a Juventus fan but that just makes me feel sad that Buffon got sent off. Gigi we love you!
dx7es40,DropItLikeItsKlopp,I'm so disappointed that this game was decided by this incident!Especially because Buffon.Love to hear Zidanes thoughts on it though!
dx7es4z,sexyitalian4ever,Absolute disgrace of an ending. Not surprising they got the penalty call. Typical refereeing for real
dx7es9x,masetheace97,"It sucks that Buffon has to go out like this, but how is anyone bitching at the ref for calling the pen? I mean it was a clear foul from Benatia, and Buffon was rightly sent off. This sub was praising the referee when he sent Verratti off, but bitch when Buffon gets sent off for the exact same reason."
dx7esbk,zbrox,https://media.giphy.com/media/Ob7p7lDT99cd2/giphy.gif
dx7escz,zeroarelius,"Damn, that was a rough end."
dx7esp7,Chuuni_,TSUIIIIIIIIII
dx7esxo,MarkoSeke,What a ridiculous move by Benatia. Gonna get a ton of hate for that one.
dx7et7s,sav86,"This is better to see live then it is with an AA replay, the run of play plus the actual drama that ensued is far more telling of the whole situation + the red card for Buffon."
dx7et8n,jackhp__,WELL. FUCKED
dx7etc8,yeldo23,What a fucking pen
dx7etci,coolfir3pwnz,That match was so emotionally demanding.
dx7etg6,sodenj5,Vazquez was sitting on an open goal and literally had the defender climb on top of him. At that point you're just hoping the ref doesn't have the balls to blow a whistle to decide the game. He did.
dx7etgw,gkkiller,"Fuck, what a match. One for the history books. Poor Buffon."
dx7etht,DSquarious_Green_Jr,Heartbreaking
dx7etsp,HennesVIII,Covfefe
dx7ett6,IAIRonI,Longest I've ever seen between the call and the penalty and he fucking buries it.
dx7eu5e,Sh3rlockHolm,So the last minute winner doesn't have to be Ramos... huh
dx7eu9o,UmCeterumCenseo,[Not like this...](https://giphy.com/gifs/movie-the-matrix-not-like-this-dCdGHgF7yFHFK/fullscreen)
dx7eu9z,Dr_Chimm_Richalds,The way Buffon ends this game with a Red is an ironic mirror image of Zidane's infamous red in the WC final. A tragic end for such an amazing player.
dx7ev56,SerDancelot,Batshit crazy.
dx7evd7,E_EqualsDankCSquared,ITT pple mad this game ended with a right call
dx7evhw,Banjohnsen,Soccer/Diving... What a shitty sport to love..
dx7evk7,archjones,Legends go out in red.
dx7evt3,Erdnussfreund,"Yesterday was great, but today we could see that football can be depressing even as a neutral. Bayern against sevilla was also a shit game."
dx7evt6,Genikavu,WHAT THE FUCK
dx7evzp,BanterEnchanter,Why did buffon get a red card?
dx7ex8f,Lymphoshite,"Shoved the ref very slightly in all the madness, bit harsh."
dx7ewf3,xZealicious,gg
dx7ewfq,kilofrisk,LOOOOOOOOOOOL !!!!!
dx7ewgb,tempnamethrowaway,Not a penalty.
dx7ewit,ShyBlack88,Buffon let his teammates down like Zidane did in 2006
dx7ewte,BeatySwallocks,It shouldn't have ended like that 😭😭
dx7ewty,Lukr1s,"Good call on the pen, but no Red on Buffon."
dx7ex9v,Spooch100,why benatia why
dx7exc3,Martinezdufc,I like football
dx7exyf,TheDrunkHispanic,Does anyone have a link to the foul + red card?? What happened?! I was driving
dx7f0xf,,[deleted]
dx7f7tc,W0666007,"Ha easy penalty call. He ran through the guy in the 6 yard box, two hands on his back, and kicked up around his chest trying to get to the ball."
dx7ey37,judsonzhao,Did buffon shove the ref at last? What's the reason for the straight red? I didn't quite catch the aftermath of the call
dx7eyas,Impatrickk,No no no not again not in semis
dx7eyjt,FallenHorizons,"As a madrid fan, I'm not sure whether to be happy or upset rn"
dx7f27o,ChiefEriksen23,Be upset. This penalty will (for no reason at all) get Ronaldo tons of undeserved praise after RM deserved to go out. Your stadium was booing their own team. That's why I don't support them
dx7eymq,Le_Anoos-101,Red card for what?
dx7f0rl,Ryuujinn,"That penalty, oh my God, the moment that penalty went in this match turned into a wet dream of orgasmic proportions."
dx7f0rq,estpost,Dont give af about Buffon but man I'm sad about Chiellini
dx7f0w8,thebreye,Yeah...I'm done watching soccer for a little while.
dx7f118,Albino_Arabic_Rhino,OH MY GOD WHAT THE FUCK
dx7f13w,unimpeccable,I'm more concerned with how Juve left the box empty in the 95th minute
dx7f14t,PeanutButter000,What a joke
dx7f1a6,_eater_of_words_,Buffon had his Zidane moment. Revenge for 2006 WC.
dx7f1as,Parrot-o-matic,*Sad trombone *
dx7f1c8,migueldias94,"Not taking into account the penalty drama, it's mental how Ronaldo just doesn't feel the pressure and bangs in a perfect penalty."
dx7f1cx,FallFromEden,What is dead may never die
dx7f1eh,SuspiciousPavement,"Sick and tired of watching this in f***** CL late stages. You have to ban straight red cards, make penalty decisions super stricter, otherwise refs will always take the game into their hands and we miss the whole beauty. I mean, I'm neither Juventus nor Real, but this decision was quite controversial for a match of this calibre. I'm really tired of switching off the tv in such crucial matches. I'll update this post with controversial decisions that have ruined the game for me in CL late stages."
dx7f1fg,Dacros,Buffon should've just punched the guy in the face before walking off. Or headbutt him in the chest. This feels terrible for Juve.
dx7f1jq,LGAMER3412,You got to be kidding me
dx7f1qa,fredewio,"That was a goal if Benatia didn't fault, so either way Real deserved to go through, even if they played quite worse."
dx7f1se,Arguing_Robot_Pony,"I want to puke, penalty sure, but a direct red card to a legends last game cause the ref shat his panths ..."
dx7f1yj,king_king123,My heart goes out to Buffon and the whole Juve team. That's not how you wanna lose a knockout tie.
dx7f1z1,FallenHorizons,Madrid: just a prank vro lol
dx7f24y,just_for_fun367,"Laughing out loud at anyone doubting the penalty. It was 100% the right call! This sub seems to always be rooting against Real, ridiculous."
dx7f2im,dURRENRM,the feeling when u can unclench after 90mins of ass whopping
dx7f2lc,KAMATCH,"Only half joy with such manner.Rly didnt like the way Ronaldo celebrated after the respect Juve fans showed him, we were losing 3-0 go get the ball to the center and show respect back."
dx7f2pt,melancious,So sad for Buffon. What a legend.
dx7f2vu,Tadamo1,"Didn't really think it was a penalty, could've went either way but because it was literally at the end he should've left it and let the game roll into extra time."
dx7f2xc,donniexc,And that's why there are no English referees in the World Cup.
dx7f331,bvb19mA,Could have been killed.
dx7f38f,BenAMDavidson,I hate football at times
dx7f38i,Trickybuz93,"Once again, the refs behind the goal prove how fucking useless they are"
dx7f39k,HOFSheamus,What a fn foke
dx7f3i0,Lucifer_xD,"Pathetic, what a shame."
dx7f3i4,helmut-schnaugenberg,I'm surprised Buffon stayed this calm after the red. There was no reason not to go full Zidane.
dx7f3ln,Lxqo,I've looked at all the AA angles and must be missing something.. Why was Buffon sent off? For shouting at the ref? Benatia committed the foul. And where did the 8 minutes of stoppage time come from if there was only 3 added?
dx7fdli,rainbow0o,the 8 mins were from the penalty call basically
dx7f3uk,deadkestrel,"Nearly 2k comments in 10minutes, holy moly"
dx7f47d,EC_74,Wait what did Buffon do to get sent off? Did he say something to the ref or am I missing something? Am I blind?
dx7f81w,Hollandrock,Touched the ref while swarming him (from behind)
dx7f4t8,Sjsvb,Lol I wanna die
dx7f4vz,Move_Over_Rosa_Parks,Whenever I go over to my grans and she taps me on the shoulder it usually absolutely blasts me the the floor so I totally see how that was a pen.
dx7f51p,BashTheBlu,What a beautiful sport
dx7f5en,INdragoneXS,"There penalty was there but how to make sure it doesn't get saved, ohh yeah let me give Buffon a red card for good measure. I don't think CR7 would have taken a penalty so nice if he was shooting vs Buffon."
dx7f5ot,GreyMatter22,"As a Real Madrid fan since I was a little kid, what an unbelievable game Juve played away from home. Gigi Buffoon played his heart out, and I wish this tale didn't have to end like that.Last minute penalty is such a sad way to go, for whatever it is worth, nothing but respect to Juventus."
dx7f6a0,SZJX,Well after all eventually on the balance maybe RM still deserved to win the tie. Also the third goal was a Navas drop. But it's just so harsh for Juve.
dx7f6a4,hashtagPLUR,Refball
dx7f6b0,Davetology,"Really soft pen, pretty much 50/50 but of course they had to pick the most controversial one.."
dx7f84k,Conspiranoid,"Does someone have a gif of the first replay of the penalty? Like, I see some people saying he was already falling/flopping before the contact, but I can't really see it, he just reacts to the push to the back..."
dx7f84r,MischifManaged,It's devastating to see Buffon sent off like that especially if it turns out to be his last. But honestly the ref had no choice. Doesn't matter the situation you can't get in the ref face like that.And props to Ronaldo for an unstoppable penalty
dx7f879,PhantomTrouper,"Benatia totally kicked the player. Not a RM fan and I really wish Juve would go to the next round, but it was an obvious penalty."
dx7f9ns,Ashitakaa,Lol I am amazed how people say 200% penalty watching this angle this replay.Give the angle from the back...
dx7fa7a,HerrLanda,"Guys i didnt watch the game, wtf happened? Did Real performed badly, or Juve just gave their best, or both?"
dx7facm,fgdadfgfdgadf,Really need another camera angle to judge it
dx7fbm2,the_man_who_comments,I was hoping Szczęsny would chokeslam Ronaldo so he couldn't take the penalty.
dx7fbw5,MadridFC,"men, what a game, I actually wanted it to go extra time but that mistake from gigi make it impossible."
dx7fc6i,CrazyRed98,Who's got the two hands on back of Lucas video? I need it.
dx7fcc9,ionelp,"If Roma draws Real and win, that will be a very conflicting matter for Juve fans"
dx7ffjx,bbkalaba,Thought benatia sold the push quite well lmao
dx7fh4w,m0cl0v,Good game. Good call by ref
dx7fini,Samytoch22,"If he saved that i would of gone to Madrid and kissed him but no , Ronaldo back at it again with pens"
dx7fjqb,existentialmentalist,So damn close. Might be for the best though cause Bayern would have had an easy final.
dx7fkc6,Urumik04,Of course he did.
dx7fljn,TMaier16,"I know it's heat of the moment, but tbh Benatia shouldn't have gambled and just let Vasquez control the ball"
