Comment ID,Username,Comment
dx7h1tt,motez23,I'm making a statement
dx7m9ct,Castdeath97,Check CL twitter's reply and come back and tell me no one said it.
dx7hinx,jrey0707,"i can obviously see why it was called a pen, but in the replay it looks like hes going down before benatia gets to him. i just think its a tough call to make after climbing your way back all game. let the game play and take it to extras"
dx7iitr,motez23,you can't pick and choose when to follow the rules
dx7ju63,jrey0707,"which is why i pointed out that he was going down before benatia got to him. and saying you cant pick and choose is kind of bullshit. how many times have fouls been given/not given based on it being in the box? it happens all the time. pks are, generally speaking, harder to earn. i think it was a soft pk, and especially soft given the circumstances."
dx7ihk9,throwaway689908,That's now how the game works.
dx7fx94,Crot4le,Because it is simulation. The slightest of touches and he throws himself on the floor.
dx7h5dl,CaptainJingles,Two hands and then a knee to the numbers? Does he have eyes on the back of his head to time his simulation?
dx7kj43,AntiChr1st,There is no push and there is no knew to the back.He gets lightly touched and falls instead of making the best play he can.Should've gotten a yellow for filming
dx7kqum,CaptainJingles,You can see Vasquez's body move from being pushed at 0:27 of this video. Unless he guesses that he is about to get touched and reacts accordingly...while his back is to Benetia.
dx7l7dx,AntiChr1st,"He gets lightly tapped, you see more contact on every single corner and free kick ever taken in the history of the game. Are you seriously trying to claim that the Juventus defender is so strong he can send a grown man flying without even looking like he is trying? Either he is secretly Clark Kent or Vasquez dives because he sees a chance to play the ref instead of the game.I'm going with the diving explanation.Football will never be fixed until they do like hockey. If a player isn't actively trying to stay on his feet, book him for diving regardless of contact."
dx7m4kb,,> no push> no knee> lightly tappedhttps://streamable.com/ft51kTell us why being kicked in your ribs while the defender makes **ZERO CONTACT WITH THE BALL** isn't a foul anymore?
dx7n3q0,AntiChr1st,"You make it sound like he was full speed drop kicked by Vin Diesel flying out of a camarro.He is barely touched. That isn't painful, it doesn't have any effect on you, you would barely notice if someone did that to you right now. He gets touched and falls down screaming in a way that my 7 year old niece would find embarassing, he does it because he sees a chance to manipulate the ref over playing the game. It's a contact sport, that means there is contact. If a small child is tougher than he is then I suggest he change careers for something more fitting his pain tolerance. Though that might be difficult considering he seems to be more fragile than an uncooked egg."
dx8dxof,,"He doesn't need long contact with the push. It needs to be impactful. Do you not know how physics works.Benatia was charging at him with momentum and gave him a shove. That's what threw him off balance. Pause right after the push and you see his head flying forward.> That isn't painful, it doesn't have any effect on you, you would barely notice if someone did that to you right now. > He gets touched and falls down screaming in a way that my 7 year old niece would find embarassingYep I'm sure you and your 7 year old niece would be fine after Benatia kicked you guys in the ribs. Good job mate."
dx8f6i3,AntiChr1st,"> He doesn't need long contact with the push. It needs to be impactful. It's not impactful either, barely touches him.> I'm sure you and your 7 year old niece would be fine after Benatia kicked you guys in the ribsIf the kick is like that anyone will be fine. It's not a roundhouse kick by a pro muay thai fighter, he moves his leg sideways and inwards towards himself while moving in the opposite direction, it's completely impossible to generate any force like that."
dx8g2yz,,"> It's not impactful either, barely touches him. It's like you didn't read the post. You're only even saying this because of how slowed down the clip is. Also I can tell you're confused because there's 0 correlation between force impact and how long Benatia touched him. It could've been for 0.1 seconds and it'd still be irrelevant. Literally the only way of judging impact here is looking at the reaction afterwards. And you can see Vazquez's head immediately fly forward. No unnatural movements.> If the kick is like that anyone will be fine If you cannot understand why kicking someone in the rib is a foul then there's no point continuing. Just watch the same link in a few days when you're less frustrated. The fact that virtually the whole thread is disagreeing with you is telling."
dx7gps6,Walmartsavings2,"This is true honestly. The contact is very, very, weak. He definitely makes contact but it's still a simulation and Juventus doesn't get that call ever."
dx7ka6t,MyNameIsSushi,"> The contact is very, very, weak.Any kind of contact in combination with a dangerous play is a penalty within the box. Doesn‘t matter what kind of contact."
dx7hfcc,kumblast3r,"Vazquez doesn't even make an attempt to play the ball, he's clearly just baiting the contact. Anyone who's played knows he went down so easily."
dx7ge24,iDrownNerds,You have to realize this sub is a Ronaldo hate circle jerk. They love to see him fail.
dx7f71u,LocostarX,ITT: A bunch off butthurt people lol.
dx7g2s1,drotoriouz,I am indeed butthurt.
dx7ezwe,FuujinSama,"This sub is so weird. It's never a foul unless someone's bleeding. Jump kick a player ""why is that a red card, not even a yellow in my book, he's trying to play the ball."""
dx7eyle,SirPoliwhirl,"Yeah I'm really surprised reading all the reactions. I was rooting for Juve, but come on."
dx7g8no,,[deleted]
dx7hk1s,SirPoliwhirl,"Yeah luckily everything is sorting out right now. But you should have seen the match thread, once it had been created. 'Robbed', 'shitref' etc."
dx7g0gu,SirWosko,"Italian TV showing """"exclusive footage"""" that shows that benatia touches the ball, salt is real lol was clearly a pen.."
dx7gdlh,Ema919,"I'm watching it and I'm calling bullshit, the image doesn't show that the ball hits the foot, and Benatia hit Vazquez's back with his body and his chest with the foot. I'm saddened by this because I wanted Juve to go through, but it just looked clear to me."
dx7gdzq,2400gbot,">I'm sadHere are a few funny [cat pictures](https://imgur.com/a/eqX4F) for you /u/Ema919, to cheer you up!___^^hello, ^^I'm ^^a ^^bot ^^and ^^this ^^action ^^was ^^performed ^^automatically ^^for ^^questions ^^pm ^^me. ^^[Source](https://github.com/maumau35/2400gbot)"
dx7ggdz,Ema919,good bot
dx7f6ld,Yankee_Gunner,Whoa whoa whoa... Get outta here with your logic
dx7ip9n,nutmeggerking,"That's a correct observation (it was a pen), not logic. You are using this in the wrong situation, mate."
dx7krw6,Yankee_Gunner,Thanks for your input
dx7f62t,pesek34,There are actually very few who said that here.
dx7j71b,amalgamatedchaos,"Late to this post, but I'll admit it... I didn't think it was a pen. It's one of those calls where it might be easy to call anywhere outside the box b/c the consequences aren't as high, but we see this kind of thing all the time. It's a bit too soft in my opinion to affect a whole tournament over.I mean you could probably break down where his hand is, his leg, his knee, and how it affected Vazquez; but Vazquez also goes down way too easily. The defender makes the play, gets the ball. The contact that was made wasn't harsh enough to be called a foul imo. It's still a contact sport. There, I said it."
dx7knhz,AntiChr1st,> Vazquez also goes down way too easilyI still say football should copy the diving rules from hockey.If you aren't trying to stay on your feet you should get booked for diving.
dx7mnca,Wutzer,How would you handle this situation? Vazques goes down easily but it was still a (soft) penalty. Give Vazques a yellow but still award the penalty? Can it be a foul and diving?
dx7nq35,AntiChr1st,"In hockey they can do both. It goes under embellishment. Basically the ref says ""yeah it was a foul, and we're taking him for that, but you're being a bigass fucking baby about it so you're going too"" (also because it's hockey they're allowed to use grown up language, so the ref might actually say exactly that).In this particular case i don't think it's a penalty at all. Vasquez falls because he wants to fall, it has nothing to do with the contact made. The contact is not noteworthy, it doesn't make Vasquez fall, it's not dangerous, it's not painful... Fotball is supposed a contact sport, you see much harder contact than this on every single free kick and corner. The level of contact that is allowable should remain constant throughout the game."
dx7f7f8,Pdeedb,"All day every day is that a pen, and Buffon went way way way overboard and frankly I think that's a red. Two tough, big calls for the ref and he got them spot on. Aside from that what a pen from Ronaldo. Incredible."
dx7f8l9,EdgeFC,"They're talking out of frustration, r/soccer desperately wanted Juve to go through. I understand some comments, others (like saying ""disgusting"" or ""not a penalty"") I simply don't but whatever I guess."
dx7g7k0,XooV,"The vast majority are saying it was the right call.. Including me, but I think it's stupid to say it was a ""clear pen"". It was pretty light contact that often wouldn't get called."
dx7ga55,Ema919,light contact? He assaulted his back
dx7gg9s,XooV,"You've got to be kidding. Slight pushes like that happen all the time all over the field and are very often not called fouls when they should be. It was not a very hard push.. but call it ""assault"" if you want"
dx7gt34,Walmartsavings2,Exactly! It's not nearly as clear as people are saying. That happens on EVERY FUCKING CORNER ever. Never called.
dx7hzbo,k1k13,Yeah but this is literally a clear goalscoring chance. Corners are not really a 99% goalscoring chance
dx7grjy,Ema919,"That was not a slight push... Benatia jumped and had the higher half of his body over Vazquez, then he put his hands on the Madrid's player's back and put all the weight of his body on him because of that. I understand all the hate about this, but it's mostly saltiness in my opinion, that was a pen and if it happened for your team you would've said it was. Edit: I thought I was responding to the one saying it wasn't a pen, sorry about the last part."
dx7kx3p,Walmartsavings2,We would absolutely never ever ever get that call vs Madrid in the final minute to bail us out.
dx7h3wp,XooV,I guess we just disgree about how forceful it was.. that kind of contact happens in the box on basically every corner and isn't always or even usually called. I just wouldn't call it a clear or easy decision
dx7exjq,A_Bit_Of_Nonsense,But Real were the *baddies!*
dx7kipm,I_AM_ALWAYS_WRONG_,"Was a pen, but we all know they wouldn't pay the same pen to knock out Barca/Madrid. That's the problem. You would have to take someones head off to have a game deciding penalty go against you as a Barca/Madrid player."
dx8d4o5,Rudi_Reifenstecher,no it really wasn't
dx7ffdu,Dyalibya,"Indeed , it's a penalty"
dx7irt3,estoxzero,"No it wasn't, maybe to your soft football yeah"
dx7iula,Ema919,"Italian football is all but soft dude, lol."
dx7jb6i,estoxzero,Shut up and hope that the referee doesn't give a hand to real Madrid vs Roma
dx7jhle,Ema919,"It's not like we got much of a chance in the case anyway, even today Real deserved to score at least 1."
dx7kf0q,estoxzero,"You are in better form than juve, and your dt is better than allegri"
dx7eeal,Koooshlover69,How are people seriously questioning that penalty call?
dx7esyr,mattwillyz,I think everyone was just pulling for juve and was gutted at the outcome.I was pulling for them hard and I hate Madrid but it was a good call. Regardless of that I still found myself calling it bullshit these last ten minutes lol
dx7fnvn,AlphaQueueHard,As soon as they lost I remembered I hate Juve too so it's not so bad hahaha
dx7fxe8,mattwillyz,Crazy how that works huh? Madrid will do that to ya
dx7fa90,JokeSportGuy,"It's one of those ""good"" calls. Soft enough to be total bullshit, but there was contact and well."
dx7fdvv,mattwillyz,"Yeah. I have to believe that with the way Madrid gets so many generous calls in CL, that players would be a bit more cautious in a situation like that. Was reckless by Benatia, but at the same time he had to at least try to make a play"
dx7g32k,adrenalinemusicguy,You were pulling for juve because Woy
dx7g48u,mattwillyz,Not gonna lie I was hoping he saved that pen haha
dx7g6fa,adrenalinemusicguy,"Yea and in the post match interview, he'd say: fuck Itally, I'm comming home, Wonga!!"
dx7fc2s,tastetherainbowmoth,"jea it was a pen, but ref come on, dont give a red, and why wasnt he playing that extra-extratime"
dx7fkuf,mattwillyz,Buffon must have said some heinous shit to have gotten a red. Curious to see what he says post game. Idk how people are already hopping on the “le classless Gigi” train when they're not entirely sure what happened minus a lot of screaming
dx7fnuz,gonnacrushit,"he didn't say shit, he manhandled the ref"
dx7fsop,tastetherainbowmoth,"he had his mouth open but was pushed from behind on the ref, and the ref kind of only sees buffon all over him and reacts instantly and gives him red. I think if he just shouted he might have gone away with yellow, but that push got him red. unfortunately it wasnt even his fault really"
dx7j2uw,fistymcbuttpuncher,"Only reason I was hoping Juve would pull it off is for the RM fan meltdowns, but then again, fuck Juve :(RM just won CL."
dx7fkpa,spanish787,"Lmao my friends are bombarding me saying that it wasn't a pen, ref was paid...Clear pen to me"
dx7iq2c,LeftHookTKD,No way that's a pen. There was barely an contact. The madrid player fell down WAY too easily and this is exactly what makes a lot of people not take our sport seriously.
dx7p3tt,kurchak31,"I actually agree. How anyone thinks it is a CLEAR pen is beyond me, it is very much in the Grey area. In my mind it's no pen. Hands resting on his back as a normal part of play, no shove, no touching to disrupt his balance, was falling before any contact. No pen and I'm no juve fan."
dx7r9bk,LeftHookTKD,Yeah I obviously am not a Juve fan and that pen still made me furious. You can't give that kind of pen in the last seconds of a tie game in the UCL.
dx7fj0w,SureSure1,We are not questioning the call. It's just that it's a sad ending to a great match that looked liked it was gonna come down to who had spirit. The ref blue-balled us from witnessing that.
dx7g4gb,NaughtyProwler,"The reverse angle they showed for like 1.5 seconds on BT. Thats why. Honestly, VAR would solve the whole thing though regardless of what we think. Too bad it's not in yet."
dx7h8qr,smala017,From some angles (that any person with a brain can tell you are useless angles because you're screened from the contact) it has the appearance of a soft call. But the television angle makes it clear that there was a push in the back.
dx7fmfk,Hispanicwhitekid,"I mean idk. I'm American so I'm used to rougher sports, like you can't wrap your leg around him obviously, but he goes down so damn easily. Weaker penalties have been given tho."
dx7egmd,W0666007,Yeah... he pushed through him and kicked him up around the side. In what world is that not a penalty? He even puts two hands on his back (seen at 27 seconds of the video).
dx7focj,Chanceria,Vázquez fell way before any contact is made
dx7g73p,W0666007,"I mean... no? https://a.pomfe.co/ouxwy.mp4You can see him standing upright at 27 seconds as the defender is extending his arms into him, and then he falls forward. Clear penalty."
dx7h0j5,Chanceria,Beneatia goes like a retard but barely touches him. Fall like a piece of paper.
dx7insu,MyNameIsSushi,Because kicking someone in the chest without touching the ball is completely within the rules.
dx7jxp2,Chanceria,He doesn't do that? He comes from behind more less like a retard but barely touches him. This is football not ballet. if the ref gonna give a foul for every shoulder shock we would have fouls everyone time Ronaldo touches the ball
dx7k70v,MyNameIsSushi,He does. A dangerous play in combination with *any kind of* contact within the box is a penalty. If there‘s no contact but still a dangerous play then that would result in an indirect free kick inside the box rather than a penalty.
dx7ec1z,Dincht04,Clear pen. Stupid defending and utterly awful positioning in the first place from Benatia.Cracking penalty as well.
dx7fi93,Ale_Hodjason,Agree with you %100. If he hadn't done anything I don't think real would score honestly.
dx7ib0k,Waylaand,"Agree and the worst thing about it is hes not even going for a header hes trying to chest it down, could have saved that :/"
dx8kn25,krylosz,Benatia was on his way back from helping out on the right wing. I don't know how he could have been in a better position. It was Matuidi who let completely gives up the center and stands around watching the rest of it play out.
dx7fsnr,Haevollgutoder,"The bad positioning was Alex Sandros fault, not at all on Benatia. Sandro completely fucked their defensive line"
dx7f8wr,BirdOfHermess,I really don't think so. Lucas was already really quick to fall even without contact before. Real was fishing for pks.
dx7g2t0,fake_lightbringer,"Penalty or no penalty, this was no dive. Benatia gets more than enough of him to make him fall."
dx7h73f,TheMentallord,"It was a clear push. Why would he dive there, with such a good opportunity to score? Buffon was beaten, the defenders were beaten, no reason to dive there at all."
dx7el9o,msdsc2,where are you when /r/soccer died
dx7f9l5,dekszter,-sitting at home watching fairytales-barcelona rings-juve is die-no
dx7ezog,Muslim_Pulisic,Buffon is kilNo
dx7ptsg,sebas8181,"Which year? 2016, 2017 or 2018?"
dx7f8fz,DippStarr,"At first look in full speed it appears to be a rock solid no call of a foul. After watching it through about 5 times you can see Benatia give Vasquez a shove, then come through him, and then kick him in the chest with a leg rap, all actions missing the ball. The only call on that play was a penalty. Damn shame Benatia had to blow it like that."
dx7hj3e,Nuwanda84,Is there a better penalty taker? He's razor sharp.
dx7e855,ekoth,fuck off
dx7f0jd,tapped21,Inb4 Bayern Real semi final
dx7gavk,Unban_Ice,Yes please!
dx7ix3g,Ab_Stark,Yes please!
dx8i4r2,Unban_Ice,"Feeling strong because you could win against juve with a 98th minute penalty? Now I want it even better, just to laugh on you afterwardsGood luck"
dx91qk7,Ab_Stark,Why so serious mate? It's just banter
dxao9oo,Unban_Ice,"Seems like either of us will be right after all, even if it was banter or not"
dx7ewfn,PastryDish,The salt lol. It was definitely a penalty too
dx7f5fx,zidaninho10,Absolutely fair goal.
dx7fzp3,diggsoutforstefon,juve won that game. the audacity ronaldo has to rip off his shirt after scoring the pen like they fucking deserve this.
dx7g60x,Criym_Rl,What are you on about ? Real still won the first leg and they deserve to go through
dx7goye,diggsoutforstefon,juve came back away and scored 3 unanswered goals. tremendous dive by vasquez to send them through though mate. ronaldo needs a lesson in humility. madrid played like utter shite all game and they get lucky in the last minute and he rips off his shirt like a horny little college girl.
dx7h09b,pizzaguy953,who hurt you lmao
dx7q64n,pianoftw,"Here, in his natural habitat. The armchair American who has never kicked a ball in his life."
dx7q8ps,diggsoutforstefon,"lol, ODP player throughout my teens. thanks though!"
dx7gg0e,RZAAMRIINF,> the audacity ronaldo has to rip off his shirt after scoring the pen like they fucking deserve this.We won 4-3. We deserved this.
dx7h7q4,,[deleted]
dx7eu83,Kurvco,Classic fucking Penaldo
dx7evfu,Albertcore,"Same Shit as last year with you guys, I'm in shock"
dx7f57a,sidhantsv,Only that the decision tonight was actually right
dx7fe11,Mktwoo,"Why on Earth is this guy downvoted? All emotions aside, that is a penalty no matter what way you look at it ."
dx7fr2e,Majormlgnoob,sports subs tend to hate the top teams
dx7gwzw,A3xMlp,I'm seeing far more people supporting the decision than those opposing it. Compare that to some local sites here in the ex-Yu and people are going mental. The comments are glorious.
dx7gcpf,bamadeo,"i wanna see other angles but in my opinion (downvotes come to me) it's not a pen, that contact, in any other part of the pitch isn't a foul. That said, stupid positioning from Benatia and even worse by Alex Sandro, he should've gotten CR7 offside"
dx7hxlo,Zack_Fair_,honestly I don't blame people agreeing with you. it's obvious Real practices flops and that one was a beaut'
dx7fcih,,[deleted]
dx7fh6h,AzeiteGalo,I think you mean salt mate.
dx7gsq3,Nerdyblitz,> Barça flair> SALTY AF
dx7ftkr,rishijoesanu,Who cares. Fuck Real Madrid
dx7fza8,sidhantsv,Cheers
dx7fqtd,Chocoschism,"Getting really tired of this.Yes we scored 2 offside goals in ET vs Bayern, but their goal that put the game to ET was offside.And before someone brings up Casemiro, Vidal should have been sent off either with an insta red for his challenge on Isco at the start of the game or with a second yellow for another bad challenge on Casemiro in the 48th minute.The ref was terrible for both teams."
dx7g9lo,I_travel_for_work,"Give it up, and let us be mad. It's not that big of a deal. You still won."
dx7gd52,Chocoschism,Aight that's fair
dx7gi9q,RamboLeon,Ye but Vidal was Sent off and casemiro Wasnt While both should have been off the field. You cant keep a straight face and say real isnt getting gifts every season in the important games.
dx7go94,Chocoschism,"Vidal should have missed 85' minutes of the game. 45' if for some reason you think his challenge on Isco wasn't a red. Casemiro should have missed 10, and let's not forget your offside goal. If anything we got the worst of it before the ET."
dx7h065,RamboLeon,"Keep argueing you monk, offside goal in the final one year, clear dive gives you a Penalty the other.Just fuck off. Madrid is „lucky“ every game that doesnt go their way. If Madrid win the Champions League this year the competition doesnt mean shit anymore. Watch the game either the spanish team is better and they Will Never be unlucky or the spanish team is worse and then play with 12 men."
dx7h3rz,Chocoschism,"[Alright friend, have a nice day.](https://www.youtube.com/watch?v=3KquFZYi6L0)"
dx7hrmy,RamboLeon,"Go celebrate your win with the other Madrid fans, if you actually Support the Club. I bet you just sit in your room and Stream the game illegally and Chose Madrid as your team so you can feel good about yourself.You dont know what real Emotions in football are and how should you if you dont even know how the game Works. Everyone who Ever played a game of football knows that it wasnt a Penalty."
dx8irqd,zaedaus,Apply butthurt cream
dx7htxd,Chocoschism,there there
dx7f5bt,MacGooder,"I really want to play these guys, but then again not really"
dx7jlmn,Vipi,"Hate him all you want, but he's the only guy you want taking that pen"
dx7goxy,xeneize93,That was a fair penalty any day but damn it saddens me :/
dx7fsuq,raj3sh1,Even buffon wouldnt be able to save that
dx7fzrb,trendy_traveler,"If you look closely, Benatia pushed Vazquez in the back using his right arm. He really didn't need to do that. Stupid decision since ref was right behind him and must have seen that clear as day."
dx89aqh,HenryHenderson,"Crazy how in the end, Buffon was the only one to blame really.Benitia had to make the challenge to prevent pretty much a certain goal - no blame.Vasquez was tackled unfairly imo with the challenge, didn't dive - no blame.Buffon got in the refs face and pushed him - blame.Ronaldo slotted home perfect penalty under intense pressure - no blame.Szczesny had no chance to save penalty - no blameSad it had to end that way but Oliver got it right all around. Maybe he could have took discretion with the red card but according to the laws of the game, he had to."
dx7efab,Irctoaun,I know it doesn't fit the narrative but Oliver got that right. Very clear shove in the back for the pen then Buffon pushes Oliver multiple times which will always be a red
dx7gv4k,TheMediumPanda,Screaming into the ref's face like a madman ( the replays are not kind to Buffon) ought to have been enough for a red. Embarrasing spectacle and Juve should probably have had 2-3 players sent off.
dx7gv35,krisburturion,Unless you play for Madrid or Barca you mean.
dx7g2p6,smala017,I'd like to see another angle on the foul. The ones we have now are inconculsive because you can't see the attacker's back.I'd also like to see push on Oliver. I haven't seen a video yet of what Buffon did.
dx7geg3,Irctoaun,"Buffon is very aggressively walking into Oliver, essentially pushing him with every step, all while screaming in his face"
dx7gnxr,smala017,That's what everyone's saying. I'm not questioning the call I just want to see the whole video.
dx7ex7z,DriizzyDrakeRogers,"That wasn't a shove. He barely makes contact with his back and as soon he does, the other guy is going down. He flopped hard, the ref just wasn't in position to see it."
dx7gb53,Irctoaun,Watch the final angle again. The Real player's body goes forward before his head because of a shove in the back. You can't really fake that
dx7en8z,mattwillyz,Where were you when Gigi was kill
dx7kyyd,ChipsfrischOriental,"I was home watching Penaldo compilations when phone was ring""Gigi is kill""""no"""
dx7fds6,reekthegoat,no
dx7gac5,prodigalkal7,No u
dx7e8dz,abshkvj,Fuck football
dx7ewg7,,[deleted]
dx7f3a8,abshkvj,man shutup
dx7go2q,zidaninho10,You stfu. We won fair as fuck.
dx7f7ha,Lorenzo_Insigne,Nah.
