Comment ID,Username,Comment
dx7gyv7,takimora,"Ffs, Vásquez baited the foul, he knew he was in a bad spot for a shot and hoped someone would panic and that was exactly what happened, otherwise he wouldn't have his knees soft waiting for a push. It was a clear chance of goal, but it wasn't a shot and nowhere close to a clear shot, and if you still think otherwise we probably just have different subjective meanings to that word."
dx7f06k,ankitm1,"Then players like Welbeck will never get a penalty. ""get up you whiny arse. You think you could have scored from there?"""
dx7f3os,chose_another_name,This would actually be a hilarious rule change if only to watch refs make fun of players
dx7f4hv,bradimus_maximus,...hey.
dx7eq8x,Theart_of_the_cards,"It was a foul, he fucking jumped in his back wothout the foot in front hitting the ball. A foul is the only criteria for a pen, or am i mistaken?"
dx7fn0k,takimora,"I didn't even say it wasn't a foul, I pointed out it wasnt a clear shot"
dx7foz2,Theart_of_the_cards,"Youre right, sorry for jumping the gun."
dx7fma7,HakeemAbdulOlajubbar,Even more reason why Benatia shouldn't have fouled him there. Buffon had a pretty decent chance of getting there in time to prevent a shot or make a save.
dx7fq4m,takimora,"Sure, I can definitely can behind that, Benatia should've been more careful."
dx7fea9,,[deleted]
dx7ffv5,JesleyH,;d
dx7fk1b,Apolog3ticBoner,"Too excited, I see."
dx7flw3,JesleyH,Gotta rush for that sweet karma lmao
dx7gwrs,hungry4nuns,> Rules are rulesIs it a rule to automatic red card for protesting a decision? because ronaldo could've been sent off multiple times for his appeals
dx7h0zi,JesleyH,"Well I am not fan of the acting and diving Real do, in fact I can't comprehand how anyone can enjoy watching them play at all, but Buffon went quite ballistic, it was a different level to Ronaldo and your usual protesting"
dx7i7dm,hungry4nuns,"Agreed it was hot headed however given the gravity of the situation, a good ref would have kept his head, given a warning shot of a yellow and followed it quickly with a red if not heeded. You could see Buffon was fired up with emotion the entire match but was not a danger to other players nor was he attempting a professional foul. Nobody would have criticised the ref (except Madrid fans) for showing yellow, especially after what he let ronaldo get away with in terms of continuous protests."
dx7s8rx,thedeliberative,He didn't push him. Jesus fuck.
dx7enc2,Kenarsene,"Where was the push? Lmfao, he literally reached around and got his leg in to clear the ball away, nowhere in that challenge did he use his hands."
dx7eqlx,detinu,He pushed him from the back right before he goes with his leg across him. It was a pen.
dx7exxx,Tweegyjambo,Rubbish.
dx7f04d,hehemyman,"There is a push every time a player is in the box, it never gets called when its that soft"
dx7fi2w,BeesAreStingers,"Barca has been proven to get a penalty on getting players pushed, even though the ball was other way and the players had no connection with where the ball was."
dx7fwim,hehemyman,Yeah and that Suarez pen shouldn't have been given
dx7g8kj,BeesAreStingers,"I wasn't speaking about that. [This] (http://www.goal.com/en-india/news/2292/editorials/2012/04/05/3015364/referee-broke-the-law-in-awarding-second-barcelona-penalty) is what first came to mind, which I am still salty after 6 years. Yet you can't negate that referees have been favourable to Barcelona in CL at least."
dx7eqc1,jordank94,I forgot it's legal to put your foot into somebodys chest
dx7exlj,Kenarsene,"Yeah bro, he definitely came in foot first right onto his chest. Studs were towards the ball, challenge was for the ball. Lucas felt benatia on him and went for the dive. Worked out in the end, I guess. Madrid have been aching for that penalty call all game lmfao"
dx7eunq,RevengeOfTheDwarfPig,C'mon man. He put both his hands in the square of his back.
dx7extn,Mrg220t,https://i.imgur.com/T8G8UJQ.pngLiterally there's a video linked in this page.
dx7f38a,NoSoyTuPotato,*looks at flair*lol [same way this is a foul](https://shittybanter.files.wordpress.com/2014/07/neymar-injury.gif)
dx7epii,PotusThePlant,He wasn't pushed though...
dx7fc3o,sjokoladenam,"How is that a push though, you can see he is faking it if you click the link and pause at 0:21"
dx7eofv,zackya89,"Or if he didnt do that dive, is a fact of today's game so much money involved any little thing they can get they will try."
dx7et0y,,[deleted]
dx7evqo,JesleyH,"Yea and you gotta be careful as a defender in those situations, Benatia wasn't"
dx7ffbp,NoSoyTuPotato,"if somebody is in front of you and you jump and wrap your legs around him, you'll get a foul called on you"
dx7gg4d,,[deleted]
dx7gu23,NoSoyTuPotato,"Still gotta do it cleanly. Can't just kick somebody in the back and pawn it off as a no call because ""he wasn't trying to foul""if he somehow go to the ball first without making contact, it would've been clean. There is a reason that you're allowed to shield the ball with your body."
dx7etz3,wtfigot,He was already falling before Benatia touches him.
dx7ekc5,monnii99,Why did football lose? It was a correct call imo
dx7eslp,TooSwissToWrestle,After all the bitching we get about refs shitting it in big moments/matches we finally get the mother of all decisions and people are complaining about it. Credit to him for not losing his nerve.
dx7pifi,msbabc,"Generally, I'm no fan of Michael Oliver, but he got this right"
dx7enr0,bustedracquet,Because we lost out on what would have been an amazing extra time + possible penalties.
dx7f07k,BeardedSwashbuckler,Has there ever been an amazing extra time? Players are tired and terrified of making mistakes so its usually pretty boring with both teams parking buses.
dx7fbam,VinceJumpmanCarter,Chelsea-Liverpool about a decade ago was pretty amazing IMO
dx7fgt5,CleveNoWin,Germany vs. Algeria at the 2014 world cup?
dx7g4aj,non-relevant,">Has there ever been an amazing extra time? Players are tired and terrified of making mistakes so its usually pretty Schalke - Ajax in the quarters of the EL last season[shit highlights](https://www.youtube.com/watch?v=AbJGFEp3CHk)Ajax down to 10 men, 2-0 at full time (after 2-0 in first match), Schalke scores 100th minute 3-0.10 men Ajax desperately fights back to 3-1 in the 110th and then even 3-2 in the 120th[sideways full extra time video](https://www.youtube.com/watch?v=HcPcdxuRawk)[Here's the Ajax away section reaction to the 3-1 and 3-2](https://youtu.be/rO6zvEmG0ms?t=435)"
dx7fhu9,ihaverocketlegs,We had a decent OT in 05.
dx7g2l7,fractokf,It would still be an amazing tactical battle to watch.
dx7g0ly,TooSwissToWrestle,That Chelsea-Liverpool CL one
dx7f6zh,tanu24,Which is why it needs a golden goal
dx7fjj1,Ractrick,"Golden goal made it even worse, games became so defensive it looked like teams were terrified to enter the oppositions half, which is to be expected when the penalty for conceding is so great. Glad we've moved on from it."
dx7fzna,tanu24,Take away the Pens and make it golden goal. Someone gotta win so you can't sit back Pens suck to decide a winner
dx7g4vm,EtoshOE,"Ooooh next goal wins in the Champion's League, neat"
dx7gjue,tanu24,It's much better since it's actual soccer/football for a winner instead of people lining up for pens.
dx7fpuz,tibetanguywithadog,"Golden goal is way too harsh. Maybe after team A scores a goal, give 10 mins for team B to score back or end it when team A scores another. So it'll keep going until one team can't score back within 10 mins or one team scores two in a row."
dx7fwl5,tanu24,No it's not you've played for 90 + minutes and now it's extra time. Next goal wins is playing actual football until a goal decides it.
dx7fdet,TZMouk,"Should just go straight to penalties. Although I wouldn't be against trialling some kind of penalty format similar to Hockey, with players dribbling from the edge of the centre circle before going one on one. But I get that idea might not go down well."
dx7fpm8,tanu24,Pens are the worst way to choose a winner. It's just awful and thank god hockey only does it for regular season.
dx7gzso,TZMouk,They're better than extra time in which both teams just sit back.
dx7ix72,tanu24,Golden goal and Pens go. Can't sit back then
dx7fwtb,silkysmoothjay,[It's similar to how the old NASL did it.](https://www.youtube.com/watch?v=uJEnwi7otu0)I'd agree with you. This style of shootout is a way better way of determining the better team than spot kicks.
dx7h1wa,TZMouk,"No idea how they'd work in practice, but I like the idea that they involve more skill than just straight pens."
dx7fdws,AtticusLynch,I like that ideaBut you smell like kneepit sweat so I have to disagree
dx7fsbq,tanu24,How did you know that?
dx7jgdk,AtticusLynch,I like that color shirt you're wearing
dx7f6af,tanu24,Pens are the absolute worst way to end a game. I'll take this over those any day
dx7f1mq,quacainia,"Yeah, it's not the refs fault, it's just sad to see such a great draw end with a last second penalty, and a red to an all time greatIf it'd have been shot in it would have been a great finish, just not the outcome I'd wanted"
dx7f068,VinceJumpmanCarter,"It's incredible how jammy this Madrid side is. They've looked vulnerable for the most part, but somehow always gets the job done in the CL."
dx7f1fl,TheMilleniumFalcao,Yeah but we got some absolute scenes
dx7f17p,skutan,"Juve would defend deep and play risk free like they did after the 3-0 goal, and Real would get more cautious as well the further it went, because an away goal would be disastrous for them. So ut probably wouldnt be champagne football lol but it's still sour that it ended like THAT."
dx7ezvl,ChedduhBob,Yeah we should have played extra football instead of following the laws of the game
dx7f78a,Khornag,He just said it would be fun to see. I can understand that it would be from a neutral perspective.
dx7f26m,bustedracquet,"I didn't say we should, I said football lost because we didn't get to see it."
dx7f0wz,Yankee_Gunner,"This is a reasonable opinion, but I'm gonna go out on a limb and say the OP was upset about the penalty call."
dx7f6zt,truthdemon,But we got a batshit insane finish instead.
dx7fd47,etonB,think this is as exciting as an ending as we could've gotten
dx7fhru,bustedracquet,I guess. I would have loved to have seen pens.
dx7fd4q,theonlyjuan123,It wouldn't have gone to extra time?
dx7fh6o,bustedracquet,"Yes it would've, it was tied on aggregate and each team had 3 away goals."
dx7hkkp,theonlyjuan123,For some reason I thought it was 4-1. My bad
dx7oaei,geraldkrasner,"That doesn't mean football lost. Football win because the ref made a correct call and we got a dramatic, legally correct finale."
dx7qpr5,Zosoer,Everyone loses when a game is decided on penalties
dx7ensq,iainturfather,It was definitely the right call...
dx7esrh,n10w4,"Yeah looks like the right call. Defender didn't even touch the ball, did he?"
dx7ewgz,Blewedup,Striker looked like he flopped.
dx7f6jl,Canefan101,I mean it looked like he made the most of it after 3 slow mo replays but in real time that's a penalty 100/100
dx7fb03,procrastinating_ftw,"So if we're talking with practical rules, you can't have you hands on a strikers back in the box let alone jumping on him and kicking him Because he might flop.If were talking literal rules where a foul out of the box is a foul inside the box, that's at the very least obstruction of play"
dx7fojs,fgdadfgfdgadf,Didn't seem to have his hands on his back though
dx7g2l9,procrastinating_ftw,Didn't say that. I said you shouldn't do that in the box **let alone** jump on and kick someone
dx7f73j,Memeions,Don't you instinctively fold in your legs if you're touched in the chest?
dx7ewtr,jeric13xd,Haters gonna hate
dx7hfat,HavardP,"It was not ""definately"" the right call. When opinions are so split i'd rather say its a call that could go either way. Stating your opinion as a fact really isnt something you want to be doing."
dx7hjnu,iainturfather,Lol thanks for the advice bud.Definitely*
dx7eon3,squeenanna,Because of what could have been.
dx7esue,thatswavy,100% the right call and I wanted Juventus to win. Anyone who says otherwise is flat-out wrong.
dx7epk7,KSF_WHSPhysics,"It was definitely a pen, I would have like to see buffon have the chance to save it though (granted nobody could have stopped that shot). He must have said some vile shit to the ref"
dx7feyo,Alvarus94,Think it was more the contact than anything else. People say what they want but you can't touch the ref.
dx7fgx6,Osceana,>He must have said some vile shit to the refI don't blame him at all. He said himself this is probably his last CL and this is the ugliest way to go out. The penalty was right but it's still a cheap way to end a CL campaign. It's like Zidane WC level disgrace.
dx7ep6d,NanookOTN,I'm surprised so many people think it wasn't a foul. He came straight through the back of him.
dx7er9u,PM_ME_I_LOVE_NUDES,Yeah and still dramatic and exciting. And I wanted Juve to go through.
dx7fesu,LordElrondd,I'm very impressed that they saw that and he actually called it.Im sad Juve didn't make it though.
dx7erko,Chemical_Robot,"Yeah I wanted Juventus to go through as well but that's a good call. Tough one to make, but the right one."
dx7etu9,maverick1905,"Exactly. Everyone was crying here over missteps in yesterday matches but when a referee makes a completely legit call here, he gets crucified. He was very good tonight. And he had the balls to call the penalty when it was necessary. Respect to him."
dx7f36r,Tweegyjambo,It was a terrible decision. You are allowed contact. It's a contact sport.
dx7enjb,GuessImStuckWithThis,50/50. Still sucks when you see a player fall down like a sack of shit.
dx7etfj,Keyann,"Can't come in from the back like that, maybe 20 years ago but not in today's game"
dx7eqkd,netolokao,"50/50 at best, on a usual game moment.Extra time on a CL Quarter-Final? That's not a fucking call you take and fuck with the game."
dx7fa8i,monnii99,Calls shouldn't be based on the minute they took place in.
dx7fgza,netolokao,"If it's a 50/50, you simply don't make the call. Why risk the game integrity by handing an chance for a decider on the last minute of the game on, by calling something that you can't be certain that was a penalty?"
dx7fg82,SirGalahadTheChaste,Or where on the field. A foul is a foul which this was.
dx7exss,Devanshr7,Why not? Rules are rules
dx7g7ij,prawntheman,How was it a 50/50? Vasquez was literally between Benatia and the ball. How was it 50/50?wtf
dx7f0g9,Tweegyjambo,He fucking dived. It's a contact sport.
dx7f55h,netolokao,"I disagree with the call too. But depending on the angle that you see it, you might think it was a penalty. But a ref shouldn't be making the call on something that LOOKS like a penalty, he should be 100% certain of it."
dx7ewo5,onemangoboi,The referee was no doubt in the heat of the moment but that call was a fucking disaster.
dx7eu6v,daveedgamboa,"That's what I don't get. Looks like he went down early as soon as he felt any contact. In a game this big and in that moment, you don't make that 50/50 call. Just nuts"
dx7euw9,10241988,Lost half an hour of extra time but yeah I agree
dx7f1h5,VexeenBro,"Of course it was, but remember you're on r/soccer."
dx7l81o,Caesar10240,"Even if it is the right call, it is shitty that a great tie ended with a pk. It just a shitty way to end it."
dx7ewsy,John_Dillinger7,"Most definitely; it's just people who wanted Juve to win. They fought extremely well but a mistake at this point of the tournament means you might and will lose, as just happened."
dx7eo6k,,[deleted]
dx7f7be,monnii99,So it wasn't a correct call?
dx7exfp,Cheezzhead,Because ronaldo has been diving all game and if he wasnt a superstar player he wouldve been given cards for it.It is fucking bullshit how often real wins like this. The amount of penalties they get in clutch situations is unreal.Football lost tonight.
dx7f41e,monnii99,So you are complaining about how they got a correct penalty? They shouldn't have gotten it?
dx7g7iq,Cheezzhead,Do you think real deserved to win?
dx7gavm,prawntheman,"We didnt win, did we?"
dx7gmvq,Cheezzhead,"You dived and whined and gesticulated for cards, you played horrible and received 3 goals in your own home, and in the end you got through to the semifinal. Just like last year against Bayern. In short, you symbolise everything that's wrong with football."
dx7hb0r,prawntheman,You whine about the correct penalty call. Yes we played horribly at home but so did Juve in Allianz. So what is the point of mentioning that? And i suggest you watch the Bayern game again and count all the wrong calls and start making score.
dx7hujb,Cheezzhead,"It is not the correct penalty call. If you look at how referees are trained (referee's handbook), almost every situation is allowed leeway. The goal of the referees is to keep the game fair while making a minimal impact on said game. Oliver did the opposite of that; not only did he decide the game over a foul that is (despite what most people are claiming) a 50/50, he also allowed the Madrid side - and Ronaldo in particular - to keep diving and complaining without any reprimand whatsoever. This despite the fact that their captain, who I don't need to remind you has the dubious record of most red cards in La Liga, was suspended. And then after all that shit, he sends Buffon off? Get the fuck outta here, how can you even support a team like that and call yourself a football fan."
dx7ia5d,prawntheman,"Wait wait. So you are telling me all this because you automatically feel like you have the right to assume the authority to decide that the foul was 50/50, in contrary to what the referees, Madrid fans, most neutral fans (or 'most people' to quote you) and commentators say? You are pretty presumptuous, aren't you? And you base all your insults and opinions of me after that on your misguided opinions? Okay, sure I'll take you seriously."
dx7eqos,ragingasian15,"Penalty was the correct call, red card is a sign of power tripping and this needs to be investigated. Just like last year. VAR needs to be implemented."
dx7eos4,E_EqualsDankCSquared,And the game was entertaining af. These people tripping of they think it should've been given a wrong call SMH
dx7ifev,pleasesayavailable,"A 0-0 game with no shots on target can be called right the whole way through, still footballs the loser.It would have been magic for Juve to overcome a 3 goal defecit, sad it ended this way"
dx7ejov,DamnTomatoDamnit,https://i.imgur.com/hyI9ItE.gif
dx7eoig,137-451,What a fucking stupid comment
dx7faw0,ImissDenisirwin,What a fucking stupid comment
dx7fe7z,Jonrahn,How so? Many neutral fans were rooting for the underdogs being Juventes.
dx7iekg,cdbriggs,Well Underdogs losing doesn't mean Football loses
dx7iqsf,Jonrahn,True. I think he is saying that the football community loses. Not the integrity of the game
dx7ihqk,pleasesayavailable,"In this circumstance it does? Would have been brilliant to see extra time and Juventus go through, pretty sure it's what every neutral was cheering for"
dx7rdj3,AlmdudlerBoy69,Nobody gives a fuck what you think
dx7eqff,kdm1998,Lmfao why did football lose? Buffon was acting like a fucking twat vs the ref and got a deserved red card. If this was Dani Alves you'd be laughing at him.
dx7evjr,allahu_akbar_boom,Calm down Xavi.
dx7es8x,BendItLikeWhiteside,What? It's a penalty!
dx7epqn,sheedz225,"What the fuck do you mean? It was a clear penalty. EVERYONE from Barcelona fans to the actual commentators and critics are saying so, clear contact and push on Vazquez. Juve fucked themselves over like that. Plain and simple"
dx7ev07,lasagnyewest,who gives a shit what the ass commentators say lol
dx7f113,cheecheepong,Save your salt for your pasta.
dx7eu6u,beavz,"Football lost? If anything Football won because the ref had the balls to make the correct call in a massive moment in the game. Overall The game was 50-50, Madrid dominated away, Juve dominated away. It came down to one error, and one kick. Thats what makes this game amazing."
dx7esss,FMetalhead,Juventus played their hearts out but Real Madrid were mentally stronger and Buffon really should've kept his composure there. It's a shame he reacted that way but Ronaldo stepped up.Inb4 any flair-related comment
dx7f0er,Rodsoldier,Because a team that took a 3-0 loss managed to win 3-0 and make a penalty in the end ? If anything it really looked like a penalty live.
dx7f1kc,johnsom3,Really? I thought it was a thrilling game and a movie script finish.
dx7f540,Djimq777,"Football lost for enforcing the rules, ok man whatever you say."
dx7fgpd,adtv1,Shut up. It was a brilliant game.
dx7fgwl,BubSwatPunt,"I respectfully disagree, that was fucking incredible. My jaw was agape watching that unfold. One of the craziest endings I've seen."
dx7h44q,titooo7,I'm guessing that all those who upvoted your comments are Juve fans.I don't see why football lost today
dx7eww6,Everton210er,"Just because it goes against the fairy tale that could have been, doesn't mean it was not a penalty"
dx7eomp,EddieBravosBong,Hahaha how? Juve barely played football and got lucky with the 3rd goal. Also constantly fouling.It was a legitimate pen won by the best player on the pitch. Can't complain.
dx7eopa,MrKearns,Football lost because the referee made the right call? No one force Juve to lose the first leg 3-0.Spackers on here acting like someone died...
dx7eup3,harboursand,"What are you on about ""Football lost tonight"" - Juve played well but made a mistake towards the end. At the top level, you will be punished. This is what football is all about.The call was correct. Michael Oliver and his team were spot on the whole night."
dx7eyg1,D3monFight3,"Entertainment lost tonight, not fotball the right call was penalty."
dx7k129,BoonOfIre,His narrative lost today
dx7eio5,nocendi,Every now and then we get a harsh reminder why this game needs video refereeing.
dx7embr,fools_eye,"Why do you think it's not a penalty?Benatia goes through Vazquez, there is no way the referee can call it any other way."
dx7ersu,aquadamn,"It seems like he has the ball before Vazquez, and that doesn't seem reckless unless I'm unaware of somethingis there any better AA out there :/?"
dx7f0vw,fools_eye,"He has literally gone through Vazquez though, the replays shown in this post are clear enough."
dx7f2pu,labtecoza,He literally kicks him in the chest after pushing him while being nowhere near the ball
dx7eqip,Ljpancake,Because there was not nearly enough contact for this to be a foul. He went down when he felt contact. Any other sport would have called this embellishment. It's an institutional problem in soccer and it is my least favorite part of the beautiful game
dx7f76c,Tweegyjambo,You are completely right. It was a dive.
dx7faez,Ljpancake,"I wouldn't say dive as much as embellishment, but yeah"
dx7ff89,Tweegyjambo,Yip.
dx7eye9,fools_eye,"Mate, Benatia has gone through his back before he comes anywhere near the ball, it is a textbook foul. Illegal contact enough to put off Vazquez is only needed for it to be called a foul."
dx7f6ni,Ljpancake,"I understand what you mean, I truly do. But could he have stayed up and headed or kicked it? Absolutely no doubt about it. I'm not not saying there was no contact, I just believe soccer players in general go down to get the foul rather than playing through it. Just my opinion from playing as a defender at the college level, if you slow every play down, they will almost always look like fouls."
dx7fjhj,Ljpancake,"Also I don't know why someone downvoted you here, these are all just opinions. I'm glad to hear yours"
dx7f51a,Devanshr7,Boot on chest. Always a foul
dx7eysb,nocendi,"Almost no physical contact at all, and he hits the ball with the kick. Yeah, I really don't see that as a penalty at all. You honestly can't be serious about him ""going through"" him in that one. I get that people might feel like kicking ""around"" a player warrants a penalty, that's debatable for sure.But the contact from behind is absolutely minimal."
dx7f753,fools_eye,I don't think you are watching the same incident I am then.
dx7fbau,nocendi,That does indeed appear to be the case.
dx7embs,Spacecabbage,Why did it need video ref? To show even more definitively that Buffon should have been red carded? I love the guy but he lost it.
dx7ermx,Theart_of_the_cards,Because of the bandwagon and Buffon deserves the UCL.
dx7fluk,NoSoyTuPotato,imagine Ramos doing that tackle. nobody would deny the call and this subreddit would go into uproarit's funny seeing all the people judging the call with bias and can't realize that
dx7ezgi,nocendi,I don't think anyone questions that Buffon's red card was correct.
dx7ep8x,Gaz133,To spend five minutes reviewing a call the ref got right the first time?
dx7eszl,real_shadowave,"That was a penalty with or without VAR, doesn't matter if Buffon is on the other side or Juventus completes a fairy tale comeback. The ref got that absolutely right especially with so much pressure on him"
dx7fbd1,Tweegyjambo,He dived as soon as he felt contact. It is a contact sport.
dx7fypf,real_shadowave,It was a scoring chance right in front of the net and Benatia ran right through his back. Vaszques controls the ball on his chest and obviously will attempt to shoot it in. If someone runs right into your back and almost kicks you in the front he is committing a foul.The fact is Benatia wasn't positioned correctly and therefore committed a mistake. There was very little chance he could have stopped Vasquez from shooting that in without fouling him.
dx7enbv,MrKearns,Video referee would have backed him up. It was a penalty.
dx7eo59,barongbord,So the video ref can confirm the correct call?
dx7eogt,a_lumberjack,VAR would still give it. He clearly goes through the player to try to get the ball. Benatia lost the fucking plot in the last five minutes.
dx7enp2,Total-Annihilation,Pen was the correct call.
dx7enrh,phdre,That's a penalty upon review.
