id,comment,toxic,severe_toxic,obscene,threat,insult,identity_hate
ShawnGH,"The function of the two party system is to create the illusion that there is a political process with public involvement. For that to be there must be as least two parties to vote for.""There is only one party in the United States, the Property Party ... and it has two right wings: Republican and Democrat. Republicans are a bit stupider, more rigid, more doctrinaire in their laissez-faire capitalism than the Democrats, who are cuter, prettier, a bit more corrupt  until recently ... and more willing than the Republicans to make small adjustments when the poor, the black, the anti-imperialists get out of hand. But, essentially, there is no difference between the two parties.[50]"" -- gore vidal.The only real difference is in the advertising.What has changed is that the fascisti have a much harder time controlling the internet. i.e. less centralized propaganda control.So now the masses are learning what classical liberals(not democrats) have known for decades: that the usa is and has been for over 100 years a fascist plutocracy.",0.00011666487262118608,2.405839616415051e-08,0.0001900721254060045,4.279857421352062e-06,3.843660306301899e-05,4.369557018435444e-07
andrewk311,you're retarded.,0.9657548069953918,0.05105612426996231,0.4914077818393707,0.1407444179058075,0.6145447492599487,0.20331189036369324
DeadlyVu,"Okay, I'm unsubbing from /r/politics. The occasional interesting article isn't worth it. It's like goddamn middle school in here, for fuck's sake.",0.16873973608016968,5.081697622699721e-07,0.006151641719043255,0.0001307269121753052,0.0069315615110099316,3.309174644527957e-05
NAN,"Bullshit, you just like Obama more.",0.9950681924819946,0.25488612055778503,0.9495742321014404,0.04763881862163544,0.8658788800239563,0.1218843013048172
dakunism,"Now, first we get into a circle...",0.001342646311968565,5.340581665791433e-08,6.973318522796035e-05,0.000100787787232548,0.00010806676436914131,1.379315563099226e-05
setyourarmsdown,Drone strikes in Pakistan dismembering children?Breaking his campaign promise and keeping Gitmo open? Signing the NDAA 2012 into law and making it legal to detain American citizens there with no trial?The DOJ declaring the other week that Goldman Sachs will not be prosecuted for their involvement in the 2008 crisis even though it is blatantly obvious that they're criminals and were aware that the nonsense they were selling would crash the global economy?This is what you call trying?,0.00011603414168348536,6.964787635510561e-10,1.4703042324981652e-05,2.867695002350956e-06,2.0591487555066124e-05,2.0208204887239845e-07
Sanguisugent,"Fucking this. When has Obama tried to do the right thing? The things mentioned above, as well as many others including marijuana laws and raids are obvious signs that he isn't trying to do the right thing. He also won the Noble peace prize, then sent more troops to Afghanistan and fired missiles in Libya. He is at least more likeable than Romney.",0.24122561514377594,7.188539257185766e-07,0.027658328413963318,6.058215149096213e-05,0.013839085586369038,1.2306468306633178e-05
mcstankin,I don't see how he is more likable than Romney?,0.9095643162727356,0.0017339843325316906,0.14846821129322052,0.03570873662829399,0.3073458969593048,0.030166275799274445
executex,"You're saying you would refuse to participate in a NATO operation that Britain and France were pushing for after all the help they've offered you in Afghanistan, against Gadaffi who was airstriking his own citizens? You think that the people who take over after Gadaffi will forget that America had the power to help them in the revolution and didn't want to get involved? You think that Mitt Romney or McCain wouldn't have used ground forces in Libya to take control of the oil fields?You're saying that Obama's directive to attorney general to stop prioritizing medical marijuana centers as long as they adhere to state laws---as nothing? You do realize how aggressive Republicans have been on marijuana right? You do know Reagan started this anti-marijuana education as a ""gateway drug"" in schools right?You do realize medical marijuana dispensaries have increased during the Obama administration---despite great local Republican opposition?You do realize that Afghanistan is vital to the stability of Pakistan, a nuclear nation, right? The very country that built all those Islamist schools and sent hundreds of its soldiers to secretly fight as Taliban in Afghanistan and made that country so extreme (as a plot to occupy and influence Afghanistan in the future).And you still want to continue this attack on Obama? You think Romney will do better? Go ahead vote Romney, vote against your own interests, let's see how someone worse than Bush (you know the Bush who campaigned on promise for ""a humble foreign policy with no nation building""---unlike Romney who actively campaigns on being more tough on terrorists, Iran, China, etc) will behave on political issues that interest you.",0.00019999495998490602,2.3931838732949018e-09,3.50068585248664e-05,5.908126240683487e-06,6.004209353704937e-05,4.2288684198865667e-07
NAN,[deleted],0.0029697588179260492,1.255476718142745e-07,9.912909445120022e-05,0.00019233932835049927,0.00024682117509655654,3.447670314926654e-05
executex,"Voting third party is a half-vote to Romney or Obama depending on which way you lean closer towards.People keep telling you, you are wasting your vote, because it's true, you are wasting your vote on a really two-party system, where both candidates have a strong hold on their bases (unlike in 1992 where H.W. Bush was labeled as a leftist).edit: Why the downvotes people, this is mathematically true. If you have a formula or mathematical equation proving me wrong, go ahead and express it.",0.0001014732479234226,4.977680490014791e-10,6.98507392371539e-06,4.20011701862677e-06,1.8583834389573894e-05,2.796287503770145e-07
NAN,[deleted],0.0029697588179260492,1.255476718142745e-07,9.912909445120022e-05,0.00019233932835049927,0.00024682117509655654,3.447670314926654e-05
executex,">Bullshit. You're assuming that I would actually vote for either one.You must not know how to read. I said it's a half-vote depending on which way you lean, left or right. If you lean left of Romney, you give a half-vote to Romney. If you lean right of Obama, you give a half-vote to Obama. It's just simple math.>I'm not responsible for the voting habits of others, nor am I responsible for the results of other's irresponsible actions.Except you're the irresponsible one, voting for 3rd party that obviously has very abysmally small chance of winning. You're the one that can look at Obama and Romney, and say ""they are absolutely the same, so I'm going to vote Romney."" It's irrational. >and let the system control them.You are letting the system control you. You're letting Romney win an election, when his right-wing nutbag opinions should lose in a landslide to send a message to the system, you've went too far to the right.It's all about probability and math. If you want to increase the chances of the US getting into a war with Iran. Don't vote for Obama. If you want to increase the chances of the government deregulating the system so that bankers can continue playing their risky games with other peoples' money without interference from regulating agencies; if you want increase the probability of bankers to use tax loopholes, send their money offshore to tax havens (like Romney has), and demand tax cuts for these bankers (like Romney asks). Then by all means, don't vote for Obama, vote 3rd party, or don't vote, or vote Romney.",0.0027756947092711926,8.243917903882902e-08,0.0005764270899817348,2.904391658375971e-05,0.00037624151445925236,3.87082855013432e-06
NAN,[deleted],0.0029697588179260492,1.255476718142745e-07,9.912909445120022e-05,0.00019233932835049927,0.00024682117509655654,3.447670314926654e-05
executex,"I'm going to ignore your childish insults and immature remarks...You are responsible for making the wrong choice: voting for something other than the two parties that are likely to win and have won for the last 150+ years.It's mathematically the wrong choice. It won't change the system at all.By voting 3rd party instead of Democrat, you are unwillingly and unintentionally promoting the Republican party and risking their attainment of power. You are mathematically increasing the chances of them achieving power and risking war with Iran.It's just simple mathematics and logic. If you don't understand logical boolean algebra, let me know, I can explain it in formulaic expressions if you like.",0.0010445516090840101,1.2863776532867632e-07,0.0007525115506723523,1.8523003745940514e-05,0.0002844270784407854,2.1621342511934927e-06
NAN,[deleted],0.0029697588179260492,1.255476718142745e-07,9.912909445120022e-05,0.00019233932835049927,0.00024682117509655654,3.447670314926654e-05
executex,"> Correct for all the wrong reasons.It doesn't matter the reasons. Principles don't matter. Only results do and principles that provide those results.If voting 3rd party hasn't been working for 100+ years---it's time to stop trying the same result, and adopting what works.>Neither will voting Democrat. I don't see a whole lot of them advocating the reforms I seek.It depends on what reforms you seek. If you want less war, more banking regulations, more education, more science funding, more diplomacy, more transparency, more laws that encourage competition rather than favoritism, more laws that make insurance companies actually compete, and laws designed by evidentialism and a scientific perspective---then I'd vote Obama. You want reforms designed by religious people, by people who advocate pure-capitalism without safety nets like Paul Ryan, by people who are generally anti-science and pro-monopoly, pro-wallstreet, pro-life, pro-trickle-down-economics, and want to be more aggressive war in the middle east. Vote Romney.It seems you have two choices, the party of the corporations, nationalists, and religious groups or the party of scientists, academics, and pragmatist realists. You will never agree with both sides 100% of the time. But I'm sure you agree with one side 51% of the time more than the other side.>But a poor measure of assigning personal responsibility.You can assign responsibility after it's all said and done. But results matter. Being technically correct matters a lot. IF you want what is good for the country, you stick to choices that will increase that probability of what you think is most beneficial for that country.> engage those that actually advocate these harmful activities.But people who stay home, or vote 3rd party, are the very reason why Obama has to work so hard to seem ""centrist"" and ""not that liberal."" To win that independent vote.I can spend my time and energy convincing Republicans their ways are wrong, but if it turns out they are indoctrinated through Fox News or religious upbringing, there's no way in hell they will change their vote. But you, as a rational person, much greater probability of changing your vote.",0.0034067463129758835,2.2303654532151995e-06,0.0021366612054407597,0.00011486927542136982,0.0007580550736747682,2.491452505637426e-05
NAN,"> Signing the NDAA 2012 into law and making it legal to detain American citizens there with no trial?Incorrect, but what's worse is that you even got your talking points wrong. The talking point you are supposed to repeat is ""making it legal to indefinitely detain US citizens without trial"" which of course is also incorrect (but you would have to read the bill and follow politics to know that and that's just too much work).",2.8065784135833383e-05,8.068649220982493e-11,2.510231524865958e-06,9.916425369738135e-07,4.088514288014267e-06,5.499789068608152e-08
TexDen,"I guess it's okay that Romney wants to nuke Iran, give the rich tax breaks and is a pathological liar?",0.943463146686554,0.0007417465094476938,0.19191007316112518,0.01747799664735794,0.31794264912605286,0.019884485751390457
losjoooo,"setyourarmsdown is right he's not ""trying"". He's not saying that Romney is any better he's just pointing out many things that Obama has done wrong. Just because someone doesn't agree with your statement doesn't mean they are for the other guy. Thinking like that is what has us in such discourse now. Go back and read the very valid points he made.",0.0008302993373945355,4.288567723165215e-09,5.3202322305878624e-05,1.1792984878411517e-05,0.00013389640662353486,1.0917652844000258e-06
ambiencenever,This post doesn't seem to fit the parameters of this subreddit's rules.,0.002133303787559271,7.041223426540455e-08,0.00010082594235427678,0.00010983602260239422,0.00019166672427672893,1.574446832819376e-05
Mr_Pricklepants,Self-posts are the Wild West.,0.0014526352752000093,5.1493369568333947e-08,6.401065911632031e-05,0.00011129517952213064,0.00012082775356248021,1.6176500139408745e-05
NAN,"Keeping in mind that there is no such thing as the ""perfect"" president. I assume that the closer the president is to your views, the closer to perfect he is.",0.000541738118045032,3.2814737593866994e-09,3.5061952075921e-05,1.0841520634130575e-05,6.374434451572597e-05,9.287039688388177e-07
NAN,"I do think it is important to recognize that for all the talk about Republican obstruction, however valid (I think it is pretty accurate), we must keep in mind that Congress did not force Obama to escalate the Afghanistan War. Also, bad policy is bad policy regardless of whether you campaigned on it or not, so please don't mention how Obama said he would refocus on Afghanistan.They did not force him to hire the likes of Summers and Geithner, go after dispensaries more aggressively than Bush, prosecute a record number of whistle blowers, to ignore the actions of Bush administration officials, take a relatively aggressive posture against Iran, invoke the state secrets privilege numerous times to prevent cases from going to trial, etc.And these are just issues where Congress has no direct power. I'm sure there are areas where Obama has put in a lackluster effort when it comes to getting Congress to address issues where they do have direct power. For example, the HAMP program the Obama adminsitration pushed has hardly been successful and Obama's effort to close Gitmo was hardly inspiring: http://www.washingtonpost.com/world/guantanamo-bay-how-the-white-house-lost-the-fight-to-close-it/2011/04/14/AFtxR5XE_story.htmlClimate change is another area where Obama's performance has been less than stellar: http://thinkprogress.org/climate/2012/08/06/642141/obama-administration-abandons-two-degree-commitment-made-in-2010/?mobile=nc and http://thinkprogress.org/climate/2012/08/15/696291/the-sounds-of-silence-on-science-the-country-is-on-fire-but-obama-isnt/?mobile=ncDespite the praise he often receives by commenters on this site he is still just a run-of-the-mill politician from everything I have seen. He does get unfair criticism from the right no doubt, but we flawed beings are all open to criticism in some respects and he is no exception.",3.392560756765306e-05,1.6991752449513342e-09,5.8824833104154095e-05,7.655020226593479e-07,1.0428927453176584e-05,6.264803431577093e-08
NAN,"The same old talking points.>go after dispensaries more aggressively than Bush [I don't think the federal onslaught is being driven by the highest levels of the White House - Nadelmann of the Drug Policy Alliance](http://www.cannabisnews.org/obamas-war-on-pot/2012/02/19)So he gets the blame for dispensary raids but no credit at all for the fact that MMJ's have more than doubled under him? [**Many of these businesses emerged in the wake of the Obama Administration's decision to deprioritize federal prosecutions of individuals and business complying with state medical marijuana laws.** The State of the Medical Marijuana Markets 2011 shows which states represent the most active markets, who is making money, and how are they doing it](http://medicalmarijuanamarkets.com/see-change-strategy-releases-the-state-of-the-medical-marijuana-markets-2011-the-first-ever-investor-grade-analysis-of-the-medical-marijuana-markets-in-the-u-s/)>prosecute a record number of whistle blowersThe biggest BS of all - only Drake was an actual whistle blower, the others were not. http://www.thedailybeast.com/articles/2012/03/08/obama-is-right-to-prosecute-leakers-who-are-not-the-same-as-whistleblowers.html>take a relatively aggressive posture against IranGood enough for [Iran's supreme leader himself who praised Obama for advocating diplomacy and not war as a solution to Tehran's nuclear ambitions](http://www.huffingtonpost.com/2012/03/08/ayatollah-khamenei-obama_n_1330645.html)>For example, his effort to close Gitmo was hardly inspiring[Politifact - President Barack Obama's campaign promise to close the Guantanamo Bay detention center has switched from In the Works to Stalled and back again (and again). All that movement reflects a simple dynamic: Obama really wants to close the center. But Congress really doesn't.](http://www.politifact.com/truth-o-meter/promises/obameter/promise/177/close-the-guantanamo-bay-detention-center/)>Despite the praise he often receives by commenters on this site he is still just a run-of-the-mill politician from everything I have seen. Isn't it run of the mill to have to the best legislative record since LBJ. http://www.thedailybeast.com/newsweek/2010/01/14/a-modern-day-lbj.htmlEdit - I see you have added more>Climate change is another area where Obama's performance has been less than stellarRight.>>The Obama administration moved closer Monday to issuing regulations on greenhouse gases, a step that would enable it to limit emissions across the economy even if Congress does not pass climate legislation.http://www.washingtonpost.com/wp-dyn/content/article/2009/12/07/AR2009120701645.htmlhttp://www.nytimes.com/2012/06/27/science/earth/epa-emissions-rules-backed-by-court.html",4.503239688347094e-05,5.409479530982253e-10,2.3583297661389224e-05,1.2745039157380234e-06,1.286692622670671e-05,7.730866968813643e-08
Theotropho,"Oh god, you understand what's going on with marijuana policy! Have you noticed how many more unbiased studies have been approved?",3.46610504493583e-05,4.3466891197496693e-10,2.7555117867450463e-06,3.2991470106935594e-06,5.1191791499149986e-06,2.4057322889348143e-07
ribbitman,"^ This. Republican policy is designed to redistribute wealth and power from the masses and concentrate it in the hands of a few who are already wealthy and powerful. Republican propaganda is designed to convince the masses that kind of redistribution is ""freedom."" The only way republicans have a chance of selling that nonsense is by claiming ""both parties are the same"" in an attempt to equalize them. They are not at all the same. Republicans want people to believe that people will just magically ""do the right thing"" if given the chance. They will not, and never have. Tax breaks do not create jobs, they are pocketed. Health care will not magically get cheaper, it will become as expensive as we allow it. Our kids will not be better educated by helpful citizens, they will become minimum wage employees. Manufacturers will not operate more cleanly because they care, they will pollute as much as they can get away with. Finance companies will not stop siphoning as much out of the economy as they can, they will crash an economy in a minute if it turns a profit. The parties are drastically different, and republicans have been on this batshit trajectory for the last 50 years. The only way to hide that is by complaining ""they're both the same.""",0.00031151738949120045,6.675030750358246e-09,0.00011189182987436652,6.830558049841784e-06,8.018680819077417e-05,6.71459872592095e-07
NAN,"The article you link to is titled Obama's War on Pot and Nadelmann's opinion while worthy of respect is not the end all be all. I recommend everyone read that article and make up their own mind.""Obama, who recently said he doesn't ""mind a debate"" about drug legalization, has increased the crackdown on medical marijuana producers across the nation, including a recent high-profile raid on a California training school. He addressed the crackdown and attempted to clarify his 2008 comments that he was ""not going to be using Justice Department resources to try to circumvent state laws [on medical marijuana]""Attorney General Eric Holder was a guest of The Huffington Post at the correspondents' dinner. Before it began, a HuffPost reporter noted to Holder that Obama's reference to ""congressional law"" was misleading because the executive branch could simply remove marijuana from its ""schedule one"" designation, thereby recognizing its medical use.""That's right,"" Holder said""http://www.huffingtonpost.com/2012/04/28/jimmy-kimmel-whcd-pot_n_1462140.htmlMy point is that the sanctions Obama pushes harm ordinary Iranians far more than leaders like Khamenei:http://www.guardian.co.uk/world/2012/aug/10/sanctions-iran-ordinary-people-targethttp://www.newsday.com/opinion/oped/opinion-sanctions-against-iran-hurt-the-people-not-the-regime-1.3881126http://www.pbs.org/wgbh/pages/frontline/tehranbureau/2012/07/news-health-group-sanctions-put-tens-of-thousands-of-iranian-children-at-risk.htmlhttp://www.aljazeera.com/indepth/opinion/2012/07/2012710132416172713.html?utm_content=automate&utm_campaign=Trial6&utm_source=NewSocialFlow&utm_term=plustweets&utm_medium=MasterAccounthttp://www.thedailybeast.com/articles/2012/03/20/sanctions-will-lead-to-war-not-prevent-it.htmlThe consensus among the international intelligence community is that Iran is not currently pursuing weaponization. They may very well be leaving the option open, which is what many of these intelligence agencies believe.In the most recent round of talks I believe Iran offered to stop 20% enrichment in exchange for the recognition of its rights to enrich and the scaling back of sanctions. The US refused this.Iran also does have a right to enrich to 20% in order to build research reactors, so while it may be concerning it should not be used to justify drastic action.Did you read the WaPO article on Gitmo? You may think it is inaccurate, but one key point is that Obama made a lackluster effort to close Gitmo.Politifact says: ""It also establishes a ""periodic review"" process for for long-held Guantanamo detainees who have not been charged, convicted or designated for transfer, ""but must continue to be detained because they 'in effect, remain at war with the United States,'"" according to a White House fact-sheet.""How does the White House esablish this? They can be detained indefinitely without trial. How nice.LBJ had many problems of his own and legislative success does not necessairly mean that the legislation will be successful. Obamacarae is unlikely to to do much to keep healthcare spending under control (this does not mean I think it will increse the debt) and many financial analysts believe Dodd-Frank is insuffieicient to stop future crises.Update: Did you actually read the links on Climate Change I provided or just post links that presented Obama in a favorable light on this issue? While I do get upset from Obama from time to time I certainly don't think he is aboslutely awful. I just don't think he is anything special. Obama also has focused on cap-and-trade rather than a carbon tax, which many analysts believe would be far better.",0.004117483273148537,1.1014619758498156e-06,0.0025488482788205147,8.540796261513606e-05,0.0013198283268138766,1.5382262063212693e-05
doodlebro,"I want you to shut the hell up about ""Obama's war on MMJ"" and listen here.In the last year or so, the DEA has closed about 60 dispensaries in Colorado, and a handful in California. Before that, since when Obama was inaugurated, not many were closed at all.All of the dispensaries in Colorado were closed for being within 1000 feet of a school zone. This is a felony offense. The law to not sell drugs within 1000 feet of a school zone was signed into the books in the **BUSH** administration as a part of No Child Left Behind. Do you know how many dispensaries are still open in Colorado? At least 1000. 60 out of 1000 is roughly *6%* of the total dispensaries. And you're telling me Obama is better for MMJ than Bush?Wait, wait, this gets better. Some dispensaries in California were closed for the same reason, within 1000 feet of any school. Most of them, however, were closed for violating state MMJ laws or violating **LOCAL** MMJ laws. Certain cities and districts flat out banned dispensaries. When those dispensaries didn't move, you know who swooped in? ***The motherfucking DEA.*** Obama said that he wouldn't have federal resources wasted on *LAW ABIDING* dispensaries in MMJ states.So, do you know how many dispensaries are still open in California? THOUSANDS.I don't see where you get your logic for this, but I'm going to tell you that you're flat out wrong. Obama has been fabulous on the issue of MMJ thus far by not bothering patients or law abiding dispensaries. Clearly the small percentage that were closed were doing something wrong, it wasn't a ""war on pot""",0.3130434453487396,0.000535466824658215,0.4210789203643799,0.000739692070055753,0.046589065343141556,0.00046578323235735297
rubberstuntbaby,And why couldn't Obama let these states handle it?,0.00038430216955021024,5.971305228058554e-09,2.5047649614862166e-05,1.9892107957275584e-05,3.350317638250999e-05,2.015277232203516e-06
doodlebro,"For one, Obama is not sitting there deciding that the DEA should raid this dispensary, and that dispensary. If the dispensaries are breaking any laws, they will be closed down by the DEA. It's that simple. Who cares why the local enforcement agencies aren't doing it?",0.014229059219360352,5.720310127799166e-07,0.0003041226009372622,0.0006539781461469829,0.002018020721152425,0.00010946817201329395
