id,comment,toxic,severe_toxic,obscene,threat,insult,identity_hate
NAN,"Just because a topic thread is upvoted does not mean people ""agree"". When a comment within that thread is upvoted, that is an ""agree"". Sometimes people upvote threads simply to spur discussion of the topic.",6.807233876315877e-05,5.408778425142202e-10,4.452936536836205e-06,4.524586984189227e-06,1.2314310879446566e-05,3.4418513905620784e-07
NAN,I've had things deleted for even mildly editorial title.,0.00012063686881447211,1.3334003901022129e-09,8.390106813749298e-06,7.495087629649788e-06,1.2664606401813217e-05,6.291398904068046e-07
NAN,"Not only that, I had unsubscripted and all of a sudden I find myself subscribed again.",0.0023085405118763447,1.6991346285522013e-07,0.0001226560998475179,0.00018210492271464318,0.0002310962590854615,2.8262147679924965e-05
YouthInRevolt,"Meanwhile, comments/posts about Obama assassinating U.S. citizens in Yemen with zero due process get burried because criticizing Obama ""helps Romney"". The two-party system marches on...",0.006087306421250105,1.4635949696639727e-07,0.0005294469301588833,7.338957948377356e-05,0.0004560450033750385,1.141008578997571e-05
Panasonic307,Beats /r/atheism where you can post something that doesn't relate to atheism at all and get front page.,0.06920795142650604,7.916628419479821e-07,0.001997161190956831,0.0003503776388242841,0.003349504666402936,6.969767855480313e-05
ImMystikz,This is so true,0.17838753759860992,5.3220283007249236e-05,0.0051053715869784355,0.006489973049610853,0.01400014292448759,0.003323035780340433
brkello,"I am liberal. Downvoted. Though I do agree, that really isn't the point.",1.9226561562390998e-05,5.320838908362546e-11,2.2318463379633613e-06,5.904329896111449e-07,2.0817706172238104e-06,3.3897634921231656e-08
LocalMadman,Is this really what /r/politics is? Someone posts some idiotic comment complaining about the post it's in and it goes to the top? Really?,0.8677451610565186,0.00034383864840492606,0.11278010904788971,0.009888078086078167,0.21520161628723145,0.007019984070211649
luveroftrees,nothing idiotic about the statement at all.,0.4094752371311188,2.365729415032547e-05,0.012692771852016449,0.0026232728268951178,0.0248055811971426,0.00116793776396662
NAN,Its called opinion,0.2566267251968384,8.324482041643932e-05,0.013623949140310287,0.00485368724912405,0.01794281043112278,0.002297379542142153
nfirm,Welcome to /r/progressivecirclejerk,0.02549080364406109,1.1503281712066382e-05,0.0010397041914984584,0.0027593420818448067,0.0028498144820332527,0.0008253806154243648
canthidecomments,"At least they've descended to the state where they're now openly mocking Barack Obama as one of the worst presidents ever ... and alleging that Romney might be worse by trying to create envy in people because Romney has been so much more successful in life than Obama.That's progress - of a sort.The five stages of getting over Obama:* Denial (this is where they started out)* Anger (stayed here almost two years)* Bargaining **(this is where they are now)*** Depression (scheduled for November 7, 2012)* Acceptance.",0.017381682991981506,2.3052822939462203e-07,0.0034386543557047844,4.807916411664337e-05,0.0027365307323634624,6.350780040520476e-06
Shoden,"> Romney has been so much more successful in life than Obama.Funny, one of them became president of the united states first, I would say that makes Obama pretty successful.",8.810542203718796e-05,2.0068192940758678e-10,9.582805432728492e-06,1.2543772527351393e-06,1.4606541299144737e-05,7.547763658521944e-08
canthidecomments,"If that's the only measure with which you define greatness, then you'd be right.You'd also be very shortsighted.When you think of Barack Obama, and his accomplishments, do you think ... ""now there's a great man.""No, you don't.He stumbled his way through life voting present and working the system by trading on his skin color to get perks none of the rest of us get and became an accidental president by a quirk of history and having ""dirty"" Jesse Jackson to compare his ""clean"" self to (in the words of Joe Biden). Recall the awarding of the Nobel Peace Prize that he was so embarrassed to receive having done nothing to earn it that he gave all the money away and admitted he didn't deserve the award. Then launched a third war - undeclared and unauthorized by the United States Congress, mind you - against brown people for their oil.I know of nobody who thinks Barack Obama is a great man, or believes he has done anything great.And you don't think he's a great man either.(PS: You should capitalize United States when you write it out ... or it makes you seem like you're trivializing your country.)",0.06556738913059235,5.622991466225358e-06,0.012637579813599586,0.0002785305550787598,0.0078107393346726894,7.884336810093373e-05
Shoden,"> If that's the only measure with which you define greatnessI said nothing of greatness, only success. Obama has successfully become president. If this wasn't something to strive for, Romney wouldn't be doing it either I suppose.",0.005823282524943352,1.0380501436202394e-07,0.0002470829931553453,0.00011853259638883173,0.0005875368369743228,1.8111673853127286e-05
canthidecomments,"I agree with you.Obama isn't a great man, and becoming President isn't the measure of greatness, or success, in a man.",0.00215187668800354,6.900396254394536e-09,8.492806955473498e-05,1.7628242858336307e-05,0.00014656721032224596,1.9787462406384293e-06
Shoden,"> I agree with you.> Obama isn't a great man, and becoming President isn't the measure of greatness, or success, in a man.I never said Obama wasn't great, just that the act of becoming the president is a success, one Romney has not yet achieved.",0.00016056541062425822,3.270693438306438e-10,1.4543519682774786e-05,1.6955166302068392e-06,1.5384213838842697e-05,1.1532554111681748e-07
canthidecomments,">I never said Obama wasn't great,You also never said Obama IS a great man (I noticed that).You didn't say that because you don't believe that he is a great man, owing to his lack of any fundamental accomplishments in his life.He became President (which you describe as a success, but which I say is debatable), by an accident of history and timing ... and certainly not as a reward for any of his previous accomplishments (like a Ted Roosevelt), because there weren't any, just like he was awarded the Nobel Peace Prize for nothing (then bizarrely started murdering Americans to prove how much he deserved the Peace Prize. Or something.)Becoming President in the way that Barack Obama became President - a nation attempting to demonstrate to itself that it wasn't racist - doesn't confer on an individual an actual accomplishment. You have to do something worthy AFTER you become President besides bomb brown people with drones.Obama was ""clean"" as Joe Biden said. The first ""clean"" black man (not really black, though) to ever run for the Presidency (clean, at least compared to his competition ... Jesse Jackson, who fathered kids out of wedlock). And so he was elected. And then he accomplished not much of anything (unless you count forcing poor people to buy insurance from his donors or risk having the IRS seize their homes) before he's shuffled off into the pages of history ala Jimmy Carter (another accidental President elected only because of one-off circumstance.)",0.00024935638066381216,9.220590158065534e-08,0.0002010494063142687,1.8055125110549852e-05,9.2512127594091e-05,2.100528490700526e-06
Shoden,> You also never said Obama IS a great man (I noticed that).He is a Fantastic President.> a nation attempting to demonstrate to itself that it wasn't racistBy that logic Romney would only become president due to the nation trying to prove it doesn't discriminate against someones religion. But we both know you don't care about logic.,0.0008027140283957124,9.408438472746639e-09,4.797515066456981e-05,2.2138672647997737e-05,9.311680332757533e-05,2.1802145511173876e-06
canthidecomments,">He is a Fantastic President.You still haven't claimed that Barack Obama is a great man.Because you don't BELIEVE he's a great man, who has done great things.I can see EVERYTHING you're NOT SAYING about this guy.",0.8868967890739441,0.00010018450120696798,0.15038084983825684,0.002817112486809492,0.15599964559078217,0.0020545267034322023
Shoden,"> You still haven't claimed that Barack Obama is a great man.Well, I'm not saying that he isn't a great man. > Because you don't BELIEVE he's a great man, who has done great things.I never said I don't believe that.> I can see EVERYTHING you're NOT SAYING about this guy.And I see everything you are saying about Romney, who you don't seem to like but praise and defend non stop.",0.8448256850242615,0.00037560469354502857,0.17175865173339844,0.0072896601632237434,0.2610177993774414,0.005434809252619743
canthidecomments,"Try to post this story to /r/politics (with no commentary, and using the original headline):[http://mobile.nytimes.com/2012/08/19/opinion/sunday/coates-obamas-perceived-transformation.xml](http://mobile.nytimes.com/2012/08/19/opinion/sunday/coates-obamas-perceived-transformation.xml)I tried to post this story, and got the following response:>This is an unofficial, automated notification that the following post appears to have been removed by the spam filter or moderators of /r/politics>>Ta-Nehisi Coates, writing in the New York Times: Barack Obama has become Dick Cheney>>submitted 4 minutes ago by: clyde_taurus to politics>>A moderator may have left a comment on your submission explaining why it was removed. If you have received no explanation you may wish to message the the moderators of /r/politics>>Most often, posts are removed for failing to follow a sub-reddits rules ilisted in the sidebar. You should read the sidebar of /r/politics to make sure your post meets the requirements.>Helpful Links:>> Search to confirm your post is missing> Message the moderators to request approval or find out why your post was removed> Post to PoliticalModeration if you believe the removal was unfair>>Information gathered by the ModerationLog bot> >created: Aug. 19, 2012 10:16 p.m. score: 1>first seen: Aug. 19, 2012 10:14 p.m. upvotes: 1>last seen: Aug. 19, 2012 10:14 p.m. downvotes: 0>missing: Aug. 19, 2012 10:20 p.m. comments: 0>Opt-Out>>If you don't want these notifications in the future send a message with the subject ""Don't spam me bro!"">>If you reply to this message your message will be forwarded to /u/go1dfish (author of this bot). /u/go1dfish does not moderate /r/politics and can not help you determine why your post was removed.>>Please direct such questions to the moderators of /r/politics Moderators of /r/politics are systematically removing any post critical of Barack Obama, no matter whether it meets the posting rules or not.A Gestapo.That's what /r/politics is.",0.24947096407413483,0.0008305818773806095,0.22913143038749695,0.002241709502413869,0.04640086367726326,0.0013387020444497466
Shoden,"I have never received a deleted notice, but was this the headline you submitted?> Ta-Nehisi Coates, writing in the New York Times: Barack Obama has become Dick CheneyBecause if it was, that was neither the verbatim title, nor a direct quote. It was a paraphrase at best.Not only that, but clyde is your submission troll account, and a known one at that. It may be flagged.You know, there is the whole thing about not spamming the same link, and since you tried to use the mobile version of a link already submitted [here](http://www.reddit.com/r/politics/comments/yg8kn/in_republican_eyes_barack_obama_has_gone_from_a/?already_submitted=true), it's no wonder that got deleted.And hey, that link is still there a day later, so your whole point amounts to a big pile of nothing. Try harder.",0.43604588508605957,0.0005217367433942854,0.22006487846374512,0.0021308651193976402,0.06189487874507904,0.0015864023007452488
sspaiva,"I've said it before, and I'll say it again. These types of posts are exactly what is wrong with our current political system. There are criticisms to be said of both parties, no doubt about that. However, you cannot make vast (and I truly mean vast) generalizations about an person or, even worse, an entire political party like the way you just did. To say Romney and Republicans 'doesn't give a fuck about anything but their bank accounts' is so fundamentally biased, it's almost inconceivable. What kind of statement is that? Where are your facts? Who are you to summarize an man's entire life just because of news headlines that you read? The same goes for Obama as well. Just because you've read what you want to read, doesn't mean that Obama is a perfect angel. Nobody is. I think our political climate would be entirely much more refined if more people just learn to have some objectivity, and be open to all sides of an issue before offering an opinion on it. /rant",0.05295233801007271,1.4754141375306062e-05,0.0046121589839458466,0.0023805289529263973,0.015185968019068241,0.000642533297650516
NAN,"I've said it before, and I'll say it again. These types of posts are exactly what is wrong with our current dialectical analysis.There are criticisms to be said of both styles of writing, no doubt about that. However, you cannot make vast (and I truly mean vast) generalizations about hyperbolic dialogue, or even worse, an entire art of metaphor and allegory, like you just did. To say an exaggeration 'doesn't indicate a fuck about its underlying basis' is so fundamentally biased, its almost inconceivable. What kind of statement about statements is that? Where are your concrete evidence? Who are you to summarize a literary device's usefulness because of a redditor's post that you read?The same goes for logical understated dialogue as well. Just because you've read something reserved and boring, doesn't mean that understatement is a form which promotes perfect truth. No form of dialogue does. I think our political climate would be entirely much more grammatical if more people just learn to read between the lines, and were open to all styles of writing before offering an opinion on it./critique",0.012894416227936745,1.2107786915294128e-06,0.0011065470753237605,0.0004171107430011034,0.0027775298804044724,9.267688437830657e-05
sspaiva,Touche sir.,0.0030615096911787987,3.3205657246071496e-07,0.00013787006901111454,0.0003223888634238392,0.00031752389622852206,6.11706855124794e-05
Kleemin,I took english in college and now all I can do with that is grammer nazi the interwebz,0.031567562371492386,3.0080744295446493e-07,0.0011310526169836521,0.00015202157374005765,0.0014013241743668914,2.5980511054513045e-05
LordBaelish,"I'm sorry, which part of that was correcting grammar?",0.00042056539678014815,1.2959552320168655e-09,2.810987461998593e-05,5.472762040881207e-06,2.772088919300586e-05,4.41855604549346e-07
luveroftrees,hahahaha,0.20944739878177643,0.0002583892201073468,0.009207621216773987,0.014561447314918041,0.02377724088728428,0.00841584987938404
carporsche,You should be a writer ;-),0.03577811270952225,2.9155447919038124e-05,0.0012521113967522979,0.005350919906049967,0.004338067024946213,0.0024009232874959707
bandini813,"> I think our political climate would be entirely much more refined if more people just learn to have some objectivity, and be open to all sides of an issue before offering an opinion on it.But then one party wouldn't always be right about everything. This makes no sense.",0.0004081933293491602,1.4870000342170897e-08,2.5843439289019443e-05,3.751565236598253e-05,8.655014244141057e-05,3.986540377809433e-06
Colorado87,Lol sarcasm.,0.001541393925435841,1.0628087210307058e-07,6.823318835813552e-05,0.00018070972873829305,0.0001443773799110204,2.9130851544323377e-05
BerateBirthers,No but one party is always *wrong*,0.00020376592874526978,1.8276001823025467e-09,1.1303233804937918e-05,1.0724200365075376e-05,1.7274796846322715e-05,1.0763848194983439e-06
DreadPirate2,So says the troll who is proven wrong on a near-daily basis.,0.00023299985332414508,4.90286655718819e-09,1.4636758351116441e-05,1.8329341401113197e-05,3.164710506098345e-05,2.071020162475179e-06
lgodsey,"I will admit that the Democrats aren't always right, but fuck me if the Republicans don't somehow manage to always be in the wrong.",0.948326051235199,0.0011785604292526841,0.7595295906066895,0.0025157411582767963,0.3598012328147888,0.0026178639382123947
Colorado87,"Your comment expresses a MAJOR problem with how people think nowadays. I want YOU to tell me what the Dems have done right. What amazing thing has Obama done?Politicians are too often thinking like you; ""I'm right, you're wrong. I don't care about your opinion."" There usually is no 100% right answer. Sorry. People/politicians have got to WORK TOGETHER, and figure it out together. That is where you get the best outcomes. Both parties are guilty of this, or, I should say most people, period.If you want this country to progress, don't sit on your ass and get in the mindset that ""the world will get better if they do exactly what I think."" It's not going to work out like that. Instead, get up off your ass, help the other people thinking the same thing stand up, talk about it with an open mind, and figure it out!",0.37792712450027466,0.0009578942554071546,0.3013530373573303,0.002202643547207117,0.061539601534605026,0.001512640155851841
NAN,I have only one upvote to give...,0.0022854895796626806,1.285893205249522e-07,0.00011320997873554006,0.000175561843207106,0.00019040878396481276,2.5540923161315732e-05
PincheGreen,i agree most folk that make post such as these generally don't have a clue about our political agenda I guess that goes for a majority of my generation. The funny thing about our economy is if you look back all the way to Nixon and his term as president then you would know our plummeting economy didn't just start with the bush campaign but it has been a shell casing of shit stacked to the ceiling of parliament disasters and just in the last 8 years or so do people actually see some what of the truth. The blame can go to both parties but it also has to do with not enough people giving two shits about today's politics and that's why we have a majority of senseless voters today.,0.3338218331336975,0.0010387190850451589,0.47314441204071045,0.0011345219099894166,0.05611522123217583,0.0006471681408584118
YouthInRevolt,">if more people just learn to have some objectivity, and be open to all sides of an issue before offering an opinion on it. But where's the karma/upvote potential in that?",8.57701015775092e-05,6.475176506093305e-10,6.6553870965435635e-06,4.149240794504294e-06,1.1007826287823264e-05,3.03239318100168e-07
JordanLeDoux,"It's plainly apparent that Republicans have things which they would not sell out or budge on philosophically. Among them, I believe, is the preferential treatment of Christian values, which is something that some people want in our society.Another, I think, is the ability of our military to assure the destruction of any other individual country if we had to, which there are a great number of people who view as prudent. Many people don't think too hard about it, but America as a society was deeply scarred by WW2. (Which is not to say that many other countries were not left with deeper scars.)I think in a lot of ways, the US people came out of WW2 going, ""holy shit, we've just been over here doing our thing and the whole rest of the world is batshit insane!"" For some, there was a feeling that we had been sensible and steadily improving for the past 150 years, and that the rest of the world appeared to be like overly destructive children. It's a description of the emotive response of the populace.Republicans are still mostly in this mindset. They view us as the adults, and think that the rest of the world is full of 5 years olds that will cause a mess as soon as we turn around. It's not strictly speaking a crazy position to hold, but it is a very ethnocentric one, which IMO is primarily caused by the fact that we teach very little history to people, especially history of the rest of the world.To many Republicans, no one ever taught them the series of connected events and circumstances that the rest of the world went through in the 18th, 19th and 20th centuries, and without that information history really does look kind of like:""Oh hey, here's America, just doing our thing and making progress... Oh, what the fuck!? Why is a WHOLE continent going to war over a stupid royal figure guy? Well at least the people that started it lost... wait, how the hell did they come back with all those tanks and shit!? And why are they collecting all those civilians? They're killing them with pesticides!?! Oh Jesus! Where's the part where we knock these sick bastards out!Well goddammit, why didn't we do shit BEFORE we got bombed?? Well at least that's over... I guess we'll have to give them a bunch of money to rebuild... wait a minute... why is all that liberated land in the East still being controlled by Russia? Hey! He's putting people in camps too! Shit, and now they have nuclear bombs so we can't force them to stop... Well what if they keep doing that around the rest of the world? Better look into that... Wait, what's that noise in China? Wait, Korea? Vietnam? Shit, Afghanistan? Iran? Iraq?When will it stop?""Without all the historical context of the REST of the world's history, it kind of looks like we're perfectly reasonable, and everyone else is absolutely fucking bonkers.It also helps if you hide some of our history with regard to the CIA.",0.07352060079574585,4.199676368443761e-06,0.0684119239449501,7.022285717539489e-05,0.008491379208862782,1.666705429670401e-05
despicable_secret,Alert: insightful comment in r/politics.I point that out only in case someone mistook my upvote to merely indicate that the comment is anti-republican.,8.856771455612034e-05,1.2032398410966039e-09,1.0238838513032533e-05,4.081151473656064e-06,9.646550097386353e-06,3.5299703426971973e-07
JordanLeDoux,"Which is most amusing because I agree more with the Republican philosophy, thought not the ideology.",2.255544313811697e-05,4.017391280752847e-11,2.2092362996772863e-06,5.281811468194064e-07,2.159478071916965e-06,3.054415387282461e-08
