id,comment,toxic,severe_toxic,obscene,threat,insult,identity_hate
NAN,"How the hell is it a strawman - the whole argument started with people talking about MMJ dispensaries which is what I was referring to.And you get to throw around insults, but if I do the same thing you did, I get a lecture on what the Democratic party is doing.",0.04310363158583641,1.1258749736953177e-06,0.0026836618781089783,0.00026144494768232107,0.004297373350709677,5.126116957399063e-05
DrakenKor,I see you only got downvotes and no replies. Lots of shills roaming the halls of r/politics.,0.0004778021539095789,1.0481146617280501e-08,3.128495154669508e-05,2.641884384502191e-05,5.050702020525932e-05,2.9312463993846904e-06
cedurr,ANYONE WHO DISAGREES WITH ME IS A CORPORATE SHILLget the fuck out of here,0.9837570190429688,0.004400614183396101,0.8559278249740601,0.00482576061040163,0.45377883315086365,0.009099339134991169
DrakenKor,"Hurr durr, a lengthy post with many rebuttals and varied sources gets downvoted without any replies. Who has the problem with disagreement? Plus I just saw 5 downvotes appear on my comment, and 5 upvotes on yours instantly. Funny, lol.",0.0012974097626283765,2.2389246012721742e-08,6.557735468959436e-05,4.887870454695076e-05,0.00020183325977995992,5.336501544661587e-06
cedurr,YOU FOUND US OUT! THE ROMNEY SHILLS ARE IN FULL EFFECT!,0.19845935702323914,1.7752663552528247e-05,0.005406643263995647,0.002541095484048128,0.014424649067223072,0.001133398967795074
setyourarmsdown,"lots of them all over the internets, and they need to be called out.",0.0007915127207525074,1.979974939558815e-08,3.146951348753646e-05,6.243160896701738e-05,6.74790280754678e-05,8.191321285266895e-06
nicitiesnotmything,"First-rate dismantling of a weak argument, sir/madam.",0.001809736480936408,8.95131719858e-08,0.00010036608000518754,0.00012175173469586298,0.0001450074923923239,1.697496190899983e-05
NAN,Please look at my responses as well.,0.0002825327683240175,2.160148726559896e-09,1.7934809875441715e-05,9.460971341468394e-06,2.1504543838091195e-05,8.33053547921736e-07
doodlebro,"Thank you so fucking much. God I hate when you bastards try to play it off that BUSH was better than OBAMA for fucking MMJ.Holy fuck, that's one thing that reddit will not stop doing.",0.9950397610664368,0.01197513286024332,0.9855772852897644,0.0014345393283292651,0.7999520897865295,0.003966898657381535
Oryx,>The same old talking points.And the same old monocular apologist bullshit.,0.9856436252593994,0.004430701490491629,0.8806197643280029,0.004331160802394152,0.4810517430305481,0.009468421339988708
NAN,"Why don't you debate me and prove me wrong then, I only hear personal attacks when I point out that these talking points are coming from editorials while lacking a lot in facts.",1.2462176528060809e-05,1.648558026201563e-11,1.1426640185163706e-06,3.469895091257058e-07,1.4130630461295368e-06,1.4852058249914535e-08
NAN,[deleted],0.0029697588179260492,1.255476718142745e-07,9.912909445120022e-05,0.00019233932835049927,0.00024682117509655654,3.447670314926654e-05
Inebriator,"Clearly Oryx isn't even a Republican, you dipshit. Hooray for tribalism!",0.9621886610984802,0.0022432063706219196,0.7954902052879333,0.0028906858060508966,0.36342185735702515,0.004096959251910448
BinaryNinja,We're so fucked. We've been divided and conquered with partisan politics.,0.9079175591468811,0.0002717726747505367,0.5358949303627014,0.0009263340616598725,0.1990949809551239,0.0008409966831095517
Murse85,"Yes, we are screwed.",0.0001591156906215474,1.3510828011931153e-09,8.34679576655617e-06,9.054169822775293e-06,1.2651327779167332e-05,7.934382892926806e-07
Atheist101,"IIRC next month, some 25k soldiers are coming home from Afghanistan and then next summer all combat troops are coming back and then the year after everyone except a handful of troops to staff our bases will remain. That doesnt seem like escalation to me...",0.00035717367427423596,3.1890845519910727e-09,1.7813630620366894e-05,1.3646745173900854e-05,4.4053205783711746e-05,1.269111407964374e-06
NAN,"We shall see how many combat troops remain (""combat troops"" itself can be a deceiving term) by the end of 2014, but Obama did expand when he came into office and escalated again at the end of 2009/beginning of 2010. The results were hardly impressive from what I have seen.Anway, I believe we should be exiting faster just as groups like the Afghanistan Study Group suggested.",0.00011986425670329481,8.518571958937571e-10,1.4361603462020867e-05,3.43837791660917e-06,1.821748082875274e-05,2.327980865857171e-07
shamrockhoax,"Out of curiosity, what military strategy experience are you basing your approved rate of exit?",2.0911758838337846e-05,4.265704803274595e-11,1.3960983551442041e-06,8.303164236167504e-07,1.9432591216173023e-06,4.5753491662026136e-08
NAN,"Look up the Afghanistan Study Group's report, but I do think it should have been faster than what they suggested, although I have no military experience of my own.",5.271170812193304e-05,1.793299952979055e-10,4.717360297945561e-06,1.468722530262312e-06,6.785312052670633e-06,9.913668463923386e-08
underweargnome04,"http://www.dailymail.co.uk/news/article-2138104/Osama-bin-Laden-death-anniversary-Barack-Obama-Afghanistan-TV-address-Kabul.htmlwhats a us presence? contractors, drones, special ops?",0.019532708451151848,3.8414931680108566e-08,0.0026145505253225565,1.3117709386278875e-05,0.0008884671260602772,1.5590723023706232e-06
Atheist101,"Well I was kind of wrong about the bases, here is what Obama's speech says about the troops past 2014 deadline and bases.""Within this framework, we will work with the Afghans to determine what support they need to accomplish two narrow security missions beyond 2014: counter-terrorism and continued training. But we will not build permanent bases in this country, nor will we be patrolling its cities and mountains. That will be the job of the Afghan people.""I assume that means the only troops left in Afghanistan after 2014 will be the trainers and special ops.",1.580520074639935e-05,1.9222573532928777e-10,4.107253516849596e-06,1.207415152748581e-06,4.375429853098467e-06,6.905244021027102e-08
Breakyerself,After 11 years how is next summer soon enough?,2.3760259864502586e-05,3.014355431929516e-11,7.006176474533277e-07,1.196020093630068e-06,1.786930852176738e-06,7.788885625359399e-08
NAN,Yes we.... Can't :(.,0.0020270447712391615,4.137009312898954e-08,6.986270454945043e-05,9.999713802244514e-05,0.0001459911436541006,1.3294897144078277e-05
Breakyerself,You're right on the money. I doubt mitt could be much worse. Although I do expect he'd be a tad worse. it's certainly a giant douche vs a turd sandwich.,0.7823741436004639,8.175411494448781e-05,0.12122324854135513,0.002324470318853855,0.0959857627749443,0.0012586135417222977
MintClassic,"> it's certainly a giant douche vs a turd sandwich.I can't even begin to tell you how fucking sick I am of this trite little refrain. It was funny *once*, on South Park, a decade ago. And even then, it wasn't that funny.",0.9271184802055359,0.0009849491761997342,0.7274757623672485,0.0018000912386924028,0.3104100823402405,0.0017132398206740618
Breakyerself,I wasn't trying to make you laugh. I also wasn't asking your permission. I used the reference because its an apt fucking description.,0.9716187119483948,0.0009825063170865178,0.7582740187644958,0.0024041233118623495,0.3397532105445862,0.004163695033639669
sorrydaijin,"> I doubt mitt could be much worse.O ye of little faith.Given the chance, I am quite sure he would prove you very wrong.",0.0027238749898970127,8.915262839082061e-08,0.00013049799599684775,0.00011931698827538639,0.00027624849462881684,1.6068566765170544e-05
Breakyerself,They're all the same. They all work for the same people. Elect whoever you want the agenda wont change. Maybe a few minor things at the margin will change. Then they'll blow those minor changes out of proportion to make you think there's a difference. Then you'll feel like you have a choice and your vote means a fucking thing.,0.8952391147613525,0.0002104511804645881,0.6267815828323364,0.000726169440895319,0.16229522228240967,0.0005440203240141273
clkou,"So if all that stuff bothers you, you must have been so pissed off you couldn't hardly breathe when you found out Bush started a war based on a lie and paid for with a credit card ... right?I mean, you probably could barely have contained yourself that bin Laden orchestrated 9/11 on Bush's watch and roamed free, right? Kudos to Obama for killing him, right?It's perfectly fine for the GOP to have an open strategy to oppose the president on any and every issue to sabotage his presidency and the American people be damned. Right?You could write a book longer with 'Gone with the Wind' with how screwed up the GOP is and why Obama and the left are superior in policy and leadership, but spin it however you like. Find something YOU think Obama has done wrong and then declare both sides 'the same'.Obama is about the same with the GOP as chocolate ice cream is to dog poo. Obama is the ice cream in that analogy btw.",0.012939107604324818,8.804517165117431e-06,0.003719099797308445,0.00042852386832237244,0.003343057818710804,0.00011707709927577525
NAN,I never said both sides are the same necessarily. I will say I'm not a fan of plurality voting or the two party system it promotes.You noticed how I said Obama essentially ignored the illegal actions by the Bush administration? I'm not one to think two wrongs make a right.,2.755024252110161e-05,8.913685761724466e-11,2.5370109142386355e-06,9.827832627706812e-07,3.243065066271811e-06,5.864508167974236e-08
Thegrizzlybearzombie,Nope. They are all the poo.,0.00014020712114870548,3.303168016888236e-10,4.670492216973798e-06,4.956869361194549e-06,9.399404916621279e-06,4.3721209408431605e-07
NAN,"You're the ice cream, girl ;-)",0.7569034695625305,0.00044673250522464514,0.039088767021894455,0.022178012877702713,0.11650378257036209,0.015819400548934937
NAN,"Fair enough, but I'd be willing to bet that any of the current republican candidates would be orders of magnitude worse. Frankly, this isn't very surprising. The incumbent advantage is nearly impossible to overcome so it's not as though the serious republican candidates are going to show up this year. The next election will be interesting. (Actually, it will probably be just a bunch of idiots clamoring to vote for the republican because ""we've had too much democrat control"")",0.0004946388071402907,1.7512011840636887e-09,5.299062104313634e-05,5.123858045408269e-06,0.00010193245543632656,3.406635187275242e-07
capnjack78,"I can't believe that after the bank bailout debacle that you would believe that Obama and his administration still tries to do the right thing. They're not as bad as Rmoney, but still.",0.00011108280887128785,2.0496816743875712e-10,5.164709818927804e-06,2.443699258947163e-06,8.019699635042343e-06,1.748197462347889e-07
Old1e,"That's right, when it comes to running the nation, it's good intentions that matter. Fuck the actual results.",0.01969890110194683,1.1756078066582631e-07,0.005470992065966129,1.3753698112850543e-05,0.0011041677789762616,2.1103169274283573e-06
moosemoomintoog,At least they're not fucking the family dog.,0.9967244267463684,0.1554955542087555,0.9641067385673523,0.028383411467075348,0.8756579756736755,0.0862220749258995
GiveMeBackMyPants,"Tries?He signed the NDAA and included a signing statement about how he agreed with the indefinite detention portion of the bill. Then, a federal judge makes a ruling that would effectively ban it. So the White House files an appeal.What the *fuck?*",0.9685900807380676,0.0023709575179964304,0.9009428024291992,0.0016168308211490512,0.4827461242675781,0.002379812067374587
fakeassposer,Tries to do the right thing? What the fuck reality do you live in?,0.9708691835403442,0.0018192355055361986,0.8313508629798889,0.0021817965898662806,0.3441510498523712,0.00338516803458333
NAN,Has this subreddit even tried to be objective?,0.015461767092347145,2.6960146897181403e-06,0.0005363599630072713,0.0011452857870608568,0.0014476176584139466,0.0003084268537349999
SirWhy,As an Irish dude with little knowledge on US politics I say..... Your system is fucked either way,0.9683947563171387,0.010640662163496017,0.7836969494819641,0.013452907092869282,0.5525100231170654,0.022127559408545494
armacitis,>with little knowledge on US politics>Your system is fucked either wayYou appear to understand it perfectly actually.,0.9045623540878296,0.000414804759202525,0.6534910202026367,0.0009476985433138907,0.2236577272415161,0.0009254383039660752
SirWhy,"Well looks like I should run for president in 2016.... I just need more than a decade added to my age and citizenship.... and money.... and a perfect system people won't call communist... Actually fuck it, I'm staying put here",0.6257438659667969,8.417820936301723e-06,0.16444145143032074,0.00014086657029110938,0.04303377866744995,5.2142608183203265e-05
Afrodaddy,You actually couldn't run even with all those things. You need to be born a citizen. I'd vote for you if it's any consolation,0.004442871548235416,1.5135290709622495e-07,0.0001388017408316955,0.0001924899552250281,0.0006099731544964015,3.2897074561333284e-05
SirWhy,"Thank you. You have to be born a citizen? I can see why, but it still just shows how it's a fucked up system. I'm not sure if it's the same here (I care little for Irish politics also).",0.8785231113433838,4.3157360778423026e-05,0.33114856481552124,0.0003578449541237205,0.12781472504138947,0.00026254451950080693
Afrodaddy,"I care little for any politics haha. But yeah, thats why when people were saying we should make the governator schwarzenegger Pres. it could just never happen. And why all the people were making a huge deal out of Obama's birth certificate, if he didn't have it he couldn't be pres. I think it makes sense why they made it that way at the founding, because you didn't want any loyalists or Brits becoming president, and it continued making sense when we became a world super power, to have an American running America. That being said I'm sure theres droves of people who aren't Native born who'd make better presidents than the ones we spit out. And it probably sucks moving to America when youre a year old and not being able to run. But i doubt many people hit that problem. Sorry for the long reply amigo",0.0027200072072446346,6.999131301199668e-07,0.003386270022019744,3.452898818068206e-05,0.0005354946479201317,5.827472705277614e-06
Afrodaddy,"Also, were superficial as shit and having 40 white guys in a row shows that. It keeps the president ""looking"" american, as bad as that is. We vote heavily on who we could see being president.Edit: i meant to make this comment an edit... damn.",0.05440700426697731,2.9071992457829765e-07,0.007635884452611208,3.727543298737146e-05,0.0022509132977575064,6.2181707107811235e-06
SirWhy,"No problem friendo. The system works I guess, or at least it has it's pros and cons.",2.0335122826509178e-05,2.235614124379559e-11,1.2834088920499198e-06,5.130984277457173e-07,1.7786882153814076e-06,2.771080431784867e-08
Afrodaddy,seems like its mostly cons these days,0.0003290375170763582,1.9725594491148968e-09,1.5453189917025156e-05,1.1794312740676105e-05,2.516436688893009e-05,1.1138612308059237e-06
mrkhan0127,This statement is 100% true. Romney is hiding his taxes while Obama is expanding the national surveillance apparatus... F em both,0.8038915991783142,0.00017777667380869389,0.1376594752073288,0.003614565124735236,0.16721294820308685,0.0021800168324261904
SubhumanTrash,Ok Celtic Tiger. How are the PIIGS doing? Maybe our Federal Reserve shouldn't have loaned you ungrateful assholes anything and let you crash and burn even harder.,0.9856399297714233,0.028493085876107216,0.6577072739601135,0.09261970967054367,0.815022349357605,0.23272469639778137
SirWhy,"Oh I know we're fucked distressed American. Doesn't change the fact that you are also fucked though. And if we seem ungrateful let me express my deepest sympathies, maybe if we got off our arses every once in awhile you wouldn't feel that way but that would take up valuable drinking time. If you excuse me I have potatoes to pull out of the..... Aww shit, blight again!",0.9899390339851379,0.019271371886134148,0.9422951340675354,0.007184030953794718,0.7068432569503784,0.016752609983086586
NAN,"Piss off, Seamus, I actually laughed at that.",0.4134003818035126,4.1802886698860675e-05,0.09004334360361099,0.00074574607424438,0.029424412176012993,0.00027864714502356946
luveroftrees,hahahah,0.06989050656557083,0.00019213752239011228,0.003349971491843462,0.014495281502604485,0.010070083662867546,0.007738609332591295
SubhumanTrash,"Nice try but the petrol dollar lives on! You know why? Because the only competition was pissed away because of the PIIGS that dragged it down. Just look in the mirror and repeat this, ""the only chance the world had at taking down the world reserve dollar was destroyed because of me."" HAHAHAHAHAHAHH!!!",0.06816762685775757,1.066167442331789e-06,0.001958123641088605,0.0004500662616919726,0.0046685668639838696,0.00010014705185312778
SirWhy,"You guy's should stop using petrol by the way, it ruins my countries rich landscape which is but one part of our immense culture. Sure we have no money but we'll go down partying. At the same time the oil will dry up and your precious petrol dollars will be gone. I should really stop feeding those who only wish to annoy me",0.0001578520459588617,2.5044257778716883e-09,1.4700615793117322e-05,9.315910574514419e-06,4.877450191997923e-05,7.214561605906056e-07
SubhumanTrash,>At the same time the oil will dry up and your precious petrol dollars will be gone. Are you really that stupid? It's the world reserve currency regardless of the largest commodity. If it's not oil it'll be something else.,0.7146859765052795,8.853148756315932e-05,0.18298660218715668,0.001694616163149476,0.19269470870494843,0.0008997897384688258
DrakenKor,Distressed American. Lol.,0.0033842255361378193,3.3348467809446447e-07,0.00016757010598666966,0.0003225717809982598,0.00031944591319188476,5.8499423175817356e-05
h0ncho,"Maybe if people with little knowledge would learn to shut the fuck up, things would get better?",0.9773367047309875,0.012676874175667763,0.8782888650894165,0.009763864800333977,0.6355416774749756,0.016312681138515472
SirWhy,Doubt they would,0.0015444637974724174,9.432986303181679e-08,5.446983050205745e-05,0.00019915483426302671,0.00014935768558643758,3.1110397685552016e-05
NAN,"Good evening OP! I think you're a cocksucker! Here's why:1) Your post is literally just a statement. You have no evidence to back up your point, you provide no relevant information, you are literally just posting an opinion with no content whatsoever. The fact that this got to the front page of r/politics is a wonderful testament to the absurdity of America's current political climate.2) You're being extremist, dogmatic, and wildly emotional in the formulation of your ideological standing, which is the quintessential problem with American politics. Rather than approaching your decision with calm, level-headed analysis, you choose to make sweeping ad hominem arguments against an entire group of individuals. I am a huge Obama supporter, and I still maintain that people like you, regardless of political affiliation, are the reason our country's politics suck so fucking hard.",0.9054313898086548,0.001830628258176148,0.9198361039161682,0.0007033585570752621,0.41656866669654846,0.00082416832447052
sspaiva,http://i.imgur.com/lWPdJ.png,0.566780149936676,0.0001271643559448421,0.025631355121731758,0.0075095645152032375,0.04638398438692093,0.0038428502157330513
mttwldngr,Right...,0.012645621784031391,1.6843683624756522e-05,0.0006548594683408737,0.003612448461353779,0.0018785649444907904,0.0013581118546426296
airbornemaniac,"I really don't like either candidate this election. But what would help is if Romney and Obama sat down and went through point by point of their stance on key issues, without saying the others name or ""my opponent""",0.00014376592298503965,8.559370989758008e-10,8.368052476726007e-06,6.271203346841503e-06,2.5960918719647452e-05,5.041228519075958e-07
Coredrill,So brave.,0.10756126791238785,4.77475332445465e-05,0.004551976453512907,0.004784801974892616,0.009042873047292233,0.002124684164300561
NAN,Broshave?,0.06989050656557083,0.00019213752239011228,0.003349971491843462,0.014495281502604485,0.010070083662867546,0.007738609332591295
NAN,"Oh fuck off. Let's stop the circlejerk. If you manage to be part of the US Congress, you're highly motivated, charismatic and able to function with others.This qualities alone will guarantee you a far higher salary than congress/wo/man.The simple fact is that the republicans are there just as much as the democrats, they're trying to fix things wrong with you country.They disagree about the way to do it but to say that the only reason they became congress/wo/men was to pad their pockets makes you look like a moronic, partisan hack.",0.7804456949234009,0.00019752280786633492,0.43601247668266296,0.0008791746804490685,0.17241770029067993,0.000642104190774262
oconnellc,"Wait, you think the real money from being in congress comes from the salary?",0.0003557107993401587,6.0764557829884325e-09,2.0082334231119603e-05,2.2149884898681194e-05,2.836694329744205e-05,2.4174000827770215e-06
rubberstuntbaby,"The payoff for being in congress is through insider trading and getting a collecting a huge paycheck when you leave congress to go ""work"" for the companies you let write your bills for you.",0.03464315086603165,2.0920761016895995e-06,0.0006520954775623977,0.0013304846361279488,0.0033228176180273294,0.0003247128042858094
TrueBlue0276,Still waiting for someone from BP to be prosecuted. Still waiting.....,0.008475933223962784,1.0019022056440008e-06,0.000248691561864689,0.0007403870695270598,0.0008739636978134513,0.00017918543017003685
funkutoo,"After reading the title, I had to look up how to spell NAVET.",0.00022138662461657077,5.615192755215048e-10,4.56757697975263e-06,8.515690751664806e-06,1.5922340026008897e-05,7.753932322884793e-07
ElCidVargas,Guys I know I'm going to be downvoted... butDAE THINK ROMNEY BAD?,0.8315182328224182,0.0015851145144551992,0.06128320470452309,0.05583230406045914,0.18730475008487701,0.043826960027217865
NAN,[deleted],0.0029697588179260492,1.255476718142745e-07,9.912909445120022e-05,0.00019233932835049927,0.00024682117509655654,3.447670314926654e-05
theyoyojo,This feels like /r/circlejerk,0.8898521065711975,0.0033408263698220253,0.17718222737312317,0.041121065616607666,0.2699200510978699,0.04018644243478775
epicwinguy101,"I think this outdoes them. There isn't even any contained text, just the outrageous title.",6.625281821470708e-05,6.426330023678872e-10,9.975519787985831e-06,2.483351408955059e-06,8.020434506761376e-06,1.958616593356055e-07
NAN,How has Obama tried to do what's right?,0.0006087381625548005,5.4621956735445565e-08,4.9089896492660046e-05,7.997749344212934e-05,6.760011456208304e-05,1.0600958376016933e-05
wurtis16,"YEAH HE DIDN'T LEGALIZE POT, LOL MAO (10) BBQ",0.08501673489809036,6.025169568601996e-06,0.004321047104895115,0.0008842856623232365,0.0051586441695690155,0.00024736608611419797
623463426362,You come off as *much* more immature than those you mock.,0.8919012546539307,0.00895680021494627,0.13427011668682098,0.1293332427740097,0.45687684416770935,0.128376767039299
wurtis16,"-retypes 5 times, checks grammar online, submit-",0.002742500975728035,2.0627284413876623e-07,0.0002911215415224433,0.0001220884150825441,0.00030318088829517365,1.8216385797131807e-05
futur1,it's between a turd and sandwich. But that shit sandwich has hidden rusty nails in that will give you AIDS.,0.978931188583374,0.00739566283300519,0.8573012351989746,0.00668353121727705,0.5053702592849731,0.012228102423250675
glutenfree123,"I mean I agree that Romney and Republicans only care about their bank accounts but using ""at least Obama tries to do the right thing"" as a means to justify support for him is not any better than the Republican base that just votes on variants of words like Jesus and America.",0.00018014373199548572,5.15865128392079e-10,1.902728581626434e-05,2.0475167730182875e-06,1.8133743651560508e-05,1.2854259523464862e-07
blackjackjester,"I personally disagree with most of his policy, but at least i can tell that his policy comes from his idea of the right thing to do for the country. I respect this. Romney just sounds like he wants to slash programs just for the sake of it, while expanding government in unproductive ways. I cant see a positive outcome under Romney",0.0021372654009610415,6.6345018367997e-09,0.00013442488852888346,1.360718670184724e-05,0.00021802469564136118,1.056366272678133e-06
existentialcwby,the only true part of your post was the second sentence. god help you.,0.0007119213696569204,7.399952650644082e-09,4.511931547312997e-05,2.274414146086201e-05,5.825570406159386e-05,2.2626795725955162e-06
KMoneyThunder,"Well...that's just like, your opinion, man...",0.005511568393558264,9.88210331342998e-08,0.00015900496509857476,0.00015976408030837774,0.00037456880090758204,2.6610914574121125e-05
