id,comment,toxic,severe_toxic,obscene,threat,insult,identity_hate
thelastvortigaunt,DEMOCRATS GOODREPUBLICANS BADKARMA PLEASE,1.8775457647279836e-05,4.621352953093627e-11,1.0659611007213243e-06,9.529251201456646e-07,1.7794993709685514e-06,6.278776254475815e-08
Malkav1379,"Your logic seems sound, old chap. Here, have a karma.",0.00032323860796168447,1.4324143648991594e-08,2.2230382455745712e-05,4.099977741134353e-05,3.5916986234951764e-05,4.840654582949355e-06
thelastvortigaunt,REPUBLICANS BAD,0.9153991341590881,0.01780100353062153,0.23923872411251068,0.1206171065568924,0.3937552869319916,0.12977170944213867
erwinthehamsandwich,"Good... good, let the hate flow through you.",0.004149452317506075,1.1960379708852997e-07,0.00015150292892940342,0.0001826924126362428,0.0003195720200892538,2.9845859899069183e-05
Mr_Pricklepants,"DEMOCRATS BADREPUBLICANS BADKARMA PLEASEMore true, but not nearly as effective.",6.436151306843385e-05,1.6959528226223597e-10,2.9069767606415553e-06,2.2963483843341237e-06,4.631645424524322e-06,1.6988121842587134e-07
chnlswmr,Politician: the only occupation for which you must prove yourself corruptable before you get the job.,0.0004742926685139537,9.27402865613658e-09,2.137864794349298e-05,3.476270649116486e-05,4.406068546813913e-05,4.585773240251001e-06
chnlswmr,Politician: the only occupation for which you must prove yourself corruptable before you get the job.,0.0004742926685139537,9.27402865613658e-09,2.137864794349298e-05,3.476270649116486e-05,4.406068546813913e-05,4.585773240251001e-06
souv,"What an insightful post. Thanks TexDen, you clearly know a lot about politics.",0.0017783025978133082,3.52780240575612e-08,7.672301580896601e-05,6.679227954009548e-05,0.00018492467643227428,9.745860552357044e-06
TexDen,"Just thought I would throw that out there, didn't know it would hit a nerve.",0.0003369580954313278,1.3441332491481717e-08,2.1599025785690174e-05,3.683650356833823e-05,3.8764661439927295e-05,4.308893949200865e-06
PoliticalHivemind,SO BRAVE.,0.10756126791238785,4.77475332445465e-05,0.004551976453512907,0.004784801974892616,0.009042873047292233,0.002124684164300561
HALLZY69,"Is this really what /r/politics is? Someone posts some idiotic statement, with no evidence, and gets front page? Really?",0.9446309208869934,0.0037399569991976023,0.3545452952384949,0.030608341097831726,0.5003048181533813,0.03485073149204254
Outlulz,"As long as it's pro-Democrat and anti-Republican it usually makes the front page, yes.",0.01690756343305111,2.3732846443635935e-07,0.0011962206335738301,9.512910037301481e-05,0.0011136025423184037,1.5986837752279826e-05
tregea,"I know right? i more of lefty myself but all this republican ""bashing"" is taking up way too much of reddit",0.0006982319755479693,1.9990775257383575e-08,4.692136644735001e-05,4.144062040722929e-05,7.011165143921971e-05,5.064850029157242e-06
Bake-me,both parties suck end of story,0.6654606461524963,3.3498894481454045e-05,0.12397471070289612,0.0006550945108756423,0.03736400976777077,0.0002905608853325248
Duthos,"That's the end of their stories, but it might be the beginning of johnson's.",0.0002518680994398892,3.885765487154913e-09,3.1580537324771285e-05,8.193892426788807e-06,2.781004150165245e-05,7.815424396540038e-07
Traithan,"Well, when one party has polarized itself so badly that they would sooner see us default on our debts, have its people die of preventable medical issues, and continually use a propaganda machine to lie to the many unfortunately uneducated citizens of the country (Note that they want to keep them uneducated, Republicans across the board continue to defund any meaningful education bills) then yes, they deserve all the bashing they can get.I like my country, and I want to stay in it. If the extremist conservatives take control of the Executive and Legislative branches again, I would be forced to leave.",0.00022572152374777943,5.307160932943589e-09,4.1261471778852865e-05,1.3454779946187045e-05,8.85086992639117e-05,1.1003533018083544e-06
TonyCheeseSteak,"Let me start with this statement. > Note that they want to keep them uneducated, Republicans across the board continue to defund any meaningful education bills)So in your opinion we need to spend more money on education. That is a fair enough opinion but may I ask what you suggest we throw that money at? Give me some ideas because since the 1970s our education spending has drastically raised while test scores have not. [Here is a graph showing the increases](http://4.bp.blogspot.com/_otfwl2zc6Qc/SqgYwPKlGCI/AAAAAAAALSA/XJI3BUM5Mn8/s400/cato.jpg) It certainly seems to me that throwing more and more money at education hasn't done much to help, but if you think it will please supply actual solutions rather then just bash another party. Furthermore, the last Republican president (the party you say cuts spending to education) increased student financial aid by 20$ billion. Funding for elementary and secondary education increased by $5.1 billion. funding for state special education grants under the Individuals with Disabilities Education Act grew by $4.6 billion, all Bush's doing. Most of which I disagreed with but you should know your facts before you make false statements. > Well, when one party has polarized itself so badly that they would sooner see us default on our debtsAs far as default on our debts, please inform me on something EITHER party has done to attempt to prevent this? I would love to hear it since it seems all each party can do is spend more and cut nothing so I would certainly be interested how you think the left is fixing this problem. Edit: I am trying to get to as many replies as possible but I am not home nor will be for a few days so I've been trying to reply as much as I can with the little bit of time I'm getting on a computer. So it will take a few days probably but I will try to get to everyone with a good as a reply as I can. Appreciate the replies and always enjoy some nice civil discourse.",6.724827926518628e-06,5.409944159318059e-10,5.921816409681924e-06,7.129965524654835e-07,3.829820798273431e-06,4.564557798403257e-08
chono,"On that note, it has been pointed out that with ""everyone"" getting an education, of course the average will plummet. Individuals who simply can't function well in an academic atmosphere. Some are just meant for labor jobs, and that's great.Honestly if everyone went to school and got great scores to drive up averages, I don't know what would happen in the economy with so many prepared for service sector jobs and not skilled labor roles. It's just one of those unfortunate truths to a society.",0.00014373261365108192,6.50864639961668e-10,3.2251518859993666e-05,1.4782118569200975e-06,1.5810959666850977e-05,1.0346266066108001e-07
vvelox,"> Individuals who simply can't function well in an academic atmosphere. Some are just meant for labor jobs, and that's great.Not functioning well in a academic environment does not mean some one is going to be working a labor job. I personally hate all the pointless large and required homework that gets in the way of studying, so I said to fuckery with college and left to work in the unix field.",1.9915150915039703e-05,3.6115187229679435e-11,1.8016778540186351e-06,5.32364367700211e-07,2.262774387418176e-06,2.7796453139217192e-08
chono,"Just getting to this now, but good on you for getting past it. The generality really is that those who don't excel in academics (structured uni, etc.) typically don't have the drive to pursue other avenues, and settle on where they land in those first years out of high school. Again, generalities.",0.00029736931901425123,3.811407633946828e-09,1.4953619029256515e-05,1.620246985112317e-05,3.9816804928705096e-05,1.7874081095214933e-06
JoshuaFB,Its not always about the money. I don't know how but we need to reform the system so that it works better and doesn't just teach kids how to take standardized tests. Education also occurs at home. That is all.,4.810833343071863e-05,1.3836656820309656e-10,4.826305030292133e-06,1.1659012670861557e-06,6.02466388954781e-06,7.380954514246696e-08
juanchopancho,"Yes you do know how. Look at Finland, that is the model. For drugs look at Portugal.",0.02240513265132904,1.4525875258186716e-07,0.0006614027079194784,0.00011523515422595665,0.0009714339976198971,1.7948326785699464e-05
BerateBirthers,Eliminate grades. Let students come to *learn* not *to be taught*,0.01888611726462841,1.8314292447030311e-06,0.00041036552283912897,0.001300624804571271,0.0022335280664265156,0.0002975862589664757
grande_hohner,Home schooling for everyone!!!!,0.009981402195990086,3.570940862118732e-06,0.00042327260598540306,0.0014329861151054502,0.0011466897558420897,0.0003663147799670696
Panzergrenadier,we're dumb enough thank you.,0.13518711924552917,4.807608547707787e-06,0.0033808189909905195,0.0012306447606533766,0.008157984353601933,0.0004140653763897717
Hijoshikina,"Frankly, it's not about the money being poured into education. Our way to teacher students sucks, especially when we think about how our country is ran. You could beat children with gold bricks that is the education fund, but we live a place where war is more important than anything else. > Funding for elementary and secondary education increased by $5.1 billion. funding for state special education grants under the Individuals with Disabilities Education Act grew by $4.6 billion, all Bush's doing. Most of which I disagreed with but you should know your facts before you make false statements.I find this really silly since when we speak of one topic we seem to ignore the defense budget which has been reaching all time highs. Not just in our country, but still.",0.00010844810458365828,3.0870619838196944e-08,0.00013978194328956306,7.108964382496197e-06,4.721365621662699e-05,7.080250270519173e-07
lovethismfincountry,the defense budget has nothing to do with his point. he was talking about all the spending we pour in to education with no results. whats your next r/politics talking point to counter his **facts**?,0.00010382955952081829,5.761349730626364e-10,6.423287686629919e-06,3.996143732365454e-06,1.5891379007371143e-05,3.3904458973665896e-07
Hijoshikina,"All I ask for is all the facts bro, nothing more.",0.02424367517232895,2.569859987033851e-07,0.0008833656320348382,0.00016960616630967706,0.0012010043719783425,2.8954536901437677e-05
NAN,Test scores would probably be a lot higher if the dropout rate was similar to what it was in the 1950s.,7.017539610387757e-05,3.83024417738298e-10,3.950318387069274e-06,3.677371751109604e-06,7.048819952615304e-06,2.877288807212608e-07
lovethismfincountry,but instead we dumb down the curriculum so the stupid kids dont get butt-hurt.,0.9893353581428528,0.040022362023591995,0.8115139007568359,0.04735349863767624,0.7804985046386719,0.10971541702747345
gynoceros,"Make kids perform up to certain standards or get left back. Parents will get kids' asses off of the xbox if they know it means an extra year of having junior live at home or, worse yet, being seen in public by another soccer mom who knows your kid couldn't hack 4th grade.The education money goes to re-educating those kids until they can read and write at grade level, pass a math test without a calculator, and correctly label a map, for starters. Add specific science requirements later on.",3.6325345718069e-05,2.1175535283579627e-11,2.602417907837662e-06,3.839772375613393e-07,5.909275387239177e-06,1.957027073729023e-08
namefaceguy,This is a silly statement. Reeks of no child left behind. We don't need teachers to be tough on kids to pass the test. That's what got us in the mess. As someone who came out of high school 7 years ago I know whats happened. Kids aren't stupid they will rebel when they know something doesn't make sense. What we need to do it make kids want to learn. We need to make school a reasonable enjoyable experience where kids aren't forced to be silent and obedient and where questions aren't met with hostility. More test are not the answer.,0.013207344338297844,2.0274397627417784e-07,0.0012802021810784936,0.00014605616161134094,0.003655926091596484,1.8158940292778425e-05
teacherdrama,"Bingo:>More test are not the answer.How about NO tests? None. How about we leave education to the people who have STUDIED to become teachers? How about we TRUST teachers to make decisions about their students? Tests SUCK. Tests are KILLING education. (I'm saying this as an educator for the past decade). We keep talking about how to test the kids, the tests will tell us! No, they don't. At their best, they are inaccurate and RIDICULOUS assessments of what the kids are learning. I keep hearing we're going to increase testing - I feel so bad for these kids who simply aren't LEARNING. Education is publicly funded so gets put into talking points by politicians, but politicians should stay the hell away from something they literally know nothing about.",0.5779277086257935,0.0001062988376361318,0.5784670114517212,0.0002620001614559442,0.08116816729307175,0.0001442937063984573
Oscar_Wilde_Ride,"I would do away with all standardized tests. I understand why administrators want tests and data, but they are doing more damage than they are worse. In medicine, you don't do a test if it is more harmful/more costly than what you want to cure. The same should be done in education.",0.004179331474006176,1.3253952602099162e-07,0.0001534750044811517,0.0002073580981232226,0.000755940331146121,2.726051206991542e-05
s0ck,"School is less about ""knowledge"", and more about learning how to think. How to solve problems. College is about knowledge, that's when you should be tested for retention of facts.",0.00019483562209643424,2.9642026611043093e-09,1.391214391333051e-05,1.105518913391279e-05,2.435278656776063e-05,1.0347642955821357e-06
JustAnotherJon,"How do you propose we determine academic success? This is a ridiculous statement. I'm sorry but when folks enter the professional world, guess what they get evaluated on?Series 7, CPA, Law boards, MCAT, SAT, DAT, LSAT, ACT, MAT, OAT, PCAT, , VCAT, WTMA, TOEFL, NAPLEX, NAPLEX-RN, NAPLEX-PN, performance exams, Contractor's Test, GMAT, GRE, AP, CMA, chiropractic exams, and I could go on and on and on. The fact is when students enter the real world tests are essential. Sure they aren't perfect, but how else am I supposed to evaluate someone I don't know? I can't assume an individual is a good hire simply because they have a good interview. Tests aren't going anywhere. Teaching our kids how to test well teaches our kids SOME of the skills that are necessary to succeed in the world.People are evaluated on tests. The may not be perfect, but they are the most cost effective way to evaluate a potential job candidate.",3.3211850677616894e-05,5.1702184755697544e-09,2.722281715250574e-05,3.644056278062635e-06,1.1875848031195346e-05,3.012702336491202e-07
teacherdrama,"I don't disagree with you - but you're talking about tests being given to 21+ year olds. That's VERY different from barraging 12 year olds with tests.Tests NEED to be given, of course, but standardized tests are disastrous in elementary/middle schools especially. Let kids just LEARN in those grades. Teachers can give tests for their subjects (this would require admins to release some power). You can start with standardized tests in high school - SATs and HSPTs or whatever. If you saw the tests my kids have to take, you'd change your mind. Questions are poorly worded. Articles are deadly dull and outdated (how this happens on tests that have had millions spent on them is beyond me), questions have more than one viable answer. I've seen typos, I've seen mistakes in directions - these tests are terrible. What's worse, they show NOTHING about what a kid learned during the year. If I teach a kid the joy of the humor of Shakespeare in Midsummer Night's Dream, is that tested? If I teach them to write a strong opening to a story by drawing the reader in - but they need to rewrite three times to get there - does that get tested? Testing below high school is detrimental to student learning. Want more proof? I got out of school before this nonsense started. Most of us over the age of 28 or so did. We got along just fine before all this testing nonsense started. Our kids are getting dumber. They are. I've seen the shift in the kids over the past decades - they're not as sharp as they were when I started teaching. Every teacher I know says this. What's changed? Testing.",3.967277370975353e-05,3.87119031275418e-10,1.0165788808080833e-05,1.708899389996077e-06,8.875374078343157e-06,1.0857632304350773e-07
stopit,then fix the test if the questions are poorly written. you have to have standards across the country and the only way to assess them is with a test.,0.00026000913931056857,2.130495335705973e-09,1.5216401152429171e-05,1.0178778211411554e-05,3.1122744985623285e-05,8.921732614908251e-07
teacherdrama,"I maintain two things: 1)that's very limited thinking about educational policy, and 2)we have zero control over the test. The administration (re: the school board) decides on the test and buys it from an independent company (capitalism at its best). We are stuck with whatever test we get because the district has a contract to give out the test for x amount of years. Supposedly in two years we're changing tests - to one that tests four times a year. Brilliant, no? Additionally, why do we need standards across the country? What is effective for a student to learn in even one part of a state is different from what it might be elsewhere. A test that is given to the richest suburban districts and then given to those in the inner city is going to have vastly different results -- but it certainly doesn't show LEARNING happening. A kid can go from a third grade to a fifth grade reading level in a year, but if that kid is in seventh grade, all that learning means nothing - and the test will not show the advancement.",1.8869624909712e-05,1.2650267500191603e-09,1.2818804862035904e-05,1.2649016980503802e-06,5.7266097428509966e-06,1.1627118823298588e-07
stopit,"again, if the test are bad, lets find a away to get better ones. replace the administration if that is what it takes. capitalism has nothing to do with it, the fact you bring that up makes me think you are just trolling.your second statement is pretty racist. all kids should be expected to reach a standard. making excuses for minorities does nothing but harm. if you don't test, how do you measure advancement? ask the kid? ask the teacher? ask their parents?",0.032285068184137344,3.6427738336897164e-07,0.0006682786624878645,0.000507492630276829,0.00578469829633832,8.226839418057352e-05
teacherdrama,"I agree completely that we need to change the tests and change the administration. Testing has EVERYTHING to do with capitalism, and the fact that you don't understand that is WHY the tests will not change. It's ALL about the money. Believe me, I'm not trolling. I've been teaching for ten years.My second statement is not at all racist. And why should all kids be expected to reach a standard? 1)I never said a word about race - you read that into my comment. 2)People are born with individual talents. Some are geared towards school, some aren't. Similarly, some are musical, some are athletic, some are artistic. Some aren't. Why should all kids be forced to reach the same arbitrary standards? Some kids have developmental issues, or learning issues or any of dozens of other possibilities.How about measuring advancements of students by leaving it to the people who, again, trained for their jobs, have hundreds of hours of continuing education beyond school, and spend every day working with the kids? How about giving teachers the responsibility to deal with their students' advancements?In an ideal world, teachers would have that responsibility, tests would be long forgotten, and students would learn as was appropriate to their needs. Of course, all this would require a TON of money coming into education and a complete overhaul of the system. I don't see that happening any time soon.",0.00011779916530940682,3.730027131609859e-08,0.00015467189950868487,7.510420800826978e-06,4.7081473894650117e-05,7.862395250413101e-07
stopit,"we spend more money than the next 10 countries combined, more money is not the answer.",0.0012478099670261145,2.4307887258601113e-08,8.425572013948113e-05,3.7430814700201154e-05,9.586417581886053e-05,4.645407443604199e-06
teacherdrama,A well thought out response.,1.6527561456314288e-05,6.585502976275137e-11,8.204370942621608e-07,1.5230566532409284e-06,1.7336400333078927e-06,9.958792190900567e-08
JustAnotherJon,"Thats a relevant point as to the age of the test takers. When I went through grade school we took one standardized test at the end of the, but it didn't determine whether we passed/failed. It was just to make sure the private schools were up to par with the public ones.I'm 26 so I'm not sure if I got the rigorous testing that our current generation is receiving. Call me sick, but I've always looked forward to tests. It's a chance to compete against my peers and put my learning into action. I just don't see anyway that we can get good data without testing.Do you think that the dumbing down of our kids could possibly have more to do with the ""cool"" culture? It seems to me that often times certain segments of society just simply teach their kids not to care about education. They get it from the TV, movies, etc. I don't really understand this. In high school there were some of my friends that could most likely be stereotyped as ""rednecks"" and if the succeeded in school it was like they were betraying some strange sense of culture. However, when I was in a fraternity in college it was most definitely not cool to struggle with your grades.I feel like our culture plays a big part in the next generations attitude toward school work.",8.623765461379662e-05,1.283488781922415e-08,0.00010131265298696235,4.312943474360509e-06,3.306711005279794e-05,3.884308341639553e-07
teacherdrama,"I do think that's part of it. The culture from movies, tv, and video games making stupidity a positive factor in life is just incredible. I knew the (so to speak) shit hit the fan when Jersey Shore became the most watched show by my 7th and 8th graders. How scary is it that 12 and 13 year olds biggest influence was Snooki and The Situation? The show reeked of stupidity and my kids ate it up.The scary thing is, I work in a pretty good middle class district. The problem, though, is that school (at least when I was going) was supposed to counter all that. Tv and entertainment in general is fine - you can laugh at idiocy - but when the school culture doesn't encourage intelligence what chance do the kids have? When we just pass them right along regardless of their scores, what motivation do they have to learn? When what little sense of placement they get comes from these ludicrous tests by a WIDE margin (teacher input is so minimal as to be farcical), why should kids unless motivated by their parents care? I can't tell you how many students I've had whose parents just can't be bothered, and so the kid fails. The whole system is terrible now. It really needs an overhaul, but like I said in another post, I just don't see it happening any time soon.",6.853303057141602e-05,2.8237023830257613e-09,2.228997072961647e-05,5.785631401522551e-06,2.2005051505402662e-05,4.437618486008432e-07
Oddjob1313,"Quite frankly, I quit taking grade school seriously by the end of 9th grade because of how backwards it felt to me. I hadn't done work nor tried seriously in years, but by high school it all just seemed pointlessly stupid. The teachers either didn't know what they were talking about because tenure allowed outdated teachers to continue babbling on for years and years past their expiration date, while tests just forced us to regurgitate factoids of information back at the teacher with no real learning.To explain how pointless grade school has become, I left high school with barely a 2.0 GPA, went to a community college, got a 3.7, then got accepted into on of the top 40 best colleges in the country. And I literally didn't go to the second half of my senior year.",0.00020199998107273132,5.2402806538509594e-09,0.00011438506044214591,4.229471414873842e-06,5.360939394449815e-05,3.411749673887243e-07
NAN,For the most part your never taught how to apply any thing you learn.That seems kind of backwards to me.,5.780210267403163e-05,1.0038877368279131e-10,3.0530231924785767e-06,1.5333504279624321e-06,5.528877409233246e-06,8.562448527982269e-08
aredditormaybe,"Well if you graduated 7 years ago, based on what you say, you must be 35 now, single, have no kids, and play WoW 24/7! Why should we let kids learn on terms that they accept based on their social life or own personal lack of discipline, thats what you are really saying right? While many kids don't succeed, there are many more that do, you may call them nerds or geeks, or maybe even young redditors. ""reeks of no child left behind?"" What is so terrible about that? Do you even know what it is, says, or stands for? Maybe if we didn't have such low standards for teachers, and even lower expectations of parents and community, then we wouldn't have drop out pukes like you posting on reddit!",0.04087498039007187,1.187101224786602e-05,0.007125610485672951,0.000684359751176089,0.00520431250333786,0.00019158871145918965
